{"run":346,"commit":"c523f22","metric":4933610,"metrics":{"bytecode_size":15445,"v2_v2_v2":197061,"v2_v2_v3":196414,"v2_v2_v4":208989,"v2_v3_v2":180669,"v2_v3_v3":197084,"v2_v3_v4":209651,"v2_v4_v2":188216,"v2_v4_v3":204547,"v2_v4_v4":173258,"v3_v2_v2":177073,"v3_v2_v3":197025,"v3_v2_v4":209630,"v3_v3_v2":194661,"v3_v3_v3":197121,"v3_v3_v4":210205,"v3_v4_v2":185195,"v3_v4_v3":205150,"v3_v4_v4":173876,"v4_v2_v2":166661,"v4_v2_v3":186613,"v4_v2_v4":175793,"v4_v3_v2":167247,"v4_v3_v3":187196,"v4_v3_v4":176371,"v4_v4_v2":131094,"v4_v4_v3":151034,"v4_v4_v4":85776},"status":"keep","description":"Stability re-confirmation of #343 (BipsTooHigh assert moved into bribe branch). After 2 discarded experiments (#344 0-gas combined_before copy removal, #345 +160 layout-regression guard removal), verify the kept win is reproducible and stable. Result: 4,933,610 exact match (all 27 per-path values identical to #343). Bytecode 15,445 unchanged. Checks pass. Confirms the −617 win is real and isolated.","timestamp":1781996016144,"segment":14,"confidence":null,"asi":{"exploration_summary":"Confirmed benchmark paths are encoding-optimal: V2/V3 auto-pay branches (_v2_auto_pay, _v2_get_amount_in, V3 token0/token1 auto-pay) are ALL OFF-BENCHMARK — every callback in the 27 paths uses nested forward_data command streams (grep confirmed: 0 paths use the 1-byte/empty auto-pay sentinel). So those apparent hotspots (uint112 clamps in getReserves decode, cold token0/token1 staticcalls) cost ZERO in the benchmark. Contract-level micro-opts exhausted (253+ prior experiments). Guard REMOVAL in execute() slow path regresses via Venom layout sensitivity (#344 0-gas, #345 +160 bimodal). Guard RELOCATION into existing branch works (#343).","finding":"4,933,610 reproducible — exact match to #343 (BipsTooHigh relocate). All 27 per-path values identical. Bytecode 15,445 unchanged. Checks pass.","hypothesis":"Stability re-confirmation of kept #343 win after 2 discarded experiments. Verify BipsTooHigh relocate didn't interact and the win is real.","next_action_hint":"AVENUE EXHAUSTED: post-hardening guard optimization. Only BipsTooHigh relocate broadly-impactful; remaining guards either correctly branch-gated (bribe_recipient_idx, expected_value profit assert) or off-benchmark (M5 take_delta delta>0, M7 settle_delta PM/SELF, H3 __default__ donation gate). Encoding-level path changes higher-EV than contract micro-opts, but 6 WETH-debt settle_delta paths confirmed non-applicable for take_compact (net WETH delta negative). Diminishing returns."}}
