{"run":58,"commit":"602444b","metric":4338456,"metrics":{"v2_v2_v2":185438,"v2_v2_v4":187164,"v2_v3_v3":148079,"v2_v4_v2":189661,"v2_v3_v4":174034,"v2_v2_v3":164466,"v2_v3_v2":168821,"v2_v4_v3":168714,"v2_v4_v4":148845,"v3_v2_v3":148047,"v3_v2_v2":164378,"v3_v2_v4":169772,"v3_v3_v2":148038,"v3_v3_v3":145395,"v3_v3_v4":161589,"v3_v4_v2":168632,"v3_v4_v3":160716,"v3_v4_v4":138738,"v4_v2_v3":168467,"v4_v2_v2":184969,"v4_v3_v2":168401,"v4_v3_v4":151610,"v4_v2_v4":168738,"v4_v3_v3":160344,"v4_v4_v2":147470,"v4_v4_v4":89190,"v4_v4_v3":158740,"bytecode_size":19243},"status":"keep","description":"WETH (0xFE) + NATIVE (0xFF) sentinels for currency/token via _lookup_address — -19,824 gas","timestamp":1781058191143,"segment":2,"confidence":null,"asi":{"hypothesis":"Use 0xFE sentinel for WETH_ADDR and 0xFF for NATIVE_ADDRESS in currency/token fields of V4 + ERC20 handlers. The _lookup_address() helper resolves sentinels to immutables, skipping TLOAD + SET_ADDRESS","result":"-19,824 gas total. Every path benefits from skipping SET_ADDRESS for WETH (and ZERO_ADDRESS via 0xFF). V4-trade-heavy paths also skip TLOAD for WETH currency. _lookup_address function unresolved overhead seems acceptable on Venom.","weth_sentinel_savings":"Skip SET_ADDRESS for WETH (~476 gas per path × 27 = 12,852) + skip TLOAD for WETH currency lookups (~100 gas × ~35 = 3,500) + shorter settle_all loop","bytecode_delta":"-63 bytes. The _lookup_address function + sentinel checks are smaller than the inline t_addresses[...] patterns they replace"}}
{"run":59,"commit":"d7c72e0","metric":4320619,"metrics":{"v2_v2_v4":186818,"v2_v2_v2":184803,"v2_v3_v3":147505,"v2_v4_v2":189004,"v2_v2_v3":163831,"v2_v3_v2":168104,"v2_v3_v4":173347,"v2_v4_v3":168057,"v2_v4_v4":148087,"v3_v2_v3":147471,"v3_v2_v2":163740,"v3_v2_v4":169082,"v3_v3_v4":160972,"v3_v3_v2":147462,"v3_v3_v3":144679,"v3_v4_v2":167972,"v3_v4_v4":138064,"v4_v2_v2":184392,"v3_v4_v3":160122,"v4_v2_v3":167808,"v4_v2_v4":168052,"v4_v3_v3":159714,"v4_v3_v4":150936,"v4_v3_v2":167742,"v4_v4_v2":146612,"v4_v4_v4":88344,"v4_v4_v3":157899,"bytecode_size":19198},"status":"keep","description":"Executor (0xFD) sentinel for recipient via _lookup_address — -17,824 gas","timestamp":1781058371373,"segment":2,"confidence":3.79953591606134,"asi":{"hypothesis":"Add 0xFD (self/executor) sentinel to _lookup_address for recipient fields. Skip SET_ADDRESS for executor address + skip TLOAD for executor recipient lookups","result":"-17,837 gas. All 27 paths benefit from skipping SET_ADDRESS for executor (~476 gas × 27 = 12,852) + TLOAD savings from ~54 executor recipient lookups (~4,900 gas). Bytecode also shrank slightly (-45 bytes) because fewer address table entries = shorter settle_all + less inline lookup code.","three_sentinels":"0xFF=NATIVE, 0xFE=WETH, 0xFD=self. Address table now only contains pool/token addresses (USDC, WBTC, V2/V3 pools, V4 PM). This eliminates 3 out of ~7 SET_ADDRESS commands per path."}}
{"run":60,"commit":"056200f","metric":4304557,"metrics":{"v2_v2_v4":185716,"v2_v4_v2":187924,"v2_v2_v2":184872,"v2_v3_v3":147560,"v2_v2_v3":163900,"v2_v3_v2":168173,"v2_v4_v3":166977,"v2_v3_v4":172373,"v2_v4_v4":146984,"v3_v2_v3":147526,"v3_v2_v4":168108,"v3_v3_v3":144716,"v3_v2_v2":163809,"v3_v3_v2":147517,"v3_v4_v2":166892,"v3_v3_v4":160192,"v3_v4_v3":159258,"v3_v4_v4":137181,"v4_v3_v2":166792,"v4_v2_v2":183442,"v4_v2_v4":167412,"v4_v2_v3":166858,"v4_v3_v3":158813,"v4_v3_v4":150053,"v4_v4_v3":157278,"v4_v4_v2":145813,"v4_v4_v4":88418,"bytecode_size":19219},"status":"keep","description":"Pool Manager (0xFC) sentinel for recipient via _lookup_address — -16,062 gas","timestamp":1781058529684,"segment":2,"confidence":2.709997982243745,"asi":{"hypothesis":"Add 0xFC (POOL_MANAGER_ADDR) sentinel to _lookup_address for PM recipient fields. Skip SET_ADDRESS for PM + skip TLOAD for PM recipient lookups","result":"-16,062 gas. 18 V4 paths benefit from skipping SET_ADDRESS for PM (~476 gas × 18 = 8,568) + TLOAD savings for ~30 PM recipient lookups (~3,000 gas). V2→V2 paths (no PM) show no regression.","four_sentinels":"0xFF=NATIVE, 0xFE=WETH, 0xFD=self, 0xFC=PM. Address table now only contains pool-specific addresses (V2 pairs, V3 pools) and token addresses (USDC, WBTC). This eliminates 4 out of 5-7 SET_ADDRESS commands per path."}}
{"run":61,"commit":"33deb3b","metric":4298800,"metrics":{"v2_v2_v4":185501,"v2_v4_v2":187544,"v2_v3_v3":147426,"v2_v2_v2":184704,"v2_v3_v2":168005,"v2_v4_v3":166597,"v2_v2_v3":163732,"v2_v3_v4":172197,"v2_v4_v4":146717,"v3_v2_v2":163641,"v3_v2_v4":167910,"v3_v2_v3":147392,"v3_v3_v2":147383,"v3_v3_v3":144619,"v3_v3_v4":160034,"v3_v4_v2":166512,"v3_v4_v3":158954,"v3_v4_v4":136968,"v4_v2_v2":183227,"v4_v2_v3":166643,"v4_v2_v4":167203,"v4_v3_v3":158655,"v4_v3_v4":149857,"v4_v3_v2":166577,"v4_v4_v2":145529,"v4_v4_v4":88264,"v4_v4_v3":157009,"bytecode_size":19216},"status":"keep","description":"Range-check in _lookup_address — -5,757 gas. Non-sentinel indices skip directly to array lookup","timestamp":1781058703561,"segment":2,"confidence":2.214321612717086,"asi":{"hypothesis":"Optimize _lookup_address with range check: if idx >= V4_PM_SENTINEL, check sentinels; else direct array lookup. This saves 3 comparisons for non-sentinel indices (0-0xFB).","result":"-5,757 gas. Non-sentinel lookups (the majority) now skip 3 of 4 sentinel comparisons. The single LT/JUMPI is cheaper than 4 EQ comparisons."}}
{"run":62,"commit":"96c7fdb","metric":4298800,"metrics":{"v2_v2_v2":184704,"v2_v3_v3":147426,"v2_v2_v4":185501,"v2_v4_v2":187544,"v2_v3_v4":172197,"v2_v2_v3":163732,"v2_v3_v2":168005,"v2_v4_v4":146717,"v2_v4_v3":166597,"v3_v2_v2":163641,"v3_v2_v4":167910,"v3_v3_v3":144619,"v3_v2_v3":147392,"v3_v3_v2":147383,"v3_v4_v4":136968,"v3_v4_v3":158954,"v3_v3_v4":160034,"v3_v4_v2":166512,"v4_v2_v4":167203,"v4_v2_v2":183227,"v4_v3_v2":166577,"v4_v2_v3":166643,"v4_v4_v2":145529,"v4_v3_v4":149857,"v4_v3_v3":158655,"v4_v4_v3":157009,"v4_v4_v4":88264,"bytecode_size":19179},"status":"keep","description":"Remove dead NATIVE/WETH check in settle_all — no gas change, -37 bytes bytecode","timestamp":1781058868628,"segment":2,"confidence":2.726064439250195,"asi":{"hypothesis":"Remove dead NATIVE_ADDRESS/WETH_ADDR check from _auto_settle_touched since those addresses are no longer in the address table (handled by sentinels)","result":"No measurable gas change. Bytecode -37 bytes from removing dead comparison. The settle_all check was already very cheap (2 comparisons per iteration)."}}
{"run":63,"commit":"96c7fdb","metric":4298800,"metrics":{"v2_v2_v2":184704,"v2_v2_v3":163732,"v2_v2_v4":185501,"v2_v3_v2":168005,"v2_v3_v3":147426,"v2_v3_v4":172197,"v2_v4_v2":187544,"v2_v4_v3":166597,"v2_v4_v4":146717,"v3_v2_v2":163641,"v3_v2_v3":147392,"v3_v2_v4":167910,"v3_v3_v2":147383,"v3_v3_v3":144619,"v3_v3_v4":160034,"v3_v4_v2":166512,"v3_v4_v3":158954,"v3_v4_v4":136968,"v4_v2_v2":183227,"v4_v2_v3":166643,"v4_v2_v4":167203,"v4_v3_v2":166577,"v4_v3_v3":158655,"v4_v3_v4":149857,"v4_v4_v2":145529,"v4_v4_v3":157009,"v4_v4_v4":88264,"bytecode_size":19179},"status":"discard","description":"Inline _compute_delta_slot — no gas change, Venom already inlines","timestamp":1781059007858,"segment":2,"confidence":4.313896141572382,"asi":{"hypothesis":"Inline _compute_delta_slot into _read_pm_delta to save function call overhead","next_action_hint":"Try a different optimization — Venom already aggressively inlines single-caller internal functions","result":"No gas change — Venom already inlines single-caller internal functions."}}
{"run":64,"commit":"2fc0a3c","metric":4296862,"metrics":{"v2_v2_v4":185416,"v2_v4_v2":187459,"v2_v2_v2":184704,"v2_v3_v3":147426,"v2_v4_v3":166512,"v2_v3_v2":168005,"v2_v3_v4":172027,"v2_v2_v3":163732,"v3_v2_v2":163641,"v2_v4_v4":146547,"v3_v2_v4":167740,"v3_v2_v3":147392,"v3_v3_v3":144619,"v3_v3_v4":159898,"v3_v3_v2":147383,"v3_v4_v2":166427,"v3_v4_v4":136832,"v4_v2_v2":183142,"v3_v4_v3":158886,"v4_v2_v4":167135,"v4_v2_v3":166558,"v4_v3_v2":166492,"v4_v3_v3":158587,"v4_v4_v2":145444,"v4_v3_v4":149721,"v4_v4_v4":88196,"v4_v4_v3":156941,"bytecode_size":19176},"status":"keep","description":"Merge idx reads in V4_TAKE_COMPACT — -1,938 gas","timestamp":1781059517267,"segment":2,"confidence":7.981546458739441,"asi":{"hypothesis":"Merge currency_idx + recipient_idx reads in V4_TAKE_COMPACT into a single 2-byte slice, then extract with shift(-8) and %256","result":"-1,938 gas. Merging two 1-byte slices into one 2-byte slice saves one slice() bounds check per V4_TAKE_COMPACT. With 26 V4_TAKE_COMPACT calls, that's ~75 gas per call savings. Also -3 bytes bytecode.","bug_fix":"Initial attempt used shift(indices, 8) (LEFT shift) instead of shift(indices, -8) (RIGHT shift). Vyper's shift() shifts LEFT for positive argument, RIGHT for negative."}}
{"run":65,"commit":"ac8d0d7","metric":4293799,"metrics":{"v2_v3_v3":147366,"v2_v2_v2":184629,"v2_v2_v4":185326,"v2_v4_v2":187294,"v2_v3_v4":171937,"v2_v2_v3":163657,"v2_v4_v4":146367,"v2_v3_v2":167930,"v3_v2_v2":163566,"v2_v4_v3":166347,"v3_v3_v2":147323,"v3_v2_v4":167650,"v3_v3_v3":144619,"v3_v2_v3":147332,"v3_v3_v4":159826,"v3_v4_v4":136688,"v3_v4_v3":158754,"v3_v4_v2":166262,"v4_v2_v2":183052,"v4_v2_v4":166991,"v4_v2_v3":166468,"v4_v3_v2":166402,"v4_v3_v3":158455,"v4_v4_v2":145264,"v4_v3_v4":149577,"v4_v4_v4":87980,"v4_v4_v3":156737,"bytecode_size":19179},"status":"keep","description":"Merge adjacent idx slice reads across 7 handlers — -3,063 gas","timestamp":1781059744102,"segment":2,"confidence":10.157687460617517,"asi":{"hypothesis":"Merge adjacent 1-byte index reads into a single 2-byte slice, extract with shift(-8) and %256. Applied to V4_TAKE, V4_TAKE_DELTA, V4_SWAP_COMPACT, ERC20_TRANSFER, V4_MINT_COMPACT, ERC20_XFER_BALANCE.","result":"-3,063 gas beyond the V4_TAKE_COMPACT-only version. Each merged pair saves one slice() bounds check (~50-80 gas) per invocation across all affected handlers. V4_SWAP_COMPACT (30 calls) saves the most.","optimization":"Merged 2-byte index slice reads across 7 command handlers"}}
{"run":66,"commit":"ba46cf1","metric":4292694,"metrics":{"v2_v2_v2":184606,"v2_v4_v2":187271,"v2_v3_v3":147348,"v2_v2_v4":185257,"v2_v2_v3":163634,"v2_v4_v3":166324,"v2_v3_v4":171845,"v2_v3_v2":167907,"v3_v2_v2":163543,"v2_v4_v4":146298,"v3_v2_v3":147313,"v3_v2_v4":167581,"v3_v3_v2":147304,"v3_v3_v4":159771,"v3_v4_v2":166239,"v3_v3_v3":144619,"v3_v4_v4":136632,"v4_v2_v2":183006,"v3_v4_v3":158736,"v4_v2_v3":166422,"v4_v2_v4":166936,"v4_v3_v2":166356,"v4_v3_v3":158400,"v4_v4_v2":145218,"v4_v3_v4":149504,"v4_v4_v3":156700,"v4_v4_v4":87924,"bytecode_size":19179},"status":"keep","description":"WETH-first sentinel check in _lookup_address — -1,105 gas","timestamp":1781059974764,"segment":2,"confidence":11.392391870766025,"asi":{"hypothesis":"Reorder _lookup_address sentinel checks: WETH first, then NATIVE, then SELF, then PM","result":"-1,105 gas. WETH (0xFE) is the most frequently looked-up sentinel (~4-5 times per V4 path as currency index). Putting it first saves 1 comparison per WETH lookup."}}
{"run":67,"commit":"ba46cf1","metric":4292694,"metrics":{"v2_v2_v4":185257,"v2_v4_v2":187271,"v2_v2_v2":184606,"v2_v3_v3":147348,"v2_v3_v2":167907,"v2_v4_v3":166324,"v2_v3_v4":171845,"v2_v2_v3":163634,"v2_v4_v4":146298,"v3_v2_v2":163543,"v3_v2_v3":147313,"v3_v2_v4":167581,"v3_v3_v4":159771,"v3_v3_v3":144619,"v3_v3_v2":147304,"v3_v4_v2":166239,"v3_v4_v4":136632,"v4_v2_v2":183006,"v3_v4_v3":158736,"v4_v2_v4":166936,"v4_v2_v3":166422,"v4_v3_v3":158400,"v4_v3_v2":166356,"v4_v4_v3":156700,"v4_v3_v4":149504,"v4_v4_v2":145218,"v4_v4_v4":87924,"bytecode_size":19176},"status":"discard","description":"MAX_COMMAND_ITERATIONS=32 — no gas change, Venom handles bounds","timestamp":1781060139668,"segment":2,"confidence":11.05723678664756,"asi":{"hypothesis":"MAX_COMMAND_ITERATIONS=32 — reduce Venom loop memory allocation","next_action_hint":"Loop bound reduction is a dead end — Venom handles this via break conditions","result":"No gas change. Bytecode -3 bytes. Venom's liveness analysis already constrains loop body memory."}}
{"run":68,"commit":"25a176a","metric":4290806,"metrics":{"v2_v2_v4":185179,"v2_v3_v3":147348,"v2_v2_v2":184606,"v2_v4_v2":187193,"v2_v3_v2":167907,"v2_v3_v4":171767,"v2_v2_v3":163634,"v2_v4_v3":166246,"v2_v4_v4":146142,"v3_v2_v2":163543,"v3_v2_v3":147313,"v3_v3_v2":147304,"v3_v2_v4":167503,"v3_v3_v3":144619,"v3_v4_v2":166161,"v3_v4_v3":158673,"v3_v3_v4":159708,"v3_v4_v4":136508,"v4_v2_v4":166811,"v4_v2_v3":166344,"v4_v2_v2":182928,"v4_v3_v2":166278,"v4_v3_v3":158337,"v4_v4_v2":145062,"v4_v3_v4":149379,"v4_v4_v3":156576,"v4_v4_v4":87737,"bytecode_size":19186},"status":"keep","description":"Merge hooks+zfo reads in V4 swap handlers — -1,888 gas","timestamp":1781060328847,"segment":2,"confidence":11.050442188011791,"asi":{"hypothesis":"Merge hooks_idx + zfo reads in V4 swap compact/dynamic into 2-byte slices","result":"-1,888 gas. Each V4 swap now saves 1 slice() call from the merged hooks_idx + zfo read. With 30 V4 swap calls, savings are ~63 gas per call. Also applied to V4_SWAP_DYNAMIC for consistency."}}
{"run":69,"commit":"977ac69","metric":4286778,"metrics":{"v2_v2_v4":185014,"v2_v2_v2":184342,"v2_v4_v2":187010,"v2_v3_v3":147156,"v2_v4_v3":166084,"v2_v2_v3":163391,"v2_v3_v2":167646,"v2_v3_v4":171605,"v3_v2_v3":147124,"v3_v2_v2":163303,"v2_v4_v4":146058,"v3_v2_v4":167344,"v3_v3_v2":147115,"v3_v3_v4":159584,"v3_v4_v2":166002,"v3_v4_v3":158548,"v3_v3_v3":144432,"v4_v2_v3":166185,"v4_v2_v4":166746,"v4_v2_v2":182766,"v3_v4_v4":136445,"v4_v3_v4":149316,"v4_v3_v3":158212,"v4_v3_v2":166119,"v4_v4_v2":144981,"v4_v4_v3":156513,"v4_v4_v4":87737,"bytecode_size":19189},"status":"keep","description":"Merge pool+zfo reads in V2/V3 swap handlers — -4,028 gas","timestamp":1781060552152,"segment":2,"confidence":11.710121192269899,"asi":{"hypothesis":"Merge pool_idx + zfo reads in V2/V3 swap handlers into 2-byte slices","result":"-4,028 gas. Applied to V2_SWAP_COMPACT, V2_SWAP_CALC, V2_SWAP_DIRECT, V3_SWAP_COMPACT, V3_SWAP_DELTA. Each saves 1 slice() bounds check per swap. With ~80+ V2/V3 swaps across 27 paths, savings accumulate well. Bytecode +3 bytes from the additional shift/% operations."}}
{"run":70,"commit":"8cf4012","metric":4284190,"metrics":{"v2_v3_v3":147156,"v2_v2_v4":184907,"v2_v2_v2":184342,"v2_v4_v2":186903,"v2_v3_v4":171498,"v2_v3_v2":167646,"v2_v2_v3":163391,"v2_v4_v4":1458844,"v2_v4_v3":165977,"v3_v2_v3":147124,"v3_v2_v2":163303,"v3_v3_v2":147115,"v3_v2_v4":167237,"v3_v3_v3":144432,"v3_v3_v4":159498,"v3_v4_v2":165895,"v3_v4_v3":158463,"v3_v4_v4":136274,"v4_v2_v4":166575,"v4_v2_v2":182659,"v4_v2_v3":166078,"v4_v3_v3":158127,"v4_v4_v2":144767,"v4_v3_v2":166012,"v4_v3_v4":149145,"v4_v4_v4":87480,"v4_v4_v3":156342,"bytecode_size":19219},"status":"keep","description":"8-byte merged read for fee+ts+hooks+zfo in V4 swap — -2,588 gas","timestamp":1781060906637,"segment":2,"confidence":12.133966590239108,"asi":{"hypothesis":"Merge fee+ts+hooks+zfo reads in V4_SWAP_COMPACT into a single 8-byte slice, extract fields with shift() and modulo","result":"-2,588 gas. The 8-byte merged read replaces 3 separate slice() calls (fee, ts, hooks+zfo) with 1 slice + bitwise extraction. With 30 V4 swaps across paths, that's ~86 gas per swap. Bytecode +30 bytes from the additional shift/modulo operations, but net gas savings from fewer bounds checks."}}
{"run":71,"commit":"8cf4012","metric":4346230,"metrics":{"v2_v2_v4":188282,"v2_v4_v2":190400,"v2_v3_v3":147156,"v2_v2_v2":184342,"v2_v4_v3":169474,"v2_v3_v2":167646,"v2_v3_v4":174873,"v2_v2_v3":163391,"v2_v4_v4":149867,"v3_v2_v2":163303,"v3_v2_v3":147124,"v3_v2_v4":170612,"v3_v3_v3":144432,"v3_v3_v2":147115,"v3_v3_v4":162198,"v3_v4_v2":169392,"v3_v4_v4":140011,"v3_v4_v3":161260,"v4_v2_v2":185710,"v4_v2_v3":169129,"v4_v3_v2":169063,"v4_v3_v3":160568,"v4_v2_v4":169793,"v4_v3_v4":152364,"v4_v4_v2":148466,"v4_v4_v4":90958,"v4_v4_v3":159301,"bytecode_size":19283},"status":"crash","description":"Auto-settle WETH/NATIVE at end of unlockCallback — +62,040 gas REGRESSION","timestamp":1781061166014,"segment":2,"confidence":10.509219858156028,"asi":{"hypothesis":"Auto-settle WETH/NATIVE at end of unlockCallback to eliminate V4_SETTLE_DELTA commands","next_action_hint":"Auto-settle is a dead end — keccak256 + exttload costs too much for per-callback reads. Instead investigate eliminating the keccak256 cost or using a different delta-tracking mechanism.","result":"+62,040 gas REGRESSION. The auto-settle reads WETH + NATIVE deltas on EVERY unlock callback using _read_pm_delta which costs ~2600 gas per keccak256 + exttload. Total cost per callback: ~5200 gas. This far exceeds the savings from removing V4_SETTLE_DELTA commands (~150 gas each).","rollback_reason":"Auto-settle adds expensive per-callback overhead that exceeds V4_SETTLE_DELTA savings"}}
{"run":72,"commit":"27fbf09","metric":4284104,"metrics":{"v2_v2_v2":184342,"v2_v4_v2":186903,"v2_v2_v4":184888,"v2_v3_v3":147156,"v2_v2_v3":163391,"v2_v4_v3":165977,"v2_v3_v2":167646,"v2_v3_v4":171498,"v2_v4_v4":1458844,"v3_v2_v3":147124,"v3_v2_v2":163303,"v3_v3_v2":147115,"v3_v2_v4":167237,"v3_v3_v4":159498,"v3_v3_v3":144432,"v3_v4_v3":158463,"v3_v4_v2":165895,"v3_v4_v4":136274,"v4_v2_v2":182640,"v4_v2_v4":166614,"v4_v2_v3":166059,"v4_v3_v2":165993,"v4_v3_v3":158127,"v4_v4_v2":144748,"v4_v3_v4":149130,"v4_v4_v4":87480,"v4_v4_v3":156327,"bytecode_size":19270},"status":"keep","description":"Precomputed WETH/NATIVE delta slots — -86 gas","timestamp":1781061325432,"segment":2,"confidence":9.278959219414562,"asi":{"hypothesis":"Precompute WETH/NATIVE delta slots as immutables to avoid keccak256 per _read_pm_delta call","result":"-86 gas. The precomputed slots replace keccak256+concat with immutable loads (CODECOPY) for WETH and NATIVE currencies. Savings are small because keccak256 is already cheap (~30 gas) and the immutable load + comparison overhead partially offsets the savings. Also -51 bytes bytecode."}}
{"run":73,"commit":"27fbf09","metric":0,"metrics":{"v2_v2_v4":184888,"v2_v4_v2":186903,"v2_v2_v2":184342,"v2_v3_v3":147156,"v2_v3_v2":167646,"v2_v4_v3":165977,"v2_v3_v4":171498,"v2_v2_v3":163391,"v2_v4_v4":145844,"v3_v2_v2":163303,"v3_v2_v4":167237,"v3_v2_v3":147124,"v3_v3_v4":159498,"v3_v3_v2":147115,"v3_v3_v3":144432,"v3_v4_v2":165895,"v3_v4_v3":158463,"v3_v4_v4":136274,"v4_v2_v2":182640,"v4_v2_v4":166614,"v4_v2_v3":166059,"v4_v3_v3":158127,"v4_v3_v2":165993,"v4_v4_v3":156327,"v4_v3_v4":149130,"v4_v4_v2":144748,"v4_v4_v4":87480,"bytecode_size":19270},"status":"crash","description":"4-byte merge for V3 recipient+forward_len — test failure, reverted","timestamp":1781061417943,"segment":2,"confidence":9.278959219414562,"asi":{"hypothesis":"Merge recipient_idx + forward_len in V3 swap compact into 4-byte slice read","next_action_hint":"Only merge adjacent same-typed fields. Non-power-of-2 merges are risky.","result":"Test failure — 4-byte read overruns into next command's data."}}
{"run":74,"commit":"2d5c4ce","metric":4281571,"metrics":{"v2_v2_v4":184792,"v2_v3_v3":147098,"v2_v2_v2":184270,"v2_v4_v2":186789,"v2_v3_v2":167574,"v2_v3_v4":171384,"v2_v2_v3":163319,"v2_v4_v4":145706,"v2_v4_v3":165863,"v3_v2_v2":163231,"v3_v3_v2":147057,"v3_v2_v3":147066,"v3_v2_v4":167123,"v3_v3_v3":144388,"v3_v4_v3":158372,"v3_v4_v4":136164,"v3_v4_v2":165781,"v3_v3_v4":159407,"v4_v2_v4":166518,"v4_v2_v3":165963,"v4_v2_v2":182544,"v4_v3_v2":165897,"v4_v4_v2":144628,"v4_v4_v3":156216,"v4_v3_v3":158036,"v4_v3_v4":149020,"v4_v4_v4":87365,"bytecode_size":18696},"status":"keep","description":"Replace shift() with >> operator — -2,533 gas, -574 bytes","timestamp":1781061841268,"segment":2,"confidence":8.486447615886712,"asi":{"hypothesis":"Replace Vyper deprecated shift(x, -8) with x >> 8 operator for cheaper byte extraction","result":"-2,533 gas. The >> operator compiles directly to the EVM SHR opcode, while shift() had overhead from builtin function dispatch. Also -574 bytes bytecode from eliminating the builtin call overhead across 15+ sites. All 27 tests pass.","note":"Also tried & 0xFF for % 256 but Vyper 0.5.0a2 has TypeMismatch issues with bitwise AND on uint256 literals. Keep using % 256 for now."}}
{"run":75,"commit":"182202a","metric":4281571,"metrics":{"v2_v2_v4":184792,"v2_v4_v2":186789,"v2_v2_v2":184270,"v2_v3_v3":147098,"v2_v3_v2":167574,"v2_v4_v3":165863,"v2_v3_v4":171384,"v2_v2_v3":163319,"v2_v4_v4":145706,"v3_v2_v2":163231,"v3_v2_v3":147066,"v3_v2_v4":167123,"v3_v3_v2":147057,"v3_v3_v3":144388,"v3_v3_v4":159407,"v3_v4_v2":165781,"v3_v4_v3":158372,"v3_v4_v4":136164,"v4_v2_v2":182544,"v4_v2_v4":166518,"v4_v2_v3":165963,"v4_v3_v3":158036,"v4_v3_v2":165897,"v4_v4_v3":156216,"v4_v3_v4":149020,"v4_v4_v2":144628,"v4_v4_v4":87365,"bytecode_size":18696},"status":"keep","description":"Replace % with & bitwise AND — no gas change","timestamp":1781061967497,"segment":2,"confidence":7.607001190003967,"asi":{"hypothesis":"Replace % 256 with & 255 for byte extraction","result":"No gas change — Venom optimizes power-of-2 modulo to bitwise AND internally"}}
