{"run":133,"commit":"01c90c6","metric":4238811,"metrics":{"bytecode_size":18009,"v2_v2_v2":182771,"v2_v2_v4":183422,"v2_v3_v3":145526,"v2_v4_v2":185118,"v2_v2_v3":161738,"v2_v4_v3":164109,"v2_v3_v2":165692,"v2_v3_v4":169633,"v2_v4_v4":144326,"v3_v2_v2":161651,"v3_v2_v3":145494,"v3_v2_v4":165372,"v3_v3_v2":145485,"v3_v3_v3":142683,"v3_v3_v4":157696,"v3_v4_v2":164031,"v3_v4_v3":156661,"v3_v4_v4":134752,"v4_v2_v2":181100,"v4_v2_v4":165334,"v4_v2_v3":164131,"v4_v3_v2":164069,"v4_v3_v3":156330,"v4_v3_v4":147541,"v4_v4_v2":143171,"v4_v4_v3":154724,"v4_v4_v4":86251},"status":"crash","description":"DynArray direct writes + t_address_count — test failures","timestamp":1781116854151,"segment":3,"confidence":13.23047691430743,"asi":{"hypothesis":"Replace DynArray.append() with direct t_addresses[i] writes + t_address_count","next_action_hint":"Vyper DynArray requires append() to maintain internal length. Cannot bypass. Look for other optimizations.","result":"27 test failures. DynArray.__getitem__ bounds-checks against stale length. Direct writes bypass length tracking.","rollback_reason":"DynArray direct writes break Vyper bounds checks — length is stale"}}
{"run":134,"commit":"01c90c6","metric":4238811,"metrics":{"bytecode_size":18009,"v2_v2_v2":182771,"v2_v2_v4":183422,"v2_v3_v3":145526,"v2_v4_v2":185118,"v2_v2_v3":161738,"v2_v4_v3":164109,"v2_v3_v2":165692,"v2_v3_v4":169633,"v2_v4_v4":144326,"v3_v2_v2":161651,"v3_v2_v3":145494,"v3_v2_v4":165372,"v3_v3_v2":145485,"v3_v3_v3":142683,"v3_v3_v4":157696,"v3_v4_v2":164031,"v3_v4_v3":156661,"v3_v4_v4":134752,"v4_v2_v2":181100,"v4_v2_v4":165334,"v4_v2_v3":164131,"v4_v3_v2":164069,"v4_v3_v3":156330,"v4_v3_v4":147541,"v4_v4_v2":143171,"v4_v4_v3":154724,"v4_v4_v4":86251},"status":"discard","description":"Remove double-converts: convert(convert(addr,uint160),bytes32) → convert(addr,bytes32) — no gas change","timestamp":1781117219618,"segment":3,"confidence":16.469252601702934,"asi":{"hypothesis":"Remove double-converts: convert(convert(addr, uint160), bytes32) → convert(addr, bytes32)","next_action_hint":"Venom optimizes double-converts internally. This is a code cleanliness change only. Try a different optimization approach.","result":"No gas change, same bytecode size. Venom optimizes chained converts at compile time.","rollback_reason":"No gas savings"}}
{"run":135,"commit":"fdd63dc","metric":4238811,"metrics":{"bytecode_size":17912,"v2_v2_v2":182771,"v2_v2_v4":183422,"v2_v3_v3":145526,"v2_v4_v2":185118,"v2_v2_v3":161738,"v2_v4_v3":164109,"v2_v3_v2":165692,"v2_v3_v4":169633,"v2_v4_v4":144326,"v3_v2_v2":161651,"v3_v2_v3":145494,"v3_v2_v4":165372,"v3_v3_v2":145485,"v3_v3_v3":142683,"v3_v3_v4":157696,"v3_v4_v2":164031,"v3_v4_v3":156661,"v3_v4_v4":134752,"v4_v2_v2":181100,"v4_v2_v4":165334,"v4_v2_v3":164131,"v4_v3_v2":164069,"v4_v3_v3":156330,"v4_v3_v4":147541,"v4_v4_v2":143171,"v4_v4_v3":154724,"v4_v4_v4":86251},"status":"keep","description":"Merge fthz in V4 batch handler — no gas change, -97 bytes","timestamp":1781117344602,"segment":3,"confidence":15.140682757121112,"asi":{"bytecode_change":"-97 bytes","hypothesis":"Merge fee+ts+hooks+zfo into single 8-byte fthz read in V4 batch handler (same pattern as V4 swap compact)","result":"No gas change, -97 bytes bytecode. Merged 4 separate slice reads (hooks_idx, fee, tick_spacing, zero_for_one) into 1 fthz read + bit extraction. But V4 batch is only used in v4_v4_v4 path which isn't the main gas driver."}}
{"run":136,"commit":"3d57be4","metric":4238507,"metrics":{"bytecode_size":18051,"v2_v2_v2":182771,"v2_v2_v4":183381,"v2_v3_v3":145526,"v2_v4_v2":185118,"v2_v2_v3":161738,"v2_v4_v3":164109,"v2_v3_v2":165692,"v2_v3_v4":169633,"v2_v4_v4":144326,"v3_v2_v2":161651,"v3_v2_v3":145494,"v3_v2_v4":165372,"v3_v3_v2":145485,"v3_v3_v3":142683,"v3_v3_v4":157696,"v3_v4_v2":164031,"v3_v4_v3":156661,"v3_v4_v4":134752,"v4_v2_v2":181059,"v4_v2_v4":165301,"v4_v2_v3":164090,"v4_v3_v2":164028,"v4_v3_v3":156330,"v4_v3_v4":147508,"v4_v4_v2":143130,"v4_v4_v3":154691,"v4_v4_v4":86251},"status":"keep","description":"Add _read_pm_delta_slot for precomputed slots — -304 gas","timestamp":1781117553156,"segment":3,"confidence":13.713393205778992,"asi":{"bytecode_change":"+139 bytes (new function + call sites)","hypothesis":"Add _read_pm_delta_slot(slot) to skip address comparisons when caller already knows the slot (WETH_DELTA_SLOT, NATIVE_DELTA_SLOT)","gas_savings":"-304 gas across all paths","paths_affected":"V4-containing paths (v2_v2_v4, v4_v2_v2, v4_v4_v2, v4_v3_v2, v4_v4_v3, v4_v2_v4, v4_v3_v4)","result":"-304 gas by replacing 6 _read_pm_delta(WETH_ADDR/NATIVE_ADDRESS) calls with _read_pm_delta_slot(precomputed_slot), skipping address comparisons in the hot delta-reading path"}}
{"run":137,"commit":"f690641","metric":4238114,"metrics":{"bytecode_size":18240,"v2_v2_v2":182771,"v2_v2_v4":183361,"v2_v3_v3":145526,"v2_v4_v2":185109,"v2_v2_v3":161738,"v2_v4_v3":164100,"v2_v3_v2":165692,"v2_v3_v4":169613,"v2_v4_v4":144297,"v3_v2_v2":161651,"v3_v2_v3":145494,"v3_v2_v4":165352,"v3_v3_v2":145485,"v3_v3_v3":142683,"v3_v3_v4":157680,"v3_v4_v2":164022,"v3_v4_v3":156654,"v3_v4_v4":134729,"v4_v2_v2":181039,"v4_v2_v4":165269,"v4_v2_v3":164070,"v4_v3_v2":164008,"v4_v3_v3":156314,"v4_v3_v4":147476,"v4_v4_v2":143101,"v4_v4_v3":154668,"v4_v4_v4":86212},"status":"keep","description":"Inline _lookup_address in V4 swap compact — -393 gas","timestamp":1781117856824,"segment":3,"confidence":13.17981072555205,"asi":{"bytecode_change":"+189 bytes (inlined sentinel resolution)","hypothesis":"Inline _lookup_address sentinel resolution in _cmd_v4_swap_compact to save function call overhead + enable Venom constant propagation for WETH/NATIVE sentinels","paths_improved":"All V4-containing paths (v4_v4_v4: -39, v4_v4_v3: -23, v4_v4_v2: -29, v4_v3_v4: -32, v4_v3_v2: -20, v4_v2_v4: -32, v4_v2_v2: -20, v4_v2_v3: -20, also mixed paths)","result":"-393 gas by inlining sentinel resolution for currency0/currency1 in V4 swap compact. Function call overhead + branch overhead was real."}}
{"run":138,"commit":"f4f52e1","metric":4237368,"metrics":{"bytecode_size":18416,"v2_v2_v2":182771,"v2_v2_v4":183323,"v2_v3_v3":145526,"v2_v4_v2":185082,"v2_v2_v3":161738,"v2_v4_v3":164073,"v2_v3_v2":165692,"v2_v3_v4":169537,"v2_v4_v4":144221,"v3_v2_v2":161651,"v3_v2_v3":145494,"v3_v2_v4":165276,"v3_v3_v2":145485,"v3_v3_v3":142683,"v3_v3_v4":157620,"v3_v4_v2":163995,"v3_v4_v3":156632,"v3_v4_v4":134668,"v4_v2_v2":181012,"v4_v2_v4":165248,"v4_v2_v3":164043,"v4_v3_v2":163981,"v4_v3_v3":156292,"v4_v3_v4":147424,"v4_v4_v2":143074,"v4_v4_v3":154646,"v4_v4_v4":86181},"status":"keep","description":"Inline _lookup_address in V4 take compact — -746 gas","timestamp":1781117981913,"segment":3,"confidence":12.821428571428571,"asi":{"bytecode_change":"+176 bytes (inlined sentinel resolution for V4_TAKE_COMPACT)","hypothesis":"Inline _lookup_address in _cmd_v4_take_compact to save function call overhead for currency and recipient resolution","result":"-746 gas improvement. V4_TAKE_COMPACT (25 uses × 2 _lookup_address calls = 50 total calls) saves ~15 gas per _lookup_address inline = significant total impact.","total_inline_savings":"V4 swap compact (-393) + V4 take compact (-746) = -1,139 gas from inlining _lookup_address"}}
{"run":139,"commit":"75bf4fa","metric":4236823,"metrics":{"bytecode_size":18588,"v2_v2_v2":182724,"v2_v2_v4":183323,"v2_v3_v3":145488,"v2_v4_v2":185035,"v2_v2_v3":161691,"v2_v4_v3":164026,"v2_v3_v2":165645,"v2_v3_v4":169537,"v2_v4_v4":144221,"v3_v2_v2":161604,"v3_v2_v3":145456,"v3_v2_v4":165276,"v3_v3_v2":145448,"v3_v3_v3":142683,"v3_v3_v4":157620,"v3_v4_v2":163948,"v3_v4_v3":156595,"v3_v4_v4":134668,"v4_v2_v2":181012,"v4_v2_v4":165248,"v4_v2_v3":164043,"v4_v3_v2":163981,"v4_v3_v3":156255,"v4_v3_v4":147474,"v4_v4_v2":143074,"v4_v4_v3":154617,"v4_v4_v4":86181},"status":"keep","description":"Inline _lookup_address in ERC20 transfer — -545 gas","timestamp":1781118123228,"segment":3,"confidence":12.556806550665302,"asi":{"bytecode_change":"+172 bytes","hypothesis":"Inline _lookup_address in _cmd_erc20_transfer to save function call overhead for token and recipient resolution","result":"-545 gas improvement. ERC20_TRANSFER (13 uses × 2 _lookup_address calls) saves ~21 gas per _lookup_address inline."}}
{"run":140,"commit":"2673d1f","metric":4235055,"metrics":{"bytecode_size":18956,"v2_v2_v2":182523,"v2_v2_v4":183216,"v2_v3_v3":145356,"v2_v4_v2":185057,"v2_v2_v3":161496,"v2_v4_v3":164054,"v2_v3_v2":165474,"v2_v3_v4":169460,"v2_v4_v4":144226,"v3_v2_v2":161403,"v3_v2_v3":145320,"v3_v2_v4":165193,"v3_v3_v2":145311,"v3_v3_v3":142570,"v3_v3_v4":157577,"v3_v4_v2":163970,"v3_v4_v3":156636,"v3_v4_v4":134692,"v4_v2_v2":180893,"v4_v2_v4":165242,"v4_v2_v3":163954,"v4_v3_v2":163892,"v4_v3_v3":156208,"v4_v3_v4":147448,"v4_v4_v2":143067,"v4_v4_v3":154636,"v4_v4_v4":86181},"status":"keep","description":"Inline _lookup_address in V3/V2 handlers — -1,768 gas","timestamp":1781118274425,"segment":3,"confidence":12.713249835201054,"asi":{"bytecode_change":"+368 bytes","hypothesis":"Inline _lookup_address in V3 swap compact, V2 swap direct, V2 swap compact to save function call overhead for recipient resolution","result":"-1,768 gas! V3 swap compact (30 uses), V2 swap direct (25 uses), V2 swap compact (3 uses) — all saved ~15 gas per _lookup_address inline. Biggest single-jump improvement in this iteration.","cumulative_lookup_address_inline_savings":"V4 swap compact (-393) + V4 take compact (-746) + ERC20 transfer (-545) + V3/V2 handlers (-1,768) = -3,452 gas total from inlining _lookup_address"}}
{"run":141,"commit":"2673d1f","metric":4235055,"metrics":{"bytecode_size":18956,"v2_v2_v2":182523,"v2_v2_v4":183216,"v2_v3_v3":145356,"v2_v4_v2":185057,"v2_v2_v3":161496,"v2_v4_v3":164054,"v2_v3_v2":165474,"v2_v3_v4":169460,"v2_v4_v4":144226,"v3_v2_v2":161403,"v3_v2_v3":145320,"v3_v2_v4":165193,"v3_v3_v2":145311,"v3_v3_v3":142570,"v3_v3_v4":157577,"v3_v4_v2":163970,"v3_v4_v3":156636,"v3_v4_v4":134692,"v4_v2_v2":180893,"v4_v2_v4":165242,"v4_v2_v3":163954,"v4_v3_v2":163892,"v4_v3_v3":156208,"v4_v3_v4":147448,"v4_v4_v2":143067,"v4_v4_v3":154636,"v4_v4_v4":86181},"status":"discard","description":"Inline _lookup_address in V4 batch — no gas change","timestamp":1781118426678,"segment":3,"confidence":12.083959899749374,"asi":{"bytecode_change":"N/A (reverted)","hypothesis":"Inline _lookup_address in V4 batch handler currencies","next_action_hint":"V4 batch inline doesn't save gas — Venom optimizes function calls differently inside tight loops. Focus on non-loop handlers for inline gains. Remaining _lookup_address calls are in low-frequency handlers (V2 swap calc, V4 take delta, V4 dynamic, etc.) which won't have measurable benchmark impact.","result":"No gas change. V4 batch loop is a special case — Venom may already optimize function calls inside loops differently. The batch path only affects v4_v4_v4.","rollback_reason":"No gas savings, bytecode regression (+262 bytes)"}}
{"type":"config","name":"Alternative command streams for 27 three-hop permutations","metricName":"total_gas","metricUnit":"gas","bestDirection":"lower"}
{"run":142,"commit":"e155602","metric":4363743,"metrics":{},"status":"keep","description":"Baseline: current optimal command streams for all 27 permutations","timestamp":1781126912071,"segment":4,"confidence":null,"asi":{"hypothesis":"Establish baseline gas numbers for all 27 three-hop permutations with current optimal command streams"}}
{"run":143,"commit":"e155602","metric":0,"metrics":{},"status":"discard","description":"V4-V4-V3 alt: V4_TAKE→V3c direct inside callback = 140,239 gas vs 161,052 current (−20,813). NO code change needed — only test encoding. Not auto-committed since this is a test-only change.","timestamp":1781127073973,"segment":4,"confidence":null,"asi":{"hypothesis":"V4-V4-V3 can use V4_TAKE WBTC→V3c directly inside V3c callback (3 transfers) instead of V4_TAKE→executor + ERC20→V3c (4 transfers)","result":"140,239 gas vs 161,052 current = −20,813 gas (−12.9%). Same IIA-during-callback pattern already used in V4-V3-V3, V4-V3-V4.","path":"v4_v4_v3","saving_type":"test_encoding_only","transfer_reduction":"4→3"}}
{"run":144,"commit":"e155602","metric":4287120,"metrics":{},"status":"discard","description":"V4_SETTLE_ETH command + init_erc6909 warmup: −76,623 total gas but +4,800 regression on 4 V2/V3-starting-V4 paths. V4-starting paths save 13-17K from warm SSTORE. Net improvement is real but regression on non-V4 paths needs investigation.","timestamp":1781129002711,"segment":4,"confidence":null,"asi":{"hypothesis":"Add V4_SETTLE_ETH command + init_erc6909 warmup to pre-warm ERC-6909 storage slots, saving cold SSTORE penalty on first mint","result":"Net −76,623 gas. V4-starting paths save 13-17K. But V2/V3-starting-V4 paths REGRESS by ~4,800 each. Bytecode +1,253 bytes.","regression_paths":"v2_v2_v4 +4800, v2_v3_v4 +4800, v2_v4_v4 +4788, v3_v2_v4 +4800","v4_savings":"v4_v2_v2 -17100, v4_v2_v3 -17100, v4_v3_v2 -17100, v4_v3_v3 -13680, v4_v4_v2 -17112, v4_v4_v3 -13689","bytecode_increase":"+1253 bytes (18956 → 20209)","rollback_reason":"4 paths regress by ~4.8K each. The warmup affects transient storage state across the contract lifecycle. Need to understand why non-V4-starting paths regress before committing.","next_action_hint":"The +4800 regression on 4 paths is suspiciously uniform. Likely the init_erc6909 call (inside PM.unlock) leaves residual transient state, or the bytecode increase changes Venom's memory layout. Try: (1) run WITHOUT init_erc6909 call to isolate whether it's the warmup or the new command/bitecode, (2) check if the regression is from dispatch reordering due to new elif in chain"}}
{"run":145,"commit":"e155602","metric":4363743,"metrics":{},"status":"discard","description":"V4_SETTLE_ETH command only (no init_erc6909): bytecode +222 bytes (18956→19178), but total_gas identical at 4,363,743. Confirms regressions were from init_erc6909 warmup, not new command.","timestamp":1781129178251,"segment":4,"confidence":null,"asi":{"hypothesis":"Isolate whether V4_SETTLE_ETH command bytecode addition alone causes the +4800 regression on V2/V3-starting-V4 paths","result":"No regression at all! total_gas = 4,363,743 (identical to baseline). The +4,800 regression was from init_erc6909 warmup call, not the new command dispatch.","bytecode_increase":"+222 bytes (18956 → 19178), no gas impact"}}
{"run":146,"commit":"712668a","metric":4363743,"metrics":{},"status":"keep","description":"Baseline reconfirm: total_gas=4,363,743","timestamp":1781133645730,"segment":4,"confidence":null,"asi":{"hypothesis":"Reconfirm baseline before next optimization wave"}}
{"run":147,"commit":"0e8c584","metric":4363398,"metrics":{"v2_v3_v3":145356,"v2_v2_v4":190088,"v2_v2_v2":182523,"v2_v4_v2":191334,"v2_v4_v3":170331,"v2_v3_v2":165474,"v2_v3_v4":177733,"v2_v2_v3":161496,"v3_v2_v4":172626,"v3_v2_v2":161403,"v2_v4_v4":153937,"v3_v2_v3":145320,"v3_v3_v2":145311,"v3_v3_v3":142570,"v3_v3_v4":163524,"v3_v4_v2":170247,"v3_v4_v3":161658,"v3_v4_v4":142460,"v4_v2_v2":186636,"v4_v2_v3":169697,"v4_v2_v4":171098,"v4_v3_v2":169635,"v4_v4_v2":151088,"v4_v3_v3":161220,"v4_v3_v4":156597,"v4_v4_v3":161052,"v4_v4_v4":92984,"bytecode_size":19033},"status":"keep","description":"Inline _lookup_address in V4_SYNC — -345 gas","timestamp":1781134104796,"segment":4,"confidence":null,"asi":{"bytecode_change":"+77 bytes (18956 → 19033)","hypothesis":"Inline _lookup_address in _cmd_v4_sync to save function call overhead for currency resolution","paths_improved":"v2_v2_v4(-27), v2_v4_v2(-27), v2_v4_v3(-27), v2_v3_v4(-65), v3_v2_v4(-27), v3_v3_v4(-21), v3_v4_v2(-27), v3_v4_v3(-22), v4_v3_v4(-22), v4_v3_v3(-31)"}}
{"run":148,"commit":"0b86b70","metric":4360494,"metrics":{"v2_v2_v2":182523,"v2_v3_v3":145356,"v2_v2_v4":189968,"v2_v4_v2":191214,"v2_v3_v4":177613,"v2_v3_v2":165474,"v2_v2_v3":161496,"v2_v4_v3":170211,"v3_v2_v2":161403,"v2_v4_v4":153697,"v3_v2_v3":145320,"v3_v2_v4":172506,"v3_v3_v2":145311,"v3_v3_v4":163428,"v3_v4_v2":170127,"v3_v3_v3":142570,"v3_v4_v3":161562,"v3_v4_v4":142268,"v4_v2_v2":186516,"v4_v2_v3":169577,"v4_v2_v4":170906,"v4_v3_v2":169515,"v4_v3_v4":156405,"v4_v3_v3":161124,"v4_v4_v2":150848,"v4_v4_v4":92696,"v4_v4_v3":160860,"bytecode_size":18988},"status":"keep","description":"Merge 2+8 byte reads into 10-byte in V4_SWAP_COMPACT — -2,904 gas","timestamp":1781134426699,"segment":4,"confidence":18.83478260869565,"asi":{"bytecode_change":"-45 bytes (19033 → 18988)","hypothesis":"Merge 2-byte + 8-byte slice reads into single 10-byte read in V4_SWAP_COMPACT to save 1 bounds check per call","paths_improved":"All V4-containing paths improved: v4_v4_v4(-288), v4_v4_v3(-192), v4_v4_v2(-240), v4_v3_v4(-192), v4_v3_v3(-96), v4_v3_v2(-120), v4_v2_v4(-192), v4_v2_v3(-120), v4_v2_v2(-120), plus all mixed V4 paths"}}
{"run":149,"commit":"0b86b70","metric":4360494,"metrics":{"v2_v3_v3":145356,"v2_v2_v4":189968,"v2_v2_v2":182523,"v2_v4_v2":191214,"v2_v4_v3":170211,"v2_v3_v2":165474,"v2_v3_v4":177613,"v2_v2_v3":161496,"v3_v2_v4":172506,"v3_v2_v2":161403,"v2_v4_v4":153697,"v3_v2_v3":145320,"v3_v3_v2":145311,"v3_v3_v3":142570,"v3_v3_v4":163428,"v3_v4_v2":170127,"v3_v4_v3":161562,"v3_v4_v4":142268,"v4_v2_v2":186516,"v4_v2_v3":169577,"v4_v2_v4":170906,"v4_v3_v2":169515,"v4_v4_v2":150848,"v4_v3_v3":161124,"v4_v3_v4":156405,"v4_v4_v3":160860,"v4_v4_v4":92696,"bytecode_size":18946},"status":"discard","description":"Merge 2+8→10 byte in V4_SWAP_DYNAMIC — no gas change","timestamp":1781134552127,"segment":4,"confidence":9.417391304347825,"asi":{"bytecode_change":"-42 bytes (18988 → 18946)","hypothesis":"Apply same 10-byte merge to V4_SWAP_DYNAMIC for consistency","result":"No gas change — V4_SWAP_DYNAMIC not used in benchmarks. -42 bytes bytecode.","rollback_reason":"Primary metric unchanged"}}
{"run":150,"commit":"0b86b70","metric":4360494,"metrics":{"v2_v4_v2":191214,"v2_v3_v3":145356,"v2_v2_v4":189968,"v2_v2_v2":182523,"v2_v4_v3":170211,"v2_v3_v4":177613,"v2_v3_v2":165474,"v2_v4_v4":153697,"v2_v2_v3":161496,"v3_v2_v3":145320,"v3_v2_v2":161403,"v3_v3_v2":145311,"v3_v2_v4":172506,"v3_v3_v4":163428,"v3_v3_v3":142570,"v3_v4_v2":170127,"v3_v4_v3":161562,"v3_v4_v4":142268,"v4_v2_v3":169577,"v4_v2_v2":186516,"v4_v2_v4":170906,"v4_v3_v2":169515,"v4_v3_v4":156405,"v4_v4_v2":150848,"v4_v3_v3":161124,"v4_v4_v3":160860,"v4_v4_v4":92696,"bytecode_size":18937},"status":"discard","description":"Merge 2+8→10 byte in V4_BATCH — no gas change","timestamp":1781134680762,"segment":4,"confidence":2,"asi":{"bytecode_change":"-9 bytes","hypothesis":"Apply 10-byte merge to V4_BATCH handler for consistency","result":"No gas change — V4_BATCH only used in v4_v4_v4 which is already heavily optimized. The loop body may have different optimization characteristics from V4_SWAP_COMPACT.","rollback_reason":"Primary metric unchanged"}}
{"run":151,"commit":"b9364bb","metric":4358615,"metrics":{"v2_v4_v2":191133,"v2_v2_v2":182361,"v2_v3_v3":145292,"v2_v2_v4":189806,"v2_v4_v3":170130,"v2_v2_v3":161334,"v2_v3_v4":177532,"v2_v4_v4":153616,"v2_v3_v2":165393,"v3_v2_v2":161241,"v3_v2_v3":145255,"v3_v3_v2":145246,"v3_v2_v4":172425,"v3_v3_v3":142570,"v3_v4_v2":170046,"v3_v3_v4":163428,"v3_v4_v3":161562,"v3_v4_v4":142268,"v4_v2_v2":186354,"v4_v2_v3":169496,"v4_v2_v4":170841,"v4_v3_v2":169434,"v4_v3_v4":156405,"v4_v3_v3":161124,"v4_v4_v3":160860,"v4_v4_v2":150767,"v4_v4_v4":92696,"bytecode_size":18977},"status":"keep","description":"Merge 2+16→18 byte read in V2_SWAP_DIRECT — -1,879 gas","timestamp":1781134898752,"segment":4,"confidence":1.765840220385675,"asi":{"bytecode_change":"+39 bytes (18946 → 18977) — wait, prev was 18988, so actually -11 bytes from V4_SWAP_COMPACT merge","hypothesis":"Merge 2+16→18 byte single-slice read in V2_SWAP_DIRECT to save 1 bounds check per call","paths_improved":"All V2-containing paths improved: v2_v2_v2(-162), v2_v2_v3(-162), v2_v2_v4(-162), v2_v3_v2(-81), v2_v3_v3(-64), v2_v3_v4(-81), v2_v4_v2(-81), v2_v4_v3(-81), v2_v4_v4(-81), v3_v2_v2(-162), v3_v2_v3(-65), v3_v2_v4(-81), plus V4-starting V2 paths"}}
{"run":152,"commit":"a0a6d4a","metric":4356509,"metrics":{"v2_v2_v4":189806,"v2_v4_v2":191133,"v2_v3_v3":145148,"v2_v2_v2":182361,"v2_v2_v3":161244,"v2_v4_v3":170040,"v2_v3_v2":165303,"v2_v3_v4":177442,"v2_v4_v4":153616,"v3_v2_v4":172335,"v3_v2_v3":145111,"v3_v2_v2":161151,"v3_v3_v4":163284,"v3_v3_v2":145102,"v3_v3_v3":142354,"v3_v4_v2":169956,"v3_v4_v4":142196,"v3_v4_v3":161418,"v4_v2_v3":169406,"v4_v2_v2":186354,"v4_v3_v2":169344,"v4_v2_v4":170841,"v4_v3_v3":160980,"v4_v4_v2":150767,"v4_v3_v4":156333,"v4_v4_v3":160788,"v4_v4_v4":92696,"bytecode_size":18954},"status":"keep","description":"Merge 2+16→18 byte read in V3_SWAP_COMPACT — -2,106 gas","timestamp":1781135012395,"segment":4,"confidence":2.351373313830652,"asi":{"bytecode_change":"-23 bytes (18977 → 18954)","hypothesis":"Merge 2+16→18 byte single-slice read in V3_SWAP_COMPACT to save 1 bounds check per call","paths_improved":"All V3-containing paths: v3_v3_v3(-216), v3_v3_v2(-144), v3_v3_v4(-144), v3_v2_v2(-90), v3_v2_v3(-144), v3_v2_v4(-90), v3_v4_v2(-90), v3_v4_v3(-144), v3_v4_v4(-72), v2_v3_v2(-90), v2_v3_v3(-144), v2_v3_v4(-90)"}}
