{"run":22,"commit":"951906e","metric":4404249,"metrics":{"bytecode_size":20540,"v2_v2_v2":187220,"v2_v2_v3":166266,"v2_v2_v4":190336,"v2_v3_v2":170656,"v2_v3_v3":149776,"v2_v3_v4":177441,"v2_v4_v2":192205,"v2_v4_v3":171301,"v2_v4_v4":151860,"v3_v2_v2":166153,"v3_v2_v3":149736,"v3_v2_v4":172969,"v3_v3_v2":149725,"v3_v3_v3":146880,"v3_v3_v4":164224,"v3_v4_v2":171194,"v3_v4_v3":162862,"v3_v4_v4":141227,"v4_v2_v2":187948,"v4_v2_v3":171531,"v4_v2_v4":171202,"v4_v3_v2":171458,"v4_v3_v3":162845,"v4_v3_v4":154290,"v4_v4_v2":150363,"v4_v4_v3":161045,"v4_v4_v4":91536},"status":"keep","description":"Inline idx vars across remaining _cmd_* functions — -82 gas","timestamp":1781049115130,"segment":0,"confidence":38.092675635276535,"asi":{"hypothesis":"Inline pool_idx/currency_idx/recipient_idx intermediate variables across all _cmd_* functions where the variable is used only once (V4_SYNC, V4_TAKE_DELTA, V4_TAKE_COMPACT, V3_SWAP_COMPACT, V3_SWAP_DELTA, V2_SWAP_COMPACT)","result":"-82 additional gas (combined with V4_TAKE inline -67 = -149 total). All these inline the t_addresses lookup directly into the consuming expression. Works when: (1) the idx variable is used once, (2) not in a struct constructor, (3) not causing double evaluation in nested extcall. Bytecode also shrinks -3 bytes."}}
{"run":23,"commit":"f86b52b","metric":4404249,"metrics":{"bytecode_size":20543,"v2_v2_v2":187220,"v2_v2_v3":166266,"v2_v2_v4":190336,"v2_v3_v2":170656,"v2_v3_v3":149776,"v2_v3_v4":177441,"v2_v4_v2":192205,"v2_v4_v3":171301,"v2_v4_v4":151860,"v3_v2_v2":166153,"v3_v2_v3":149736,"v3_v2_v4":172969,"v3_v3_v2":149725,"v3_v3_v3":146880,"v3_v3_v4":164224,"v3_v4_v2":171194,"v3_v4_v3":162862,"v3_v4_v4":141227,"v4_v2_v2":187948,"v4_v2_v3":171531,"v4_v2_v4":171202,"v4_v3_v2":171458,"v4_v3_v3":162845,"v4_v3_v4":154290,"v4_v4_v2":150363,"v4_v4_v3":161045,"v4_v4_v4":91536},"status":"keep","description":"Inline idx vars in zero-use commands — gas unchanged, cleaner","timestamp":1781049265473,"segment":0,"confidence":45.345195729537366,"asi":{"hypothesis":"Inline idx vars across all remaining _cmd_* functions (V4_SETTLE_DELTA, V4_MINT_COMPACT, V4_BURN_COMPACT, SEND_ETH, SEND_ETH_ALL, V2_SWAP_CALC, ERC20_XFER_BALANCE)","result":"Same total_gas (4,404,249). These commands are not used in the 27 benchmark paths, so no gas change. Bytecode essentially unchanged. Code is cleaner with fewer intermediate variables but no performance benefit."}}
{"run":24,"commit":"f5cba84","metric":4404249,"metrics":{"bytecode_size":20530,"v2_v2_v2":187220,"v2_v2_v3":166266,"v2_v2_v4":190336,"v2_v3_v2":170656,"v2_v3_v3":149776,"v2_v3_v4":177441,"v2_v4_v2":192205,"v2_v4_v3":171301,"v2_v4_v4":151860,"v3_v2_v2":166153,"v3_v2_v3":149736,"v3_v2_v4":172969,"v3_v3_v2":149725,"v3_v3_v3":146880,"v3_v3_v4":164224,"v3_v4_v2":171194,"v3_v4_v3":162862,"v3_v4_v4":141227,"v4_v2_v2":187948,"v4_v2_v3":171531,"v4_v2_v4":171202,"v4_v3_v2":171458,"v4_v3_v3":162845,"v4_v3_v4":154290,"v4_v4_v2":150363,"v4_v4_v3":161045,"v4_v4_v4":91536},"status":"keep","description":"V2 auto-pay elif — gas unchanged, -13 bytes","timestamp":1781049392166,"segment":0,"confidence":41.37012987012987,"asi":{"hypothesis":"Change _v2_auto_pay to use elif instead of two separate if blocks for amount0_out/amount1_out","result":"Same total_gas (4,404,249). Bytecode -13 bytes. In V2 swaps, only one of amount0_out/amount1_out is > 0, so the branches are mutually exclusive anyway. No gas savings but cleaner code."}}
{"run":25,"commit":"f5cba84","metric":4404691,"metrics":{"bytecode_size":20546,"v2_v2_v2":187220,"v2_v2_v3":166284,"v2_v2_v4":190336,"v2_v3_v2":170674,"v2_v3_v3":149812,"v2_v3_v4":177459,"v2_v4_v2":192205,"v2_v4_v3":171319,"v2_v4_v4":151860,"v3_v2_v2":166171,"v3_v2_v3":149772,"v3_v2_v4":172987,"v3_v3_v2":149761,"v3_v3_v3":146923,"v3_v3_v4":164252,"v3_v4_v2":171212,"v3_v4_v3":162891,"v3_v4_v4":141241,"v4_v2_v2":187948,"v4_v2_v3":171549,"v4_v2_v4":171202,"v4_v3_v2":171476,"v4_v3_v3":162874,"v4_v3_v4":154304,"v4_v4_v2":150363,"v4_v4_v4":91536,"v4_v4_v3":161060},"status":"discard","description":"V3 recipient_idx inline — +442 gas regression","timestamp":1781049529949,"segment":0,"confidence":45.345195729537366,"asi":{"hypothesis":"Inline recipient_idx in V3_SWAP_COMPACT and V3_SWAP_DELTA (same pattern as V4_TAKE)","result":"+442 gas regression! The t_addresses lookup inside the IUniswapV3Pool.swap() argument causes double evaluation or extra overhead. Unlike V4_TAKE where IPoolManager is a constant address, the V3 pool extcall requires the recipient as an argument. Revert."}}
{"run":26,"commit":"d298ae7","metric":4404232,"metrics":{"bytecode_size":20527,"v2_v2_v2":187220,"v2_v2_v3":166266,"v2_v2_v4":190336,"v2_v3_v2":170656,"v2_v3_v3":149776,"v2_v3_v4":177441,"v2_v4_v2":192205,"v2_v4_v3":171301,"v2_v4_v4":151860,"v3_v2_v2":166153,"v3_v2_v3":149736,"v3_v2_v4":172969,"v3_v3_v2":149725,"v3_v3_v3":146863,"v3_v3_v4":164224,"v3_v4_v2":171194,"v3_v4_v3":162862,"v3_v4_v4":141227,"v4_v2_v2":187948,"v4_v2_v3":171531,"v4_v2_v4":171202,"v4_v3_v2":171458,"v4_v3_v3":162845,"v4_v3_v4":154290,"v4_v4_v2":150363,"v4_v4_v4":91536,"v4_v4_v3":161045},"status":"keep","description":"V3 auto-pay elif — -17 gas","timestamp":1781049674256,"segment":0,"confidence":41.425324675324674,"asi":{"hypothesis":"Change _v3_auto_pay to use elif instead of two if blocks for amount0_delta/amount1_delta","result":"-17 gas. In V3 swaps, only one delta is positive, so the elif avoids an unnecessary comparison. Correct for standard single-direction V3 swaps."}}
{"run":27,"commit":"c9f720a","metric":4404232,"metrics":{"bytecode_size":20527,"v2_v2_v2":187220,"v2_v2_v3":166266,"v2_v2_v4":190336,"v2_v3_v2":170656,"v2_v3_v3":149776,"v2_v3_v4":177441,"v2_v4_v2":192205,"v2_v4_v3":171301,"v2_v4_v4":151860,"v3_v2_v2":166153,"v3_v2_v3":149736,"v3_v2_v4":172969,"v3_v3_v2":149725,"v3_v3_v3":146863,"v3_v3_v4":164224,"v3_v4_v2":171194,"v3_v4_v3":162862,"v3_v4_v4":141227,"v4_v2_v2":187948,"v4_v2_v3":171531,"v4_v2_v4":171202,"v4_v3_v2":171458,"v4_v3_v3":162845,"v4_v3_v4":154290,"v4_v4_v2":150363,"v4_v4_v4":91536,"v4_v4_v3":161045},"status":"keep","description":"Shorten callback assert strings — no bytecode change","timestamp":1781049868785,"segment":0,"confidence":39.99686520376176,"asi":{"hypothesis":"Shorten callback assertion strings to reduce bytecode (~172 bytes expected savings)","result":"Same total_gas (4,404,232) AND same bytecode_size (20,527). Shortening assertion strings did NOT reduce bytecode — Vyper/Venom may pack strings or offset with alignment. The V3 elif change was already committed. Minor code cleanup."}}
{"run":28,"commit":"ecd62e3","metric":4404232,"metrics":{"bytecode_size":20429,"v2_v2_v2":187220,"v2_v2_v3":166266,"v2_v2_v4":190336,"v2_v3_v2":170656,"v2_v3_v3":149776,"v2_v3_v4":177441,"v2_v4_v2":192205,"v2_v4_v3":171301,"v2_v4_v4":151860,"v3_v2_v2":166153,"v3_v2_v3":149736,"v3_v2_v4":172969,"v3_v3_v2":149725,"v3_v3_v3":146863,"v3_v3_v4":164224,"v3_v4_v2":171194,"v3_v4_v3":162862,"v3_v4_v4":141227,"v4_v2_v2":187948,"v4_v2_v3":171531,"v4_v2_v4":171202,"v4_v3_v2":171458,"v4_v3_v3":162845,"v4_v3_v4":154290,"v4_v4_v2":150363,"v4_v4_v4":91536,"v4_v4_v3":161045},"status":"keep","description":"unsafe_mul in V2 math — gas unchanged, -98 bytes","timestamp":1781050111426,"segment":0,"confidence":39.99686520376176,"asi":{"hypothesis":"Replace checked arithmetic with unsafe_mul in _v2_get_amount_in and _v2_get_amount_out to remove overflow checks","result":"Same total_gas (4,404,232). Bytecode -98 bytes (20,527→20,429). The V2 math functions are only called during V2 auto-pay callback, which isn't the primary gas hotspot. But bytecode shrinking gives more room under the 24KB limit."}}
{"run":29,"commit":"c475bc0","metric":4404232,"metrics":{"bytecode_size":20429,"v2_v2_v2":187220,"v2_v2_v3":166266,"v2_v2_v4":190336,"v2_v3_v2":170656,"v2_v3_v3":149776,"v2_v3_v4":177441,"v2_v4_v2":192205,"v2_v4_v3":171301,"v2_v4_v4":151860,"v3_v2_v2":166153,"v3_v2_v3":149736,"v3_v2_v4":172969,"v3_v3_v2":149725,"v3_v3_v3":146863,"v3_v3_v4":164224,"v3_v4_v2":171194,"v3_v4_v3":162862,"v3_v4_v4":141227,"v4_v2_v2":187948,"v4_v2_v3":171531,"v4_v2_v4":171202,"v4_v3_v2":171458,"v4_v3_v3":162845,"v4_v3_v4":154290,"v4_v4_v2":150363,"v4_v4_v4":91536,"v4_v4_v3":161045},"status":"keep","description":"Precompute sqrt price constants — no change","timestamp":1781050287853,"segment":0,"confidence":39.99686520376176,"asi":{"hypothesis":"Precompute MIN_SQRT_PRICE+1 and MAX_SQRT_PRICE-1 as constants to avoid runtime arithmetic in V4 swap paths","result":"Same gas and bytecode. Vyper/Venom already folds constant expressions at compile time. No benefit."}}
{"run":30,"commit":"b2485a8","metric":4388898,"metrics":{"bytecode_size":19912,"v2_v2_v2":186780,"v2_v2_v3":165824,"v2_v2_v4":189752,"v2_v3_v2":170154,"v2_v3_v3":149272,"v2_v3_v4":176704,"v2_v4_v2":191526,"v2_v4_v3":170620,"v2_v4_v4":151178,"v3_v2_v2":165711,"v3_v2_v3":149232,"v3_v2_v4":172285,"v3_v3_v2":149221,"v3_v3_v3":146484,"v3_v3_v4":163627,"v3_v4_v2":170513,"v3_v4_v3":162268,"v3_v4_v4":140632,"v4_v2_v2":187417,"v4_v2_v3":170938,"v4_v2_v4":170698,"v4_v3_v2":170865,"v4_v3_v3":162251,"v4_v3_v4":153664,"v4_v4_v2":149772,"v4_v4_v3":160464,"v4_v4_v4":91046},"status":"keep","description":"unsafe_add for offset arithmetic — -15,334 gas!","timestamp":1781050703539,"segment":0,"confidence":88.06583072100314,"asi":{"hypothesis":"Replace checked arithmetic (offset + const) with unsafe_add() in all _cmd_* command handler functions and their return values. Offsets in a 512-byte stream can never overflow uint256.","result":"-15,334 gas! Massive improvement by removing overflow checks on offset arithmetic across ~20 command handlers. Each 'offset + constant' addition had an overflow check (ADD + JUMPI = ~3 gas). With 168+ dispatches across 27 paths and multiple offsets per handler, this adds up fast. Bytecode also shrunk -517 bytes (20,429 → 19,912) from removing overflow check code."}}
{"run":31,"commit":"5a308ac","metric":4384690,"metrics":{"bytecode_size":19724,"v2_v2_v2":186657,"v2_v2_v3":165701,"v2_v2_v4":189556,"v2_v3_v2":170031,"v2_v3_v3":149149,"v2_v3_v4":176492,"v2_v4_v2":191330,"v2_v4_v3":170424,"v2_v4_v4":150993,"v3_v2_v2":165588,"v3_v2_v3":149109,"v3_v2_v4":172089,"v3_v3_v2":149098,"v3_v3_v3":146392,"v3_v3_v4":163470,"v3_v4_v2":170317,"v3_v4_v3":162111,"v3_v4_v4":140484,"v4_v2_v2":187237,"v4_v2_v3":170758,"v4_v2_v4":170556,"v4_v3_v2":170685,"v4_v3_v3":162094,"v4_v3_v4":153509,"v4_v4_v2":149603,"v4_v4_v3":160322,"v4_v4_v4":90935},"status":"keep","description":"Expand unsafe_add to all remaining cmds — -4,208 gas","timestamp":1781050890018,"segment":0,"confidence":101.25705329153605,"asi":{"hypothesis":"Expand unsafe_add to all remaining offset arithmetic: V4_UNLOCK (19 uses), V4 batch inner loop, preprocess function, V4_SWAP_DYNAMIC, and other _cmd_* functions","result":"-4,208 additional gas! Total savings from unsafe_add across all iterations: -19,542 gas. Every offset + constant addition formerly had an overflow check that Vyper compiles to ADD+JUMPI. Removing these across ~20 command handlers is a massive win. Bytecode also shrunk further (19,912 → 19,724 = -188 bytes)."}}
{"run":32,"commit":"938db95","metric":4384235,"metrics":{"bytecode_size":19676,"v2_v2_v2":186632,"v2_v2_v3":165676,"v2_v2_v4":189531,"v2_v3_v2":170031,"v2_v3_v3":149124,"v2_v3_v4":176467,"v2_v4_v2":191330,"v2_v4_v3":170399,"v2_v4_v4":150968,"v3_v2_v2":165588,"v3_v2_v3":149084,"v3_v2_v4":172064,"v3_v3_v2":149073,"v3_v3_v3":146372,"v3_v3_v4":163450,"v3_v4_v2":170317,"v3_v4_v3":162091,"v3_v4_v4":140464,"v4_v2_v2":187237,"v4_v2_v3":170733,"v4_v2_v4":170536,"v4_v3_v2":170685,"v4_v3_v3":162074,"v4_v3_v4":153489,"v4_v4_v2":149603,"v4_v4_v3":160302,"v4_v4_v4":90915},"status":"keep","description":"Expand unsafe_sub to V2 math and profit — -455 gas","timestamp":1781051033376,"segment":0,"confidence":100.01832061068703,"asi":{"hypothesis":"Expand unsafe arithmetic to V2 math functions (unsafe_sub for 10000-fee, reserve_out-amount_out) and execute() profit/bribe paths (unsafe_sub for combined_after-combined_before)","result":"-455 gas additional savings. The unsafe_sub on '10000-fee' (called once per V2 auto-pay) and 'reserve_out-amount_out' saves overflow checks. Also saves in bribe path (rarely used) and profit return. Bytecode -48 bytes (19,724 → 19,676)."}}
{"run":33,"commit":"fa2727c","metric":4384235,"metrics":{"bytecode_size":19611,"v2_v2_v2":186632,"v2_v2_v3":165676,"v2_v2_v4":189531,"v2_v3_v2":170031,"v2_v3_v3":149124,"v2_v3_v4":176467,"v2_v4_v2":191330,"v2_v4_v3":170399,"v2_v4_v4":150968,"v3_v2_v2":165588,"v3_v2_v3":149084,"v3_v2_v4":172064,"v3_v3_v2":149073,"v3_v3_v3":146372,"v3_v3_v4":163450,"v3_v4_v2":170317,"v3_v4_v3":162091,"v3_v4_v4":140464,"v4_v2_v2":187237,"v4_v2_v3":170733,"v4_v2_v4":170536,"v4_v3_v2":170685,"v4_v3_v3":162074,"v4_v3_v4":153489,"v4_v4_v2":149603,"v4_v4_v3":160302,"v4_v4_v4":90915},"status":"keep","description":"Expand unsafe_sub to remaining paths — -65 bytes","timestamp":1781051192597,"segment":0,"confidence":97.48809523809524,"asi":{"hypothesis":"Expand unsafe_sub to remaining subtraction patterns: owed-weth_balance (guarded), bribe_amount-self.balance (guarded), pair_balance-reserve_in (guarded), len(data)-chunk_offset, tstore chunk arithmetic","result":"Same total_gas (4,384,235). These subtractions are all in non-benchmark paths (V2_CALC, bribe, tstore_continuation), so no gas impact. Bytecode -65 bytes from removing overflow checks in those code paths."}}
{"run":34,"commit":"8fb0103","metric":4384235,"metrics":{"bytecode_size":19603,"v2_v2_v2":186632,"v2_v2_v3":165676,"v2_v2_v4":189531,"v2_v3_v2":170031,"v2_v3_v3":149124,"v2_v3_v4":176467,"v2_v4_v2":191330,"v2_v4_v3":170399,"v2_v4_v4":150968,"v3_v2_v2":165588,"v3_v2_v3":149084,"v3_v2_v4":172064,"v3_v3_v2":149073,"v3_v3_v3":146372,"v3_v3_v4":163450,"v3_v4_v2":170317,"v3_v4_v3":162091,"v3_v4_v4":140464,"v4_v2_v2":187237,"v4_v2_v3":170733,"v4_v2_v4":170536,"v4_v3_v2":170685,"v4_v3_v3":162074,"v4_v3_v4":153489,"v4_v4_v2":149603,"v4_v4_v3":160302,"v4_v4_v4":90915},"status":"keep","description":"Final unsafe arithmetic cleanup — -8 bytes","timestamp":1781051340235,"segment":0,"confidence":130.5019920318725,"asi":{"hypothesis":"Replace remaining checked arithmetic with unsafe variants: V2 get_amount_in return +1, and other minor patterns","result":"Same total_gas (4,384,235). Bytecode -8 bytes (19,611 → 19,603). The V2 get_amount_in +1 is rarely called in benchmarks. Total unsafe_add/sub savings: -19,997 gas across all iterations."}}
{"run":35,"commit":"31f0f1f","metric":4377893,"metrics":{"bytecode_size":19556,"v2_v2_v2":186392,"v2_v2_v3":165436,"v2_v2_v4":189261,"v2_v3_v2":169791,"v2_v3_v3":148884,"v2_v3_v4":176197,"v2_v4_v2":191060,"v2_v4_v3":170129,"v2_v4_v4":150728,"v3_v2_v2":165348,"v3_v2_v3":148844,"v3_v2_v4":171794,"v3_v3_v2":148833,"v3_v3_v3":146180,"v3_v3_v4":163234,"v3_v4_v2":170047,"v3_v4_v3":161875,"v3_v4_v4":140272,"v4_v2_v2":186967,"v4_v2_v3":170463,"v4_v2_v4":170344,"v4_v3_v2":170415,"v4_v3_v3":161858,"v4_v3_v4":153297,"v4_v4_v2":149363,"v4_v4_v3":160110,"v4_v4_v4":90771},"status":"keep","description":"unsafe_add for offset += in preprocess/tstore — -6,342 gas","timestamp":1781051491919,"segment":0,"confidence":133.44027303754265,"asi":{"hypothesis":"Apply unsafe_add to offset += patterns in _preprocess (offset += SIZE_SET_ADDRESS etc) and _cmd_tstore_continuation (offset += cmd_size)","result":"-6,342 gas! Even the preprocessing offset increments (which run once per execute() call) save gas via unsafe_add. The _preprocess function iterates through SET_ADDRESS opcodes that appear ~3-8 times per command stream. Bytecode -47 bytes (19,603 → 19,556)."}}
{"run":36,"commit":"f0c963a","metric":4377893,"metrics":{"bytecode_size":19516,"v2_v2_v2":186392,"v2_v2_v3":165436,"v2_v2_v4":189261,"v2_v3_v2":169791,"v2_v3_v3":148884,"v2_v3_v4":176197,"v2_v4_v2":191060,"v2_v4_v3":170129,"v2_v4_v4":150728,"v3_v2_v2":165348,"v3_v2_v3":148844,"v3_v2_v4":171794,"v3_v3_v2":148833,"v3_v3_v3":146180,"v3_v3_v4":163234,"v3_v4_v2":170047,"v3_v4_v3":161875,"v3_v4_v4":140272,"v4_v2_v2":186967,"v4_v2_v3":170463,"v4_v2_v4":170344,"v4_v3_v2":170415,"v4_v3_v3":161858,"v4_v3_v4":153297,"v4_v4_v2":149363,"v4_v4_v3":160110,"v4_v4_v4":90771},"status":"keep","description":"unsafe arithmetic in tstore — -40 bytes","timestamp":1781051681449,"segment":0,"confidence":110.29055007052186,"asi":{"hypothesis":"Apply unsafe arithmetic to tstore_continuation function","result":"Same total_gas (4,377,893). Bytecode -40 bytes. Non-benchmark code path."}}
{"run":37,"commit":"de470c3","metric":4377893,"metrics":{"bytecode_size":19516,"v2_v2_v2":186392,"v2_v2_v3":165436,"v2_v2_v4":189261,"v2_v3_v2":169791,"v2_v3_v3":148884,"v2_v3_v4":176197,"v2_v4_v2":191060,"v2_v4_v3":170129,"v2_v4_v4":150728,"v3_v2_v2":165348,"v3_v2_v3":148844,"v3_v2_v4":171794,"v3_v3_v2":148833,"v3_v3_v3":146180,"v3_v3_v4":163234,"v3_v4_v2":170047,"v3_v4_v3":161875,"v3_v4_v4":140272,"v4_v2_v2":186967,"v4_v2_v3":170463,"v4_v2_v4":170344,"v4_v3_v2":170415,"v4_v3_v3":161858,"v4_v3_v4":153297,"v4_v4_v2":149363,"v4_v4_v3":160110,"v4_v4_v4":90771},"status":"keep","description":"Loop bound 32→16 — no change, reverted","timestamp":1781051873358,"segment":0,"confidence":93.98557692307692,"asi":{"hypothesis":"Reduce _auto_settle_touched loop bound from 32 to 16 to reduce Venom memory allocation","result":"No change in gas or bytecode. Venom doesn't allocate memory based on loop bounds — it uses liveness analysis. Reverted to 32 to maintain safety."}}
{"run":38,"commit":"ff39b0a","metric":4376611,"metrics":{"bytecode_size":19505,"v2_v2_v2":186392,"v2_v2_v3":165436,"v2_v2_v4":189208,"v2_v3_v2":169791,"v2_v3_v3":148884,"v2_v3_v4":176144,"v2_v4_v2":191007,"v2_v4_v3":170076,"v2_v4_v4":150622,"v3_v2_v2":165348,"v3_v2_v3":148844,"v3_v2_v4":171741,"v3_v3_v2":148833,"v3_v3_v3":146180,"v3_v3_v4":163192,"v3_v4_v2":169994,"v3_v4_v3":161832,"v3_v4_v4":140187,"v4_v2_v2":186914,"v4_v2_v3":170410,"v4_v2_v4":170260,"v4_v3_v2":170362,"v4_v3_v3":161816,"v4_v3_v4":153212,"v4_v4_v2":149257,"v4_v4_v3":160025,"v4_v4_v4":90644},"status":"keep","description":"Inline pool key struct in v4_swap_compact — -1,282 gas","timestamp":1781052089691,"segment":0,"confidence":91.46092865232163,"asi":{"hypothesis":"Inline pool key struct constructor directly in the extcall for _cmd_v4_swap_compact, eliminating intermediate pool_key variable and named fee/tick_spacing variables. Reduces Venom memory allocation.","result":"-1,282 gas! Eliminating the intermediate pool_key variable + inlining fee/tick_spacing into the struct constructor saved memory allocation overhead. The c0/c1/hooks_idx variables are kept as named since inlining them in struct constructors causes Venom crashes. Bytecode -11 bytes (19,516 -> 19,505)."}}
{"run":39,"commit":"ff39b0a","metric":4376611,"metrics":{"bytecode_size":19561,"v2_v2_v2":186392,"v2_v2_v3":165436,"v2_v2_v4":189208,"v2_v3_v2":169791,"v2_v3_v3":148884,"v2_v3_v4":176144,"v2_v4_v2":191007,"v2_v4_v3":170076,"v2_v4_v4":150622,"v3_v2_v2":165348,"v3_v2_v3":148844,"v3_v2_v4":171741,"v3_v3_v2":148833,"v3_v3_v3":146180,"v3_v3_v4":163192,"v3_v4_v2":169994,"v3_v4_v3":161832,"v3_v4_v4":140187,"v4_v2_v2":186914,"v4_v2_v3":170410,"v4_v2_v4":170260,"v4_v3_v2":170362,"v4_v3_v3":161816,"v4_v3_v4":153212,"v4_v4_v2":149257,"v4_v4_v3":160025,"v4_v4_v4":90644},"status":"discard","description":"Inline pool key in v4_swap_dynamic/batch — bytecode +56, no gas change","timestamp":1781052254533,"segment":0,"confidence":86.46680942184155,"asi":{"hypothesis":"Apply same pool_key inline pattern to _cmd_v4_swap_dynamic and _cmd_v4_batch","next_action":"Don't inline pool_key in non-benchmark paths — it bloats bytecode. The V4_SWAP_COMPACT inlining only helped because that's the most frequent command in benchmarks. Focus on V3/V2 hot-path optimizations instead.","result":"Same gas (4,376,611). V4_SWAP_DYNAMIC and V4_BATCH aren't in the 27 benchmark paths. Bytecode +56 bytes because inlining duplicates the struct constructor for the delta read. Reverted.","rollback_reason":"Bytecode regression (+56 bytes) with no gas improvement — changes are in non-benchmark paths"}}
{"run":40,"commit":"12d1a49","metric":4376611,"metrics":{"bytecode_size":19488,"v2_v2_v2":186392,"v2_v2_v3":165436,"v2_v2_v4":189208,"v2_v3_v2":169791,"v2_v3_v3":148884,"v2_v3_v4":176144,"v2_v4_v2":191007,"v2_v4_v3":170076,"v2_v4_v4":150622,"v3_v2_v2":165348,"v3_v2_v3":148844,"v3_v2_v4":171741,"v3_v3_v2":148833,"v3_v3_v3":146180,"v3_v3_v4":163192,"v3_v4_v2":169994,"v3_v4_v3":161832,"v3_v4_v4":140187,"v4_v2_v2":186914,"v4_v2_v3":170410,"v4_v2_v4":170260,"v4_v3_v2":170362,"v4_v3_v3":161816,"v4_v3_v4":153212,"v4_v4_v2":149257,"v4_v4_v3":160025,"v4_v4_v4":90644},"status":"keep","description":"Remaining unsafe_add in V2 math and tstore — -17 bytes","timestamp":1781052401372,"segment":0,"confidence":55.92797783933518,"asi":{"hypothesis":"Replace checked add in _v2_get_amount_out denominator and tstore chunk_idx+1 with unsafe_add","result":"Same gas (4,376,611). Bytecode -17 bytes (19,505 -> 19,488). Changes in non-benchmark paths (V2_CALC, tstore_continuation)."}}
