{"run":245,"commit":"19f03ee","metric":4507479,"metrics":{},"status":"keep","description":"Remove assertion strings from TSTORE_CONTINUATION, BRIBE, and initialize() code paths. -1,298 bytes bytecode but no gas change (unused code paths).","timestamp":1781207086579,"segment":7,"confidence":null,"asi":{"bytecode_delta":"-1,298 bytes (18845→17547)","hypothesis":"Remove assertion strings from unused code paths (TSTORE_CONTINUATION, bribe validation, initialize) to reduce bytecode size"}}
{"run":246,"commit":"0c32d88","metric":4507479,"metrics":{},"status":"keep","description":"Remove all remaining assertion strings from callback handlers and owner-only functions. -1,180 bytes bytecode, gas unchanged at 4,507,479.","timestamp":1781207259431,"segment":7,"confidence":null,"asi":{"bytecode_delta":"-1,180 bytes (17547→16367)","hypothesis":"Remove assertion strings from callback handlers (cb_v2, cb_v3, cb_v4, cb_ext) and owner-only functions","gas_note":"Same gas as before — removing string data from assert only saves bytecode, not execution gas. The assertion check itself still runs."}}
{"run":247,"commit":"0c32d88","metric":4507479,"metrics":{},"status":"discard","description":"Replace empty(int256) with 0 in unsafe_sub — no gas change (Venom already optimizes)","timestamp":1781207504293,"segment":7,"confidence":null,"asi":{"hypothesis":"Replace unsafe_sub(empty(int256), x) with unsafe_sub(0, x) — Venom already optimizes empty(int256) to 0","result":"No gas change"}}
{"type":"config","name":"cmd_executor gas optimization (resumed)","metricName":"total_gas","metricUnit":"gas","bestDirection":"lower"}
{"run":248,"commit":"d4af72f","metric":4507479,"metrics":{"v2_v2_v4":210291,"v2_v3_v3":160062,"v2_v4_v2":189060,"v2_v2_v2":197942,"v2_v3_v2":163726,"v2_v4_v3":185372,"v2_v3_v4":192833,"v2_v2_v3":177166,"v2_v4_v4":174174,"v3_v2_v3":160110,"v3_v2_v2":160080,"v3_v2_v4":192896,"v3_v3_v2":160052,"v3_v3_v3":155254,"v3_v4_v2":168286,"v3_v3_v4":175805,"v3_v4_v4":157136,"v3_v4_v3":173696,"v4_v2_v3":168059,"v4_v2_v2":168029,"v4_v2_v4":183340,"v4_v3_v3":159773,"v4_v3_v2":150901,"v4_v4_v3":138931,"v4_v3_v4":162012,"v4_v4_v4":90048,"v4_v4_v2":132445,"bytecode_size":16367},"status":"keep","description":"Baseline after profit check default inversion. Gas unchanged from prior baseline (4,507,479).","timestamp":1781209998630,"segment":8,"confidence":null,"asi":{"hypothesis":"Baseline measurement after profit check default inversion change","note":"Gas unchanged — the profit check encoding change only affects test encoding, not the benchmark paths (which use skip_profit=True, now encoded as 0x01 byte)"}}
{"run":249,"commit":"d4af72f","metric":4520392,"metrics":{"v2_v2_v4":210291,"v2_v3_v3":160062,"v2_v4_v2":189943,"v2_v2_v2":197942,"v2_v3_v2":163726,"v2_v4_v3":186255,"v2_v3_v4":193616,"v2_v2_v3":177166,"v2_v4_v4":174972,"v3_v2_v3":160110,"v3_v2_v2":160080,"v3_v2_v4":193664,"v3_v3_v2":160052,"v3_v3_v3":155254,"v3_v4_v2":169154,"v3_v3_v4":176539,"v3_v4_v4":157904,"v3_v4_v3":174390,"v4_v2_v3":168969,"v4_v2_v2":168924,"v4_v2_v4":184068,"v4_v3_v3":160492,"v4_v3_v2":151796,"v4_v4_v3":139635,"v4_v3_v4":162012,"v4_v4_v4":90048,"v4_v4_v2":133328,"bytecode_size":16367},"status":"discard","description":"Replace V4_TAKE_COMPACT with V4_TAKE_DELTA for full-delta takes: +12,913 gas REGRESSION. Each replacement costs ~700-900 gas more due to _lookup_address INVOKE overhead + _read_pm_delta keccak256+exttload overhead, far exceeding 12-byte calldata savings (192 gas).","timestamp":1781211051312,"segment":8,"confidence":null,"asi":{"calldata_savings_vs_invoke_overhead":"12 bytes calldata × 16 gas/byte = 192 gas saved. INVOKE overhead ~276 gas × 2 = 552 gas added. keccak256+exttload ~130 gas added. Net: +490 gas regression.","hypothesis":"Replace V4_TAKE_COMPACT with V4_TAKE_DELTA where amount equals full PM delta, saving 12 bytes calldata per take","next_action_hint":"V4_TAKE_DELTA is only beneficial when it replaces a multi-step sequence (sync+transfer+settle or similar). For simple take operations, V4_TAKE_COMPACT with inline sentinel resolution is always cheaper even with 12 extra calldata bytes. Never replace standalone takes with TAKE_DELTA.","regression_reason":"+883 gas average per path. V4_TAKE_DELTA calls _lookup_address (2× INVOKE) and _read_pm_delta (INVOKE + keccak256 + exttload). V4_TAKE_COMPACT has inline sentinel resolution (0 INVOKEs) and reads amount from calldata. Net: 2× INVOKE (~552 gas) + keccak256+exttload (~130 gas) - calldata savings (192 gas) = +490 gas per path. Actual regression higher due to Venom code gen effects."}}
{"run":250,"commit":"de8623c","metric":4507479,"metrics":{"v2_v2_v4":210291,"v2_v2_v2":197942,"v2_v3_v3":160062,"v2_v4_v2":189060,"v2_v3_v4":192833,"v2_v3_v2":163726,"v2_v2_v3":177166,"v2_v4_v3":185372,"v3_v2_v3":160110,"v3_v2_v4":192896,"v2_v4_v4":174174,"v3_v2_v2":160080,"v3_v3_v2":160052,"v3_v4_v2":168286,"v3_v3_v3":155254,"v3_v3_v4":175805,"v3_v4_v3":173696,"v3_v4_v4":157136,"v4_v2_v2":168029,"v4_v2_v4":183340,"v4_v3_v2":150901,"v4_v2_v3":168059,"v4_v3_v3":159773,"v4_v4_v2":132445,"v4_v4_v3":138931,"v4_v3_v4":162012,"v4_v4_v4":90048,"bytecode_size":16367},"status":"keep","description":"Simplify __default__() from if/else raise to assert — 0 gas, 0 bytes (not called in benchmarks, Venom identical)","timestamp":1781211285306,"segment":8,"confidence":null,"asi":{"hypothesis":"Simplify __default__() from if/else to assert","result":"0 gas change, 0 byte bytecode change. __default__ not called in benchmarks. Venom generates identical bytecode for both patterns."}}
{"run":251,"commit":"742ea34","metric":4507479,"metrics":{"v2_v2_v4":210291,"v2_v4_v2":189060,"v2_v2_v2":197942,"v2_v3_v3":160062,"v2_v3_v2":163726,"v2_v4_v3":185372,"v2_v3_v4":192833,"v2_v2_v3":177166,"v2_v4_v4":174174,"v3_v2_v4":192896,"v3_v2_v2":160080,"v3_v2_v3":160110,"v3_v3_v2":160052,"v3_v3_v4":175805,"v3_v3_v3":155254,"v3_v4_v2":168286,"v3_v4_v3":173696,"v3_v4_v4":157136,"v4_v2_v4":183340,"v4_v2_v2":168029,"v4_v2_v3":168059,"v4_v3_v2":150901,"v4_v4_v2":132445,"v4_v3_v3":159773,"v4_v3_v4":162012,"v4_v4_v3":138931,"v4_v4_v4":90048,"bytecode_size":16367},"status":"keep","description":"Flip callback assertion to compare as uint256 — 0 gas change (Venom identical)","timestamp":1781211483827,"segment":8,"confidence":null,"asi":{"hypothesis":"Compare callback sender as uint256 instead of converting packed to address","result":"0 gas change. Venom generates identical bytecode for both patterns — it optimizes the convert(packed % SHIFT, address) to a simple AND comparison regardless of direction."}}
{"run":252,"commit":"585be26","metric":4507470,"metrics":{"v2_v2_v4":210291,"v2_v2_v2":197942,"v2_v3_v3":160062,"v2_v3_v2":163726,"v2_v3_v4":192833,"v2_v2_v3":177166,"v2_v4_v2":189060,"v2_v4_v4":174174,"v3_v2_v3":160110,"v3_v2_v4":192896,"v3_v2_v2":160080,"v2_v4_v3":185372,"v3_v3_v2":160052,"v3_v3_v3":155245,"v3_v3_v4":175805,"v3_v4_v2":168286,"v3_v4_v3":173696,"v4_v2_v2":168029,"v4_v2_v3":168059,"v3_v4_v4":157136,"v4_v2_v4":183340,"v4_v3_v2":150901,"v4_v3_v4":162012,"v4_v3_v3":159773,"v4_v4_v2":132445,"v4_v4_v4":90048,"v4_v4_v3":138931,"bytecode_size":16356},"status":"keep","description":"Replace elif with else in _v3_auto_pay — -9 gas, -11 bytes (skip amount1_delta > 0 check)","timestamp":1781211649115,"segment":8,"confidence":null,"asi":{"hypothesis":"Replace elif amount1_delta > 0 with else in _v3_auto_pay — in valid V3 swaps, if we don't owe token0, we must owe token1","result":"-9 gas total, -11 bytes bytecode. Saves the amount1_delta > 0 comparison (3 gas) in V3 auto-pay paths."}}
{"run":253,"commit":"28b2236","metric":4507470,"metrics":{"v2_v3_v3":160062,"v2_v2_v2":197942,"v2_v2_v4":210291,"v2_v4_v2":189060,"v2_v3_v4":192833,"v2_v4_v4":174174,"v2_v3_v2":163726,"v2_v2_v3":177166,"v2_v4_v3":185372,"v3_v2_v3":160110,"v3_v3_v2":160052,"v3_v2_v2":160080,"v3_v2_v4":192896,"v3_v3_v4":175805,"v3_v4_v2":168286,"v3_v3_v3":155245,"v3_v4_v3":173696,"v3_v4_v4":157136,"v4_v2_v3":168059,"v4_v2_v2":168029,"v4_v2_v4":183340,"v4_v3_v3":159773,"v4_v3_v2":150901,"v4_v3_v4":162012,"v4_v4_v2":132445,"v4_v4_v4":90048,"v4_v4_v3":138931,"bytecode_size":16340},"status":"keep","description":"Replace elif with else in _v2_auto_pay — 0 gas, -16 bytes bytecode (elif not in benchmarks)","timestamp":1781211807842,"segment":8,"confidence":2,"asi":{"hypothesis":"Replace elif amount1_out > 0 with else in _v2_auto_pay — same pattern as V3","result":"0 gas change, -16 bytes bytecode. V2 auto-pay elif branch not exercised in benchmark paths, so no gas savings. But bytecode reduction from eliminating the comparison."}}
{"run":254,"commit":"31d73cb","metric":4507470,"metrics":{"v2_v4_v2":189060,"v2_v2_v4":210291,"v2_v2_v2":197942,"v2_v3_v3":160062,"v2_v4_v3":185372,"v2_v3_v4":192833,"v2_v2_v3":177166,"v2_v3_v2":163726,"v2_v4_v4":174174,"v3_v2_v4":192896,"v3_v2_v2":160080,"v3_v2_v3":160110,"v3_v3_v2":160052,"v3_v4_v2":168286,"v3_v3_v4":175805,"v3_v3_v3":155245,"v3_v4_v3":173696,"v3_v4_v4":157136,"v4_v2_v2":168029,"v4_v2_v3":168059,"v4_v2_v4":183340,"v4_v3_v4":162012,"v4_v3_v3":159773,"v4_v3_v2":150901,"v4_v4_v4":90048,"v4_v4_v2":132445,"v4_v4_v3":138931,"bytecode_size":16340},"status":"keep","description":"Stability re-run — confirmed 4,507,470 gas after exhaustive optimization search","timestamp":1781212845752,"segment":8,"confidence":1,"asi":{"hypothesis":"Stability re-run confirming current best (4,507,470 gas) after exhaustive search for new optimization opportunities","result":"Confirmed stable. Searched: V4_TAKE→V4_TAKE_COMPACT in benchmarks (already using compact), token_idx encoding for V3 auto-pay (dead end - no auto-pay in benchmarks), remaining merge/sentinel/convert patterns (all exhausted). No new gas savings found.","next_action":"Session has reached diminishing returns. All code-level and test-encoding optimizations exhausted."}}
{"run":255,"commit":"3c359b3","metric":4470769,"metrics":{"v2_v2_v2":196456,"v2_v4_v2":187669,"v2_v2_v4":208871,"v2_v3_v3":158582,"v2_v2_v3":175511,"v2_v4_v3":183940,"v2_v3_v2":162287,"v2_v4_v4":172751,"v2_v3_v4":191393,"v3_v2_v2":158472,"v3_v2_v4":191409,"v3_v2_v3":158583,"v3_v3_v2":158619,"v3_v3_v3":154071,"v3_v4_v2":166901,"v3_v4_v3":172550,"v3_v3_v4":174653,"v3_v4_v4":155713,"v4_v2_v4":182225,"v4_v2_v2":166642,"v4_v2_v3":166625,"v4_v3_v2":149561,"v4_v3_v4":160797,"v4_v3_v3":158664,"v4_v4_v2":131100,"v4_v4_v4":88907,"v4_v4_v3":137817,"bytecode_size":17489},"status":"keep","description":"Extend sentinel system: USDC(0xF0) + WBTC(0xF1) as deploy-time immutables, eliminating 2 SET_ADDRESS per path — -36,701 gas","timestamp":1781215687431,"segment":8,"confidence":8157.777777777777,"asi":{"hypothesis":"Extend sentinel system from 4 addresses (0xFC-0xFF) to 14 addresses (0xF0-0xFF) with user immutables. USER0_ADDR (0xF0=USDC) and USER1_ADDR (0xF1=WBTC) eliminate SET_ADDRESS commands per transaction (~476 gas each) and replace TLOAD reads with immutable reads (~97 gas savings each).","result":"-36,701 gas! 4,507,479 → 4,470,769. Every path saves gas. Bytecode grew 1,149 bytes (16,340→17,489) from additional elif branches in sentinel resolution blocks, but calldata savings (42 bytes × 16 gas = 672 gas per path) + TSTORE elimination (2× 476 = 952 gas per path) + TLOAD→immutable savings far exceed the dispatch overhead."}}
{"run":256,"commit":"594be8e","metric":4470736,"metrics":{"v2_v2_v4":208871,"v2_v3_v3":158582,"v2_v4_v2":187669,"v2_v2_v2":196456,"v2_v3_v4":191393,"v2_v2_v3":175511,"v2_v4_v3":183940,"v2_v3_v2":162287,"v3_v2_v2":158472,"v2_v4_v4":172751,"v3_v2_v4":191409,"v3_v2_v3":158583,"v3_v3_v2":158619,"v3_v3_v4":174653,"v3_v4_v2":166901,"v3_v3_v3":154071,"v3_v4_v3":172550,"v4_v2_v3":166625,"v3_v4_v4":155713,"v4_v2_v2":166642,"v4_v2_v4":182225,"v4_v3_v2":149561,"v4_v3_v4":160764,"v4_v3_v3":158664,"v4_v4_v3":137817,"v4_v4_v2":131100,"v4_v4_v4":88907,"bytecode_size":17489},"status":"keep","description":"Reorder _lookup_address: USDC(0xF0) before NATIVE/SELF/PM — extra -33 gas on top of user sentinel system","timestamp":1781216258622,"segment":8,"confidence":4082.5555555555557,"asi":{"hypothesis":"Reorder _lookup_address to put USER0(USDC) before NATIVE/SELF/PM since USDC is resolved more frequently in currency fields","result":"-36,734 gas total (4,507,479 → 4,470,736). Slight improvement over the initial -36,701 from reordering _lookup_address: USDC check moved from 5th to 2nd position. Bytecode unchanged at 17,489."}}
{"run":257,"commit":"c194ec7","metric":4469202,"metrics":{"v2_v3_v3":158582,"v2_v2_v4":208871,"v2_v4_v2":187605,"v2_v2_v2":196456,"v2_v3_v4":191359,"v2_v4_v3":183876,"v2_v2_v3":175511,"v2_v3_v2":162287,"v2_v4_v4":172653,"v3_v2_v3":158583,"v3_v2_v2":158472,"v3_v2_v4":191375,"v3_v3_v2":158619,"v3_v3_v3":154071,"v3_v4_v2":166837,"v3_v3_v4":174626,"v3_v4_v3":172499,"v3_v4_v4":155615,"v4_v2_v4":182123,"v4_v2_v3":166497,"v4_v2_v2":166514,"v4_v3_v2":149433,"v4_v3_v4":160713,"v4_v4_v2":130972,"v4_v3_v3":158561,"v4_v4_v4":88777,"v4_v4_v3":137715,"bytecode_size":17489},"status":"keep","description":"Reorder sentinel elif branches in hot handlers: USDC before SELF/NATIVE/PM for currency, SELF first for recipient — additional -1,534 gas","timestamp":1781216564759,"segment":8,"confidence":4253,"asi":{"hypothesis":"Reorder inline sentinel elif branches in hot handlers (V4_SWAP_COMPACT, V4_TAKE_COMPACT, V4_MINT_COMPACT) to put USER0(USDC) before SELF/NATIVE/PM for currency fields, and SELF before WETH/PM for recipient fields","result":"-38,277 gas total (4,507,479 → 4,469,202). The reordering saved an additional ~1,534 gas on top of the -36,734 from user sentinels. USDC as a currency is checked 2nd instead of 5th, SELF as a recipient is checked 1st instead of 2nd. Bytecode unchanged at 17,489."}}
{"run":258,"commit":"2010300","metric":4468322,"metrics":{"v2_v2_v4":208848,"v2_v4_v2":187484,"v2_v2_v2":196422,"v2_v3_v3":158605,"v2_v3_v2":162253,"v2_v4_v3":183812,"v2_v2_v3":175534,"v2_v3_v4":191313,"v2_v4_v4":172566,"v3_v2_v2":158438,"v3_v2_v4":191352,"v3_v2_v3":158606,"v3_v3_v2":158585,"v3_v3_v3":154089,"v3_v4_v2":166693,"v3_v3_v4":174589,"v3_v4_v3":172429,"v3_v4_v4":155505,"v4_v2_v3":166520,"v4_v2_v2":166480,"v4_v2_v4":182096,"v4_v3_v2":149399,"v4_v3_v4":160676,"v4_v4_v2":130938,"v4_v3_v3":158580,"v4_v4_v3":137733,"v4_v4_v4":88777,"bytecode_size":17489},"status":"keep","description":"Reorder remaining inline sentinel elif branches: ERC20/V4_SYNC/V2/V3 — additional -880 gas","timestamp":1781216872399,"segment":8,"confidence":4350.777777777777,"asi":{"hypothesis":"Reorder remaining inline sentinel elif branches in ERC20_TRANSFER, V4_SYNC, V2_SWAP_COMPACT, V2_SWAP_DIRECT, V3_SWAP_COMPACT based on frequency analysis: USDC before SELF/NATIVE/PM for currency, PM/SELF before WETH for recipient","result":"-39,157 gas total (4,507,479 → 4,468,322). Additional ~880 gas saved from reordering the remaining inline sentinel blocks. ERC20_TRANSFER: PM first for recipient, USER0 before SELF for token. V4_SYNC: USER0 before SELF. V2 callbacks: SELF first for recipient.","breakdown":"ERC20_TRANSFER t_idx (USDC>SELF): -3 gas per resolve. ERC20_TRANSFER r_idx (PM>SELF): -6 gas per resolve. V4_SYNC (USDC>SELF): -3 gas per resolve. V2 callbacks (SELF>WETH): -6 gas per resolve."}}
{"run":259,"commit":"bca3447","metric":4468322,"metrics":{"v2_v3_v3":158605,"v2_v4_v2":187484,"v2_v2_v2":196422,"v2_v2_v4":208848,"v2_v3_v2":162253,"v2_v3_v4":191313,"v2_v4_v3":183812,"v2_v2_v3":175534,"v2_v4_v4":172566,"v3_v2_v4":191352,"v3_v2_v3":158606,"v3_v2_v2":158438,"v3_v3_v2":158585,"v3_v3_v3":154089,"v3_v3_v4":174589,"v3_v4_v2":166693,"v3_v4_v4":155505,"v3_v4_v3":172429,"v4_v2_v3":166520,"v4_v2_v4":182096,"v4_v2_v2":166480,"v4_v3_v3":158580,"v4_v3_v2":149399,"v4_v4_v2":130938,"v4_v3_v4":160676,"v4_v4_v4":88777,"v4_v4_v3":137733,"bytecode_size":17489},"status":"keep","description":"Stability re-run — confirmed 4,468,322 gas (-39,157 from baseline)","timestamp":1781217180862,"segment":8,"confidence":6.056298816796845,"asi":{"hypothesis":"Stability re-run confirming -39,157 gas improvement from extended sentinel system + reordering","result":"Confirmed stable at 4,468,322 gas. All 278 tests pass. Bytecode 17,489 bytes (within 24,576 limit). Peak savings from user sentinels (USDC/WBTC): -36,734 gas. Sentinel branch reordering: additional -2,414 gas."}}
{"type":"config","name":"Investigate untried optimizations from ideas.md","metricName":"total_gas","metricUnit":"gas","bestDirection":"lower"}
{"run":260,"commit":"4a4a9ef","metric":4604361,"metrics":{"v2_v2_v2":200241,"v2_v2_v4":212628,"v2_v4_v2":193173,"v2_v3_v3":164344,"v2_v3_v2":167994,"v2_v4_v3":189499,"v2_v2_v3":179351,"v2_v3_v4":196991,"v2_v4_v4":176328,"v3_v2_v4":197030,"v3_v2_v3":164345,"v3_v2_v2":162255,"v3_v3_v2":164324,"v3_v3_v4":181836,"v3_v3_v3":160225,"v3_v4_v2":172380,"v3_v4_v3":178516,"v3_v4_v4":161189,"v4_v2_v3":172245,"v4_v2_v2":170283,"v4_v2_v4":185157,"v4_v3_v4":165307,"v4_v3_v2":155124,"v4_v4_v2":134747,"v4_v4_v3":142318,"v4_v3_v3":164697,"v4_v4_v4":91834,"bytecode_size":16870},"status":"keep","description":"Baseline measurement before investigating untried optimizations","timestamp":1781219639539,"segment":9,"confidence":null,"asi":{"hypothesis":"baseline before testing ideas from ideas.md","bytecode_size":16870,"note":"ideas.md reports 4,468,322 but current codebase measures 4,604,361. This is the true baseline."}}
{"run":261,"commit":"a29c42b","metric":4603701,"metrics":{"v2_v2_v2":200217,"v2_v2_v4":212604,"v2_v4_v2":193143,"v2_v3_v3":164320,"v2_v3_v2":167970,"v2_v4_v3":189469,"v2_v2_v3":179327,"v2_v3_v4":196961,"v2_v4_v4":176298,"v3_v2_v4":197000,"v3_v2_v3":164321,"v3_v2_v2":162231,"v3_v3_v2":164300,"v3_v3_v4":181806,"v3_v3_v3":160211,"v3_v4_v2":172350,"v3_v4_v3":178492,"v3_v4_v4":161159,"v4_v2_v3":172221,"v4_v2_v2":170259,"v4_v2_v4":185138,"v4_v3_v4":165289,"v4_v3_v2":155100,"v4_v4_v2":134723,"v4_v4_v3":142299,"v4_v3_v3":164678,"v4_v4_v4":91815,"bytecode_size":16838},"status":"keep","description":"Remove redundant & 255 / & 65535 bit-masks after shift on merged slice reads (14 sites)","timestamp":1781219894990,"segment":9,"confidence":null,"asi":{"hypothesis":"Remove redundant AND masks after SHR on highest field of merged slice reads. Shift alone constrains value when extracting top bits.","bytecode_size":16838,"bytecode_delta":-32,"gas_delta":-660,"sites_changed":14,"result":"Modest but real improvement. ~24 gas/path average."}}
{"run":262,"commit":"current","metric":0,"metrics":{"v2_v2_v2":0,"v2_v2_v4":0,"v2_v4_v2":0,"v2_v3_v3":0,"v2_v3_v2":0,"v2_v4_v3":0,"v2_v2_v3":0,"v2_v3_v4":0,"v2_v4_v4":0,"v3_v2_v4":0,"v3_v2_v3":0,"v3_v2_v2":0,"v3_v3_v2":0,"v3_v3_v4":0,"v3_v3_v3":0,"v3_v4_v2":0,"v3_v4_v3":0,"v3_v4_v4":0,"v4_v2_v3":0,"v4_v2_v2":0,"v4_v2_v4":0,"v4_v3_v4":0,"v4_v3_v2":0,"v4_v4_v2":0,"v4_v4_v3":0,"v4_v3_v3":0,"v4_v4_v4":0,"bytecode_size":0},"status":"crash","description":"Inline _preprocess into execute() — Venom compiler crash","timestamp":1781220208421,"segment":9,"confidence":null,"asi":{"hypothesis":"Inline _preprocess body into execute() to save JUMP overhead per transaction","result":"Venom compiler crash (AssertionError) — loop in execute() causes alloca conflict. Venom cannot handle the inlined loop inside execute().","rollback_reason":"Compiler crash — Venom codegen fails with AssertionError on alloca conflict. _preprocess must remain a separate function.","next_action_hint":"Avoid inlining loops into execute(). Venom's alloca analysis breaks. Stick to separate functions for any loop-containing logic."}}
{"run":263,"commit":"current","metric":4605311,"metrics":{"v2_v2_v2":200267,"v2_v2_v4":212654,"v2_v4_v2":193218,"v2_v3_v3":164395,"v2_v3_v2":168045,"v2_v4_v3":189544,"v2_v2_v3":179377,"v2_v3_v4":197036,"v2_v4_v4":176348,"v3_v2_v4":197075,"v3_v2_v3":164396,"v3_v2_v2":162281,"v3_v3_v2":164375,"v3_v3_v4":181906,"v3_v3_v3":160291,"v3_v4_v2":172425,"v3_v4_v3":178572,"v3_v4_v4":161234,"v4_v2_v3":172296,"v4_v2_v2":170309,"v4_v2_v4":185178,"v4_v3_v4":165169,"v4_v3_v2":155175,"v4_v4_v2":134773,"v4_v4_v3":142359,"v4_v3_v3":164758,"v4_v4_v4":91855,"bytecode_size":17306},"status":"discard","description":"Inline _lookup_address and _read_pm_delta into _cmd_v4_take_delta","timestamp":1781220593257,"segment":9,"confidence":1,"asi":{"hypothesis":"Inline _lookup_address (2x) and _read_pm_delta into _cmd_v4_take_delta to eliminate INVOKE overhead for TestV4V3V4","result":"MASSIVE REGRESSION: +1,610 gas, +468 bytes bytecode. Bytecode expansion from inlined sentinel branches overwhelms any INVOKE savings.","rollback_reason":"Bytecode bloat (+468 bytes) causes gas regression across ALL paths, not just the ones using V4_TAKE_DELTA. Confirms ideas.md finding that specific-handler inlining can be harmful if bytecode grows too much.","next_action_hint":"Avoid inlining _lookup_address/_read_pm_delta into handlers not on the critical path. The bytecode expansion cost exceeds per-call savings."}}
