{"run":336,"commit":"23cb069","metric":4939070,"metrics":{"bytecode_size":15359,"v2_v2_v2":197111,"v2_v2_v3":196464,"v2_v2_v4":209039,"v2_v3_v2":180681,"v2_v3_v3":197134,"v2_v3_v4":209701,"v2_v4_v2":188228,"v2_v4_v3":204597,"v2_v4_v4":173308,"v3_v2_v2":177085,"v3_v2_v3":197075,"v3_v2_v4":209680,"v3_v3_v2":194711,"v3_v3_v3":197171,"v3_v3_v4":210255,"v3_v4_v2":185207,"v3_v4_v3":205200,"v3_v4_v4":173926,"v4_v2_v2":167258,"v4_v2_v3":187248,"v4_v2_v4":175843,"v4_v3_v2":167844,"v4_v3_v3":187831,"v4_v3_v4":177337,"v4_v4_v2":131691,"v4_v4_v3":151669,"v4_v4_v4":85776},"status":"keep","description":"V4V3V4: replace V4_TAKE_DELTA(WETH, executor) with V4_TAKE_COMPACT(WETH, executor, AMOUNT_WETH_PROFIT - AMOUNT_WETH). Net WETH delta = +1 profit (V4c +2 minus V4a -1). −823 gas (v4_v3_v4: 178,160→177,337). Eliminates exttload + _lookup_address INVOKE + keccak256 (TAKE_DELTA overhead); TAKE_COMPACT uses inline sentinel + calldata amount.","timestamp":1781986589007,"segment":13,"confidence":0.08511665325824617,"asi":{"finding":"−823 gas (v4_v3_v4: 178,160→177,337). Checks pass. Bigger than #334/#335 (-537, -409) because V4_TAKE_DELTA has MORE overhead than V4_SETTLE_DELTA: TAKE_DELTA does _lookup_address (INVOKE) + _read_pm_delta (keccak256+exttload) + take; TAKE_COMPACT does inline sentinel (0 INVOKE) + calldata amount (0 exttload). Net WETH delta = +AMOUNT_WETH_PROFIT (V4c) - AMOUNT_WETH (V4a debt) = +1 profit.","hypothesis":"Replace V4_TAKE_DELTA(WETH, executor) in V4V3V4 with V4_TAKE_COMPACT(WETH, executor, AMOUNT_WETH_PROFIT - AMOUNT_WETH). Same net-profit arithmetic as #334/#335, but TAKE_DELTA→TAKE_COMPACT has higher savings (1 INVOKE + 1 exttload + 1 keccak256 eliminated). The documented V4_TAKE_DELTA→TAKE_COMPACT dead-end (+12,913 in run #330-notes) was for FULL-DELTA takes with unknown amount; here the amount is a known constant, so TAKE_COMPACT is strictly cheaper.","next_action_hint":"Remaining take_delta/settle_delta(weth) paths all have V4a WETH→X DEBT with no V4c WETH production (V4V2V2, V4V2V3, V4V3V2, V4V3V3, V4V4V2, V4V4V3) → net WETH delta NEGATIVE (debt), cannot use TAKE_COMPACT. Check V2V4V4/V3V4V4 profit takes — V3V3V4/V2V4V4 use V4_TAKE_COMPACT already; V3V4V4 uses V4_TAKE_COMPACT for profit. Audit V2V4V4 (line ~1042 had two take_compact for profit). EXHAUSTED for the take_delta→take_compact profit pattern."}}
{"run":337,"commit":"373e825","metric":4938154,"metrics":{"bytecode_size":15359,"v2_v2_v2":197111,"v2_v2_v3":196464,"v2_v2_v4":209039,"v2_v3_v2":180681,"v2_v3_v3":197134,"v2_v3_v4":209701,"v2_v4_v2":188228,"v2_v4_v3":204597,"v2_v4_v4":173308,"v3_v2_v2":177085,"v3_v2_v3":197075,"v3_v2_v4":209680,"v3_v3_v2":194711,"v3_v3_v3":197171,"v3_v3_v4":210255,"v3_v4_v2":185207,"v3_v4_v3":205200,"v3_v4_v4":173926,"v4_v2_v2":167258,"v4_v2_v3":187248,"v4_v2_v4":175843,"v4_v3_v2":167844,"v4_v3_v3":187831,"v4_v3_v4":176421,"v4_v4_v2":131691,"v4_v4_v3":151669,"v4_v4_v4":85776},"status":"keep","description":"V4V3V4: replace IIA take_delta(usdc→v3b) with take_compact(usdc, v3b, a_out). Amount = V4a output (known); USDC delta nets to zero. −916 gas (v4_v3_v4: 177,337→176,421). Eliminates _lookup_address INVOKE + _read_pm_delta keccak256 + exttload (USDC is a table currency here, so bigger savings than the WETH take_delta in #336).","timestamp":1781986738789,"segment":13,"confidence":0.11887640449438203,"asi":{"finding":"−916 gas (v4_v3_v4: 177,337→176,421). Checks pass. Replacing the IIA take_delta(usdc_idx(table)→v3b) with take_compact(usdc, v3b, a_out). Bigger savings than #336's WETH take_delta because USDC is a TABLE currency here -> _read_pm_delta does keccak256 (not precomputed slot) + _lookup_address INVOKE. TAKE_COMPACT eliminates both + exttload. Net USDC delta = +AMOUNT_USDC (V4a output) - take(AMOUNT_USDC) = 0; PM.unlock() sees USDC delta zero.","hypothesis":"Replace V4_TAKE_DELTA(usdc_idx, v3b_idx) [IIA take] in V4V3V4 with V4_TAKE_COMPACT(usdc, v3b, a_out). Amount = V4a output (known constant AMOUNT_USDC). USDC delta after = V4a (+AMOUNT_USDC) minus take = 0.","next_action_hint":"Check V4V3V2 (L1944) — uses enc_v4_take_compact(usdc, v3b, a_out) already. V4V3V3 uses take_compact too. V4V3V4 was the only path with take_delta for the IIA usdc take. Look for other take_delta calls (search all) and check if amount is a known V4-swap output."}}
{"run":338,"commit":"373e825","metric":4938154,"metrics":{"bytecode_size":15359,"v2_v2_v2":197111,"v2_v2_v3":196464,"v2_v2_v4":209039,"v2_v3_v2":180681,"v2_v3_v3":197134,"v2_v3_v4":209701,"v2_v4_v2":188228,"v2_v4_v3":204597,"v2_v4_v4":173308,"v3_v2_v2":177085,"v3_v2_v3":197075,"v3_v2_v4":209680,"v3_v3_v2":194711,"v3_v3_v3":197171,"v3_v3_v4":210255,"v3_v4_v2":185207,"v3_v4_v3":205200,"v3_v4_v4":173926,"v4_v2_v2":167258,"v4_v2_v3":187248,"v4_v2_v4":175843,"v4_v3_v2":167844,"v4_v3_v3":187831,"v4_v3_v4":176421,"v4_v4_v2":131691,"v4_v4_v3":151669,"v4_v4_v4":85776},"status":"keep","description":"Stability confirmation: 4,938,154 reproducible after #334-337 (take_delta/settle_delta→take_compact profit-capture wins). All 4 wins stable (v2_v2_v4=209,039, v4_v2_v4=175,843, v4_v3_v4=176,421). Characteristics of the pattern recorded; avenue exhausted.","timestamp":1781986897442,"segment":13,"confidence":0.19702048417132215,"asi":{"finding":"4,938,154 reproducible (exact match to #337). All 4 wins stable: v2_v2_v4=209,039 (#334 -409), v4_v2_v4=175,843 (#335 -537), v4_v3_v4=176,421 (#336 -823 + #337 -916). Bytecode 15,359 (test-only changes across all 4). Checks pass.","hypothesis":"Stability confirmation after the take_delta/settle_delta→take_compact profit-capture wins (#334-337) to verify all four are reproducible together and no path interacted badly.","pattern_characterized":"When the net PM delta for a currency is a KNOWN positive constant (pure profit, no debt for that currency), replace V4_SETTLE_DELTA(c) or V4_TAKE_DELTA(c) with V4_TAKE_COMPACT(c, executor, known_amount). Savings: SETTLE_DELTA→TAKE_COMPACT = ~400-540 gas (1 exttload); TAKE_DELTA→TAKE_COMPACT = ~820-920 gas (1 exttload + 1 _lookup_address INVOKE + 1 _read_pm_delta keccak256 for table currencies). APPLICABLE ONLY when: (a) V4c is X→WETH (produces +profit WETH delta) AND (b) V4a debt (if any) is a different currency OR exactly known. NOT applicable when V4a is WETH→X with no compensating V4c WETH production (net WETH delta negative = debt, settle_delta required).","avenue_status":"EXHAUSTED: 2 settle_delta→take_compact (V2V2V4, V4V2V4), 2 take_delta→take_compact (V4V3V4 WETH + V4V3V4 USDC IIA). Remaining settle_delta(weth) paths all have V4a WETH→X debt (V4V2V2/V4V2V3/V4V3V2/V4V3V3/V4V4V2/V4V4V3) — net WETH delta negative, cannot use TAKE_COMPACT. No remaining take_delta calls in path tests."}}
{"run":339,"commit":"373e825","metric":4938154,"metrics":{"bytecode_size":15232,"v2_v2_v2":197111,"v2_v2_v3":196464,"v2_v2_v4":209039,"v2_v3_v2":180681,"v2_v3_v3":197134,"v2_v3_v4":209701,"v2_v4_v2":188228,"v2_v4_v3":204597,"v2_v4_v4":173308,"v3_v2_v2":177085,"v3_v2_v3":197075,"v3_v2_v4":209680,"v3_v3_v2":194711,"v3_v3_v3":197171,"v3_v3_v4":210255,"v3_v4_v2":185207,"v3_v4_v3":205200,"v3_v4_v4":173926,"v4_v2_v2":167258,"v4_v2_v3":187248,"v4_v2_v4":175843,"v4_v3_v2":167844,"v4_v3_v3":187831,"v4_v3_v4":176421,"v4_v4_v2":131691,"v4_v4_v3":151669,"v4_v4_v4":85776},"status":"checks_failed","description":"Remove balanceOf+conditional deposit in _v4_settle_currency WETH-debt branch. 0 benchmark gas change + 3 checks failed (V4_SETTLE_ALL/V4_BATCH cross-currency use the deposit fallback for ETH→WETH funding).","timestamp":1781987412530,"segment":13,"confidence":0.21326345494859908,"asi":{"finding":"0 gas change in benchmark (4,938,154 unchanged) despite −127 bytes bytecode. balanceOf+deposit branch NEVER executed in 27 benchmark paths (deposit always skipped, swap output >= owed). 3 checks FAILED: V4_SETTLE_ALL + V4_BATCH cross-currency tests use the deposit fallback (executor ETH→WETH funding). Breaks real functionality.","hypothesis":"Remove balanceOf(self)+conditional deposit in _v4_settle_currency WETH-debt branch (always transfer owed). Expected ~200 gas/path warm staticcall × 6 WETH-debt paths = ~1,200 gas.","next_action_hint":"DO NOT remove WETH deposit fallback — used by V4_SETTLE_ALL/V4_BATCH cross-currency paths. 0 benchmark gas savings anyway. WETH-debt settle balanceOf NOT a viable target.","rollback_reason":"3 checks failed (V4_SETTLE_ALL, V4_BATCH cross-currency) — deposit fallback is real functionality. 0 benchmark gas savings (deposit never triggered in 27 paths)."}}
{"run":340,"commit":"2cb65c4","metric":4934644,"metrics":{"bytecode_size":15239,"v2_v2_v2":197111,"v2_v2_v3":196464,"v2_v2_v4":209039,"v2_v3_v2":180681,"v2_v3_v3":197134,"v2_v3_v4":209701,"v2_v4_v2":188228,"v2_v4_v3":204597,"v2_v4_v4":173308,"v3_v2_v2":177085,"v3_v2_v3":197075,"v3_v2_v4":209680,"v3_v3_v2":194711,"v3_v3_v3":197171,"v3_v3_v4":210255,"v3_v4_v2":185207,"v3_v4_v3":205200,"v3_v4_v4":173926,"v4_v2_v2":166673,"v4_v2_v3":186663,"v4_v2_v4":175843,"v4_v3_v2":167259,"v4_v3_v3":187246,"v4_v3_v4":176421,"v4_v4_v2":131106,"v4_v4_v3":151084,"v4_v4_v4":85776},"status":"keep","description":"Remove balanceOf+conditional deposit from _cmd_v4_settle_delta's inline WETH branch only (leaving _v4_settle_currency intact for V4_SETTLE_ALL/V4_BATCH). The 6 WETH-debt benchmark paths use this inline branch (not _v4_settle_currency); deposit was always skipped (swap output ≥ owed), so the warm staticcall+branch (~585 gas) was wasted. −3,510 gas (−585 × 6 paths). Checks PASS.","timestamp":1781987705940,"segment":13,"confidence":0.23242530755711774,"asi":{"finding":"−3,510 gas (4,938,154→4,934,644). All 6 WETH-debt paths improved exactly −585 each (v4_v2_v2, v4_v2_v3, v4_v3_v2, v4_v3_v3, v4_v4_v2, v4_v4_v3). Checks PASS (276 tests). Bytecode −120 bytes. balanceOf+conditional deposit in _cmd_v4_settle_delta inline WETH branch was a warm staticcall (~585 gas) + branch accomplishing nothing (deposit always skipped, swap output ≥ owed).","hypothesis":"KEY INSIGHT from #339: that run removed balanceOf+deposit from _v4_settle_currency (V4_SETTLE_ALL/V4_BATCH) → 0 benchmark gas because the 6 WETH-debt benchmark paths use the INLINE branch in _cmd_v4_settle_delta, NOT _v4_settle_currency. The inline branch has its OWN balanceOf+deposit executed (warm) on all 6 benchmark paths. Removing it from the inline branch only (leaving _v4_settle_currency intact) saves ~585 × 6 paths without breaking cross-currency settle_all tests.","next_action_hint":"Settle_delta(WETH) no longer has ETH→WETH deposit fallback, but _v4_settle_currency (V4_SETTLE_ALL) keeps it. Defensible split: settle_delta=targeted (operator ensures funding), settle_all=catch-all (handles ETH deposit). _v4_settle_currency MUST keep the fallback (#339 proved V4_SETTLE_ALL/V4_BATCH cross-currency use it). Avenue exhausted."}}
{"run":341,"commit":"2cb65c4","metric":4934644,"metrics":{"bytecode_size":15239,"v2_v2_v2":197111,"v2_v2_v3":196464,"v2_v2_v4":209039,"v2_v3_v2":180681,"v2_v3_v3":197134,"v2_v3_v4":209701,"v2_v4_v2":188228,"v2_v4_v3":204597,"v2_v4_v4":173308,"v3_v2_v2":177085,"v3_v2_v3":197075,"v3_v2_v4":209680,"v3_v3_v2":194711,"v3_v3_v3":197171,"v3_v3_v4":210255,"v3_v4_v2":185207,"v3_v4_v3":205200,"v3_v4_v4":173926,"v4_v2_v2":166673,"v4_v2_v3":186663,"v4_v2_v4":175843,"v4_v3_v2":167259,"v4_v3_v3":187246,"v4_v3_v4":176421,"v4_v4_v2":131106,"v4_v4_v3":151084,"v4_v4_v4":85776},"status":"keep","description":"Stability confirmation: 4,934,644 reproducible after #340 (settle_delta inline WETH balanceOf+deposit removal). 6 WETH-debt paths stable at −585 each. Inlined-branch redundancy pattern characterized; avenue exhausted.","timestamp":1781987869931,"segment":13,"confidence":0.14059800664451827,"asi":{"finding":"4,934,644 reproducible (exact match to #340). 6 WETH-debt paths stable at -585 each (v4_v2_v2=166,673, v4_v2_v3=186,663, v4_v3_v2=167,259, v4_v3_v3=187,246, v4_v4_v2=131,106, v4_v4_v3=151,084). Checks pass (276 tests). Bytecode 15,239.","hypothesis":"Stability confirmation after #340 (settle_delta inline WETH balanceOf+deposit removal).","pattern_characterized":"INLINED-branch redundancy: _cmd_v4_settle_delta has an INLINE copy of the WETH settle logic (separate from _v4_settle_currency). The inline copy's balanceOf+deposit was dead on benchmark WETH-debt paths (deposit always skipped, swap output >= owed) but still cost ~585 gas/path (warm staticcall + branch + bytecode). Removing it from the inline branch saved -585 × 6 paths = -3,510 gas. The _v4_settle_currency copy MUST stay (V4_SETTLE_ALL/V4_BATCH cross-currency use the deposit fallback, proven by #339). KEY INSIGHT: always check whether a handler has an inlined copy of shared logic — the inline copy may carry dead defensive code that the shared version needs for other callers.","next_action_hint":"No more removable balanceOf: remaining sites are _v4_settle_currency (dead in benchmark, needed by settle_all), profit-check combined_after (necessary, checks ON), dead handlers (withdraw/V2_SWAP_CALC/XFER_BALANCE/WETH_WITHDRAW_ALL), bribe logic (skipped via early-return). Avenue exhausted."}}
{"type":"config","name":"cmd_executor 27-perm gas reduction (fresh baseline)","metricName":"total_gas","metricUnit":"gas","bestDirection":"lower"}
{"run":342,"commit":"9874ef6","metric":4934227,"metrics":{"bytecode_size":15445,"v2_v2_v2":197084,"v2_v2_v3":196437,"v2_v2_v4":209012,"v2_v3_v2":180692,"v2_v3_v3":197107,"v2_v3_v4":209674,"v2_v4_v2":188239,"v2_v4_v3":204570,"v2_v4_v4":173281,"v3_v2_v2":177096,"v3_v2_v3":197048,"v3_v2_v4":209653,"v3_v3_v2":194684,"v3_v3_v3":197144,"v3_v3_v4":210228,"v3_v4_v2":185218,"v3_v4_v3":205173,"v3_v4_v4":173899,"v4_v2_v2":166684,"v4_v2_v3":186636,"v4_v2_v4":175816,"v4_v3_v2":167270,"v4_v3_v3":187219,"v4_v3_v4":176394,"v4_v4_v2":131117,"v4_v4_v3":151057,"v4_v4_v4":85795},"status":"keep","description":"Fresh baseline at HEAD (9874ef6). 7 commits since last logged experiment (2cb65c4, metric 4,934,644): owner gate, BipsTooHigh guard, profit-check hardening, donation gate, bribe routing, sentinel bounds, docs. Net Δ vs last: -417 gas (4,934,644→4,934,227), +206 bytes bytecode (15,239→15,445). Mostly correctness hardening with negligible gas impact. Checks pass.","timestamp":1781994769253,"segment":14,"confidence":null,"asi":{"hypothesis":"Baseline after recent hardening commits (owner gate, BipsTooHigh, profit check, donation gate, bribe routing, sentinel bounds)","baseline_total_gas":4934227,"baseline_bytecode_size":15445,"delta_vs_last_logged":"-417 gas, +206 bytes","note":"Recent commits were correctness hardening, not gas optimization. Bytecode grew +206 bytes from guards/asserts; gas roughly flat (-417). Within noise floor."}}
{"run":343,"commit":"c523f22","metric":4933610,"metrics":{"bytecode_size":15445,"v2_v2_v2":197061,"v2_v2_v3":196414,"v2_v2_v4":208989,"v2_v3_v2":180669,"v2_v3_v3":197084,"v2_v3_v4":209651,"v2_v4_v2":188216,"v2_v4_v3":204547,"v2_v4_v4":173258,"v3_v2_v2":177073,"v3_v2_v3":197025,"v3_v2_v4":209630,"v3_v3_v2":194661,"v3_v3_v3":197121,"v3_v3_v4":210205,"v3_v4_v2":185195,"v3_v4_v3":205150,"v3_v4_v4":173876,"v4_v2_v2":166661,"v4_v2_v3":186613,"v4_v2_v4":175793,"v4_v3_v2":167247,"v4_v3_v3":187196,"v4_v3_v4":176371,"v4_v4_v2":131094,"v4_v4_v3":151034,"v4_v4_v4":85776},"status":"keep","description":"Move `assert bribe_bips <= 10_000` (BipsTooHigh) from unconditional slow path into the `if bribe_bips > 0:` bribe block. The guard only matters when a bribe is requested; benchmark paths run with no bribe (= honest production default), so the unconditional assert cost ~19-23 gas/path was dead on all 27. −617 gas total (~−23 × 27). Bytecode unchanged. Checks pass.","timestamp":1781994964148,"segment":14,"confidence":null,"asi":{"finding":"−617 gas total, ~−23/path across all 27. V4V4V4: 85,795→85,776, exactly reversing the +19 added by commit 8b8d6d7's BipsTooHigh assert. Bytecode unchanged.","hypothesis":"BipsTooHigh assert runs unconditionally on the slow path but only matters when bribe_bips > 0; move it into the `if bribe_bips > 0:` block to skip on all non-bribe (default production) paths.","next_action_hint":"Audit other post-hardening asserts. _cmd_v4_take_delta delta>0 guard (M5) on hot benchmark paths? execute() other asserts (recipient_idx, expected_value) are already correctly gated."}}
{"run":344,"commit":"local","metric":4933610,"metrics":{"bytecode_size":15445,"v2_v2_v2":197061,"v2_v2_v3":196414,"v2_v2_v4":208989,"v2_v3_v2":180669,"v2_v3_v3":197084,"v2_v3_v4":209651,"v2_v4_v2":188216,"v2_v4_v3":204547,"v2_v4_v4":173258,"v3_v2_v2":177073,"v3_v2_v3":197025,"v3_v2_v4":209630,"v3_v3_v2":194661,"v3_v3_v3":197121,"v3_v3_v4":210205,"v3_v4_v2":185195,"v3_v4_v3":205150,"v3_v4_v4":173876,"v4_v2_v2":166661,"v4_v2_v3":186613,"v4_v2_v4":175793,"v4_v3_v2":167247,"v4_v3_v3":187196,"v4_v3_v4":176371,"v4_v4_v2":131094,"v4_v4_v3":151034,"v4_v4_v4":85776},"status":"discard","description":"Remove redundant `combined_before = expected_value` local copy; replace its 3 uses with expected_value directly. Result: 0 gas change (4,933,610 exact match, identical per-path). Venom copy-propagates straight-line local copies. Discarded.","timestamp":1781995275009,"segment":14,"confidence":null,"asi":{"finding":"0 gas change. Exact same per-path metrics (4,933,610 unchanged). Venom already elides the `combined_before = expected_value` local copy via copy propagation.","hypothesis":"`combined_before = expected_value` redundant local copy costs MSTORE; replacing 3 uses with expected_value directly would save gas.","next_action_hint":"Don't pursue copy-prop micro-opts on straight-line locals — Venom handles them.","rollback_reason":"0 gas change — Venom copy-propagates straight-line local copies."}}
{"run":345,"commit":"local","metric":4933770,"metrics":{"bytecode_size":15443,"v2_v2_v2":197078,"v2_v2_v3":196431,"v2_v2_v4":209006,"v2_v3_v2":180648,"v2_v3_v3":197101,"v2_v3_v4":209668,"v2_v4_v2":188195,"v2_v4_v3":204564,"v2_v4_v4":173275,"v3_v2_v2":177052,"v3_v2_v3":197042,"v3_v2_v4":209647,"v3_v3_v2":194678,"v3_v3_v3":197138,"v3_v3_v4":210222,"v3_v4_v2":185174,"v3_v4_v3":205167,"v3_v4_v4":173893,"v4_v2_v2":166640,"v4_v2_v3":186630,"v4_v2_v4":175810,"v4_v3_v2":167226,"v4_v3_v3":187213,"v4_v3_v4":176388,"v4_v4_v2":131073,"v4_v4_v3":151051,"v4_v4_v4":85760},"status":"discard","description":"Remove redundant `if expected_value > 0:` guard around the profit assert (uint>=uint(0) trivially true). Result: +160 gas regression with bimodal per-path distribution (V4 paths −, V2/V3 paths +) — Venom bytecode-layout sensitivity. Bytecode −2 bytes. Discarded.","timestamp":1781995594177,"segment":14,"confidence":7.7125,"asi":{"finding":"+160 gas regression (4,933,610→4,933,770) with BIMODAL per-path distribution: V4-ending paths improved (v4_v4_v4 −16, v4_v4_v2 −21, v4_v2_v2 −21) while V2/V3-ending paths regressed (v2_v2_v2 +17). Non-uniform shift = Venom bytecode-layout sensitivity, not a real signal. Bytecode −2 bytes but gas worse.","hypothesis":"`if expected_value > 0:` guard around profit assert is redundant (uint>=uint(0) trivially true). Removing saves ~3 gas/path on common expected_value>0 case. Correct for all inputs.","next_action_hint":"AVOID single-guard REMOVAL in execute() slow path — layout-sensitive, net regression despite bytecode shrink. BipsTooHigh win (#343) worked because it MOVED the assert into a separate branch (no jump-target shift); fully REMOVING a guard reflows bytecode. Dead-end class: guard REMOVAL in execute() slow path = layout regression; guard RELOCATION into existing branch = ok.","rollback_reason":"+160 net gas regression from Venom layout shift (bimodal per-path, not uniform). -2 bytes bytecode but gas worse."}}
