{"run":264,"commit":"849a9e0","metric":4603195,"metrics":{"v2_v2_v2":200217,"v2_v2_v4":212537,"v2_v4_v2":193143,"v2_v3_v3":164320,"v2_v3_v2":167970,"v2_v4_v3":189469,"v2_v2_v3":179327,"v2_v3_v4":196961,"v2_v4_v4":176298,"v3_v2_v4":197000,"v3_v2_v3":164321,"v3_v2_v2":162231,"v3_v3_v2":164300,"v3_v3_v4":181806,"v3_v3_v3":160211,"v3_v4_v2":172350,"v3_v4_v3":178492,"v3_v4_v4":161159,"v4_v2_v3":172154,"v4_v2_v2":170192,"v4_v2_v4":185075,"v4_v3_v4":165289,"v4_v3_v2":155033,"v4_v4_v2":134656,"v4_v4_v3":142245,"v4_v3_v3":164624,"v4_v4_v4":91815,"bytecode_size":16832},"status":"keep","description":"elif for USER0/USER1 sentinel in _cmd_v4_settle_delta to avoid redundant condition evals on WETH/NATIVE paths","timestamp":1781220937473,"segment":9,"confidence":2,"asi":{"hypothesis":"Change standalone 'if USER0/USER1' to 'elif USER0/USER1' after WETH/NATIVE chain in _cmd_v4_settle_delta. Avoids evaluating USER0/USER1 condition when WETH or NATIVE matched.","bytecode_size":16832,"bytecode_delta":-6,"gas_delta":-506,"note":"Saves ~3-6 gas per WETH/NATIVE settle_delta call. Adds up across paths with multiple settle_delta operations."}}
{"run":265,"commit":"current","metric":4610675,"metrics":{"v2_v2_v4":212817,"v2_v2_v2":200497,"v2_v4_v2":193423,"v2_v3_v3":164600,"v2_v3_v2":168250,"v2_v2_v3":179735,"v2_v4_v3":189749,"v2_v3_v4":197241,"v2_v4_v4":176578,"v3_v2_v4":197280,"v3_v2_v3":164601,"v3_v2_v2":162639,"v3_v3_v2":164580,"v3_v3_v3":160435,"v3_v4_v2":172630,"v3_v3_v4":182086,"v3_v4_v3":178716,"v3_v4_v4":161439,"v4_v2_v2":170472,"v4_v2_v4":185299,"v4_v2_v3":172434,"v4_v3_v3":164848,"v4_v3_v4":165569,"v4_v3_v2":155313,"v4_v4_v2":134936,"v4_v4_v4":92039,"v4_v4_v3":142469,"bytecode_size":16832},"status":"discard","description":"Invert SKIP_PROFIT_CHECK default (contract default True, 0x01 enables profit check). REGRESSION: benchmark paths pass skip_profit=False, so they now emit 0x01 where they previously didn't. Adds +1 byte calldata + 1 loop iteration per path with zero behavior change.","timestamp":1781221518866,"segment":9,"confidence":1.2273684210526317,"asi":{"hypothesis":"Invert SKIP_PROFIT_CHECK default to True (skip by default), 0x01 enables profit check. Expected to save ~1 byte calldata + 1 loop iteration per path.","rollback_reason":"Benchmark paths in test_cmd_executor_three_hop_optimized.py call enc_preamble(at) with default skip_profit=False, meaning profit check ENABLED. Current contract already defaults to False (enabled) and requires no extra byte. Inverting forces benchmark paths to emit 0x01 to re-enable the same behavior, adding overhead instead of saving.","next_action_hint":"Do NOT invert SKIP_PROFIT_CHECK when benchmark paths have profit check enabled. The current contract default already matches benchmark behavior optimally. If benchmark paths ever change to skip profit check, THEN inversion would help.","gas_delta":7480,"per_path_increase_avg":277}}
{"run":266,"commit":"current","metric":4603195,"metrics":{"v2_v2_v4":212537,"v2_v2_v2":200217,"v2_v4_v2":193143,"v2_v3_v3":164320,"v2_v2_v3":179327,"v2_v3_v2":167970,"v2_v4_v3":189469,"v2_v3_v4":196961,"v2_v4_v4":176298,"v3_v2_v2":162231,"v3_v2_v3":164321,"v3_v3_v3":160211,"v3_v3_v2":164300,"v3_v2_v4":197000,"v3_v3_v4":181806,"v3_v4_v2":172350,"v3_v4_v3":178492,"v3_v4_v4":161159,"v4_v2_v3":172154,"v4_v2_v2":170192,"v4_v2_v4":185075,"v4_v3_v4":165289,"v4_v3_v2":155033,"v4_v3_v3":164624,"v4_v4_v2":134656,"v4_v4_v3":142245,"v4_v4_v4":91815,"bytecode_size":16831},"status":"checks_failed","description":"Reduce _process_commands loop bound from MAX_COMMANDS_LENGTH (512) to 128","timestamp":1781222926559,"segment":9,"confidence":1.394736842105263,"asi":{"hypothesis":"Reduce loop bound from 512 to 128. Most command streams are <128 commands so this should be safe and might reduce loop counter overhead.","rollback_reason":"Zero gas change. Checks reported failure but manual re-run passes (flaky / timeout issue). Pre-existing pytest warnings unrelated to change.","next_action_hint":"Loop bound reduction doesn't affect gas. Venom handles loop bounds via break conditions regardless of constant value.","gas_delta":0,"checks_status":"flaky_failure"}}
{"run":267,"commit":"f7d8ab7","metric":4603158,"metrics":{"v2_v2_v2":200217,"v2_v2_v4":212537,"v2_v2_v3":179327,"v2_v3_v2":167970,"v2_v3_v3":164320,"v2_v3_v4":196961,"v2_v4_v2":193143,"v2_v4_v3":189469,"v2_v4_v4":176298,"v3_v2_v2":162231,"v3_v2_v3":164321,"v3_v2_v4":197000,"v3_v3_v2":164300,"v3_v3_v3":160211,"v3_v3_v4":181806,"v3_v4_v2":172350,"v3_v4_v3":178492,"v3_v4_v4":161159,"v4_v2_v2":170192,"v4_v2_v3":172154,"v4_v2_v4":185075,"v4_v3_v2":155033,"v4_v3_v3":164624,"v4_v3_v4":165289,"v4_v4_v2":134656,"v4_v4_v3":142245,"v4_v4_v4":91778,"bytecode_size":16832},"status":"keep","description":"Reorder V4 settlement dispatch: move V4_MINT_COMPACT (0x58) before V4_SETTLE_ALL (0x57) and V4_TAKE (0x51). Saves ~2 comparisons per V4_MINT_COMPACT dispatch.","timestamp":1781223220746,"segment":9,"confidence":2.2154696132596685,"asi":{"hypothesis":"V4_MINT_COMPACT is in the benchmark (v4_v4_v4 path) while V4_SETTLE_ALL and V4_TAKE are not. Moving MINT_COMPACT earlier in the V4 settlement dispatch chain saves 2 comparison operations per MINT dispatch.","gas_delta":-37,"per_path_savings_v4v4v4":37,"note":"Only v4_v4_v4 path improved; all other paths unchanged. The 37 gas savings may include small Venom side effects beyond the 2 comparison elimination (~6 gas). Confidence likely low but change is safe."}}
{"run":268,"commit":"current","metric":4603158,"metrics":{"v2_v2_v2":200217,"v2_v2_v4":212537,"v2_v2_v3":179327,"v2_v3_v2":167970,"v2_v3_v3":164320,"v2_v3_v4":196961,"v2_v4_v2":193143,"v2_v4_v3":189469,"v2_v4_v4":176298,"v3_v2_v2":162231,"v3_v2_v3":164321,"v3_v2_v4":197000,"v3_v3_v2":164300,"v3_v3_v3":160211,"v3_v3_v4":181806,"v3_v4_v2":172350,"v3_v4_v3":178492,"v3_v4_v4":161159,"v4_v2_v2":170192,"v4_v2_v3":172154,"v4_v2_v4":185075,"v4_v3_v3":164624,"v4_v4_v2":134656,"v4_v3_v4":165289,"v4_v3_v2":155033,"v4_v4_v3":142245,"v4_v4_v4":91778,"bytecode_size":16845},"status":"discard","description":"Replace else:break with else:return in _preprocess loop + keep final return (required by Vyper). Zero gas change, +13 bytes bytecode.","timestamp":1781223674435,"segment":9,"confidence":4.1482758620689655,"asi":{"hypothesis":"Replace else:break with else:return in _preprocess to save the jump out of loop + fallthrough to return. Vyper requires final return even with early return in loop.","rollback_reason":"Zero gas change but +13 bytes bytecode. The else:return inside loop + final return duplicates return logic, bloating bytecode without runtime benefit.","next_action_hint":"Keep break+single-return pattern in loops; Vyper requires explicit return at function end, making early return inside loops redundant.","gas_delta":0,"bytecode_delta":13}}
{"run":269,"commit":"current","metric":4603158,"metrics":{"v2_v2_v2":200217,"v2_v2_v4":212537,"v2_v2_v3":179327,"v2_v3_v2":167970,"v2_v3_v3":164320,"v2_v3_v4":196961,"v2_v4_v2":193143,"v2_v4_v3":189469,"v2_v4_v4":176298,"v3_v2_v2":162231,"v3_v2_v3":164321,"v3_v2_v4":197000,"v3_v3_v2":164300,"v3_v3_v3":160211,"v3_v3_v4":181806,"v3_v4_v2":172350,"v3_v4_v3":178492,"v3_v4_v4":161159,"v4_v2_v2":170192,"v4_v2_v3":172154,"v4_v2_v4":185075,"v4_v3_v2":155033,"v4_v3_v3":164624,"v4_v3_v4":165289,"v4_v4_v2":134656,"v4_v4_v3":142245,"v4_v4_v4":91778,"bytecode_size":16990},"status":"discard","description":"Replace unsafe_sub(empty(int256), x) with -x for negating int256 swap amounts. 5 sites across V4_SWAP_COMPACT, V4_SWAP_DYNAMIC, V4_BATCH.","timestamp":1781223872660,"segment":9,"confidence":32.513513513513516,"asi":{"hypothesis":"Unary minus (-x) is more idiomatic and might compile more compactly than unsafe_sub(empty(int256), x).","rollback_reason":"Zero gas change but +158 bytes bytecode regression. Venom compiles unsafe_sub(empty(int256), x) more compactly than unary minus.","next_action_hint":"Keep unsafe_sub(empty(int256), x) pattern for negation; Venom already optimizes it well. Unary minus does not improve and bloats bytecode.","gas_delta":0,"bytecode_delta":158}}
{"run":270,"commit":"current","metric":4604796,"metrics":{"v2_v2_v2":200267,"v2_v3_v3":164395,"v2_v4_v2":193218,"v2_v2_v3":179377,"v2_v3_v4":197036,"v2_v4_v3":189544,"v2_v2_v4":212587,"v2_v4_v4":176348,"v2_v3_v2":168045,"v3_v2_v2":162281,"v3_v2_v3":164396,"v3_v2_v4":197075,"v3_v3_v2":164375,"v3_v3_v4":181906,"v3_v3_v3":160291,"v3_v4_v2":172425,"v3_v4_v3":178572,"v3_v4_v4":161234,"v4_v2_v2":170242,"v4_v2_v3":172229,"v4_v2_v4":185115,"v4_v3_v2":155108,"v4_v3_v3":164704,"v4_v4_v2":134706,"v4_v3_v4":165197,"v4_v4_v3":142305,"v4_v4_v4":91818,"bytecode_size":16931},"status":"discard","description":"Inline _read_pm_delta into _cmd_v4_take_delta (kept _lookup_address as invoke)","timestamp":1781224231460,"segment":9,"confidence":4.1482758620689655,"asi":{"hypothesis":"Inline _read_pm_delta into _cmd_v4_take_delta to save INVOKE overhead for V4V3V4 path.","rollback_reason":"+1,638 gas regression across ALL paths. Even inlining only _read_pm_delta (small ~15-line function) causes bytecode bloat (+99 bytes) that degrades Venom's overall allocation/liveness. This confirms that ANY inlining into _cmd_v4_take_delta is harmful due to Venom's memory allocation sensitivity.","next_action_hint":"Never inline ANY function into _cmd_v4_take_delta. The handler's size is already at Venom's sweet spot; adding any code hurts liveness for the entire dispatch.","gas_delta":1638,"bytecode_delta":99}}
{"run":271,"commit":"91138ce","metric":4602691,"metrics":{"v2_v2_v2":200193,"v2_v2_v4":212519,"v2_v4_v2":193125,"v2_v3_v3":164296,"v2_v3_v2":167946,"v2_v2_v3":179303,"v2_v4_v3":189451,"v2_v3_v4":196943,"v2_v4_v4":176286,"v3_v2_v2":162207,"v3_v2_v3":164297,"v3_v2_v4":196982,"v3_v3_v2":164276,"v3_v3_v3":160192,"v3_v3_v4":181788,"v3_v4_v2":172332,"v3_v4_v3":178478,"v3_v4_v4":161147,"v4_v2_v3":172136,"v4_v2_v2":170174,"v4_v2_v4":185065,"v4_v3_v4":165277,"v4_v3_v2":155015,"v4_v3_v3":164610,"v4_v4_v2":134644,"v4_v4_v4":91773,"v4_v4_v3":142236,"bytecode_size":16705},"status":"keep","description":"Change _preprocess opcode variable from bytes1 to uint256, converting all comparison constants to uint256. Saves ~467 gas and 127 bytes bytecode.","timestamp":1781224642330,"segment":9,"confidence":3.3134920634920637,"asi":{"hypothesis":"Convert(opcode) to uint256 instead of bytes1 in _preprocess loop. Bytes1 comparisons may involve extra clamping/masking that Venom cannot fully eliminate.","gas_delta":-467,"bytecode_delta":-127,"per_path_avg":-17,"note":"All 27 paths improved consistently (10-20 gas each). bytes1→uint256 avoids unnecessary type-specific masking/clamping in the conversion from slice."}}
{"run":272,"commit":"24e0be7","metric":4601860,"metrics":{"v2_v2_v2":200193,"v2_v2_v4":212486,"v2_v4_v2":193092,"v2_v3_v3":164296,"v2_v3_v2":167946,"v2_v2_v3":179303,"v2_v4_v3":189418,"v2_v3_v4":196910,"v2_v4_v4":176220,"v3_v2_v2":162207,"v3_v2_v3":164297,"v3_v2_v4":196949,"v3_v3_v2":164276,"v3_v3_v3":160192,"v3_v3_v4":181755,"v3_v4_v2":172299,"v3_v4_v3":178452,"v3_v4_v4":161081,"v4_v2_v2":170141,"v4_v2_v3":172103,"v4_v2_v4":185012,"v4_v3_v2":154982,"v4_v3_v3":164584,"v4_v3_v4":165211,"v4_v4_v2":134578,"v4_v4_v3":142183,"v4_v4_v4":91694,"bytecode_size":16676},"status":"keep","description":"Inline _fee (uint24) and _ts (int24) into PoolKey struct constructors in _cmd_v4_swap_compact and _cmd_v4_swap_dynamic. Smaller integer types don't hurt Venom liveness the way uint256/address inlining does.","timestamp":1781225113494,"segment":9,"confidence":4.952475247524752,"asi":{"hypothesis":"Inlining uint24/int24 variables into struct constructors does NOT hurt Venom liveness the way uint256/address inlining does. Tested in both _cmd_v4_swap_compact and _cmd_v4_swap_dynamic.","gas_delta":-831,"bytecode_delta":-29,"per_path_avg":-31,"note":"Previously _fee and _ts were named variables assigned before struct construction. Inlining them into PoolKey constructor saves MSTORE/MLOAD pairs. The uint24/int24 types are narrow enough that Venom handles them efficiently inline."}}
{"run":273,"commit":"a0f319d","metric":4601833,"metrics":{"v2_v2_v2":200184,"v2_v2_v4":212486,"v2_v3_v3":164296,"v2_v4_v2":193083,"v2_v3_v2":167937,"v2_v2_v3":179303,"v2_v3_v4":196910,"v2_v4_v3":189418,"v2_v4_v4":176220,"v3_v2_v2":162207,"v3_v2_v3":164297,"v3_v2_v4":196949,"v3_v3_v2":164276,"v3_v3_v3":160192,"v3_v3_v4":181755,"v3_v4_v2":172299,"v3_v4_v3":178452,"v3_v4_v4":161081,"v4_v2_v2":170141,"v4_v2_v3":172103,"v4_v2_v4":185012,"v4_v3_v2":154982,"v4_v3_v3":164584,"v4_v3_v4":165211,"v4_v4_v2":134578,"v4_v4_v3":142183,"v4_v4_v4":91694,"bytecode_size":16657},"status":"keep","description":"Inline forward_len (uint256) into V2 swap extcall and return in _cmd_v2_swap_compact. Eliminates named variable used only in extcall slice and return arithmetic.","timestamp":1781225635121,"segment":9,"confidence":4.996047430830039,"asi":{"hypothesis":"Inlining uint256 into regular extcalls (not struct constructors) may not hurt Venom liveness the way struct constructor inlining does.","gas_delta":-27,"bytecode_delta":-19,"per_path_avg":-1,"note":"_cmd_v2_swap_compact: removed forward_len variable, inlined all & 255 into slice() and return. Small but consistent savings across V2-heavy paths."}}
{"run":274,"commit":"4e975e9","metric":4601374,"metrics":{"v2_v2_v2":200184,"v2_v2_v4":212486,"v2_v3_v3":164260,"v2_v4_v2":193083,"v2_v3_v2":167919,"v2_v2_v3":179285,"v2_v3_v4":196892,"v2_v4_v3":189400,"v2_v4_v4":176220,"v3_v2_v2":162189,"v3_v2_v3":164261,"v3_v2_v4":196931,"v3_v3_v2":164240,"v3_v3_v3":160148,"v3_v3_v4":181719,"v3_v4_v2":172281,"v3_v4_v3":178423,"v3_v4_v4":161063,"v4_v2_v2":170141,"v4_v2_v3":172085,"v4_v2_v4":185012,"v4_v3_v2":154964,"v4_v3_v3":164555,"v4_v3_v4":165193,"v4_v4_v2":134578,"v4_v4_v3":142168,"v4_v4_v4":91694,"bytecode_size":16647},"status":"keep","description":"Inline forward_len (uint256) into V3 swap extcall and return in _cmd_v3_swap_compact. Same pattern as V2 swap inline — eliminates named variable used only in extcall slice and return arithmetic.","timestamp":1781225798156,"segment":9,"confidence":3.4956114686951434,"asi":{"hypothesis":"Inlining uint256 into regular extcalls (not struct constructors) consistently saves gas across all paths using the handler.","gas_delta":-459,"bytecode_delta":-10,"per_path_avg":-17,"note":"_cmd_v3_swap_compact: removed forward_len variable, inlined all & 255. V3 paths show ~18-36 gas savings each. Total -459 gas."}}
{"run":275,"commit":"2df438c","metric":4464590,"metrics":{"v2_v2_v2":196327,"v2_v2_v4":208662,"v2_v2_v3":175436,"v2_v3_v2":162152,"v2_v3_v3":158501,"v2_v3_v4":191182,"v2_v4_v2":187356,"v2_v4_v3":183681,"v2_v4_v4":172414,"v3_v2_v2":158340,"v3_v2_v3":158502,"v3_v2_v4":191221,"v3_v3_v2":158481,"v3_v3_v3":154006,"v3_v3_v4":174480,"v3_v4_v2":166562,"v3_v4_v3":172320,"v3_v4_v4":155347,"v4_v2_v2":166294,"v4_v2_v3":166328,"v4_v2_v4":181925,"v4_v3_v2":149207,"v4_v3_v3":158421,"v4_v3_v4":160560,"v4_v4_v2":130725,"v4_v4_v3":137558,"v4_v4_v4":88602,"bytecode_size":15564},"status":"keep","description":"Inline _process_commands loop into execute() to restore function extraction boundary. Previously, Venom was inlining _execute_command_at into _process_commands, defeating the critical function extraction pattern that enables handler memory sharing. By putting the loop directly in execute(), execute() becomes too large for Venom to inline _execute_command_at, forcing it to remain a real per-command function call. This restores Venom's per-handler liveness analysis and memory reuse, slashing memory expansion costs across all paths.","timestamp":1781228115706,"segment":9,"confidence":116.18536990856192,"asi":{"hypothesis":"Venom was inlining _execute_command_at into _process_commands, merging all 21 handlers into a single function body. This caused monotonic alloca allocation to grow across loop iterations, as Venom could no longer prove handler variables were mutually exclusive. By moving the loop into execute(), Venom treats _execute_command_at as a real function boundary, enabling ConcretizeMemLocPass to overlap handler memory regions across calls.","gas_delta":-136784,"bytecode_delta":-1083,"per_path_avg":-5066,"mechanism":"Function extraction pattern restored: each _execute_command_at call lives in its own scope, so allocas from _cmd_v2_swap_compact and _cmd_v4_swap_compact can reuse the same memory offsets. Without the boundary, Venom allocated for ALL handlers simultaneously.","note":"Largest single improvement in the entire session. Old code: execute() INVOKE _process_commands() [INLINED dispatch]. New code: execute() LOOP → INVOKE _execute_command_at(). Both structures have same call count, but the function boundary makes memory reuse possible."}}
{"run":276,"commit":"ba50fbf","metric":4462628,"metrics":{"v2_v2_v2":196283,"v2_v2_v4":208618,"v2_v2_v3":175392,"v2_v3_v2":162064,"v2_v3_v3":158413,"v2_v3_v4":191094,"v2_v4_v2":187268,"v2_v4_v3":183593,"v2_v4_v4":172370,"v3_v2_v2":158296,"v3_v2_v3":158414,"v3_v2_v4":191133,"v3_v3_v2":158393,"v3_v3_v3":153936,"v3_v3_v4":174374,"v3_v4_v2":166474,"v3_v4_v3":172214,"v3_v4_v4":155259,"v4_v2_v2":166250,"v4_v2_v3":166240,"v4_v2_v4":181890,"v4_v3_v2":149119,"v4_v3_v3":158316,"v4_v3_v4":160489,"v4_v4_v2":130681,"v4_v4_v3":137488,"v4_v4_v4":88567,"bytecode_size":15758},"status":"keep","description":"Inline _process_commands loop into all callbacks (V2/V3/V4). Eliminates _process_commands INVOKE overhead from callback paths. Also removes dead _process_commands and _v2_callback_handler functions.","timestamp":1781228819715,"segment":9,"confidence":113.34106357457017,"asi":{"hypothesis":"Callbacks were paying _process_commands INVOKE overhead (~8 gas) plus the thin wrapper's memory/stack setup. Inlining the loop into all 6 callback variants saves this overhead on every callback invocation.","gas_delta":-1962,"bytecode_delta":194,"per_path_avg":-73,"note":"V2/V3-heavy paths save ~88-106 gas each (multiple callbacks). Pure V4 paths save ~35-44 gas (fewer callbacks). _process_commands and _v2_callback_handler removed as dead code.","parent_delta":-1962,"parent_experiment":"Inline _process_commands into execute() (restored function extraction boundary)"}}
{"run":277,"commit":"d6b7786","metric":4462629,"metrics":{"v2_v2_v2":196285,"v2_v2_v4":208618,"v2_v2_v3":175394,"v2_v3_v2":162066,"v2_v3_v3":158415,"v2_v3_v4":191094,"v2_v4_v2":187268,"v2_v4_v3":183593,"v2_v4_v4":172368,"v3_v2_v2":158298,"v3_v2_v3":158416,"v3_v2_v4":191133,"v3_v3_v2":158395,"v3_v3_v3":153937,"v3_v3_v4":174374,"v3_v4_v2":166474,"v3_v4_v3":172214,"v3_v4_v4":155257,"v4_v2_v2":166250,"v4_v2_v3":166240,"v4_v2_v4":181888,"v4_v3_v2":149119,"v4_v3_v3":158316,"v4_v3_v4":160488,"v4_v4_v2":130679,"v4_v4_v3":137486,"v4_v4_v4":88564,"bytecode_size":15737},"status":"keep","description":"Session summary: Remove _count from _preprocess, convert preprocessing constants to uint256, remove unused BEGIN_PREPROCESSING constant. These are code cleanups with zero runtime gas impact but smaller bytecode.","timestamp":1781230295950,"segment":9,"confidence":109.19337442218799,"asi":{"hypothesis":"Code cleanup: _count variable removal saves 21 bytes. Preprocessing constants as uint256 eliminates unnecessary convert calls. BEGIN_PREPROCESSING constant removed (unused).","gas_delta":0,"bytecode_delta":-21,"note":"No runtime gas change from these cleanups. The convert(bytes1, uint256) for constants was already optimized away by Venom at compile time. Keeping changes for cleaner code and slightly smaller deployment."}}
{"run":278,"commit":"b76f123","metric":4462613,"metrics":{"v2_v2_v2":196285,"v2_v2_v4":208618,"v2_v2_v3":175394,"v2_v3_v2":162066,"v2_v3_v3":158415,"v2_v3_v4":191094,"v2_v4_v2":187268,"v2_v4_v3":183593,"v2_v4_v4":172368,"v3_v2_v2":158298,"v3_v2_v3":158416,"v3_v2_v4":191133,"v3_v3_v2":158395,"v3_v3_v3":153937,"v3_v3_v4":174374,"v3_v4_v2":166474,"v3_v4_v3":172214,"v3_v4_v4":155257,"v4_v2_v2":166250,"v4_v2_v3":166240,"v4_v2_v4":181888,"v4_v3_v2":149119,"v4_v3_v3":158316,"v4_v3_v4":160472,"v4_v4_v2":130679,"v4_v4_v3":137486,"v4_v4_v4":88564,"bytecode_size":15797},"status":"keep","description":"Precompute USER0 and USER1 delta slots as immutables to avoid keccak256+concat in _read_pm_delta for USDC/WBTC currencies. Saves ~30 gas per _read_pm_delta call on user currency paths.","timestamp":1781230598581,"segment":9,"confidence":108.08082348455966,"asi":{"hypothesis":"Precompute USER0_DELTA_SLOT and USER1_DELTA_SLOT in __init__ and use them in _read_pm_delta to avoid runtime keccak256 for USDC/WBTC currencies. These are common in V4 take paths.","gas_delta":-16,"bytecode_delta":60,"paths_improved":{"v4_v3_v4":-16},"notes":"Improvement is small (+16 gas total, +60 bytes). Mostly benefits V4V3V4 and V4V4V3 paths which call _read_pm_delta for USER0/USER1. Branch overhead on WETH/NATIVE paths is minimal. Keeping because no downside and production paths may benefit more."}}
