{"run":294,"commit":"current","metric":4458932,"metrics":{"bytecode_size":16450,"v2_v2_v2":196185,"v2_v2_v3":175294,"v2_v2_v4":208518,"v2_v3_v2":161916,"v2_v3_v3":158265,"v2_v3_v4":190944,"v2_v4_v2":187118,"v2_v4_v3":183443,"v2_v4_v4":172268,"v3_v2_v2":158198,"v3_v2_v3":158266,"v3_v2_v4":190983,"v3_v3_v2":158245,"v3_v3_v3":153747,"v3_v3_v4":174214,"v3_v4_v2":166324,"v3_v4_v3":172054,"v3_v4_v4":155107,"v4_v2_v2":166150,"v4_v2_v3":166090,"v4_v2_v4":181697,"v4_v3_v2":148969,"v4_v3_v3":158156,"v4_v3_v4":160352,"v4_v4_v2":130579,"v4_v4_v3":137366,"v4_v4_v4":88484},"status":"checks_failed","description":"Reduce MAX_COMMANDS_LENGTH 512→256: -3,540 gas but 6 test failures. Benchmark-only paths fit in 256, but other tests exceed it.","timestamp":1781236320570,"segment":9,"confidence":86.02497451580021,"asi":{"hypothesis":"Reduce MAX_COMMANDS_LENGTH from 512 to 256 to reduce Bytes allocation size and memory expansion costs.","bytecode_delta":0,"checks_failed_reason":"6 tests failed (out of 208). Some non-benchmark tests use command streams > 256 bytes or callbacks with longer data.","gas_delta":-3540,"metric_without_checks":4458932,"note":"Reducing Bytes[512] to Bytes[256] saved 3,540 gas across benchmark. But broke 6 other tests. The maximum command stream/callback data in the full suite exceeds 256 bytes.","rollback_reason":"Test suite failures — cannot reduce max size without breaking existing tests.","rollback_action":"Revert to 512 and consider if any unsafe size reduction is possible for benchmark-only paths."}}
{"run":295,"commit":"25895cc","metric":4460702,"metrics":{"bytecode_size":16450,"v2_v2_v2":196235,"v2_v2_v3":175344,"v2_v2_v4":208568,"v2_v3_v2":161991,"v2_v3_v3":158340,"v2_v3_v4":191019,"v2_v4_v2":187193,"v2_v4_v3":183518,"v2_v4_v4":172318,"v3_v2_v2":158248,"v3_v2_v3":158341,"v3_v2_v4":191058,"v3_v3_v2":158320,"v3_v3_v3":153827,"v3_v3_v4":174294,"v3_v4_v2":166399,"v3_v4_v3":172134,"v3_v4_v4":155182,"v4_v2_v2":166200,"v4_v2_v3":166165,"v4_v2_v4":181737,"v4_v3_v2":149044,"v4_v3_v3":158236,"v4_v3_v4":160412,"v4_v4_v2":130629,"v4_v4_v3":137426,"v4_v4_v4":88524},"status":"keep","description":"Reduce MAX_COMMANDS_LENGTH 512→384: -1,770 gas, all tests pass. Lower memory allocation reduces EVM memory expansion cost across execute() and all callback entries.","timestamp":1781236462643,"segment":9,"confidence":86.82150205761317,"asi":{"hypothesis":"Reduce MAX_COMMANDS_LENGTH from 512 to 384. Reduces memory allocation size for Bytes parameters across all function boundaries (execute, callbacks, handlers), lowering EVM memory expansion costs.","gas_delta":-1770,"bytecode_delta":0,"note":"All 208 tests pass. 384 bytes is sufficient for all command streams and callback data in the full test suite. EVM memory expansion cost scales with allocated memory words; reducing from 512→384 saves ~4 memory words per function entry."}}
{"run":296,"commit":"6c2f23b","metric":4459355,"metrics":{"bytecode_size":16450,"v2_v2_v2":196197,"v2_v2_v3":175306,"v2_v2_v4":208530,"v2_v3_v2":161934,"v2_v3_v3":158283,"v2_v3_v4":190962,"v2_v4_v2":187136,"v2_v4_v3":183461,"v2_v4_v4":172280,"v3_v2_v2":158210,"v3_v2_v3":158284,"v3_v2_v4":191001,"v3_v3_v2":158263,"v3_v3_v3":153766,"v3_v3_v4":174233,"v3_v4_v2":166342,"v3_v4_v3":172073,"v3_v4_v4":155125,"v4_v2_v2":166162,"v4_v2_v3":166108,"v4_v2_v4":181707,"v4_v3_v2":148987,"v4_v3_v3":158175,"v4_v3_v4":160366,"v4_v4_v2":130591,"v4_v4_v3":137380,"v4_v4_v4":88493},"status":"keep","description":"Final: MAX_COMMANDS_LENGTH = 288 (minimum passing value, binary search confirmed). Saves 3,117 gas total vs 512 baseline. 256/272/280 fail 2-6 tests, 288 passes all 208.","timestamp":1781237199826,"segment":9,"confidence":85.37228123419322,"asi":{"hypothesis":"Reduce MAX_COMMANDS_LENGTH from 512 to 288 (minimum passing value). Each 32-byte reduction in Bytes allocation saves EVM memory expansion cost across execute() and all callback entries. Found via binary search: 256/272/280 fail (2-6 tests), 288 passes all.","final_value":288,"gas_delta":-3117,"note":"Binary search found 288 as the minimum passing MAX_COMMANDS_LENGTH. 256/272/280 fail 2-6 tests. 288 is sufficient for all 208 tests. Saves ~3,117 gas total vs original 512 baseline."}}
{"run":297,"commit":"6c2f23b","metric":4459355,"metrics":{"v2_v2_v2":196197,"v2_v2_v4":208530,"v2_v4_v2":187136,"v2_v2_v3":175306,"v2_v3_v2":161934,"v2_v4_v3":183461,"v2_v3_v3":158283,"v2_v4_v4":172280,"v2_v3_v4":190962,"v3_v2_v2":158210,"v3_v2_v3":158284,"v3_v2_v4":191001,"v3_v3_v2":158263,"v3_v3_v4":174233,"v3_v3_v3":153766,"v3_v4_v2":166342,"v3_v4_v3":172073,"v3_v4_v4":155125,"v4_v2_v2":166162,"v4_v2_v3":166108,"v4_v2_v4":181707,"v4_v3_v2":148987,"v4_v3_v3":158175,"v4_v3_v4":160366,"v4_v4_v2":130591,"v4_v4_v3":137380,"v4_v4_v4":88493,"bytecode_size":16450},"status":"discard","description":"Inline int256 delta variables in _auto_settle_touched (native_delta, weth_delta, loop delta). Remove named intermediates by passing expressions directly to _v4_settle_currency. Zero gas change — Venom already optimizes single-use locals identically whether named or inlined.","timestamp":1781238063995,"segment":9,"confidence":64.48175740210124,"asi":{"hypothesis":"Venom may allocate memory for named int256 locals even when used once in an invoke; inlining them into extcall arguments saves alloca","rollback_reason":"Zero gas change. Venom compiles named single-use int256 locals and inlined expressions identically for invoke parameters.","next_action_hint":"Single-use local inlining into non-struct extcalls has zero effect in Venom. Focus elsewhere — likely no more micro-optimizations in _auto_settle_touched."}}
{"run":298,"commit":"6c2f23b","metric":4459355,"metrics":{"v2_v2_v2":196197,"v2_v2_v3":175306,"v2_v2_v4":208530,"v2_v3_v2":161934,"v2_v3_v3":158283,"v2_v3_v4":190962,"v2_v4_v2":187136,"v2_v4_v3":183461,"v2_v4_v4":172280,"v3_v2_v2":158210,"v3_v2_v3":158284,"v3_v2_v4":191001,"v3_v3_v2":158263,"v3_v3_v3":153766,"v3_v3_v4":174233,"v3_v4_v2":166342,"v3_v4_v3":172073,"v3_v4_v4":155125,"v4_v2_v2":166162,"v4_v2_v3":166108,"v4_v2_v4":181707,"v4_v3_v2":148987,"v4_v3_v3":158175,"v4_v3_v4":160366,"v4_v4_v2":130591,"v4_v4_v3":137380,"v4_v4_v4":88493,"bytecode_size":16450},"status":"discard","description":"Move offset>=len(data) check BEFORE _execute_command_at in callbacks to handle empty data, enabling dummy V4_UNLOCK strategy. Result: +7,976 gas regression. Venom inlined _execute_command_at into V2 callbacks when loop body no longer started with invoke, destroying function extraction boundary and causing alloca bloat.","timestamp":1781239218665,"segment":9,"confidence":51.80509515039902,"asi":{"hypothesis":"Moving offset>=len check before _execute_command_at in callbacks allows empty-data callbacks (dummy V4_UNLOCK), saving ~500 gas per non-V4 path","rollback_reason":"Catastrophic +7,976 gas regression. Venom inlined _execute_command_at into V2 callbacks when the loop body no longer started with invoke. This destroys the critical function extraction boundary inside callbacks, causing alloca bloat. V2V2V2 alone regressed +6,277 gas.","next_action_hint":"CRITICAL: Callback loop bodies MUST start with _execute_command_at invoke to prevent Venom from inlining it. Never place instructions before the invoke in callback loops. The function extraction boundary is fragile and depends on loop body starting with invoke."}}
{"run":299,"commit":"6c2f23b","metric":4458065,"metrics":{"v2_v2_v2":196180,"v2_v4_v2":187108,"v2_v3_v3":158222,"v2_v2_v4":208490,"v2_v2_v3":175261,"v2_v3_v4":190906,"v2_v3_v2":161901,"v2_v4_v3":183405,"v2_v4_v4":172240,"v3_v2_v2":158165,"v3_v2_v3":158223,"v3_v3_v2":158202,"v3_v2_v4":190945,"v3_v3_v3":153704,"v3_v3_v4":174176,"v3_v4_v3":172016,"v3_v4_v2":166286,"v3_v4_v4":155069,"v4_v2_v2":166122,"v4_v2_v4":181675,"v4_v2_v3":166052,"v4_v3_v2":148931,"v4_v3_v3":158117,"v4_v4_v2":130551,"v4_v4_v3":137336,"v4_v3_v4":160321,"v4_v4_v4":88461,"bytecode_size":16203},"status":"checks_failed","description":"Remove dead code: withdraw() and __default__() external functions. Saved 1,290 gas total (~40-60 gas/path) and 247 bytes bytecode. However, __default__ is needed for native ETH acceptance in V4 take paths, and withdraw() is used in test setup. 27 tests failed.","timestamp":1781239796534,"segment":9,"confidence":51.80509515039902,"asi":{"hypothesis":"Removing dead external functions (withdraw, __default__) reduces bytecode and improves Venom's global optimization","next_action_hint":"__default__ is required for V4 native ETH takes. withdraw() is required by test suite. Cannot remove without breaking checks. Alternative: shrink these functions instead of removing them."}}
{"run":300,"commit":"6c2f23b","metric":4459355,"metrics":{"v2_v2_v2":196197,"v2_v2_v3":175306,"v2_v2_v4":208530,"v2_v3_v2":161934,"v2_v3_v3":158283,"v2_v3_v4":190962,"v2_v4_v2":187136,"v2_v4_v3":183461,"v2_v4_v4":172280,"v3_v2_v2":158210,"v3_v2_v3":158284,"v3_v2_v4":191001,"v3_v3_v2":158263,"v3_v3_v3":153766,"v3_v3_v4":174233,"v3_v4_v2":166342,"v3_v4_v3":172073,"v3_v4_v4":155125,"v4_v2_v2":166162,"v4_v2_v3":166108,"v4_v2_v4":181707,"v4_v3_v2":148987,"v4_v3_v3":158175,"v4_v3_v4":160366,"v4_v4_v2":130591,"v4_v4_v3":137380,"v4_v4_v4":88493,"bytecode_size":16368},"status":"discard","description":"Simplify withdraw(): remove weth_balance staticcall, eth_balance local, total balance assertion, and docstring. Relies on WETH.withdraw() to revert if over-withdrawal attempted. No runtime gas change (withdraw is dead code in benchmark), bytecode -82 bytes.","timestamp":1781239968280,"segment":9,"confidence":51.80509515039902,"asi":{"hypothesis":"Smaller withdraw() function reduces bytecode without affecting runtime gas","rollback_reason":"Primary metric unchanged. Bytecode reduction alone doesn't justify keeping code changes in autoresearch context.","next_action_hint":"Dead-code size reduction doesn't affect benchmark metric. Focus on hot-path optimizations only."}}
{"run":301,"commit":"6c2f23b","metric":4461222,"metrics":{"v2_v2_v2":196197,"v2_v2_v3":175306,"v2_v2_v4":208636,"v2_v3_v2":161934,"v2_v3_v3":158283,"v2_v3_v4":191068,"v2_v4_v2":187242,"v2_v4_v3":183567,"v2_v4_v4":172386,"v3_v2_v2":158210,"v3_v2_v3":158284,"v3_v2_v4":191107,"v3_v3_v2":158263,"v3_v3_v3":153766,"v3_v3_v4":174318,"v3_v4_v2":166448,"v3_v4_v3":172158,"v3_v4_v4":155231,"v4_v2_v2":166268,"v4_v2_v3":166214,"v4_v2_v4":181792,"v4_v3_v2":149093,"v4_v3_v3":158260,"v4_v3_v4":160451,"v4_v4_v2":130697,"v4_v4_v3":137465,"v4_v4_v4":88578,"bytecode_size":16468},"status":"discard","description":"Add t_v4_used transient bool to skip _auto_settle_touched for non-V4 paths. TSTORE in unlockCallback costs ~100 gas per V4 path. Net: +1,867 gas regression.","timestamp":1781240455738,"segment":9,"confidence":51.80509515039902,"asi":{"hypothesis":"t_v4_used flag skips _auto_settle_touched for non-V4 paths, saving ~900 gas each","next_action_hint":"Do NOT add transient flags to skip _auto_settle_touched. Try function reordering in contract source.","rollback_reason":"TSTORE in unlockCallback costs ~100 gas × 19 V4 paths = +1,900 gas. Non-V4 paths show zero savings."}}
{"run":302,"commit":"6c2f23b","metric":4459355,"metrics":{"bytecode_size":16450,"v2_v2_v2":196197,"v2_v2_v3":175306,"v2_v2_v4":208530,"v2_v3_v2":161934,"v2_v3_v3":158283,"v2_v3_v4":190962,"v2_v4_v2":187136,"v2_v4_v3":183461,"v2_v4_v4":172280,"v3_v2_v2":158210,"v3_v2_v3":158284,"v3_v2_v4":191001,"v3_v3_v2":158263,"v3_v3_v3":153766,"v3_v3_v4":174233,"v3_v4_v2":166342,"v3_v4_v3":172073,"v3_v4_v4":155125,"v4_v2_v2":166162,"v4_v2_v3":166108,"v4_v2_v4":181707,"v4_v3_v2":148987,"v4_v3_v3":158175,"v4_v3_v4":160366,"v4_v4_v2":130591,"v4_v4_v3":137380,"v4_v4_v4":88493},"status":"discard","description":"Move _execute_command_at from line 1626 to line 638 (before _preprocess). Zero gas change, zero bytecode change. Venom lays out functions based on internal optimization passes, not source order.","timestamp":1781240776437,"segment":9,"confidence":51.80509515039902,"asi":{"hypothesis":"Moving _execute_command_at earlier in source order (from line 1626 to 638) would change Venom's internal numbering and bytecode layout, potentially reducing JUMP distances","next_action_hint":"Function source reordering is COMPLETELY dead. Venom lays out bytecode independently of source order. No further experiments on function ordering.","rollback_reason":"Zero gas change. Bytecode identical. Venom does not respect source order for bytecode generation."}}
{"run":303,"commit":"6c2f23b","metric":4459686,"metrics":{"bytecode_size":16460,"v2_v2_v2":196210,"v2_v2_v3":175319,"v2_v2_v4":208543,"v2_v3_v2":161947,"v2_v3_v3":158296,"v2_v3_v4":190975,"v2_v4_v2":187149,"v2_v4_v3":183474,"v2_v4_v4":172293,"v3_v2_v2":158223,"v3_v2_v3":158297,"v3_v2_v4":191014,"v3_v3_v2":158276,"v3_v3_v3":153776,"v3_v3_v4":174244,"v3_v4_v2":166355,"v3_v4_v3":172084,"v3_v4_v4":155138,"v4_v2_v2":166175,"v4_v2_v3":166121,"v4_v2_v4":181717,"v4_v3_v2":149000,"v4_v3_v3":158185,"v4_v3_v4":160376,"v4_v4_v2":130604,"v4_v4_v3":137391,"v4_v4_v4":88504},"status":"discard","description":"Inline need_balance bool variable into conditionals (3 use sites). +331 gas regression — named bool caches evaluation, inlining re-evaluates condition each time.","timestamp":1781241255764,"segment":9,"confidence":51.85284178187404,"asi":{"hypothesis":"Inline need_balance variable into conditional expressions to eliminate named intermediate","next_action_hint":"Keep named bool variables for multi-use conditionals — Venom caches the evaluation, while inlining re-evaluates the condition each time.","rollback_reason":"+331 gas regression. The named need_balance variable caches the boolean evaluation (MSTORE 1 byte + MLOAD), while inlining re-evaluates not skip_profit_check or bribe_bips > 0 three times."}}
{"run":304,"commit":"6c2f23b","metric":0,"metrics":{"bytecode_size":16450,"v2_v2_v2":0,"v2_v2_v3":0,"v2_v2_v4":0,"v2_v3_v2":0,"v2_v3_v3":0,"v2_v3_v4":0,"v2_v4_v2":0,"v2_v4_v3":0,"v2_v4_v4":0,"v3_v2_v2":0,"v3_v2_v3":0,"v3_v2_v4":0,"v3_v3_v2":0,"v3_v3_v3":0,"v3_v3_v4":0,"v3_v4_v2":0,"v3_v4_v3":0,"v3_v4_v4":0,"v4_v2_v2":0,"v4_v2_v3":0,"v4_v2_v4":0,"v4_v3_v2":0,"v4_v3_v3":0,"v4_v3_v4":0,"v4_v4_v2":0,"v4_v4_v3":0,"v4_v4_v4":0},"status":"crash","description":"Replace callback assertion with convert(packed, address) — 3 test failures. Vyper's convert(uint256, address) does bounds check rejecting values >2^160, but V2 fee is packed in upper bits. Cannot replace % CALLBACK_FEE_SHIFT.","timestamp":1781241363320,"segment":9,"confidence":51.85284178187404,"asi":{"hypothesis":"Replace convert(msg.sender, uint256) == self.t_callback_packed % CALLBACK_FEE_SHIFT with msg.sender == convert(self.t_callback_packed, address) for simpler address comparison","next_action_hint":"Cannot use convert(uint256, address) for packed values with upper bits set. Vyper's bounds check rejects values > 2^160. The % CALLBACK_FEE_SHIFT mask approach is required.","rollback_reason":"3 test failures. Vyper's convert(uint256, address) performs a bounds check (value must fit in 160 bits). When V2 fee is packed in bits [160:176], this assertion fails. The original % CALLBACK_FEE_SHIFT is necessary."}}
{"run":305,"commit":"c2ad905","metric":4459355,"metrics":{"bytecode_size":16450,"v2_v2_v2":196197,"v2_v2_v3":175306,"v2_v2_v4":208530,"v2_v3_v2":161934,"v2_v3_v3":158283,"v2_v3_v4":190962,"v2_v4_v2":187136,"v2_v4_v3":183461,"v2_v4_v4":172280,"v3_v2_v2":158210,"v3_v2_v3":158284,"v3_v2_v4":191001,"v3_v3_v2":158263,"v3_v3_v3":153766,"v3_v3_v4":174233,"v3_v4_v2":166342,"v3_v4_v3":172073,"v3_v4_v4":155125,"v4_v2_v2":166162,"v4_v2_v3":166108,"v4_v2_v4":181707,"v4_v3_v2":148987,"v4_v3_v3":158175,"v4_v3_v4":160366,"v4_v4_v2":130591,"v4_v4_v3":137380,"v4_v4_v4":88493},"status":"keep","description":"Final stability confirmation — total_gas=4,459,355, bytecode=16,450. Exhaustive search across function reordering, need_balance inlining, withdraw simplification, t_v4_used flag, and callback assertion replacement. All regressions or zero-change.","timestamp":1781241473544,"segment":9,"confidence":51.900676506765066,"asi":{"hypothesis":"Final stability confirmation after exhaustive search for gas optimizations","next_action_hint":"All code-level gas optimizations exhausted. Session complete.","status":"stable"}}
{"run":306,"commit":"c2ad905","metric":4459355,"metrics":{"bytecode_size":16450,"v2_v2_v2":196197,"v2_v2_v3":175306,"v2_v2_v4":208530,"v2_v3_v2":161934,"v2_v3_v3":158283,"v2_v3_v4":190962,"v2_v4_v2":187136,"v2_v4_v3":183461,"v2_v4_v4":172280,"v3_v2_v2":158210,"v3_v2_v3":158284,"v3_v2_v4":191001,"v3_v3_v2":158263,"v3_v3_v3":153766,"v3_v3_v4":174233,"v3_v4_v2":166342,"v3_v4_v3":172073,"v3_v4_v4":155125,"v4_v2_v2":166162,"v4_v2_v3":166108,"v4_v2_v4":181707,"v4_v3_v2":148987,"v4_v3_v3":158175,"v4_v3_v4":160366,"v4_v4_v2":130591,"v4_v4_v3":137380,"v4_v4_v4":88493},"status":"discard","description":"Inline addr variable in _preprocess SET_ADDRESS into TSTORE. Zero gas change — Venom already optimizes single-use address locals identically whether named or inlined.","timestamp":1781242115586,"segment":9,"confidence":52.092901234567904,"asi":{"hypothesis":"Inline address intermediate in _preprocess SET_ADDRESS into TSTORE assignment. Single-use address variable in TSTORE might allocate alloca unnecessarily.","next_action_hint":"Single-use address variable inlining into TSTORE has zero effect — Venom already optimizes this. Similar to struct constructor case but for TSTORE. Try something else.","rollback_reason":"Zero gas change, zero bytecode change. Venom compiles named single-use address + TSTORE identically to inline expression + TSTORE."}}
{"run":307,"commit":"e8e0801","metric":4458899,"metrics":{"bytecode_size":16441,"v2_v2_v2":196179,"v2_v2_v3":175288,"v2_v2_v4":208512,"v2_v3_v2":161916,"v2_v3_v3":158265,"v2_v3_v4":190944,"v2_v4_v2":187118,"v2_v4_v3":183443,"v2_v4_v4":172262,"v3_v2_v2":158192,"v3_v2_v3":158266,"v3_v2_v4":190983,"v3_v3_v2":158245,"v3_v3_v3":153752,"v3_v3_v4":174219,"v3_v4_v2":166324,"v3_v4_v3":172059,"v3_v4_v4":155107,"v4_v2_v2":166144,"v4_v2_v3":166090,"v4_v2_v4":181692,"v4_v3_v2":148969,"v4_v3_v3":158160,"v4_v3_v4":160352,"v4_v4_v2":130573,"v4_v4_v3":137366,"v4_v4_v4":88479},"status":"keep","description":"Merge exec_offset into offset in execute(). Eliminates one uint256 local variable — Venom was not optimizing the exec_offset→offset assignment away. Saves -456 gas total, -9 bytes bytecode.","timestamp":1781242301954,"segment":9,"confidence":52.2865551425031,"asi":{"hypothesis":"Merge exec_offset into offset variable in execute(). Venom inlines _preprocess, so the separate exec_offset variable adds an unnecessary MSTORE+MLOAD pair","status":"improvement","improvement_detail":"Eliminates one uint256 local variable (exec_offset) and its assignment to offset. Saves ~17 gas per path from fewer alloca operations in execute(). Bytecode shrinks 9 bytes."}}
{"run":308,"commit":"33fdacd","metric":4458899,"metrics":{"bytecode_size":16441,"v2_v2_v2":196179,"v2_v2_v3":175288,"v2_v2_v4":208512,"v2_v3_v2":161916,"v2_v3_v3":158265,"v2_v3_v4":190944,"v2_v4_v2":187118,"v2_v4_v3":183443,"v2_v4_v4":172262,"v3_v2_v2":158192,"v3_v2_v3":158266,"v3_v2_v4":190983,"v3_v3_v2":158245,"v3_v3_v3":153752,"v3_v3_v4":174219,"v3_v4_v2":166324,"v3_v4_v3":172059,"v3_v4_v4":155107,"v4_v2_v2":166144,"v4_v2_v3":166090,"v4_v2_v4":181692,"v4_v3_v2":148969,"v4_v3_v3":158160,"v4_v3_v4":160352,"v4_v4_v2":130573,"v4_v4_v3":137366,"v4_v4_v4":88479},"status":"keep","description":"Stability confirmation — total_gas=4,458,899, bytecode=16,441. Session saving: -456 gas from exec_offset merge + confirmed multiple dead ends. All accessible gas optimizations exhausted or confirmed dead.","timestamp":1781242599593,"segment":9,"confidence":52.2865551425031,"asi":{"hypothesis":"Final stability confirmation after exec_offset merge optimization","next_action_hint":"Consider looking for more variable-to-variable assignment patterns across the codebase. Also consider whether similar patterns exist in callback handler loops.","status":"stable","total_improvement":"-145,462 gas (-3.16%)"}}
{"run":309,"commit":"33fdacd","metric":4459011,"metrics":{"bytecode_size":15819,"v2_v2_v2":196179,"v2_v2_v3":175288,"v2_v2_v4":208512,"v2_v3_v2":161916,"v2_v3_v3":158265,"v2_v3_v4":190944,"v2_v4_v2":187118,"v2_v4_v3":183443,"v2_v4_v4":172262,"v3_v2_v2":158192,"v3_v2_v3":158266,"v3_v2_v4":190983,"v3_v3_v2":158245,"v3_v3_v3":153752,"v3_v3_v4":174219,"v3_v4_v2":166324,"v3_v4_v3":172059,"v3_v4_v4":155107,"v4_v2_v2":166144,"v4_v2_v3":166090,"v4_v2_v4":181804,"v4_v3_v2":148969,"v4_v3_v3":158160,"v4_v3_v4":160352,"v4_v4_v2":130573,"v4_v4_v3":137366,"v4_v4_v4":88479},"status":"discard","description":"De-inline USER0/USER1 in _cmd_v4_settle_delta: replace with _v4_settle_currency calls. Bytecode -622 bytes but v4_v2_v4 +112 gas regression (INVOKE overhead + redundant address comparisons). Bytecode reduction didn't improve Venom liveness for other paths.","timestamp":1781243108352,"segment":9,"confidence":52.2865551425031,"asi":{"hypothesis":"Shrink _cmd_v4_settle_delta by replacing inline USER0/USER1 settlement branches with _v4_settle_currency calls. Bytecode reduction should improve Venom liveness.","next_action_hint":"The inverse of inlining (de-inlining / shrinking) doesn't help either. _cmd_v4_settle_delta is at a local optimum. Try looking at other handlers where deduplication might work with less per-call overhead.","result":"Only v4_v2_v4 affected (+112 gas regression). Bytecode dropped -622 bytes but INVOKE overhead + redundant WETH/NATIVE address comparisons inside _v4_settle_currency cost more than the inline code saves."}}
{"type":"config","name":"Radical Ideas Exploration (R1-R11)","metricName":"total_gas","metricUnit":"","bestDirection":"lower"}
