{"run":194,"commit":"0122653","metric":4342694,"metrics":{"v2_v4_v2":190454,"v2_v3_v3":144888,"v2_v2_v2":181844,"v2_v2_v4":189181,"v2_v4_v3":169545,"v2_v3_v2":164795,"v2_v3_v4":176812,"v2_v2_v3":160911,"v2_v4_v4":152950,"v3_v2_v2":160818,"v3_v2_v4":171711,"v3_v2_v3":144852,"v3_v3_v2":144843,"v3_v3_v4":162787,"v3_v3_v3":142102,"v3_v4_v2":169455,"v3_v4_v3":161024,"v3_v4_v4":141666,"v4_v2_v4":170139,"v4_v3_v2":168684,"v4_v2_v3":168746,"v4_v2_v2":185685,"v4_v4_v2":150065,"v4_v4_v3":160234,"v4_v3_v4":155671,"v4_v4_v4":92240,"v4_v3_v3":160592,"bytecode_size":20052},"status":"discard","description":"Mint vs take investigation complete — NOT gas advantageous (+8,136 gas more expensive)","timestamp":1781147688301,"segment":5,"confidence":null,"asi":{"conclusion":"MINT IS NOT gas advantageous for capturing profits in the PoolManager. Empirically measured +8,136 gas MORE expensive than take for V4→V4→V4 WETH profit capture (take=92,240 vs mint=100,376). Root cause: fake PM's erc6909_balance_of uses double HashMap (2 keccak256s per access) vs WETH.balanceOf single HashMap (1 keccak256). Additionally: (1) Mint produces IERC6909Claims.Transfer events instead of ERC20 Transfer events, breaking transfer count assertions in benchmarks. (2) Only saves gas in compounding scenarios (warm erc6909 slot from prior mint) — not applicable to single-tx arbitrage. (3) Tokens captured as ERC6909 can't be used for V2/V3 operations without burn+take, negating savings. The investigation is COMPLETE and the answer is DEFINITIVE: mint is NOT advantageous for the benchmark optimization target.","empirical_gas":{"take_v4v4v4":92240,"mint_v4v4v4":100376,"difference":"+8136 gas (+8.8%)"},"experiment_1":"Changed _v4_settle_currency positive delta from take→mint: 2 tests failed (transfer count mismatch), 25 passed","experiment_2":"Changed _cmd_v4_take_compact to mint when recipient==self: V4V4V4 test failed (transfer count mismatch)","experiment_3":"Direct comparison using existing V4_MINT_COMPACT vs V4_TAKE_COMPACT commands: mint=100,376 vs take=92,240 (+8,136 gas)","hypothesis":"Investigate whether capturing profits in the PoolManager with ERC-6909 mint instead of take is gas advantageous","reasons_mint_loses":["Double HashMap storage access (2 keccak256s) vs single HashMap (1 keccak256)","IERC6909Claims.Transfer LOG has 4 topics vs ERC20 Transfer's 3 topics","Amount > 0 assertion in mint()","Mint produces different event signature, breaking test assertions"]}}
{"run":195,"commit":"089ba95","metric":4342223,"metrics":{"v2_v4_v2":190265,"v2_v2_v2":181841,"v2_v3_v3":144931,"v2_v2_v4":189134,"v2_v2_v3":161028,"v2_v4_v3":169476,"v2_v3_v4":176640,"v2_v3_v2":164728,"v2_v4_v4":152954,"v3_v2_v2":160935,"v3_v2_v4":171669,"v3_v2_v3":144894,"v3_v3_v3":142112,"v3_v3_v2":144885,"v3_v4_v2":169386,"v3_v4_v3":160918,"v3_v3_v4":162702,"v3_v4_v4":141618,"v4_v2_v2":185768,"v4_v2_v4":170139,"v4_v2_v3":168765,"v4_v3_v4":155571,"v4_v3_v3":160485,"v4_v3_v2":168703,"v4_v4_v2":150130,"v4_v4_v4":92330,"v4_v4_v3":160216,"bytecode_size":19275},"status":"keep","description":"Two-level dispatch (SHR 4 high nibble) reduces avg comparison count by ~1.5 per command, saving -471 gas with -777 bytes bytecode","timestamp":1781148647124,"segment":5,"confidence":null,"asi":{"bytecode_delta":"-777 bytes (20052->19275)","hypothesis":"Two-level dispatch using command >> 4 (SHR) to compute high nibble reduces average comparison count. The high nibble group check (1 comparison) replaces multiple EQ checks for opcodes in the same group, especially benefiting V4_UNLOCK (5->3 comparisons), V4_SYNC (7->4), V4_SETTLE (8->5), ERC20_TRANSFER (6->5).","total_gas_delta":"-471","technique":"command_hi = command >> 4 produces the high nibble (5 for 0x50+, 4 for 0x40+, etc.). The dispatch first matches the group, then matches within the group. This reduces the number of EQ comparisons for most commands, especially the frequently-dispatched V4 settlement group."}}
{"run":196,"commit":"e95e15d","metric":4245656,"metrics":{"v2_v2_v2":181876,"v2_v2_v3":161063,"v2_v2_v4":193969,"v2_v3_v2":164763,"v2_v3_v3":144959,"v2_v3_v4":181475,"v2_v4_v2":190300,"v2_v4_v3":169511,"v2_v4_v4":157777,"v3_v2_v2":160970,"v3_v2_v3":144922,"v3_v2_v4":176504,"v3_v3_v2":144913,"v3_v3_v3":142140,"v3_v3_v4":162730,"v3_v4_v2":169421,"v3_v4_v3":160946,"v3_v4_v4":141636,"v4_v2_v2":168703,"v4_v2_v3":151700,"v4_v2_v4":170157,"v4_v3_v2":151638,"v4_v3_v3":146833,"v4_v3_v4":155589,"v4_v4_v2":133053,"v4_v4_v3":125760,"v4_v4_v4":92348,"bytecode_size":19437},"status":"keep","description":"V4V4V3: Take WBTC directly to V3c in callback instead of executor intermediate custody — -20,795 gas by eliminating 1 WBTC.transfer() + 1 ERC20_XFER command dispatch","timestamp":1781154845991,"segment":5,"confidence":null,"asi":{"hypothesis":"Move V4_TAKE WBTC into V3 callback forward_data, taking directly to V3c instead of executor intermediate custody. This eliminates 1 WBTC.transfer() call and 1 ERC20_XFER command dispatch.","key_insight":"V3 pools verify payment via balance DELTA (IIA check). V4_TAKE(WBTC→V3c) during V3 callback increases V3c's WBTC balance, satisfying the IIA check. This works because the take happens INSIDE the callback, after balance_before is snapped.","v4v4v3_savings":"-20795 gas (146555→125760)","transfer_count_change":"4→3 because PM→executor→V3c (2 transfers) becomes PM→V3c (1 transfer)","test_change_required":"Updated expected_transfers from 4 to 3 in TestV4V4V3","broader_applicability":"V4V4V3 was the ONLY path with intermediate executor custody for routing tokens. All other paths already take directly to the destination pool."}}
{"run":197,"commit":"3da78db","metric":4245519,"metrics":{"bytecode_size":19437,"v2_v2_v2":181876,"v2_v2_v3":161063,"v2_v2_v4":193969,"v2_v3_v2":164763,"v2_v3_v3":144959,"v2_v3_v4":181475,"v2_v4_v2":190300,"v2_v4_v3":169511,"v2_v4_v4":157777,"v3_v2_v2":160970,"v3_v2_v3":144922,"v3_v2_v4":176504,"v3_v3_v2":144913,"v3_v3_v3":142140,"v3_v3_v4":162730,"v3_v4_v2":169421,"v3_v4_v3":160946,"v3_v4_v4":141636,"v4_v2_v2":168703,"v4_v2_v3":151700,"v4_v2_v4":170157,"v4_v3_v2":151638,"v4_v3_v3":146696,"v4_v3_v4":155589,"v4_v4_v2":133053,"v4_v4_v3":125760,"v4_v4_v4":92348},"status":"keep","description":"V4V3V3: Replace V4_SYNC+ERC20_TRANSFER+V4_SETTLE with V4_SETTLE_DELTA WETH — -137 gas","timestamp":1781155020224,"segment":5,"confidence":412.63269639065817,"asi":{"hypothesis":"Replace V4_SYNC + ERC20_TRANSFER + V4_SETTLE with V4_SETTLE_DELTA for WETH settlement in V4V3V3 path. Eliminates 2 command dispatches and 36 bytes of calldata.","key_insight":"V4_SETTLE_DELTA reads the delta from PM exttload and auto-settles (sync+transfer+settle). When the executor already has WETH in balance, the settle logic works identically to the explicit approach.","v4v3v3_savings":"-137 gas (146833→146696)","transfer_count_unchanged":true}}
{"run":198,"commit":"bd3ecf0","metric":4239941,"metrics":{"v2_v2_v2":181876,"v2_v2_v3":161063,"v2_v2_v4":193969,"v2_v3_v2":164763,"v2_v3_v3":144959,"v2_v3_v4":181475,"v2_v4_v2":190300,"v2_v4_v3":169511,"v2_v4_v4":157777,"v3_v2_v2":160970,"v3_v2_v3":144922,"v3_v2_v4":176504,"v3_v3_v2":144913,"v3_v3_v3":142140,"v3_v3_v4":162730,"v3_v4_v2":169421,"v3_v4_v3":160946,"v3_v4_v4":141767,"v4_v2_v2":168703,"v4_v2_v3":151700,"v4_v2_v4":170157,"v4_v3_v2":151638,"v4_v3_v3":146696,"v4_v3_v4":155589,"v4_v4_v2":133053,"v4_v4_v3":125760,"v4_v4_v4":86639,"bytecode_size":19437},"status":"keep","description":"V4_MINT for profit capture: V4V4V4 -5,709 gas (92348→86639). V3V4V4 +131 regression. Updated count_transfers to also count ERC6909 Transfer events.","timestamp":1781155671400,"segment":5,"confidence":218.15923566878982,"asi":{"hypothesis":"Use V4_MINT_COMPACT instead of V4_TAKE_COMPACT for WETH profit capture in V4V4V4 and V3V4V4. With warm ERC6909 slot (from initialize()), mint avoids the external WETH.transfer() call.","key_insight":"V4_MINT for profit capture saves -5,709 gas for V4V4V4. V3V4V4 has +131 gas regression. V2V4V4 CANNOT use V4_MINT — V4_TAKE to V2a consumes all WETH delta.","v4v4v4_savings":"-5709 gas","v3v4v4_regression":"+131 gas","total_savings":"-5578 gas net"}}
{"run":199,"commit":"d19fbd5","metric":4239810,"metrics":{"bytecode_size":19437,"v2_v2_v2":181876,"v2_v2_v3":161063,"v2_v2_v4":193969,"v2_v3_v2":164763,"v2_v3_v3":144959,"v2_v3_v4":181475,"v2_v4_v2":190300,"v2_v4_v3":169511,"v2_v4_v4":157777,"v3_v2_v2":160970,"v3_v2_v3":144922,"v3_v2_v4":176504,"v3_v3_v2":144913,"v3_v3_v3":142140,"v3_v3_v4":162730,"v3_v4_v2":169421,"v3_v4_v3":160946,"v3_v4_v4":141636,"v4_v2_v2":168703,"v4_v2_v3":151700,"v4_v2_v4":170157,"v4_v3_v2":151638,"v4_v3_v3":146696,"v4_v3_v4":155589,"v4_v4_v2":133053,"v4_v4_v3":125760,"v4_v4_v4":86639},"status":"keep","description":"Revert V3V4V4 mint regression — keep V4V4V4 mint only. Net: -5,709 gas from V4_MINT for V4V4V4 profit capture.","timestamp":1781155801197,"segment":5,"confidence":2.1102462336809937,"asi":{"hypothesis":"Revert V3V4V4 mint regression. Keep V4V4V4 mint profit capture only (+131 gas regression on V3V4V4 was not worth it).","key_insight":"V4_MINT for profit works for V4V4V4 (pure delta netting inside 1 unlock) but regresses for V3V4V4 (+131 gas) likely due to V3 callback context affecting ERC6909 storage slot efficiency","v4v4v4_mint_savings":"-5709 gas","v3v4v4_reverted":"V4_TAKE restored for V3V4V4 (mint was +131 gas regression)","net_improvement":"-5709 gas from V4V4V4 mint only"}}
{"run":200,"commit":"c1f8c2c","metric":4239785,"metrics":{"bytecode_size":19601,"v2_v2_v2":181876,"v2_v2_v3":161063,"v2_v2_v4":193969,"v2_v3_v2":164763,"v2_v3_v3":144959,"v2_v3_v4":181475,"v2_v4_v2":190300,"v2_v4_v3":169511,"v2_v4_v4":157777,"v3_v2_v2":160970,"v3_v2_v3":144922,"v3_v2_v4":176504,"v3_v3_v2":144913,"v3_v3_v3":142140,"v3_v3_v4":162730,"v3_v4_v2":169421,"v3_v4_v3":160946,"v3_v4_v4":141636,"v4_v2_v2":168703,"v4_v2_v3":151700,"v4_v2_v4":170157,"v4_v3_v2":151638,"v4_v3_v3":146696,"v4_v3_v4":155589,"v4_v4_v2":133053,"v4_v4_v3":125760,"v4_v4_v4":86614},"status":"keep","description":"Inline _lookup_address in V4_MINT_COMPACT — -25 gas on V4V4V4 (86639→86614). Only this handler benefits; mass inlining of other handlers regresses +134 gas.","timestamp":1781156500115,"segment":5,"confidence":17.528359734287175,"asi":{"broader_inlining_is_harmful":"Mass inlining of _lookup_address in all handlers caused +134 gas regression + 1,360 bytes bytecode bloat. Venom already optimizes these calls.","bytecode_cost":"+164 bytes for single handler inline","hypothesis":"Inline _lookup_address in V4_MINT_COMPACT saves ~25 gas from function call overhead elimination on the V4V4V4 path","key_insight":"V4_MINT_COMPACT inline saves INVOKE overhead that Venom does NOT optimize away for this specific handler. Other handlers should NOT be inlined — Venom already optimizes their _lookup_address calls and manual inlining hurts its optimization heuristics.","v4v4v4_savings":"-25 gas from V4_MINT_COMPACT inline only"}}
{"run":201,"commit":"7dcdbd1","metric":4239785,"metrics":{"bytecode_size":19580,"v2_v2_v2":181876,"v2_v2_v3":161063,"v2_v2_v4":193969,"v2_v3_v2":164763,"v2_v3_v3":144959,"v2_v3_v4":181475,"v2_v4_v2":190300,"v2_v4_v3":169511,"v2_v4_v4":157777,"v3_v2_v2":160970,"v3_v2_v3":144922,"v3_v2_v4":176504,"v3_v3_v2":144913,"v3_v3_v3":142140,"v3_v3_v4":162730,"v3_v4_v2":169421,"v3_v4_v3":160946,"v3_v4_v4":141636,"v4_v2_v2":168703,"v4_v2_v3":151700,"v4_v2_v4":170157,"v4_v3_v2":151638,"v4_v3_v3":146696,"v4_v3_v4":155589,"v4_v4_v2":133053,"v4_v4_v3":125760,"v4_v4_v4":86614},"status":"keep","description":"Merge SEND_ETH slice reads (1+16→17 byte) — no gas change (not in benchmarks), -21 bytes bytecode","timestamp":1781156996310,"segment":5,"confidence":17.735286514433433,"asi":{"bytecode_savings":"-21 bytes from merged slice read in SEND_ETH","gas_savings":"0 gas (SEND_ETH not used in benchmark paths)","hypothesis":"Merge 1+16 byte reads into single 17-byte slice read in SEND_ETH handler to save 1 bounds check per call"}}
{"run":202,"commit":"7dcdbd1","metric":4239917,"metrics":{"bytecode_size":19580,"v2_v2_v2":181876,"v2_v2_v3":161063,"v2_v2_v4":193969,"v2_v3_v2":164763,"v2_v3_v3":144959,"v2_v3_v4":181607,"v2_v4_v2":190300,"v2_v4_v3":169511,"v2_v4_v4":157777,"v3_v2_v2":160970,"v3_v2_v3":144922,"v3_v2_v4":176504,"v3_v3_v2":144913,"v3_v3_v3":142140,"v3_v3_v4":162730,"v3_v4_v2":169421,"v3_v4_v3":160946,"v3_v4_v4":141636,"v4_v2_v2":168703,"v4_v2_v3":151700,"v4_v2_v4":170157,"v4_v3_v2":151638,"v4_v3_v3":146696,"v4_v3_v4":155589,"v4_v4_v2":133053,"v4_v4_v3":125760,"v4_v4_v4":86614},"status":"discard","description":"V2V3V4 V4_MINT regression: +132 gas (same as V3V4V4). V4_MINT only saves gas in pure V4V4V4.","timestamp":1781157192334,"segment":5,"confidence":17.94715730728985,"asi":{"hypothesis":"V4_MINT for profit capture in V2V3V4 path (V3 callback context)","key_insight":"V4_MINT inside V3 callback regresses +132 gas, same as V3V4V4 (+131). Only V4V4V4 benefits from V4_MINT.","pattern":"V4_MINT inside any V2/V3 callback regresses ~130 gas","v2v3v4_regression":"+132 gas"}}
{"run":203,"commit":"7dcdbd1","metric":4241974,"metrics":{"bytecode_size":19673,"v2_v2_v2":181876,"v2_v2_v3":161155,"v2_v2_v4":193969,"v2_v3_v2":164855,"v2_v3_v3":145106,"v2_v3_v4":181567,"v2_v4_v2":190300,"v2_v4_v3":169603,"v2_v4_v4":157777,"v3_v2_v2":161062,"v3_v2_v3":145069,"v3_v2_v4":176596,"v3_v3_v2":145060,"v3_v3_v3":142384,"v3_v3_v4":162877,"v3_v4_v2":169513,"v3_v4_v3":161093,"v3_v4_v4":141724,"v4_v2_v2":168703,"v4_v2_v3":151792,"v4_v2_v4":170157,"v4_v3_v2":151730,"v4_v3_v3":146843,"v4_v3_v4":155663,"v4_v4_v2":133053,"v4_v4_v3":125833,"v4_v4_v4":86614},"status":"discard","description":"V3 t_callback_packed elimination via forward_data pool_idx prefix: REGRESSED +2,189 gas. Extra byte in V3 swap extcall forward_data costs ~147 gas/call in memory+ABI overhead, exceeding 100 gas TSTORE savings.","timestamp":1781158023145,"segment":5,"confidence":26.05950873638896,"asi":{"hypothesis":"Eliminate t_callback_packed TSTORE for V3 swaps by passing pool_idx as first byte of forward_data","key_insight":"REGRESSED +2,189 gas. The extra byte in V3 forward_data prefix (+1 byte per V3 swap call) costs more in calldata encoding + memory than the 100 gas TSTORE savings. The V3 pool.swap() extcall includes forward_data as ABI-encoded bytes — adding even 1 byte costs ~147 gas (memory expansion + ABI encoding) in the external call, far exceeding the TSTORE savings of 100 gas.","per_path_regression":"V3 paths regressed +74 to +244 gas each. V3V3V3 had worst regression at +244 (3 V3 swaps × ~80 gas overhead each)","calldata_cost_analysis":"1 extra byte of forward_data in V3 swap extcall ≈ 147 gas overhead. This exceeds the 100 gas TSTORE savings.","conclusion":"t_callback_packed TSTORE (100 gas) is CHEAPER than adding bytes to V3 swap extcall forward_data. The memory/ABI encoding overhead of extcall dominates.","rollback_reason":"All V3 paths regressed. Forward_data prefix approach costs more than TSTORE savings.","next_action_hint":"Revert all changes and try a different approach"}}
{"run":204,"commit":"855679c","metric":4239211,"metrics":{"bytecode_size":19531,"v2_v2_v2":181876,"v2_v2_v3":161063,"v2_v2_v4":193953,"v2_v3_v2":164763,"v2_v3_v3":144959,"v2_v3_v4":181459,"v2_v4_v2":190284,"v2_v4_v3":169495,"v2_v4_v4":157745,"v3_v2_v2":160970,"v3_v2_v3":144922,"v3_v2_v4":176488,"v3_v3_v2":144913,"v3_v3_v3":142140,"v3_v3_v4":162703,"v3_v4_v2":169405,"v3_v4_v3":160933,"v3_v4_v4":141613,"v4_v2_v2":168687,"v4_v2_v3":151684,"v4_v2_v4":170120,"v4_v3_v2":151622,"v4_v3_v3":146683,"v4_v3_v4":155552,"v4_v4_v2":132893,"v4_v4_v3":125722,"v4_v4_v4":86564},"status":"keep","description":"Shrink V4 swap fee:3→2 bytes and tick_spacing:3→2 bytes in command encoding (uint16/int16 sufficient for all pool parameters). Saves -574 gas across 18 V4 paths, -49 bytes bytecode.","timestamp":1781158799089,"segment":5,"confidence":37.453130655085054,"asi":{"hypothesis":"Shrink V4_SWAP_COMPACT fee and tick_spacing from 3 bytes (uint24/int24) to 2 bytes (uint16/int16) in command encoding. Fee values: 500, 3000, 10000 all fit in uint16. Tick spacing: 10, 60, 200 all fit in int16. Saves 2 bytes per V4 swap command in the command stream, reducing calldata/memory.","key_insight":"2 bytes saved per V4 swap command stream encoding. With 29 V4 swaps across 18 benchmark paths, this saves ~574 gas total. Savings vary per path: single-V4 paths save ~16 gas, multi-V4 paths (V4V4*) save more. The PoolKey struct still uses uint24/int24, but the convert from uint16 is free with optimize gas.","paths_affected":"All 18 V4-involving paths improved. Pure V2/V3 paths unchanged.","bytecode_savings":"-49 bytes","encoding_change":"V4_SWAP_COMPACT: 27→25 bytes, V4_SWAP_DYNAMIC: 11→9 bytes, V4_BATCH entry: 26→24 bytes"}}
{"run":205,"commit":"e8e0ff2","metric":4238936,"metrics":{"bytecode_size":19527,"v2_v2_v2":181876,"v2_v2_v3":161063,"v2_v2_v4":193953,"v2_v3_v2":164763,"v2_v3_v3":144959,"v2_v3_v4":181444,"v2_v4_v2":190269,"v2_v4_v3":169480,"v2_v4_v4":157745,"v3_v2_v2":160970,"v3_v2_v3":144922,"v3_v2_v4":176488,"v3_v3_v2":144913,"v3_v3_v3":142140,"v3_v3_v4":162693,"v3_v4_v2":169405,"v3_v4_v3":160933,"v3_v4_v4":141613,"v4_v2_v2":168687,"v4_v2_v3":151669,"v4_v2_v4":170017,"v4_v3_v2":151622,"v4_v3_v3":146683,"v4_v3_v4":155552,"v4_v4_v2":132893,"v4_v4_v3":125620,"v4_v4_v4":86564},"status":"keep","description":"Shrink V4 swap amount from uint128 (16 bytes) to uint96 (12 bytes) in command encoding. All practical token amounts fit in uint96. Saves -275 gas from reduced command stream / calldata.","timestamp":1781159023500,"segment":5,"confidence":55.07324840764331,"asi":{"hypothesis":"Shrink V4_SWAP_COMPACT amount from uint128 (16 bytes) to uint96 (12 bytes). Max uint96 ≈ 7.9e28 covers all practical token amounts. Saves 4 bytes per V4 swap in command stream calldata.","key_insight":"uint96 amount saves 4 bytes per V4 swap command. 29 V4 swaps × ~9.5 gas/byte = ~275 gas. All benchmark amounts (1e18 WETH, 2e21 USDC, 1e10 WBTC) fit in uint96. Also shrinks V4_BATCH entry size from 24 to 20 bytes.","v4_swap_compact_size":"27→25→21 bytes (fee:3→2, ts:3→2, amount:16→12)","bytecode_change":"-4 bytes additional from uint96 amount","amount_mask":"2^96-1 = 79228162514264337593543950335"}}
{"run":206,"commit":"1a2f482","metric":4238430,"metrics":{"bytecode_size":19515,"v2_v2_v2":181876,"v2_v2_v3":161063,"v2_v2_v4":193953,"v2_v3_v2":164763,"v2_v3_v3":144959,"v2_v3_v4":181316,"v2_v4_v2":190269,"v2_v4_v3":169480,"v2_v4_v4":157730,"v3_v2_v2":160970,"v3_v2_v3":144922,"v3_v2_v4":176360,"v3_v3_v2":144913,"v3_v3_v3":142140,"v3_v3_v4":162591,"v3_v4_v2":169390,"v3_v4_v3":160933,"v3_v4_v4":141613,"v4_v2_v2":168687,"v4_v2_v3":151654,"v4_v2_v4":170017,"v4_v3_v2":151622,"v4_v3_v3":146683,"v4_v3_v4":155552,"v4_v4_v2":132893,"v4_v4_v3":125620,"v4_v4_v4":86461},"status":"keep","description":"Shrink V4_TAKE/MINT/BURN_COMPACT amounts from uint128 (16 bytes) to uint96 (12 bytes) + fix initialize() warmup encoding. Saves -506 gas, -12 bytes bytecode.","timestamp":1781159433092,"segment":5,"confidence":69.00330906684314,"asi":{"bytecode_savings":"-12 bytes additional from smaller handler code","hypothesis":"Shrink V4_TAKE/MINT/BURN_COMPACT amounts from uint128 to uint96. Also fixed initialize() hardcoded uint128 amount.","initialize_bug":"Warmup sequence had hardcoded uint128 format. Changed to slice(convert(1, bytes32), 20, 12) for uint96.","key_insight":"4 bytes saved per V4_TAKE/TAKE_COMPACT call. 25 V4_TAKE_COMPACT + 2 V4_MINT_COMPACT = 108 bytes saved, ~506 gas.","v4_command_sizes":"V4_SWAP_COMPACT: 27->21, V4_TAKE_COMPACT: 19->15, V4_MINT_COMPACT: 19->15, V4_BURN_COMPACT: 18->14"}}
{"run":207,"commit":"2a5fb6b","metric":4238105,"metrics":{"bytecode_size":19499,"v2_v2_v2":181876,"v2_v2_v3":161063,"v2_v2_v4":193953,"v2_v3_v2":164763,"v2_v3_v3":144959,"v2_v3_v4":181316,"v2_v4_v2":190254,"v2_v4_v3":169465,"v2_v4_v4":157602,"v3_v2_v2":160970,"v3_v2_v3":144922,"v3_v2_v4":176360,"v3_v3_v2":144913,"v3_v3_v3":142140,"v3_v3_v4":162591,"v3_v4_v2":169390,"v3_v4_v3":160921,"v3_v4_v4":141613,"v4_v2_v2":168559,"v4_v2_v3":151654,"v4_v2_v4":170017,"v4_v3_v2":151607,"v4_v3_v3":146683,"v4_v3_v4":155540,"v4_v4_v2":132893,"v4_v4_v3":125620,"v4_v4_v4":86461},"status":"keep","description":"Shrink V2/V3/SEND_ETH amounts from uint128 (16 bytes) to uint96 (12 bytes). Saves -325 gas, -16 bytes bytecode.","timestamp":1781159730043,"segment":5,"confidence":62.94854047547397,"asi":{"bytecode_savings":"-16 bytes additional","encoding_changes":"V3_SWAP_COMPACT: 22+N->18+N, V2_SWAP_COMPACT: 24+N->20+N, V2_SWAP_DIRECT: 20->16, SEND_ETH: 18->14","hypothesis":"Shrink V2/V3/SEND_ETH uint128 amounts to uint96 (12 bytes).","key_insight":"4 bytes saved per amount command. ~325 gas from shorter command streams in V2/V3/SEND_ETH."}}
{"run":208,"commit":"e0676d5","metric":4235570,"metrics":{"bytecode_size":19515,"v2_v2_v2":181628,"v2_v2_v3":160815,"v2_v2_v4":193953,"v2_v3_v2":164500,"v2_v3_v3":144748,"v2_v3_v4":181316,"v2_v4_v2":190021,"v2_v4_v3":169232,"v2_v4_v4":157602,"v3_v2_v2":160722,"v3_v2_v3":144712,"v3_v2_v4":176360,"v3_v3_v2":144703,"v3_v3_v3":142140,"v3_v3_v4":162591,"v3_v4_v2":169157,"v3_v4_v3":160723,"v3_v4_v4":141613,"v4_v2_v2":168559,"v4_v2_v3":151654,"v4_v2_v4":170017,"v4_v3_v2":151607,"v4_v3_v3":146683,"v4_v3_v4":155540,"v4_v4_v2":132893,"v4_v4_v3":125620,"v4_v4_v4":86461},"status":"keep","description":"Shrink ERC20_TRANSFER amount from uint256 (32 bytes) to uint96 (12 bytes). Saves -2,535 gas, +16 bytes bytecode. 11 paths with ERC20_XFER save 198-263 gas each.","timestamp":1781160397358,"segment":5,"confidence":59.11920529801324,"asi":{"hypothesis":"Shrink ERC20_TRANSFER amount from uint256 (32 bytes) to uint96 (12 bytes)","savings":"~2,535 gas from 20 fewer bytes per ERC20_TRANSFER command stream"}}
