{"run":76,"commit":"931fe70","metric":4280699,"metrics":{"v2_v2_v4":184756,"v2_v4_v2":186753,"v2_v2_v2":184270,"v2_v3_v3":147098,"v2_v3_v2":167574,"v2_v4_v3":165827,"v2_v3_v4":171348,"v2_v2_v3":163319,"v2_v4_v4":145634,"v3_v2_v2":163231,"v3_v2_v3":147066,"v3_v2_v4":167087,"v3_v3_v2":147057,"v3_v3_v3":144388,"v3_v3_v4":159378,"v3_v4_v2":165745,"v3_v4_v3":158343,"v3_v4_v4":136106,"v4_v2_v2":182508,"v4_v2_v4":166460,"v4_v2_v3":165927,"v4_v3_v3":158007,"v4_v3_v2":165861,"v4_v4_v3":156159,"v4_v3_v4":148962,"v4_v4_v2":144556,"v4_v4_v4":87279,"bytecode_size":18620},"status":"keep","description":"Replace remaining shift() with >> and % with & in V4 swap 8-byte merge — -872 gas","timestamp":1781062127891,"segment":2,"confidence":7.618304119408847,"asi":{"hypothesis":"Replace remaining shift(fthz, -40/-16) with >> 40/16 and % 16777216 with & 16777215 in V4 swap compact's 8-byte merged field extraction","result":"-872 gas, -76 bytes bytecode. The last 2 shift() calls in the 8-byte merged read (fthz) were using builtin dispatch overhead. Replacing with >> operator compiles directly to SHR. Also replaced % 16777216 with & 16777215 (bitwise AND instead of modulo) for the tick_spacing mask."}}
{"run":77,"commit":"12d2527","metric":4280699,"metrics":{"v2_v2_v4":184756,"v2_v4_v2":186753,"v2_v2_v2":184270,"v2_v3_v3":147098,"v2_v3_v2":167574,"v2_v4_v3":165827,"v2_v3_v4":171348,"v2_v2_v3":163319,"v2_v4_v4":145634,"v3_v2_v2":163231,"v3_v2_v3":147066,"v3_v2_v4":167087,"v3_v3_v2":147057,"v3_v3_v3":144388,"v3_v3_v4":159378,"v3_v4_v2":165745,"v3_v4_v3":158343,"v3_v4_v4":136106,"v4_v2_v2":182508,"v4_v2_v4":166460,"v4_v2_v3":165927,"v4_v3_v3":158007,"v4_v3_v2":165861,"v4_v4_v3":156159,"v4_v3_v4":148962,"v4_v4_v2":144556,"v4_v4_v4":87279,"bytecode_size":18620},"status":"keep","description":"Remaining % 256 to & 255 — no gas change (Venom optimizes internally)","timestamp":1781062411079,"segment":2,"confidence":8.00216606498195,"asi":{"hypothesis":"Replace remaining (fthz >> 8) % 256 with & 255 in hooks_idx extraction","result":"No gas change — Venom optimizes power-of-2 modulo to bitwise AND. Same as experiment #75."}}
{"run":78,"commit":"3a345d9","metric":4280699,"metrics":{"v2_v2_v4":184756,"v2_v4_v2":186753,"v2_v2_v2":184270,"v2_v3_v3":147098,"v2_v3_v2":167574,"v2_v4_v3":165827,"v2_v3_v4":171348,"v2_v2_v3":163319,"v2_v4_v4":145634,"v3_v2_v2":163231,"v3_v2_v3":147066,"v3_v2_v4":167087,"v3_v3_v2":147057,"v3_v3_v3":144388,"v3_v3_v4":159378,"v3_v4_v2":165745,"v3_v4_v3":158343,"v3_v4_v4":136106,"v4_v2_v2":182508,"v4_v2_v4":166460,"v4_v2_v3":165927,"v4_v3_v3":158007,"v4_v3_v2":165861,"v4_v4_v3":156159,"v4_v3_v4":148962,"v4_v4_v2":144556,"v4_v4_v4":87279,"bytecode_size":18564},"status":"keep","description":"8-byte merge in V4_SWAP_DYNAMIC — no gas change, -56 bytes","timestamp":1781062526671,"segment":2,"confidence":7.586270962694959,"asi":{"hypothesis":"Merge fee+ts+hooks+zfo into 8-byte slice in _cmd_v4_swap_dynamic, matching the pattern already used in _cmd_v4_swap_compact","result":"No gas change (V4_SWAP_DYNAMIC not in benchmark paths), but -56 bytes bytecode. Consistency improvement."}}
{"run":79,"commit":"240bc6b","metric":4280699,"metrics":{"v2_v2_v4":184756,"v2_v4_v2":186753,"v2_v2_v2":184270,"v2_v3_v3":147098,"v2_v3_v2":167574,"v2_v4_v3":165827,"v2_v3_v4":171348,"v2_v2_v3":163319,"v2_v4_v4":145634,"v3_v2_v2":163231,"v3_v2_v3":147066,"v3_v2_v4":167087,"v3_v3_v2":147057,"v3_v3_v3":144388,"v3_v3_v4":159378,"v3_v4_v2":165745,"v3_v4_v3":158343,"v3_v4_v4":136106,"v4_v2_v2":182508,"v4_v2_v4":166460,"v4_v2_v3":165927,"v4_v3_v3":158007,"v4_v3_v2":165861,"v4_v4_v3":156159,"v4_v3_v4":148962,"v4_v4_v2":144556,"v4_v4_v4":87279,"bytecode_size":18523},"status":"keep","description":"2-byte merge in V4_BATCH — no gas change, -41 bytes","timestamp":1781062777838,"segment":2,"confidence":6.974826935179358,"asi":{"hypothesis":"Merge currency0+currency1 indices into 2-byte slice in V4 batch handler","result":"No gas change (V4_BATCH not in benchmark paths), but -41 bytes bytecode"}}
{"run":80,"commit":"240bc6b","metric":4280699,"metrics":{"bytecode_size":18516,"v2_v2_v2":184270,"v2_v2_v3":163319,"v2_v2_v4":184756,"v2_v3_v2":167574,"v2_v3_v3":147098,"v2_v3_v4":171348,"v2_v4_v2":186753,"v2_v4_v3":165827,"v2_v4_v4":145634,"v3_v2_v2":163231,"v3_v2_v3":147066,"v3_v2_v4":167087,"v3_v3_v2":147057,"v3_v3_v3":144388,"v3_v3_v4":159378,"v3_v4_v2":165745,"v3_v4_v3":158343,"v3_v4_v4":136106,"v4_v2_v2":182508,"v4_v2_v3":165927,"v4_v2_v4":166460,"v4_v3_v2":165861,"v4_v3_v3":158007,"v4_v3_v4":148962,"v4_v4_v2":144556,"v4_v4_v3":156159,"v4_v4_v4":87279},"status":"discard","description":"Double-convert via bytes32 for int256→uint256 — no gas change","timestamp":1781063121942,"segment":2,"confidence":6.974826935179358,"asi":{"hypothesis":"Replace convert(int256, uint256) with convert(convert(int256, bytes32), uint256) to skip signedness bounds check when value is known positive","next_action_hint":"Try a different approach — Venom already optimizes this. Look for other areas.","result":"No gas change. Venom already optimizes the signedness check when it can prove the value is positive (e.g., after a > 0 comparison). Bytecode slightly smaller (-7 bytes) but no runtime savings."}}
{"run":81,"commit":"240bc6b","metric":4280941,"metrics":{"bytecode_size":18524,"v2_v2_v2":184270,"v2_v2_v3":163319,"v2_v2_v4":184766,"v2_v3_v2":167574,"v2_v3_v3":147098,"v2_v3_v4":171358,"v2_v4_v2":186763,"v2_v4_v3":165837,"v2_v4_v4":145654,"v3_v2_v2":163231,"v3_v2_v3":147066,"v3_v2_v4":167097,"v3_v3_v2":147057,"v3_v3_v3":144388,"v3_v3_v4":159386,"v3_v4_v2":165755,"v3_v4_v3":158351,"v3_v4_v4":136122,"v4_v2_v2":182518,"v4_v2_v3":165937,"v4_v2_v4":166476,"v4_v3_v2":165871,"v4_v3_v3":158015,"v4_v3_v4":148978,"v4_v4_v2":144576,"v4_v4_v3":156175,"v4_v4_v4":87303},"status":"discard","description":"Inline fee/ts into PoolKey — +242 gas regression","timestamp":1781063262620,"segment":2,"confidence":6.974826935179358,"asi":{"hypothesis":"Inline _fee and _ts into PoolKey constructor in _cmd_v4_swap_compact to eliminate intermediate variables","next_action_hint":"Named intermediate variables HELP Venom optimize. Don't inline them. Try a completely different optimization approach.","result":"+242 gas regression. Named intermediate variables give Venom better liveness information, allowing more efficient memory allocation. Inlining into the constructor expression makes the values live simultaneously, preventing Venom from sharing their memory slots."}}
{"run":82,"commit":"92c893a","metric":4280511,"metrics":{"v2_v2_v2":184270,"v2_v2_v3":163319,"v2_v2_v4":184733,"v2_v3_v2":167574,"v2_v3_v3":147098,"v2_v3_v4":171348,"v2_v4_v2":186753,"v2_v4_v3":165827,"v2_v4_v4":145634,"v3_v2_v2":163231,"v3_v2_v3":147066,"v3_v2_v4":167087,"v3_v3_v2":147057,"v3_v3_v3":144388,"v3_v3_v4":159378,"v3_v4_v2":165745,"v3_v4_v3":158343,"v3_v4_v4":136106,"v4_v2_v2":182485,"v4_v2_v3":165904,"v4_v2_v4":166424,"v4_v3_v2":165838,"v4_v3_v3":158007,"v4_v3_v4":148944,"v4_v4_v2":144533,"v4_v4_v3":156140,"v4_v4_v4":87279,"bytecode_size":18513},"status":"keep","description":"Remove delta!=0 check in V4_SETTLE_DELTA — -188 gas","timestamp":1781063506809,"segment":2,"confidence":7.410806174957118,"asi":{"hypothesis":"Remove delta != 0 check in _cmd_v4_settle_delta — _v4_settle_currency already handles delta=0 gracefully (falls through without extcalls)","result":"-188 gas saved. The conditional branch (ISZERO + JUMPI) was unnecessary. _v4_settle_currency handles all three cases: delta>0 (take), delta<0 (settle), delta=0 (no-op). Also -11 bytes bytecode."}}
{"run":83,"commit":"673b8c7","metric":4280511,"metrics":{"bytecode_size":18485,"v2_v2_v2":184270,"v2_v2_v3":163319,"v2_v2_v4":184733,"v2_v3_v2":167574,"v2_v3_v3":147098,"v2_v3_v4":171348,"v2_v4_v2":186753,"v2_v4_v3":165827,"v2_v4_v4":145634,"v3_v2_v2":163231,"v3_v2_v3":147066,"v3_v2_v4":167087,"v3_v3_v2":147057,"v3_v3_v3":144388,"v3_v3_v4":159378,"v3_v4_v2":165745,"v3_v4_v3":158343,"v3_v4_v4":136106,"v4_v2_v2":182485,"v4_v2_v3":165904,"v4_v2_v4":166424,"v4_v3_v2":165838,"v4_v3_v3":158007,"v4_v3_v4":148944,"v4_v4_v2":144533,"v4_v4_v3":156140,"v4_v4_v4":87279},"status":"keep","description":"Remove delta!=0 checks in _auto_settle_touched — no gas change, -28 bytes","timestamp":1781063631374,"segment":2,"confidence":7.883324885960466,"asi":{"hypothesis":"Remove delta != 0 checks in _auto_settle_touched — _v4_settle_currency handles delta=0 gracefully","result":"No gas change, -28 bytes bytecode. The conditional check overhead was offset by the function call overhead for delta=0 cases. Bytecode savings from removing the JUMPI instructions."}}
{"run":84,"commit":"f071c05","metric":4280511,"metrics":{"bytecode_size":18467,"v2_v2_v2":184270,"v2_v2_v3":163319,"v2_v2_v4":184733,"v2_v3_v2":167574,"v2_v3_v3":147098,"v2_v3_v4":171348,"v2_v4_v2":186753,"v2_v4_v3":165827,"v2_v4_v4":145634,"v3_v2_v2":163231,"v3_v2_v3":147066,"v3_v2_v4":167087,"v3_v3_v2":147057,"v3_v3_v3":144388,"v3_v3_v4":159378,"v3_v4_v2":165745,"v3_v4_v3":158343,"v3_v4_v4":136106,"v4_v2_v2":182485,"v4_v2_v3":165904,"v4_v2_v4":166424,"v4_v3_v2":165838,"v4_v3_v3":158007,"v4_v3_v4":148944,"v4_v4_v2":144533,"v4_v4_v3":156140,"v4_v4_v4":87279},"status":"keep","description":"Remove delta!=0 checks in V4 batch settle — no gas change, -18 bytes","timestamp":1781063748529,"segment":2,"confidence":9.60941554429754,"asi":{"hypothesis":"Remove delta != 0 checks in V4 batch settle section (consistent with _auto_settle_touched)","result":"No gas change (V4_BATCH not in benchmark paths), -18 bytes bytecode"}}
{"run":85,"commit":"5648092","metric":4279247,"metrics":{"bytecode_size":18434,"v2_v2_v2":184270,"v2_v2_v3":163258,"v2_v2_v4":184733,"v2_v3_v2":167513,"v2_v3_v3":147000,"v2_v3_v4":171287,"v2_v4_v2":186753,"v2_v4_v3":165766,"v2_v4_v4":145634,"v3_v2_v2":163170,"v3_v2_v3":146968,"v3_v2_v4":167026,"v3_v3_v2":146960,"v3_v3_v3":144406,"v3_v3_v4":159280,"v3_v4_v2":165684,"v3_v4_v3":158245,"v3_v4_v4":136057,"v4_v2_v2":182485,"v4_v2_v3":165843,"v4_v2_v4":166424,"v4_v3_v2":165777,"v4_v3_v3":157909,"v4_v3_v4":148895,"v4_v4_v2":144533,"v4_v4_v3":156092,"v4_v4_v4":87279},"status":"keep","description":"Remove forward_len>0 check in V3 swap compact — -1,264 gas","timestamp":1781063934822,"segment":2,"confidence":12.610978139460666,"asi":{"hypothesis":"Remove forward_len > 0 conditional in V3 swap compact — slice(data, offset, 0) returns b\"\" which is equivalent to the explicit b\"\" initialization","result":"-1,264 gas saved! Eliminated conditional branch (ISZERO + JUMPI). Also -33 bytes bytecode. This works because: (1) slice(data, offset, 0) == b\"\" in Vyper, (2) V3 always registers callback unconditionally, so no semantic change for TSTORE."}}
{"run":86,"commit":"ef26e13","metric":4276446,"metrics":{"bytecode_size":18411,"v2_v2_v2":184210,"v2_v2_v3":163198,"v2_v2_v4":184630,"v2_v3_v2":167423,"v2_v3_v3":146928,"v2_v3_v4":171154,"v2_v4_v2":186620,"v2_v4_v3":165633,"v2_v4_v4":145531,"v3_v2_v2":163110,"v3_v2_v3":146896,"v3_v2_v4":166893,"v3_v3_v2":146888,"v3_v3_v3":144310,"v3_v3_v4":159150,"v3_v4_v2":165551,"v3_v4_v3":158115,"v3_v4_v4":135951,"v4_v2_v2":182382,"v4_v2_v3":165710,"v4_v2_v4":166341,"v4_v3_v2":165644,"v4_v3_v3":157779,"v4_v3_v4":148788,"v4_v4_v2":144430,"v4_v4_v3":155985,"v4_v4_v4":87196},"status":"keep","description":"Remove forward_len>0 check in V4_UNLOCK — -2,801 gas","timestamp":1781064063318,"segment":2,"confidence":14.159356345704646,"asi":{"hypothesis":"Remove forward_len > 0 conditional in V4_UNLOCK — slice(data, offset, 0) returns b\"\" which is equivalent to the explicit b\"\" initialization","result":"-2,801 gas saved! The conditional branch (ISZERO + JUMPI) was eliminated. V4_UNLOCK is called 19 times across benchmarks, so each removal saves ~147 gas per invocation. Also -23 bytes bytecode."}}
{"run":87,"commit":"bebe5cf","metric":4276386,"metrics":{"bytecode_size":18400,"v2_v2_v2":184190,"v2_v2_v3":163198,"v2_v2_v4":184630,"v2_v3_v2":167403,"v2_v3_v3":146928,"v2_v3_v4":171154,"v2_v4_v2":186600,"v2_v4_v3":165633,"v2_v4_v4":145531,"v3_v2_v2":163110,"v3_v2_v3":146896,"v3_v2_v4":166893,"v3_v3_v2":146888,"v3_v3_v3":144310,"v3_v3_v4":159150,"v3_v4_v2":165551,"v3_v4_v3":158115,"v3_v4_v4":135951,"v4_v2_v2":182382,"v4_v2_v3":165710,"v4_v2_v4":166341,"v4_v3_v2":165644,"v4_v3_v3":157779,"v4_v3_v4":148788,"v4_v4_v2":144430,"v4_v4_v3":155985,"v4_v4_v4":87196},"status":"keep","description":"Remove forward_len>0 check in V2 swap compact (slice only) — -60 gas","timestamp":1781064192148,"segment":2,"confidence":12.378174123337365,"asi":{"hypothesis":"Move forward_data slice outside conditional in V2 swap compact, keep TSTORE registration conditional","result":"-60 gas. The slice(data, offset, 0) == b\"\" optimization works for V2 too. The TSTORE registration must remain conditional to avoid registering callbacks when forward_len=0 (no callback expected). Also -11 bytes bytecode."}}
{"run":88,"commit":"bebe5cf","metric":4276386,"metrics":{"bytecode_size":18400,"v2_v2_v2":184190,"v2_v2_v3":163198,"v2_v2_v4":184630,"v2_v3_v2":167403,"v2_v3_v3":146928,"v2_v3_v4":171154,"v2_v4_v2":186600,"v2_v4_v3":165633,"v2_v4_v4":145531,"v3_v2_v2":163110,"v3_v2_v3":146896,"v3_v2_v4":166893,"v3_v3_v2":146888,"v3_v3_v3":144310,"v3_v3_v4":159150,"v3_v4_v2":165551,"v3_v4_v3":158115,"v3_v4_v4":135951,"v4_v2_v2":182382,"v4_v2_v3":165710,"v4_v2_v4":166341,"v4_v3_v2":165644,"v4_v3_v3":157779,"v4_v3_v4":148788,"v4_v4_v2":144430,"v4_v4_v3":155985,"v4_v4_v4":87196},"status":"discard","description":"Replace convert(., bool) with != 0 — no gas change","timestamp":1781064343733,"segment":2,"confidence":11.405849582172701,"asi":{"hypothesis":"Replace convert((fthz & 255), bool) with (fthz & 255) != 0 to avoid bool bounds check","result":"No gas change. Venom already optimizes convert(uint256, bool) when the value comes from bitwise AND with a single-byte mask."}}
{"run":89,"commit":"dbc3e16","metric":4276386,"metrics":{"bytecode_size":18360,"v2_v2_v2":184190,"v2_v2_v3":163198,"v2_v2_v4":184630,"v2_v3_v2":167403,"v2_v3_v3":146928,"v2_v3_v4":171154,"v2_v4_v2":186600,"v2_v4_v3":165633,"v2_v4_v4":145531,"v3_v2_v2":163110,"v3_v2_v3":146896,"v3_v2_v4":166893,"v3_v3_v2":146888,"v3_v3_v3":144310,"v3_v3_v4":159150,"v3_v4_v2":165551,"v3_v4_v3":158115,"v3_v4_v4":135951,"v4_v2_v2":182382,"v4_v2_v3":165710,"v4_v2_v4":166341,"v4_v3_v2":165644,"v4_v3_v3":157779,"v4_v3_v4":148788,"v4_v4_v2":144430,"v4_v4_v3":155985,"v4_v4_v4":87196},"status":"keep","description":"Unsafe negation in V4 batch — no gas change, -40 bytes","timestamp":1781105570236,"segment":2,"confidence":10.693914860276834,"asi":{"hypothesis":"Replace -input_delta with unsafe_sub(empty(int256), input_delta) in V4 batch handler","result":"No gas change (V4_BATCH not in benchmark paths), -40 bytes bytecode. The overflow check is removed but this handler isn't exercised by benchmarks."}}
{"run":90,"commit":"1243849","metric":4274140,"metrics":{"bytecode_size":18325,"v2_v2_v2":184190,"v2_v2_v3":163102,"v2_v2_v4":184630,"v2_v3_v2":167307,"v2_v3_v3":146775,"v2_v3_v4":171058,"v2_v4_v2":186600,"v2_v4_v3":165537,"v2_v4_v4":145531,"v3_v2_v2":163014,"v3_v2_v3":146743,"v3_v2_v4":166797,"v3_v3_v2":146734,"v3_v3_v3":144080,"v3_v3_v4":158996,"v3_v4_v2":165455,"v3_v4_v3":157961,"v3_v4_v4":135874,"v4_v2_v2":182382,"v4_v2_v3":165614,"v4_v2_v4":166341,"v4_v3_v2":165548,"v4_v3_v3":157625,"v4_v3_v4":148712,"v4_v4_v2":144430,"v4_v4_v3":155908,"v4_v4_v4":87196},"status":"keep","description":"Merge recipient+forward_len reads in V3 swap compact — -2,246 gas","timestamp":1781105969777,"segment":2,"confidence":13.041928233744091,"asi":{"hypothesis":"Merge recipient_idx (1 byte) + forward_len (2 bytes) in V3 swap compact into a single 3-byte slice read, then extract with shift and mask","result":"-2,246 gas saved! Eliminates 1 bounds check per V3 swap compact call. 30 V3 swaps × ~75 gas = ~2,250 gas. Also -35 bytes bytecode."}}
{"run":91,"commit":"8562a7b","metric":4273843,"metrics":{"bytecode_size":18288,"v2_v2_v2":184091,"v2_v2_v3":163102,"v2_v2_v4":184630,"v2_v3_v2":167208,"v2_v3_v3":146775,"v2_v3_v4":171058,"v2_v4_v2":186501,"v2_v4_v3":165537,"v2_v4_v4":145531,"v3_v2_v2":163014,"v3_v2_v3":146743,"v3_v2_v4":166797,"v3_v3_v2":146734,"v3_v3_v3":144080,"v3_v3_v4":158996,"v3_v4_v2":165455,"v3_v4_v3":157961,"v3_v4_v4":135874,"v4_v2_v2":182382,"v4_v2_v3":165614,"v4_v2_v4":166341,"v4_v3_v2":165548,"v4_v3_v3":157625,"v4_v3_v4":148712,"v4_v4_v2":144430,"v4_v4_v3":155908,"v4_v4_v4":87196},"status":"keep","description":"Merge recipient+fee reads in V2 swap compact — -297 gas","timestamp":1781106223486,"segment":2,"confidence":16.284860173577627,"asi":{"hypothesis":"Merge recipient_idx + fee as 3-byte slice in V2 swap compact","result":"-297 gas. V2_SWAP_COMPACT only used 3 times in benchmarks, so savings are small. Also -37 bytes bytecode."}}
{"run":92,"commit":"20f1a6d","metric":4273627,"metrics":{"bytecode_size":18261,"v2_v2_v2":184019,"v2_v2_v3":163102,"v2_v2_v4":184630,"v2_v3_v2":167136,"v2_v3_v3":146775,"v2_v3_v4":171058,"v2_v4_v2":186429,"v2_v4_v3":165537,"v2_v4_v4":145531,"v3_v2_v2":163014,"v3_v2_v3":146743,"v3_v2_v4":166797,"v3_v3_v2":146734,"v3_v3_v3":144080,"v3_v3_v4":158996,"v3_v4_v2":165455,"v3_v4_v3":157961,"v3_v4_v4":135874,"v4_v2_v2":182382,"v4_v2_v3":165614,"v4_v2_v4":166341,"v4_v3_v2":165548,"v4_v3_v3":157625,"v4_v3_v4":148712,"v4_v4_v2":144430,"v4_v4_v3":155908,"v4_v4_v4":87196},"status":"keep","description":"5-byte merge in V2 swap compact — -216 gas","timestamp":1781106371758,"segment":2,"confidence":16.291955350269436,"asi":{"hypothesis":"Expand V2 merge to 5 bytes: recipient_idx + fee + forward_len","result":"-216 gas from eliminating another bounds check. Now 3 reads → 1 read for those fields. Also -27 bytes bytecode."}}
{"run":93,"commit":"07a64e9","metric":4273627,"metrics":{"bytecode_size":18225,"v2_v2_v2":184019,"v2_v2_v3":163102,"v2_v2_v4":184630,"v2_v3_v2":167136,"v2_v3_v3":146775,"v2_v3_v4":171058,"v2_v4_v2":186429,"v2_v4_v3":165537,"v2_v4_v4":145531,"v3_v2_v2":163014,"v3_v2_v3":146743,"v3_v2_v4":166797,"v3_v3_v2":146734,"v3_v3_v3":144080,"v3_v3_v4":158996,"v3_v4_v2":165455,"v3_v4_v3":157961,"v3_v4_v4":135874,"v4_v2_v2":182382,"v4_v2_v3":165614,"v4_v2_v4":166341,"v4_v3_v2":165548,"v4_v3_v3":157625,"v4_v3_v4":148712,"v4_v4_v2":144430,"v4_v4_v3":155908,"v4_v4_v4":87196},"status":"keep","description":"Merge recipient+fee reads in V2 swap calc — no gas change, -36 bytes","timestamp":1781106489143,"segment":2,"confidence":16.257537929710004,"asi":{"hypothesis":"Merge recipient_idx + fee reads in V2 swap calc","result":"No gas change (V2_SWAP_CALC not in benchmark paths), -36 bytes bytecode. Same merge pattern as V2 compact."}}
{"run":94,"commit":"07a64e9","metric":0,"metrics":{"bytecode_size":18225,"v2_v2_v2":0,"v2_v2_v3":0,"v2_v2_v4":0,"v2_v3_v2":0,"v2_v3_v3":0,"v2_v3_v4":0,"v2_v4_v2":0,"v2_v4_v3":0,"v2_v4_v4":0,"v3_v2_v2":0,"v3_v2_v3":0,"v3_v2_v4":0,"v3_v3_v2":0,"v3_v3_v3":0,"v3_v3_v4":0,"v3_v4_v2":0,"v3_v4_v3":0,"v3_v4_v4":0,"v4_v2_v2":0,"v4_v2_v3":0,"v4_v2_v4":0,"v4_v3_v2":0,"v4_v3_v3":0,"v4_v3_v4":0,"v4_v4_v2":0,"v4_v4_v3":0,"v4_v4_v4":0},"status":"crash","description":"26-byte merge in V4 swap compact — CRASH (byte ordering)","timestamp":1781106840387,"segment":2,"confidence":16.257537929710004,"asi":{"hypothesis":"Merge 26 data bytes of V4 swap compact into single slice read","next_action_hint":"Need to understand Vyper convert(Bytes[N], uint256) byte ordering for non-power-of-2 sizes","result":"Experiment abandoned — byte ordering in convert(slice, uint256) is complex for non-power-of-2 sizes. Multiple test failures. The right-aligned behavior for Bytes→uint256 conversion means shift amounts need careful calculation.","rollback_reason":"Test failures from incorrect bit extraction"}}
{"run":95,"commit":"07a64e9","metric":0,"metrics":{"bytecode_size":18225,"v2_v2_v2":0,"v2_v2_v3":0,"v2_v2_v4":0,"v2_v3_v2":0,"v2_v3_v3":0,"v2_v3_v4":0,"v2_v4_v2":0,"v2_v4_v3":0,"v2_v4_v4":0,"v3_v2_v2":0,"v3_v2_v3":0,"v3_v2_v4":0,"v3_v3_v2":0,"v3_v3_v3":0,"v3_v3_v4":0,"v3_v4_v2":0,"v3_v4_v3":0,"v3_v4_v4":0,"v4_v2_v2":0,"v4_v2_v3":0,"v4_v2_v4":0,"v4_v3_v2":0,"v4_v3_v3":0,"v4_v3_v4":0,"v4_v4_v2":0,"v4_v4_v3":0,"v4_v4_v4":0},"status":"crash","description":"18-byte merge in V4_TAKE_COMPACT — CRASH (bit extraction wrong)","timestamp":1781107035709,"segment":2,"confidence":16.257537929710004,"asi":{"hypothesis":"Merge indices + amount as 18-byte slice in V4_TAKE_COMPACT","next_action_hint":"Stick to small merges (2-5 bytes) that are proven. The byte ordering for large non-power-of-2 slices is tricky.","result":"Test failures. The 18-byte merge for V4_TAKE_COMPACT had incorrect bit extraction. Large non-power-of-2 merges are error-prone.","rollback_reason":"Test failures from incorrect bit extraction in 18-byte merge"}}
{"type":"config","name":"cmd_executor gas reduction - continued","metricName":"total_gas","metricUnit":"gas","bestDirection":"lower"}
{"run":96,"commit":"07a64e9","metric":4273627,"metrics":{"v2_v4_v2":186429,"v2_v2_v4":184630,"v2_v3_v3":146775,"v2_v2_v2":184019,"v2_v4_v3":165537,"v2_v2_v3":163102,"v2_v3_v4":171058,"v2_v3_v2":167136,"v2_v4_v4":145531,"v3_v2_v4":166797,"v3_v2_v2":163014,"v3_v2_v3":146743,"v3_v3_v2":146734,"v3_v3_v3":144080,"v3_v3_v4":158996,"v3_v4_v3":157961,"v3_v4_v2":165455,"v3_v4_v4":135874,"v4_v2_v4":166341,"v4_v2_v3":165614,"v4_v2_v2":182382,"v4_v3_v2":165548,"v4_v3_v4":148712,"v4_v4_v3":155908,"v4_v4_v2":144430,"v4_v3_v3":157625,"v4_v4_v4":87196,"bytecode_size":18208},"status":"checks_failed","description":"Baseline measurement - checks have pre-existing failures","timestamp":1781108492651,"segment":3,"confidence":null,"asi":{"hypothesis":"Baseline measurement to establish current total_gas","note":"Checks show 15 failed + 52 errors - need to investigate if pre-existing"}}
