{"run":174,"commit":"7ba9a52","metric":4344252,"metrics":{"bytecode_size":19492,"v2_v2_v2":181932,"v2_v2_v3":160905,"v2_v2_v4":189286,"v2_v3_v2":164877,"v2_v3_v3":144879,"v2_v3_v4":176839,"v2_v4_v2":190575,"v2_v4_v3":169572,"v2_v4_v4":153016,"v3_v2_v2":160812,"v3_v2_v3":144842,"v3_v2_v4":171738,"v3_v3_v2":144833,"v3_v3_v3":142088,"v3_v3_v4":162804,"v3_v4_v2":169482,"v3_v4_v3":161041,"v3_v4_v4":141714,"v4_v2_v2":185790,"v4_v2_v3":168845,"v4_v2_v4":170352,"v4_v3_v2":168783,"v4_v3_v3":160608,"v4_v3_v4":155776,"v4_v4_v2":150203,"v4_v4_v3":160340,"v4_v4_v4":92320},"status":"keep","description":"Inline settle logic for V4_SETTLE_DELTA table-index path — -73 gas","timestamp":1781139592899,"segment":4,"confidence":3.199441891004596,"asi":{"bytecode_change":"+334 bytes (19158 → 19492)","gas_change":"-73 gas from skipping _v4_settle_currency function call + 2 redundant WETH/NATIVE comparisons for table-index paths","hypothesis":"Inline _v4_settle_currency's else branch (sync+transfer+settle) for table-index path in V4_SETTLE_DELTA to skip redundant WETH/NATIVE comparisons + function call overhead. _v4_settle_currency is NOT inlined by Venom (confirmed in IR)."}}
{"run":175,"commit":"7ba9a52","metric":4344252,"metrics":{"bytecode_size":19867,"v2_v2_v2":181932,"v2_v2_v3":160905,"v2_v2_v4":189286,"v2_v3_v2":164877,"v2_v3_v3":144879,"v2_v3_v4":176839,"v2_v4_v2":190575,"v2_v4_v3":169572,"v2_v4_v4":153016,"v3_v2_v2":160812,"v3_v2_v3":144842,"v3_v2_v4":171738,"v3_v3_v2":144833,"v3_v3_v3":142088,"v3_v3_v4":162804,"v3_v4_v2":169482,"v3_v4_v3":161041,"v3_v4_v4":141714,"v4_v2_v2":185790,"v4_v2_v3":168845,"v4_v2_v4":170352,"v4_v3_v2":168783,"v4_v3_v3":160608,"v4_v3_v4":155776,"v4_v4_v2":150203,"v4_v4_v3":160340,"v4_v4_v4":92320},"status":"discard","description":"Inline settle in auto_settle_touched loop — no gas, +375 bytes","timestamp":1781139730497,"segment":4,"confidence":3.1396585051546393,"asi":{"bytecode_change":"+375 bytes (19492 → 19867)","gas_change":"0 — Venom optimizes loop function calls differently","hypothesis":"Inline _v4_settle_currency in _auto_settle_touched table loop to skip redundant comparisons"}}
{"run":176,"commit":"f9df20e","metric":4343720,"metrics":{"bytecode_size":19772,"v2_v2_v2":181932,"v2_v2_v3":160905,"v2_v2_v4":189214,"v2_v3_v2":164877,"v2_v3_v3":144879,"v2_v3_v4":176839,"v2_v4_v2":190575,"v2_v4_v3":169572,"v2_v4_v4":153016,"v3_v2_v2":160812,"v3_v2_v3":144842,"v3_v2_v4":171738,"v3_v3_v2":144833,"v3_v3_v3":142088,"v3_v3_v4":162804,"v3_v4_v2":169482,"v3_v4_v3":161041,"v3_v4_v4":141714,"v4_v2_v2":185718,"v4_v2_v3":168773,"v4_v2_v4":170295,"v4_v3_v2":168711,"v4_v3_v3":160608,"v4_v3_v4":155719,"v4_v4_v2":150131,"v4_v4_v3":160282,"v4_v4_v4":92320},"status":"keep","description":"Inline _read_pm_delta_slot calls — -532 gas","timestamp":1781139939617,"segment":4,"confidence":3.225354381443299,"asi":{"bytecode_change":"+280 bytes (19492 → 19772)","gas_change":"-532 gas from eliminating _read_pm_delta_slot function call overhead at 6 call sites","hypothesis":"Inline _read_pm_delta_slot() by replacing with direct staticcall IPoolManagerExttload.exttload(slot) to eliminate function call overhead. Non-loop call sites save the Venom INVOKE overhead."}}
{"run":177,"commit":"234706b","metric":4343617,"metrics":{"bytecode_size":19943,"v2_v2_v2":181932,"v2_v2_v3":160905,"v2_v2_v4":189214,"v2_v3_v2":164877,"v2_v3_v3":144879,"v2_v3_v4":176839,"v2_v4_v2":190575,"v2_v4_v3":169572,"v2_v4_v4":153016,"v3_v2_v2":160812,"v3_v2_v3":144842,"v3_v2_v4":171738,"v3_v3_v2":144833,"v3_v3_v3":142088,"v3_v3_v4":162804,"v3_v4_v2":169482,"v3_v4_v3":161041,"v3_v4_v4":141714,"v4_v2_v2":185718,"v4_v2_v3":168773,"v4_v2_v4":170192,"v4_v3_v2":168711,"v4_v3_v3":160608,"v4_v3_v4":155719,"v4_v4_v2":150131,"v4_v4_v3":160282,"v4_v4_v4":92320},"status":"keep","description":"Inline _read_pm_delta in V4_SETTLE_DELTA — -103 gas","timestamp":1781140097999,"segment":4,"confidence":3.2419458762886597,"asi":{"bytecode_change":"+171 bytes (19772 → 19943)","gas_change":"-103 gas from eliminating _read_pm_delta function call overhead + pruning WETH/NATIVE slot branches for table-index paths in V4_SETTLE_DELTA","hypothesis":"Inline _read_pm_delta in V4_SETTLE_DELTA dispatch handler to skip function call overhead. Table indices always use keccak256 slot (never WETH_DELTA_SLOT or NATIVE_DELTA_SLOT), so WETH/NATIVE branches are dead code after inlining."}}
{"run":178,"commit":"8a932ab","metric":4343617,"metrics":{"bytecode_size":19943,"v2_v2_v2":181932,"v2_v2_v3":160905,"v2_v2_v4":189214,"v2_v3_v2":164877,"v2_v3_v3":144879,"v2_v3_v4":176839,"v2_v4_v2":190575,"v2_v4_v3":169572,"v2_v4_v4":153016,"v3_v2_v2":160812,"v3_v2_v3":144842,"v3_v2_v4":171738,"v3_v3_v2":144833,"v3_v3_v3":142088,"v3_v3_v4":162804,"v3_v4_v2":169482,"v3_v4_v3":161041,"v3_v4_v4":141714,"v4_v2_v2":185718,"v4_v2_v3":168773,"v4_v2_v4":170192,"v4_v3_v2":168711,"v4_v3_v3":160608,"v4_v3_v4":155719,"v4_v4_v2":150131,"v4_v4_v3":160282,"v4_v4_v4":92320},"status":"keep","description":"Remove dead _read_pm_delta_slot definition — no gas change","timestamp":1781140372475,"segment":4,"confidence":3.2419458762886597,"asi":{"bytecode_change":"0 bytes — Venom keeps dead function in bytecode even after all calls inlined","gas_change":"0","hypothesis":"Remove dead _read_pm_delta_slot function definition for bytecode savings"}}
{"run":179,"commit":"8a932ab","metric":4343617,"metrics":{"bytecode_size":20521,"v2_v2_v2":181932,"v2_v2_v3":160905,"v2_v2_v4":189214,"v2_v3_v2":164877,"v2_v3_v3":144879,"v2_v3_v4":176839,"v2_v4_v2":190575,"v2_v4_v3":169572,"v2_v4_v4":153016,"v3_v2_v2":160812,"v3_v2_v3":144842,"v3_v2_v4":171738,"v3_v3_v2":144833,"v3_v3_v3":142088,"v3_v3_v4":162804,"v3_v4_v2":169482,"v3_v4_v3":161041,"v3_v4_v4":141714,"v4_v2_v2":185718,"v4_v2_v3":168773,"v4_v2_v4":170192,"v4_v3_v2":168711,"v4_v3_v3":160608,"v4_v3_v4":155719,"v4_v4_v2":150131,"v4_v4_v3":160282,"v4_v4_v4":92320},"status":"discard","description":"Inline _v4_settle_currency in auto_settle_touched — no gas, +578 bytes","timestamp":1781140506157,"segment":4,"confidence":3.2419458762886597,"asi":{"bytecode_change":"+578 bytes (19943 → 20521)","gas_change":"0 — Venom optimizes _auto_settle_touched function calls differently despite INVOKE in IR","hypothesis":"Inline _v4_settle_currency for WETH/NATIVE in _auto_settle_touched to eliminate function call overhead","rollback_reason":"No gas savings, significant bytecode regression","next_action_hint":"Confirmed: _auto_settle_touched function calls are already optimized by Venom despite IR showing INVOKE."}}
{"run":180,"commit":"8a932ab","metric":4343676,"metrics":{"bytecode_size":19943,"v2_v2_v2":181932,"v2_v2_v3":160905,"v2_v2_v4":189215,"v2_v3_v2":164877,"v2_v3_v3":144879,"v2_v3_v4":176839,"v2_v4_v2":190575,"v2_v4_v3":169572,"v2_v4_v4":153016,"v3_v2_v2":160812,"v3_v2_v3":144842,"v3_v2_v4":171738,"v3_v3_v2":144833,"v3_v3_v3":142088,"v3_v3_v4":162804,"v3_v4_v2":169482,"v3_v4_v3":161041,"v3_v4_v4":141714,"v4_v2_v2":185730,"v4_v2_v3":168785,"v4_v2_v4":170183,"v4_v3_v2":168723,"v4_v3_v3":160608,"v4_v3_v4":155728,"v4_v4_v2":150143,"v4_v4_v3":160292,"v4_v4_v4":92320},"status":"discard","description":"Reorder V4_SETTLE_DELTA: table first → +59 gas regression","timestamp":1781140785995,"segment":4,"confidence":4.082767014910234,"asi":{"bytecode_change":"0 bytes","gas_change":"+59 gas regression — LT check is slightly more expensive than GT + fall-through for mixed sentinel/table paths","hypothesis":"Reorder V4_SETTLE_DELTA to check table index (< 0xFC) FIRST before sentinels, since benchmarks always use table indices","next_action_hint":"Revert to original order (sentinels first with >= check)"}}
{"run":181,"commit":"1e48954","metric":4343494,"metrics":{"bytecode_size":20079,"v2_v2_v2":181844,"v2_v2_v3":160911,"v2_v2_v4":189214,"v2_v3_v2":164795,"v2_v3_v3":144888,"v2_v3_v4":176845,"v2_v4_v2":190487,"v2_v4_v3":169578,"v2_v4_v4":153016,"v3_v2_v2":160818,"v3_v2_v3":144852,"v3_v2_v4":171744,"v3_v3_v2":144843,"v3_v3_v3":142102,"v3_v3_v4":162813,"v3_v4_v2":169488,"v3_v4_v3":161051,"v3_v4_v4":141719,"v4_v2_v2":185718,"v4_v2_v3":168779,"v4_v2_v4":170192,"v4_v3_v2":168717,"v4_v3_v3":160618,"v4_v3_v4":155724,"v4_v4_v2":150131,"v4_v4_v3":160287,"v4_v4_v4":92320},"status":"keep","description":"Pack t_expected_callback + t_callback_fee into single transient uint256 — -123 gas","timestamp":1781141419527,"segment":4,"confidence":5.54615173924952,"asi":{"bytecode_change":"+136 bytes","gas_change":"-123 gas vs 4343617 previous best","hypothesis":"Pack t_expected_callback + t_callback_fee into single t_callback_packed transient(uint256). Saves 1 TSTORE per V2 swap + 1 TLOAD per V2 callback.","implementation":"Replaced transient(address) + transient(uint256) with packed transient(uint256). V2 packs pool|fee<<160, V3 packs pool only (fee=0). Callback reads convert(packed % 2^160, address) for assertion + packed>>160 for fee."}}
{"run":182,"commit":"1e48954","metric":4343545,"metrics":{"bytecode_size":20097,"v2_v2_v2":181861,"v2_v2_v3":160911,"v2_v2_v4":189214,"v2_v3_v2":164812,"v2_v3_v3":144888,"v2_v3_v4":176845,"v2_v4_v2":190504,"v2_v4_v3":169578,"v2_v4_v4":153016,"v3_v2_v2":160818,"v3_v2_v3":144852,"v3_v2_v4":171744,"v3_v3_v2":144843,"v3_v3_v3":142102,"v3_v3_v4":162813,"v3_v4_v2":169488,"v3_v4_v3":161051,"v3_v4_v4":141719,"v4_v2_v2":185718,"v4_v2_v3":168779,"v4_v2_v4":170192,"v4_v3_v2":168717,"v4_v3_v3":160618,"v4_v3_v4":155724,"v4_v4_v2":150131,"v4_v4_v3":160287,"v4_v4_v4":92320},"status":"discard","description":"Cached TLOAD in V2 callbacks: +51 gas regression — Venom already optimizes","timestamp":1781141627779,"segment":4,"confidence":5.753374058815172,"asi":{"hypothesis":"Cache t_callback_packed TLOAD result to save 1 TLOAD per V2 callback","next_action_hint":"Revert to uncached reads — Venom already caches repeated TLOADs automatically. Manual caching adds overhead (extra parameter passing, memory allocation) that exceeds the savings."}}
{"run":183,"commit":"1e48954","metric":4343494,"metrics":{"bytecode_size":20079,"v2_v2_v2":181844,"v2_v2_v3":160911,"v2_v2_v4":189214,"v2_v3_v2":164795,"v2_v3_v3":144888,"v2_v3_v4":176845,"v2_v4_v2":190487,"v2_v4_v3":169578,"v2_v4_v4":153016,"v3_v2_v2":160818,"v3_v2_v3":144852,"v3_v2_v4":171744,"v3_v3_v2":144843,"v3_v3_v3":142102,"v3_v3_v4":162813,"v3_v4_v2":169488,"v3_v4_v3":161051,"v3_v4_v4":141719,"v4_v2_v2":185718,"v4_v2_v3":168779,"v4_v2_v4":170192,"v4_v3_v2":168717,"v4_v3_v3":160618,"v4_v3_v4":155724,"v4_v4_v2":150131,"v4_v4_v3":160287,"v4_v4_v4":92320},"status":"discard","description":"Replace unsafe_mul with << 160 for packed callback — no gas change","timestamp":1781141932509,"segment":4,"confidence":7.655576559546314,"asi":{"hypothesis":"Replace unsafe_mul(fee, CALLBACK_FEE_SHIFT) with fee << 160 for cheaper SHL opcode","next_action_hint":"Both generate identical bytecode. Keep << 160 as it's more readable. Try a different optimization."}}
{"run":184,"commit":"1e48954","metric":4343494,"metrics":{"v2_v3_v3":144888,"v2_v2_v4":189214,"v2_v2_v2":181844,"v2_v4_v2":190487,"v2_v4_v3":169578,"v2_v3_v2":164795,"v2_v3_v4":176845,"v2_v2_v3":160911,"v3_v2_v4":171744,"v3_v2_v2":160818,"v2_v4_v4":153016,"v3_v2_v3":144852,"v3_v3_v2":144843,"v3_v3_v3":142102,"v3_v3_v4":162813,"v3_v4_v2":169488,"v3_v4_v3":161051,"v3_v4_v4":141719,"v4_v2_v2":185718,"v4_v2_v3":168779,"v4_v2_v4":170192,"v4_v3_v2":168717,"v4_v4_v2":150131,"v4_v3_v3":160618,"v4_v3_v4":155724,"v4_v4_v3":160287,"v4_v4_v4":92320,"bytecode_size":20079},"status":"discard","description":"Replace convert(packed%SHIFT,address) with convert(msg.sender,uint256)==packed%SHIFT — no gas change","timestamp":1781142604817,"segment":4,"confidence":9.185302789748242,"asi":{"hypothesis":"Avoid Vyper convert(uint256,address) bounds check by comparing as uint256 instead","finding":"Venom already eliminates the bounds check when modulo 2^16 guarantees the value fits. No gas savings."}}
{"run":185,"commit":"1e48954","metric":4343494,"metrics":{"v2_v3_v3":144888,"v2_v2_v4":189214,"v2_v2_v2":181844,"v2_v4_v2":190487,"v2_v4_v3":169578,"v2_v3_v2":164795,"v2_v3_v4":176845,"v2_v2_v3":160911,"v3_v2_v4":171744,"v3_v2_v2":160818,"v2_v4_v4":153016,"v3_v2_v3":144852,"v3_v3_v2":144843,"v3_v3_v3":142102,"v3_v3_v4":162813,"v3_v4_v2":169488,"v3_v4_v3":161051,"v3_v4_v4":141719,"v4_v2_v2":185718,"v4_v2_v3":168779,"v4_v2_v4":170192,"v4_v3_v2":168717,"v4_v4_v2":150131,"v4_v3_v3":160618,"v4_v3_v4":155724,"v4_v4_v3":160287,"v4_v4_v4":92320,"bytecode_size":20079},"status":"discard","description":"Add skip_contract_check=True to staticcall operations — no gas change","timestamp":1781143068806,"segment":4,"confidence":14.061805555555555,"asi":{"finding":"Vyper 0.5.0a2 already skips EXTCODESIZE check for staticcall by default. skip_contract_check=True is redundant for staticcall (it only affects extcall). no gas savings.","hypothesis":"Add skip_contract_check=True to all staticcall operations to skip EXTCODESIZE check (~100 gas per call)"}}
{"run":186,"commit":"1e48954","metric":0,"metrics":{"v2_v3_v3":0,"v2_v2_v4":0,"v2_v2_v2":0,"v2_v4_v2":0,"v2_v4_v3":0,"v2_v3_v2":0,"v2_v3_v4":0,"v2_v2_v3":0,"v3_v2_v4":0,"v3_v2_v2":0,"v2_v4_v4":0,"v3_v2_v3":0,"v3_v3_v2":0,"v3_v3_v3":0,"v3_v3_v4":0,"v3_v4_v2":0,"v3_v4_v3":0,"v3_v4_v4":0,"v4_v2_v2":0,"v4_v2_v3":0,"v4_v2_v4":0,"v4_v3_v2":0,"v4_v4_v2":0,"v4_v3_v3":0,"v4_v3_v4":0,"v4_v4_v3":0,"v4_v4_v4":0,"bytecode_size":0},"status":"crash","description":"Read opcode as uint256 instead of bytes1 — test errors (type mismatch)","timestamp":1781143234552,"segment":4,"confidence":14.061805555555555,"asi":{"finding":"uint256 comparison vs bytes1 doesn't work - COMMAND_* constants are bytes1 type, can't compare with uint256 without convert. Type mismatch causes errors.","hypothesis":"Read dispatch opcode as uint256 instead of bytes1 to potentially save gas on comparison"}}
{"run":187,"commit":"46f2f22","metric":4342694,"metrics":{"v2_v2_v2":181844,"v2_v2_v4":189181,"v2_v4_v2":190454,"v2_v3_v3":144888,"v2_v2_v3":160911,"v2_v3_v2":164795,"v2_v4_v3":169545,"v2_v4_v4":152950,"v2_v3_v4":176812,"v3_v3_v2":144843,"v3_v2_v2":160818,"v3_v2_v3":144852,"v3_v2_v4":171711,"v3_v4_v2":169455,"v3_v3_v3":142102,"v3_v3_v4":162787,"v3_v4_v3":161024,"v4_v2_v4":170139,"v3_v4_v4":141666,"v4_v2_v2":185685,"v4_v2_v3":168746,"v4_v4_v2":150065,"v4_v3_v4":155671,"v4_v3_v2":168684,"v4_v3_v3":160592,"v4_v4_v3":160234,"v4_v4_v4":92240,"bytecode_size":20080},"status":"keep","description":"Inline hooks_addr in V4_SWAP_COMPACT using ternary — -800 gas","timestamp":1781143730941,"segment":4,"confidence":11.439673913043478,"asi":{"hypothesis":"Inline hooks_addr using ternary expression in PoolKey constructor, eliminating empty(address) MSTORE initialization in common case (no hooks)","gas_change":"-800 gas vs 4343494 previous best","paths_affected":"All V4-involving paths saved gas (v4_v4_v4: 92320→92240, -80; v4_v4_v2: 150131→150065, -66; etc.)","implementation":"Replace hooks_addr: address = empty(address) + if/else with inline ternary: hooks=self.t_addresses[hooks_idx] if hooks_idx != V4_NATIVE_SENTINEL else empty(address)"}}
{"run":188,"commit":"ee360ef","metric":4342694,"metrics":{"v2_v2_v2":181844,"v2_v2_v4":189181,"v2_v2_v3":160911,"v2_v3_v3":144888,"v2_v4_v2":190454,"v2_v4_v4":152950,"v2_v3_v2":164795,"v2_v3_v4":176812,"v2_v4_v3":169545,"v3_v2_v4":171711,"v3_v2_v3":144852,"v3_v2_v2":160818,"v3_v3_v2":144843,"v3_v3_v3":142102,"v3_v4_v2":169455,"v3_v3_v4":162787,"v3_v4_v3":161024,"v3_v4_v4":141666,"v4_v2_v2":185685,"v4_v2_v4":170139,"v4_v2_v3":168746,"v4_v3_v2":168684,"v4_v3_v3":160592,"v4_v4_v2":150065,"v4_v4_v3":160234,"v4_v4_v4":92240,"v4_v3_v4":155671,"bytecode_size":20052},"status":"keep","description":"Inline hooks_addr in V4_SWAP_DYNAMIC + V4_BATCH — no gas, -28 bytes","timestamp":1781143859716,"segment":4,"confidence":9.396875,"asi":{"finding":"Inline ternary in V4_SWAP_DYNAMIC and V4_BATCH — no gas change (not in benchmarks), -28 bytes bytecode","hypothesis":"Apply same inline ternary hooks pattern to V4_SWAP_DYNAMIC and V4_BATCH handlers"}}
{"run":189,"commit":"46f2f22","metric":4342694,"metrics":{"v2_v3_v3":144888,"v2_v2_v4":189181,"v2_v2_v2":181844,"v2_v4_v2":190454,"v2_v4_v3":169545,"v2_v3_v2":164795,"v2_v3_v4":176812,"v2_v2_v3":160911,"v3_v2_v4":171711,"v3_v2_v2":160818,"v2_v4_v4":152950,"v3_v2_v3":144852,"v3_v3_v2":144843,"v3_v3_v3":142102,"v3_v3_v4":162787,"v3_v4_v2":169455,"v3_v4_v3":161024,"v3_v4_v4":141666,"v4_v2_v2":185685,"v4_v2_v3":168746,"v4_v2_v4":170139,"v4_v3_v2":168684,"v4_v4_v2":150065,"v4_v3_v3":160592,"v4_v3_v4":155671,"v4_v4_v3":160234,"v4_v4_v4":92240,"bytecode_size":20052},"status":"discard","description":"Nested ternary for currency resolution in V4_SWAP_COMPACT — no gas change","timestamp":1781144027130,"segment":4,"confidence":9.396875,"asi":{"finding":"Nested ternary for multi-branch sentinel (5-way) has no gas advantage. Only simple 2-way ternary saves gas.","hypothesis":"Inline currency resolution using nested ternary to eliminate empty(address) initialization"}}
{"run":190,"commit":"46f2f22","metric":4342728,"metrics":{"v2_v2_v2":181844,"v2_v2_v4":189181,"v2_v2_v3":160911,"v2_v3_v3":144888,"v2_v4_v2":190454,"v2_v4_v3":169545,"v2_v3_v2":164795,"v2_v3_v4":176812,"v2_v4_v4":152950,"v3_v2_v4":171711,"v3_v2_v2":160818,"v3_v2_v3":144852,"v3_v3_v2":144843,"v3_v3_v3":142136,"v3_v4_v2":169455,"v3_v3_v4":162787,"v3_v4_v3":161024,"v3_v4_v4":141666,"v4_v2_v2":185685,"v4_v2_v3":168746,"v4_v2_v4":170139,"v4_v3_v2":168684,"v4_v4_v2":150065,"v4_v3_v3":160592,"v4_v3_v4":155671,"v4_v4_v3":160234,"v4_v4_v4":92240,"bytecode_size":19978},"status":"discard","description":"Merge V3 auto-pay branches using ternary — +34 gas regression","timestamp":1781144264958,"segment":4,"confidence":9.396875,"asi":{"finding":"Merging V3 auto-pay branches with ternary + single extcall causes +34 gas regression. The merged code adds overhead from the owed computation (2 conditionals for owed + token), and Vyper's ternary for staticcall may not be as well optimized by Venom as the if/elif pattern with separate extcalls. The -74 bytes bytecode is nice but gas regresses.","hypothesis":"Merge V3 auto-pay if/elif branches using ternary for token selection and single extcall"}}
{"run":191,"commit":"46f2f22","metric":4343067,"metrics":{"v2_v2_v2":181844,"v2_v2_v3":160927,"v2_v2_v4":189181,"v2_v3_v2":164811,"v2_v3_v3":144914,"v2_v4_v2":190454,"v2_v3_v4":176828,"v2_v4_v3":169561,"v2_v4_v4":152950,"v3_v2_v2":160834,"v3_v2_v3":144877,"v3_v2_v4":171727,"v3_v3_v2":144868,"v3_v3_v3":142140,"v3_v3_v4":162812,"v3_v4_v2":169471,"v3_v4_v3":161050,"v3_v4_v4":141679,"v4_v2_v2":185685,"v4_v2_v3":168762,"v4_v2_v4":170139,"v4_v3_v2":168700,"v4_v3_v3":160617,"v4_v3_v4":155684,"v4_v4_v2":150065,"v4_v4_v3":160247,"v4_v4_v4":92240,"bytecode_size":20062},"status":"discard","description":"Skip MOD in V3 callback assertion — +373 gas regression","timestamp":1781145042279,"segment":4,"confidence":10.971592389887933,"asi":{"finding":"Skipping MOD in V3 callback assertion causes +373 gas regression. convert(uint256, address) bounds check that validates upper 96 bits is MORE expensive than the MOD + convert chain. The MOD (2^160) is optimized by Venom to AND, which is cheap. The bounds check in convert is apparently a full comparison of the upper bits.","hypothesis":"Skip MOD in V3 callback assertion since fee=0 means upper bits are zero"}}
{"type":"config","name":"Mint vs Take gas investigation","metricName":"total_gas","metricUnit":"gas","bestDirection":"lower"}
{"run":192,"commit":"0122653","metric":4342694,"metrics":{"v2_v2_v4":189181,"v2_v3_v3":144888,"v2_v2_v2":181844,"v2_v4_v2":190454,"v2_v2_v3":160911,"v2_v3_v2":164795,"v2_v3_v4":176812,"v2_v4_v3":169545,"v2_v4_v4":152950,"v3_v2_v3":144852,"v3_v2_v2":160818,"v3_v2_v4":171711,"v3_v3_v2":144843,"v3_v3_v3":142102,"v3_v4_v2":169455,"v3_v3_v4":162787,"v3_v4_v4":141666,"v3_v4_v3":161024,"v4_v2_v3":168746,"v4_v2_v2":185685,"v4_v2_v4":170139,"v4_v3_v2":168684,"v4_v3_v3":160592,"v4_v4_v2":150065,"v4_v3_v4":155671,"v4_v4_v4":92240,"v4_v4_v3":160234,"bytecode_size":20052},"status":"keep","description":"Baseline measurement for mint vs take investigation","timestamp":1781146404810,"segment":5,"confidence":null,"asi":{"hypothesis":"Baseline for investigating mint vs take gas advantage"}}
{"run":193,"commit":"ee360ef","metric":4342694,"metrics":{"v2_v2_v4":189181,"v2_v3_v3":144888,"v2_v2_v2":181844,"v2_v4_v2":190454,"v2_v2_v3":160911,"v2_v3_v2":164795,"v2_v3_v4":176812,"v2_v4_v3":169545,"v2_v4_v4":152950,"v3_v2_v3":144852,"v3_v2_v2":160818,"v3_v2_v4":171711,"v3_v3_v2":144843,"v3_v3_v3":142102,"v3_v4_v2":169455,"v3_v3_v4":162787,"v3_v4_v4":141666,"v3_v4_v3":161024,"v4_v2_v3":168746,"v4_v2_v2":185685,"v4_v2_v4":170139,"v4_v3_v2":168684,"v4_v3_v3":160592,"v4_v4_v2":150065,"v4_v3_v4":155671,"v4_v4_v4":92240,"v4_v4_v3":160234,"bytecode_size":20052},"status":"discard","description":"Investigate mint vs take for profit capture — MINT IS NOT GAS ADVANTAGEOUS","timestamp":1781146826696,"segment":5,"confidence":null,"asi":{"finding":"MINT IS NOT gas advantageous for single-transaction profit capture. Cold SSTORE for erc6909_balance_of (0-nonzero 22100 gas) is MORE expensive than warm WETH balance updates in take path (~5K gas). Tests also fail because mint ERC6909 Transfer event differs from ERC20 Transfer event, breaking transfer count assertions. Mint only saves gas in compounding scenarios (warm erc6909 balance slots from prior mint).","gas_impact":"Mint would ADD ~18K gas per positive delta settlement vs take","hypothesis":"Replace PM.take() with PM.mint() for positive deltas to save gas","next_action_hint":"Consider V4_MINT_DELTA as a new command for compounding use cases. Won't help benchmarks since test code is off-limits.","rollback_reason":"Mint is more expensive for cold paths. Breaks tests even if gas were equal."}}
