{"run":209,"commit":"1247af1","metric":4235570,"metrics":{"bytecode_size":19515,"v2_v2_v2":181628,"v2_v2_v3":160815,"v2_v2_v4":193953,"v2_v3_v2":164500,"v2_v3_v3":144748,"v2_v3_v4":181316,"v2_v4_v2":190021,"v2_v4_v3":169232,"v2_v4_v4":157602,"v3_v2_v2":160722,"v3_v2_v3":144712,"v3_v2_v4":176360,"v3_v3_v2":144703,"v3_v3_v3":142140,"v3_v3_v4":162591,"v3_v4_v2":169157,"v3_v4_v3":160723,"v3_v4_v4":141613,"v4_v2_v2":168559,"v4_v2_v3":151654,"v4_v2_v4":170017,"v4_v3_v2":151607,"v4_v3_v3":146683,"v4_v3_v4":155540,"v4_v4_v2":132893,"v4_v4_v3":125620,"v4_v4_v4":86461},"status":"keep","description":"Consistent & mask for uint96 amount extraction — no gas change, purely cosmetic. Venom already optimizes % to AND for powers of 2.","timestamp":1781160679048,"segment":5,"confidence":55.37554923752908,"asi":{"hypothesis":"Switch V4 handlers from % 2^96 to & (2^96-1) for consistency with V2/V3/SEND_ETH handlers. Check if Venom handles them differently.","result":"No gas change. Venom correctly optimizes % to AND for powers of 2."}}
{"run":210,"commit":"1247af1","metric":4235570,"metrics":{"bytecode_size":19515,"v2_v2_v2":181628,"v2_v2_v3":160815,"v2_v2_v4":193953,"v2_v3_v2":164500,"v2_v3_v3":144748,"v2_v3_v4":181316,"v2_v4_v2":190021,"v2_v4_v3":169232,"v2_v4_v4":157602,"v3_v2_v2":160722,"v3_v2_v3":144712,"v3_v2_v4":176360,"v3_v3_v2":144703,"v3_v3_v3":142140,"v3_v3_v4":162591,"v3_v4_v2":169157,"v3_v4_v3":160723,"v3_v4_v4":141613,"v4_v2_v2":168559,"v4_v2_v3":151654,"v4_v2_v4":170017,"v4_v3_v2":151607,"v4_v3_v3":146683,"v4_v3_v4":155540,"v4_v4_v2":132893,"v4_v4_v3":125620,"v4_v4_v4":86461},"status":"discard","description":"Double convert remove attempt — no gas change, reverted for semantic correctness. ERC6909 id computation needs uint160 truncation.","timestamp":1781160872004,"segment":5,"confidence":49.50277264325324,"asi":{"hypothesis":"Remove double convert(convert(currency, uint160), uint256) → convert(currency, uint256) for ERC6909 id calculation","result":"No gas change. Venom already optimizes double convert. Reverted — the uint160 truncation is semantically important for correctness."}}
{"run":211,"commit":"73758d9","metric":4231136,"metrics":{"bytecode_size":19425,"v2_v2_v2":181663,"v2_v2_v3":160853,"v2_v2_v4":193800,"v2_v3_v2":164535,"v2_v3_v3":144779,"v2_v3_v4":181169,"v2_v4_v2":189554,"v2_v4_v3":168768,"v2_v4_v4":157264,"v3_v2_v2":160760,"v3_v2_v3":144742,"v3_v2_v4":176207,"v3_v3_v2":144733,"v3_v3_v3":142252,"v3_v3_v4":162473,"v3_v4_v2":168699,"v3_v4_v3":160356,"v3_v4_v4":141348,"v4_v2_v2":168412,"v4_v2_v3":151507,"v4_v2_v4":169752,"v4_v3_v2":151460,"v4_v3_v3":146565,"v4_v3_v4":155274,"v4_v4_v2":132561,"v4_v4_v3":125354,"v4_v4_v4":86296},"status":"keep","description":"Replace DynArray[address,32] with fixed address[32] + t_addr_count. Eliminates bounds checks on every indexed address access, saving -4,434 gas and -90 bytes bytecode.","timestamp":1781161106482,"segment":5,"confidence":34.84009993753904,"asi":{"hypothesis":"Replace transient(DynArray[address, 32]) with transient(address[32]) + t_addr_count to eliminate DynArray bounds checks on every indexed access","key_insight":"DynArray does a bounds check (idx < len) on every indexed read, costing ~3-6 gas each. With 20+ address lookups per path, this adds up. Fixed array skips bounds check entirely. Also saves 90 bytes bytecode from removing DynArray length tracking code.","savings":"-4,434 gas total, -90 bytes bytecode. Every path benefits because all handlers do t_addresses lookups."}}
{"run":212,"commit":"73758d9","metric":4231136,"metrics":{"v2_v2_v2":181663,"v2_v2_v3":160853,"v2_v2_v4":193800,"v2_v3_v2":164535,"v2_v3_v3":144779,"v2_v3_v4":181169,"v2_v4_v2":189554,"v2_v4_v3":168768,"v2_v4_v4":157264,"v3_v2_v2":160760,"v3_v2_v3":144742,"v3_v2_v4":176207,"v3_v3_v2":144733,"v3_v3_v3":142252,"v3_v3_v4":162473,"v3_v4_v2":168699,"v3_v4_v3":160356,"v3_v4_v4":141348,"v4_v2_v2":168412,"v4_v2_v3":151507,"v4_v2_v4":169752,"v4_v3_v2":151460,"v4_v3_v3":146565,"v4_v3_v4":155274,"v4_v4_v2":132561,"v4_v4_v3":125354,"v4_v4_v4":86296,"bytecode_size":19423},"status":"discard","description":"V2 fee uint16→uint8: 0 gas change, -2 bytes bytecode. 1 byte per V2 swap too small to affect execution gas.","timestamp":1781161957265,"segment":5,"confidence":26.46690391459075,"asi":{"hypothesis":"Shrink V2 fee from uint16 (2 bytes) to uint8 (1 byte). All V2 fees fit in uint8 (max 255 bps).","key_insight":"1 byte saved per V2 swap too small to affect execution gas. Calldata savings not measured. Memory expansion ~3 gas/32 bytes. Earlier uint128->uint96 worked because 4-20 bytes per field.","next_action_hint":"Look for larger encoding reductions or different optimization vectors."}}
{"run":213,"commit":"f0cacaa","metric":4227412,"metrics":{"v2_v2_v2":181663,"v2_v2_v3":160853,"v2_v2_v4":193800,"v2_v3_v2":164535,"v2_v3_v3":144779,"v2_v3_v4":177445,"v2_v4_v2":189554,"v2_v4_v3":168768,"v2_v4_v4":157264,"v3_v2_v2":160760,"v3_v2_v3":144742,"v3_v2_v4":176207,"v3_v3_v2":144733,"v3_v3_v3":142252,"v3_v3_v4":162473,"v3_v4_v2":168699,"v3_v4_v3":160356,"v3_v4_v4":141348,"v4_v2_v2":168412,"v4_v2_v3":151507,"v4_v2_v4":169752,"v4_v3_v2":151460,"v4_v3_v3":146565,"v4_v3_v4":155274,"v4_v4_v2":132561,"v4_v4_v3":125354,"v4_v4_v4":86296,"bytecode_size":19425},"status":"keep","description":"V2V3V4: Replace V4_SYNC+V4_SETTLE with V4_SETTLE_DELTA when delta=0 after takes. Saves -3,724 gas (1 sync extcall + 1 settle extcall → 1 extload no-op).","timestamp":1781162264646,"segment":5,"confidence":27.350415183867142,"asi":{"hypothesis":"Replace V4_SYNC(WETH) + V4_SETTLE with V4_SETTLE_DELTA(WETH) in V2V3V4 path. After V4_TAKE exhausts all WETH from swap, the delta is zero, so SETTLE_DELTA is a no-op (just extload) vs sync+settle which does 2 extcalls.","key_insight":"V4_SYNC + V4_SETTLE does sync (extcall ~2600 gas) + settle (extcall ~2600 gas) = ~5200 gas. V4_SETTLE_DELTA does extload (~2600 gas) + no-op if delta=0. Saves ~2600 gas when delta is zero. Equivalent when delta is nonzero. Only applicable when there are no external deposits between sync and settle.","savings":"-3,724 gas on V2V3V4 path (181,169 → 177,445). No other paths affected."}}
{"run":214,"commit":"00b8c22","metric":4227331,"metrics":{"v2_v2_v4":193800,"v2_v3_v3":144779,"v2_v2_v2":181636,"v2_v4_v2":189527,"v2_v2_v3":160853,"v2_v3_v2":164508,"v2_v3_v4":177445,"v2_v4_v3":168768,"v2_v4_v4":157264,"v3_v2_v3":144742,"v3_v2_v2":160760,"v3_v2_v4":176207,"v3_v3_v2":144733,"v3_v3_v3":142252,"v3_v4_v2":168699,"v3_v3_v4":162473,"v3_v4_v4":141348,"v3_v4_v3":160356,"v4_v2_v3":151507,"v4_v2_v2":168412,"v4_v2_v4":169752,"v4_v3_v2":151460,"v4_v3_v3":146565,"v4_v4_v2":132561,"v4_v3_v4":155274,"v4_v4_v4":86296,"v4_v4_v3":125354,"bytecode_size":19350},"status":"keep","description":"Simplify V2 callback auto-pay check: len(data)==1 instead of len+slice+convert+0xFE compare. -81 gas, -75 bytes bytecode.","timestamp":1781163071142,"segment":5,"confidence":27.369632265717676,"asi":{"bytecode_reduction":"-75 bytes","hypothesis":"Replace V2 callback auto-pay check (len+slice+convert+0xFE compare) with simple len(data)==1 check","paths_improved":"V2V2V2 -27, V2V3V2 -27, V2V4V2 -27"}}
{"run":215,"commit":"abc","metric":4227607,"metrics":{"v2_v2_v4":193827,"v2_v3_v3":144779,"v2_v2_v2":181636,"v2_v4_v2":189554,"v2_v2_v3":160853,"v2_v3_v2":164508,"v2_v3_v4":177472,"v2_v4_v3":168795,"v2_v4_v4":157291,"v3_v2_v3":144742,"v3_v2_v2":160760,"v3_v2_v4":176234,"v3_v3_v2":144733,"v3_v3_v3":142252,"v3_v4_v2":168726,"v3_v3_v4":162495,"v3_v4_v4":141369,"v3_v4_v3":160378,"v4_v2_v3":151507,"v4_v2_v2":168412,"v4_v2_v4":169752,"v4_v3_v2":151460,"v4_v3_v3":146565,"v4_v4_v2":132561,"v4_v3_v4":155296,"v4_v4_v4":86296,"v4_v4_v3":125354,"bytecode_size":19275},"status":"discard","description":"Replace inline sentinel in V4_SYNC with _lookup_address: +276 gas regression. INVOKE overhead exceeds savings.","timestamp":1781163245141,"segment":5,"confidence":29.36939918533605,"asi":{"hypothesis":"Replace inline sentinel resolution in V4_SYNC with _lookup_address call to save bytecode","next_action_hint":"Revert and keep inline sentinel resolution in V4_SYNC","regression_reason":"INVOKE overhead ~80 gas per call exceeds savings from removing inline code"}}
{"run":216,"commit":"abc","metric":4227388,"metrics":{"v2_v2_v4":193800,"v2_v3_v3":144779,"v2_v2_v2":181655,"v2_v4_v2":189546,"v2_v2_v3":160853,"v2_v3_v2":164527,"v2_v3_v4":177445,"v2_v4_v3":168768,"v2_v4_v4":157264,"v3_v2_v3":144742,"v3_v2_v2":160760,"v3_v2_v4":176207,"v3_v3_v2":144733,"v3_v3_v3":142252,"v3_v4_v2":168699,"v3_v3_v4":162473,"v3_v4_v4":141348,"v3_v4_v3":160356,"v4_v2_v3":151507,"v4_v2_v2":168412,"v4_v2_v4":169752,"v4_v3_v2":151460,"v4_v3_v3":146565,"v4_v4_v2":132561,"v4_v3_v4":155274,"v4_v4_v4":86296,"v4_v4_v3":125354,"bytecode_size":19345},"status":"discard","description":"Conditional V2 fee packing: +57 gas regression. Branch overhead exceeds saved mul+OR.","timestamp":1781163403918,"segment":5,"confidence":31.68442735512222,"asi":{"hypothesis":"Conditional fee packing: skip mul+OR for non-auto-pay V2 swaps","next_action_hint":"Revert to unconditional fee packing","rollback_reason":"Branch overhead +57 gas exceeds savings from skipping mul+OR"}}
{"run":217,"commit":"abc","metric":4227707,"metrics":{"v2_v2_v4":193800,"v2_v2_v2":181636,"v2_v3_v3":144804,"v2_v3_v2":164524,"v2_v2_v3":160869,"v2_v4_v2":189527,"v2_v3_v4":177461,"v2_v4_v4":157264,"v3_v2_v2":160776,"v2_v4_v3":168784,"v3_v2_v3":144768,"v3_v3_v2":144759,"v3_v2_v4":176223,"v3_v3_v3":142291,"v3_v3_v4":162499,"v3_v4_v2":168715,"v3_v4_v3":160382,"v3_v4_v4":141360,"v4_v2_v2":168412,"v4_v2_v4":169752,"v4_v2_v3":151523,"v4_v3_v2":151476,"v4_v3_v3":146591,"v4_v3_v4":155287,"v4_v4_v4":86296,"v4_v4_v2":132561,"v4_v4_v3":125367,"bytecode_size":19360},"status":"checks_failed","description":"Remove % SHIFT from V3 callback assertions: +376 gas regression. convert() bounds check not eliminated by Venom for TLOAD values without % hint.","timestamp":1781163700029,"segment":5,"confidence":23.190873454618554,"asi":{"hypothesis":"Remove % CALLBACK_FEE_SHIFT from V3 callback assertions since V3 stores fee=0 (upper bits zero)","regression_reason":"convert(uint256, address) has a bounds check that Venom can't optimize away for TLOAD values. The % mask actually HELPS Venom skip the bounds check by proving value < 2^160. Without %, the bounds check is still performed (+16-39 gas per V3 callback). Also caused a check crash (xdist worker) — likely the convert() revert in edge cases.","next_action_hint":"Revert immediately. The % mask is beneficial because it helps Venom eliminate the bounds check. Never remove explicit bounds-hinting operations."}}
{"run":218,"commit":"abc","metric":4228483,"metrics":{"v2_v2_v4":193834,"v2_v2_v2":181670,"v2_v3_v3":144820,"v2_v3_v2":164559,"v2_v2_v3":160887,"v2_v4_v2":189578,"v2_v3_v4":177496,"v2_v4_v3":168819,"v2_v4_v4":157298,"v3_v2_v2":160794,"v3_v2_v3":144783,"v3_v2_v4":176258,"v3_v3_v2":144774,"v3_v3_v3":142293,"v3_v3_v4":162528,"v3_v4_v2":168750,"v3_v4_v3":160411,"v3_v4_v4":141388,"v4_v2_v2":168446,"v4_v2_v4":169779,"v4_v2_v3":151558,"v4_v3_v2":151511,"v4_v3_v3":146620,"v4_v3_v4":155315,"v4_v4_v2":132595,"v4_v4_v4":86324,"v4_v4_v3":125395,"bytecode_size":19356},"status":"discard","description":"Cache len(data) in _process_commands: +1,152 gas regression. Saving len() result costs more than the MLOAD it replaces.","timestamp":1781163827198,"segment":5,"confidence":17.52438098131551,"asi":{"hypothesis":"Cache len(data) in _process_commands loop as `end` variable to avoid repeated len() calls","regression_reason":"The MSTORE+MLOAD for cached `end` variable (+6 gas per access) outweighs the savings from avoiding len() overhead. Venom's len() is already just MLOAD from the Bytes header (~3 gas).","next_action_hint":"Revert — repeated len() is cheaper than caching. Venom optimizes len() to a simple MLOAD."}}
{"run":219,"commit":"abc","metric":4227968,"metrics":{"v2_v2_v2":181636,"v2_v2_v4":193800,"v2_v4_v2":189527,"v2_v2_v3":160853,"v2_v3_v3":144779,"v2_v3_v2":164508,"v2_v4_v4":157382,"v2_v4_v3":168768,"v3_v2_v2":160760,"v2_v3_v4":177563,"v3_v2_v4":176325,"v3_v2_v3":144742,"v3_v3_v4":162568,"v3_v3_v3":142252,"v3_v3_v2":144733,"v3_v4_v3":160356,"v3_v4_v2":168699,"v4_v2_v2":168412,"v3_v4_v4":141442,"v4_v3_v2":151460,"v4_v2_v4":169752,"v4_v2_v3":151507,"v4_v3_v3":146565,"v4_v3_v4":155368,"v4_v4_v3":125354,"v4_v4_v2":132561,"v4_v4_v4":86296,"bytecode_size":19604},"status":"discard","description":"V4_TAKE_SELF (0x5A) command: +637 gas regression. Bytecode expansion + dispatch overhead exceeds 1-byte calldata savings per self-take.","timestamp":1781164195596,"segment":5,"confidence":16.708378593670794,"asi":{"hypothesis":"V4_TAKE_SELF command (0x5A) for self-directed takes: saves 1 byte calldata + recipient sentinel dispatch per self-take","regression_reason":"New handler adds ~250+ bytes bytecode + dispatch entry. The 1-byte calldata savings (~16 gas × 6 takes = ~96 gas) is dwarfed by: (1) dispatch table expansion (1 more elif), (2) Venom's increased bytecode affecting memory layout, (3) the handler itself isn't cheaper — still needs currency sentinel resolution. The existing V4_TAKE_COMPACT + V4_SELF_SENTINEL is already optimal for self-takes.","next_action_hint":"Revert. Adding new commands for marginal encoding savings is counterproductive due to bytecode expansion and dispatch overhead."}}
{"run":220,"commit":"abc","metric":4227806,"metrics":{"v2_v2_v4":193841,"v2_v3_v3":144769,"v2_v3_v2":164496,"v2_v4_v2":189580,"v2_v2_v2":181612,"v2_v4_v4":157317,"v2_v3_v4":177433,"v2_v4_v3":168821,"v2_v2_v3":160829,"v3_v2_v3":144732,"v3_v2_v4":176260,"v3_v2_v2":160801,"v3_v3_v2":144776,"v3_v3_v3":142252,"v3_v4_v2":168752,"v3_v3_v4":162473,"v3_v4_v4":141348,"v4_v2_v3":151495,"v3_v4_v3":160356,"v4_v2_v2":168453,"v4_v3_v2":151513,"v4_v2_v4":169794,"v4_v3_v4":155274,"v4_v4_v2":132614,"v4_v4_v4":86296,"v4_v3_v3":146565,"v4_v4_v3":125354,"bytecode_size":19289},"status":"discard","description":"2-way ternary sentinel dispatch in V2_SWAP_DIRECT: +475 gas regression. _lookup_address INVOKE overhead hurts even for unused sentinel path.","timestamp":1781164419573,"segment":5,"confidence":15.964987544976474,"asi":{"hypothesis":"Replace inline sentinel dispatch in V2_SWAP_DIRECT with 2-way ternary using _lookup_address for sentinel branch","regression_reason":"The INVOKE overhead from _lookup_address affects Venom's code generation even when the sentinel branch is not taken. Bytecode shrank (-61 bytes) but gas increased. The empty(address) MSTORE elimination (~3 gas) doesn't offset the INVOKE overhead's effect on Venom's optimizer.","next_action_hint":"Revert. The inline sentinel dispatch is optimal. Don't replace with _lookup_address calls."}}
{"run":221,"commit":"3fe8d17","metric":4227241,"metrics":{"v2_v2_v4":193800,"v2_v4_v2":189497,"v2_v2_v2":181606,"v2_v3_v3":144779,"v2_v3_v2":164478,"v2_v4_v3":168768,"v2_v2_v3":160853,"v2_v3_v4":177445,"v2_v4_v4":157264,"v3_v3_v2":144733,"v3_v2_v2":160760,"v3_v2_v3":144742,"v3_v2_v4":176207,"v3_v4_v3":160356,"v3_v4_v2":168699,"v3_v3_v3":142252,"v3_v3_v4":162473,"v3_v4_v4":141348,"v4_v2_v4":169752,"v4_v2_v2":168412,"v4_v2_v3":151507,"v4_v3_v2":151460,"v4_v3_v3":146565,"v4_v3_v4":155274,"v4_v4_v2":132561,"v4_v4_v4":86296,"v4_v4_v3":125354,"bytecode_size":19395},"status":"keep","description":"Inline _v2_callback_handler into V2 callback functions: -90 gas. Eliminates INVOKE overhead per V2 callback dispatch.","timestamp":1781164574216,"segment":5,"confidence":16.054091635959118,"asi":{"hypothesis":"Inline _v2_callback_handler into V2 callback entry points (uniswapV2Call, hook, pancakeCall) to eliminate INVOKE overhead per V2 callback","savings_breakdown":"V2-callback paths improved: v2_v2_v2 -30, v2_v3_v2 -30, v2_v4_v2 -57. Average ~22.5 gas per V2 callback.","bytecode_impact":"+45 bytes (tripled the small if/else block in 3 functions) but gas improved, confirming INVOKE overhead is real and eliminable"}}
{"run":222,"commit":"49c97ea","metric":0,"metrics":{"v2_v2_v4":0,"v2_v3_v3":0,"v2_v2_v2":0,"v2_v4_v2":0,"v2_v2_v3":0,"v2_v3_v2":0,"v2_v3_v4":0,"v2_v4_v3":0,"v2_v4_v4":0,"v3_v2_v3":0,"v3_v2_v2":0,"v3_v2_v4":0,"v3_v3_v2":0,"v3_v3_v3":0,"v3_v4_v2":0,"v3_v3_v4":0,"v3_v4_v4":0,"v3_v4_v3":0,"v4_v2_v3":0,"v4_v2_v2":0,"v4_v2_v4":0,"v4_v3_v2":0,"v4_v3_v3":0,"v4_v4_v2":0,"v4_v3_v4":0,"v4_v4_v4":0,"v4_v4_v3":0,"bytecode_size":0},"status":"crash","description":"While loop for _process_commands — Vyper 0.5.0a2 doesn't support while loops (SyntaxException: unsupported 'While' Python AST node)","timestamp":1781165098097,"segment":5,"confidence":16.054091635959118,"asi":{"hypothesis":"Replace for-range loop with while loop to eliminate loop counter overhead (~6 gas per iteration)","next_action_hint":"Try a different loop optimization or a different experiment entirely","rollback_reason":"Vyper does not support while loops","vyper_limitation":"Vyper 0.5.0a2 only supports for-range loops, not while loops"}}
{"run":223,"commit":"a9438c3","metric":4227241,"metrics":{"v2_v3_v3":144779,"v2_v2_v4":193800,"v2_v4_v2":189497,"v2_v2_v2":181606,"v2_v3_v4":177445,"v2_v3_v2":164478,"v2_v4_v3":168768,"v2_v2_v3":160853,"v3_v2_v2":160760,"v2_v4_v4":157264,"v3_v2_v3":144742,"v3_v3_v3":142252,"v3_v2_v4":176207,"v3_v3_v2":144733,"v3_v3_v4":162473,"v3_v4_v4":141348,"v3_v4_v3":160356,"v3_v4_v2":168699,"v4_v2_v2":168412,"v4_v3_v2":151460,"v4_v2_v4":169752,"v4_v2_v3":151507,"v4_v3_v3":146565,"v4_v3_v4":155274,"v4_v4_v2":132561,"v4_v4_v3":125354,"v4_v4_v4":86296,"bytecode_size":19395},"status":"keep","description":"Reconfirm current best at 4,227,241 gas after while-loop crash (Vyper doesn't support while loops)","timestamp":1781165365059,"segment":5,"confidence":15.57229565686539,"asi":{"hypothesis":"Verify current best after V2 callback inlining and while-loop crash","description":"Confirmation run — no code changes, verifying total_gas=4,227,241 is stable"}}
{"run":224,"commit":"f0144db","metric":4226766,"metrics":{"v2_v3_v3":144779,"v2_v2_v2":181606,"v2_v4_v2":189497,"v2_v2_v3":160853,"v2_v2_v4":193800,"v2_v3_v4":177445,"v2_v4_v3":168768,"v2_v4_v4":157264,"v3_v2_v2":160760,"v2_v3_v2":164478,"v3_v2_v3":144742,"v3_v3_v3":142150,"v3_v2_v4":176207,"v3_v4_v2":168699,"v3_v3_v4":162473,"v3_v3_v2":144733,"v3_v4_v3":160356,"v3_v4_v4":141245,"v4_v2_v2":168412,"v4_v2_v3":151379,"v4_v3_v2":151332,"v4_v3_v4":155274,"v4_v2_v4":169752,"v4_v3_v3":146551,"v4_v4_v4":86296,"v4_v4_v3":125354,"v4_v4_v2":132561,"bytecode_size":19393},"status":"keep","description":"Reduce forward_len from uint16 (2 bytes) to uint8 (1 byte) for V2/V3/V4/TSTORE encoding. Saves -475 gas (1 byte per V2/V3/V4 command in calldata). SIZE_LEN_PREFIXED_HEADER: 3→2.","timestamp":1781165649612,"segment":5,"confidence":13.609767551068327,"asi":{"hypothesis":"Reduce forward_len from uint16 (2 bytes) to uint8 (1 byte) in V2_SWAP_COMPACT, V3_SWAP_COMPACT, V4_UNLOCK, and TSTORE_CONTINUATION encoding. Max forward_data 255 bytes is sufficient for all command streams.","encoding_changes":"V2_SWAP_COMPACT: 19→18 byte read, V3_SWAP_COMPACT: 17→16 byte read, V4_UNLOCK: read WIDTH_UINT8 instead of WIDTH_UINT16, SIZE_LEN_PREFIXED_HEADER: 3→2","savings_pattern":"1 byte saved per V2 swap + 1 per V3 swap + 1 per V4_UNLOCK"}}
{"run":225,"commit":"a44d5bf","metric":4220900,"metrics":{"v2_v2_v2":181606,"v2_v2_v3":160853,"v2_v2_v4":193800,"v2_v3_v2":164478,"v2_v3_v3":144779,"v2_v3_v4":177445,"v2_v4_v2":189497,"v2_v4_v3":168768,"v2_v4_v4":157264,"v3_v2_v2":160760,"v3_v2_v3":144742,"v3_v2_v4":176207,"v3_v3_v2":144733,"v3_v3_v3":142150,"v3_v3_v4":162473,"v3_v4_v2":168699,"v3_v4_v3":160356,"v3_v4_v4":141245,"v4_v2_v2":168412,"v4_v2_v3":151379,"v4_v2_v4":169752,"v4_v3_v2":151332,"v4_v3_v3":146551,"v4_v3_v4":149408,"v4_v4_v2":132561,"v4_v4_v3":125354,"v4_v4_v4":86296,"bytecode_size":19393},"status":"keep","description":"V4V3V4: Use V4_TAKE_DELTA instead of V4_TAKE_COMPACT for USDC and WETH takes. Takes net deltas directly, eliminating an unnecessary sync+transfer+settle roundtrip. Saves -5,866 gas on V4V3V4 path (155,274→149,408). V4_TAKE_DELTA not viable for other paths (partial takes or bytecode expansion).","timestamp":1781166770462,"segment":5,"confidence":16.021310181531177,"asi":{"delta_savings_per_take":"12 bytes encoding (saves ~192 gas calldata) + exttload (~130 gas delta read) = net ~60 gas per take for non-round-trip paths","v4v3v4_savings":"V4_TAKE_DELTA for WETH takes net delta (1 WETH) instead of over-withdrawing (2 WETH) and settling back (1 WETH). This eliminates 1 sync + 1 transfer + 1 settle = ~5,866 gas. Test transfer count updated from 4 to 3.","ineligible_paths":"V4_TAKE_DELTA CANNOT replace V4_TAKE_COMPACT when: 1) take is partial (amount < full delta), 2) bytecode expansion from inline sentinel/delta read affects all paths. Only V4V3V4 benefits because it eliminates an entire round-trip.","v2v2v4_issue":"V4_TAKE_DELTA for V2V2V4's first take would send 2 WETH to V2a instead of 1 — over-funding the pair with stuck excess tokens."}}
