{"type":"config","name":"cmd_executor 27-perm gas reduction","metricName":"total_gas","metricUnit":"gas","bestDirection":"lower"}
{"run":1,"commit":"8611375","metric":4416991,"metrics":{"v2_v2_v2":187849,"v2_v2_v4":191412,"v2_v3_v3":149929,"v2_v4_v2":193107,"v2_v3_v4":178793,"v2_v4_v3":172052,"v2_v2_v3":166744,"v2_v3_v2":170960,"v3_v2_v3":149886,"v2_v4_v4":152795,"v3_v2_v4":173858,"v3_v2_v2":166628,"v3_v3_v3":146776,"v3_v3_v2":149875,"v3_v3_v4":164675,"v3_v4_v2":171942,"v3_v4_v4":141712,"v4_v2_v3":171819,"v3_v4_v3":163200,"v4_v2_v2":188561,"v4_v2_v4":171430,"v4_v3_v4":154739,"v4_v3_v3":163184,"v4_v3_v2":171746,"v4_v4_v3":161013,"v4_v4_v4":91612,"v4_v4_v2":150694,"bytecode_size":22184},"status":"keep","description":"Baseline: 27-perm total_gas across all three-hop paths","timestamp":1781045509743,"segment":0,"confidence":null,"asi":{"hypothesis":"baseline measurement"}}
{"run":2,"commit":"8611375","metric":4417064,"metrics":{"v2_v2_v2":187849,"v2_v2_v4":191421,"v2_v3_v3":149929,"v2_v4_v2":193107,"v2_v3_v4":178793,"v2_v4_v3":172052,"v2_v2_v3":166744,"v2_v3_v2":170960,"v3_v2_v3":149886,"v2_v4_v4":152795,"v3_v2_v4":173858,"v3_v2_v2":166628,"v3_v3_v3":146776,"v3_v3_v2":149875,"v3_v3_v4":164675,"v3_v4_v2":171942,"v3_v4_v4":141712,"v4_v2_v3":171828,"v3_v4_v3":163200,"v4_v2_v2":188570,"v4_v2_v4":171444,"v4_v3_v4":154746,"v4_v3_v3":163184,"v4_v3_v2":171755,"v4_v4_v3":161020,"v4_v4_v4":91612,"v4_v4_v2":150703,"bytecode_size":22186},"status":"discard","description":"abi_encode in _compute_delta_slot — +73 gas regression","timestamp":1781045681765,"segment":0,"confidence":null,"asi":{"hypothesis":"Replace concat(convert(...), convert(...)) with abi_encode(self, currency) in _compute_delta_slot","result":"tiny regression +73 gas, abi_encode slightly more expensive than concat+convert approach"}}
{"run":3,"commit":"91d4bf2","metric":4405366,"metrics":{"v2_v2_v2":187504,"v2_v2_v4":190354,"v2_v3_v3":149791,"v2_v4_v2":192486,"v2_v3_v4":177459,"v2_v4_v3":171316,"v2_v2_v3":166284,"v2_v3_v2":170937,"v3_v2_v3":149748,"v2_v4_v4":151875,"v3_v2_v4":172984,"v3_v2_v2":166168,"v3_v3_v3":146887,"v3_v3_v2":149737,"v3_v3_v4":164233,"v3_v4_v2":171206,"v3_v4_v4":141234,"v4_v2_v3":171543,"v3_v4_v3":162869,"v4_v2_v2":187963,"v4_v2_v4":171209,"v4_v3_v4":154297,"v4_v3_v3":162852,"v4_v3_v2":171470,"v4_v4_v3":161050,"v4_v4_v4":91538,"v4_v4_v2":150372,"bytecode_size":22184},"status":"keep","description":"Dispatch reorder by frequency: -11,625 gas","timestamp":1781045896726,"segment":0,"confidence":159.24657534246575,"asi":{"hypothesis":"Reorder dispatch in _execute_command_at by frequency: V4_SWAP_COMPACT, V4_TAKE, V2_SWAP_DIRECT, V3_SWAP_COMPACT, V4_UNLOCK, ERC20_TRANSFER, V4_SYNC, V4_SETTLE...","result":"-11,625 gas (-0.26%). V2_SWAP_DIRECT moved from pos 15 to pos 3, V4_TAKE from pos 6 to pos 2, V4_SYNC/V4_SETTLE from pos 17-18 to 7-8"}}
{"run":4,"commit":"91d4bf2","metric":4405308,"metrics":{"v2_v2_v2":187504,"v2_v2_v4":190340,"v2_v3_v3":149791,"v2_v4_v2":192486,"v2_v3_v4":177459,"v2_v4_v3":171316,"v2_v2_v3":166284,"v2_v3_v2":170937,"v3_v2_v3":149748,"v2_v4_v4":151875,"v3_v2_v4":172984,"v3_v2_v2":166168,"v3_v3_v3":146887,"v3_v3_v2":149737,"v3_v3_v4":164233,"v3_v4_v2":171206,"v3_v4_v4":141234,"v4_v2_v3":171529,"v3_v4_v3":162869,"v4_v2_v2":187949,"v4_v2_v4":171243,"v4_v3_v4":154286,"v4_v3_v3":162852,"v4_v3_v2":171456,"v4_v4_v3":161039,"v4_v4_v4":91538,"v4_v4_v2":150358,"bytecode_size":22382},"status":"checks_failed","description":"Cached delta slots — -58 gas but +198 bytes bytecode","timestamp":1781046479438,"segment":0,"confidence":1.990071043396388,"asi":{"hypothesis":"Cache WETH and native delta slots as immutables to skip keccak256 in _read_pm_delta","result":"Only 58 gas saved across all 27 paths but +198 bytes bytecode. The branching overhead and duplicated exttload calls in 3 code paths outweigh the keccak256 savings. Also caused checks timeout","rollback_reason":"bad trade: 58 gas saved vs 198 bytes bytecode increase","next_action_hint":"Consider inlining the fast-path inside _auto_settle_touched and _v4_batch_settle directly instead of changing _read_pm_delta"}}
{"run":5,"commit":"91d4bf2","metric":0,"metrics":{"v2_v2_v2":0,"v2_v2_v4":0,"v2_v3_v3":0,"v2_v4_v2":0,"v2_v3_v4":0,"v2_v4_v3":0,"v2_v2_v3":0,"v2_v3_v2":0,"v3_v2_v3":0,"v2_v4_v4":0,"v3_v2_v4":0,"v3_v2_v2":0,"v3_v3_v3":0,"v3_v3_v2":0,"v3_v3_v4":0,"v3_v4_v2":0,"v3_v4_v4":0,"v4_v2_v3":0,"v3_v4_v3":0,"v4_v2_v2":0,"v4_v2_v4":0,"v4_v3_v4":0,"v4_v3_v3":0,"v4_v3_v2":0,"v4_v4_v3":0,"v4_v4_v4":0,"v4_v4_v2":0,"bytecode_size":0},"status":"crash","description":"while loop — Vyper doesn't support it","timestamp":1781046568729,"segment":0,"confidence":1.990071043396388,"asi":{"hypothesis":"Switch _process_commands from for-range to while loop","result":"Vyper 0.5.0a2 does not support while loops - SyntaxException","rollback_reason":"compilation failure","next_action_hint":"Consider reducing loop bound or other approaches"}}
{"run":6,"commit":"91d4bf2","metric":4405366,"metrics":{"v2_v2_v2":187504,"v2_v2_v4":190354,"v2_v3_v3":149791,"v2_v4_v2":192486,"v2_v3_v4":177459,"v2_v4_v3":171316,"v2_v2_v3":166284,"v2_v3_v2":170937,"v3_v2_v3":149748,"v2_v4_v4":151875,"v3_v2_v4":172984,"v3_v2_v2":166168,"v3_v3_v3":146887,"v3_v3_v2":149737,"v3_v3_v4":164233,"v3_v4_v2":171206,"v3_v4_v4":141234,"v4_v2_v3":171543,"v3_v4_v3":162869,"v4_v2_v2":187963,"v4_v2_v4":171209,"v4_v3_v4":154297,"v4_v3_v3":162852,"v4_v3_v2":171470,"v4_v4_v3":161050,"v4_v4_v4":91538,"v4_v4_v2":150372,"bytecode_size":22183},"status":"discard","description":"Loop bound 512→64 — no gas change","timestamp":1781046684489,"segment":0,"confidence":200.43103448275863,"asi":{"hypothesis":"Reduce _process_commands loop bound from 512 to 64","next_action_hint":"Loop bound change has no measurable gas impact in Venom. Look at different optimizations","result":"No gas change at all. Venom compiles the range() bound differently than expected - the loop counter check against a smaller bound doesn't measurably affect gas per iteration"}}
{"run":7,"commit":"ab2bbf6","metric":4405366,"metrics":{"v2_v2_v2":187504,"v2_v2_v4":190354,"v2_v3_v3":149791,"v2_v4_v2":192486,"v2_v3_v4":177459,"v2_v4_v3":171316,"v2_v2_v3":166284,"v2_v3_v2":170937,"v3_v2_v3":149748,"v2_v4_v4":151875,"v3_v2_v4":172984,"v3_v2_v2":166168,"v3_v3_v3":146887,"v3_v3_v2":149737,"v3_v3_v4":164233,"v3_v4_v2":171206,"v3_v4_v4":141234,"v4_v2_v3":171543,"v3_v4_v3":162869,"v4_v2_v2":187963,"v4_v2_v4":171209,"v4_v3_v4":154297,"v4_v3_v3":162852,"v4_v3_v2":171470,"v4_v4_v3":161050,"v4_v4_v4":91538,"v4_v4_v2":150372,"bytecode_size":22076},"status":"keep","description":"bytes1 sentinel constant — bytecode -108, gas unchanged","timestamp":1781046864368,"segment":0,"confidence":400.86206896551727,"asi":{"hypothesis":"Replace convert(V2_AUTO_PAY_SENTINEL, bytes1) with a bytes1 constant _V2_AUTO_PAY_BYTE in 3 callback handlers","result":"Same total_gas (4,405,366) but bytecode -108 bytes (22,184→22,076). The bytes1 constant avoids runtime Bytes[1]→bytes1 conversion, but Venom likely optimizes this anyway. Bytecode reduction is from constant folding"}}
{"run":8,"commit":"15c574e","metric":4405366,"metrics":{"v2_v2_v2":187504,"v2_v2_v4":190354,"v2_v3_v3":149791,"v2_v4_v2":192486,"v2_v3_v4":177459,"v2_v4_v3":171316,"v2_v2_v3":166284,"v2_v3_v2":170937,"v3_v2_v3":149748,"v2_v4_v4":151875,"v3_v2_v4":172984,"v3_v2_v2":166168,"v3_v3_v3":146887,"v3_v3_v2":149737,"v3_v3_v4":164233,"v3_v4_v2":171206,"v3_v4_v4":141234,"v4_v2_v3":171543,"v3_v4_v3":162869,"v4_v2_v2":187963,"v4_v2_v4":171209,"v4_v3_v4":154297,"v4_v3_v3":162852,"v4_v3_v2":171470,"v4_v4_v3":161050,"v4_v4_v4":91538,"v4_v4_v2":150372,"bytecode_size":22076},"status":"keep","description":"Inline _v4_batch_settle — gas unchanged, cleaner code","timestamp":1781047041196,"segment":0,"confidence":null,"asi":{"hypothesis":"Inline _v4_batch_settle into _cmd_v4_batch to save function call overhead","result":"No gas change. Venom likely already inlined this function. The function extraction pattern helps memory liveness for _execute_command_at dispatches but Venom likely inlines simple helper calls. Keeping inlined version for clarity"}}
{"run":9,"commit":"942d54e","metric":4404865,"metrics":{"v2_v2_v2":187337,"v2_v2_v4":190354,"v2_v3_v3":149791,"v2_v4_v2":192319,"v2_v3_v4":177459,"v2_v4_v3":171316,"v2_v2_v3":166284,"v2_v3_v2":170770,"v3_v2_v3":149748,"v2_v4_v4":151875,"v3_v2_v4":172984,"v3_v2_v2":166168,"v3_v3_v3":146887,"v3_v3_v2":149737,"v3_v3_v4":164233,"v3_v4_v2":171206,"v3_v4_v4":141234,"v4_v2_v3":171543,"v3_v4_v3":162869,"v4_v2_v2":187963,"v4_v2_v4":171209,"v4_v3_v4":154297,"v4_v3_v3":162852,"v4_v3_v2":171470,"v4_v4_v3":161050,"v4_v4_v4":91538,"v4_v4_v2":150372,"bytecode_size":22061},"status":"keep","description":"Merge t_callback maps — -501 gas, -15 bytes bytecode","timestamp":1781047279121,"segment":0,"confidence":418.13793103448273,"asi":{"hypothesis":"Merge t_allowed_callback_addresses + t_v2_pair_fee into a single t_callback map (saves 1 TSTORE + 1 TLOAD per V2 swap with auto-pay)","result":"-501 gas from merged transient maps. V2 paths with auto-pay (V2V2V2: -167, V2V4V2: -167, V2V3V2: -167, V2V2V2: -167) show the savings. The fee value doubles as registration (fee>0), eliminating separate TSTORE for bool registration. Bytecode also reduced 15 bytes from one fewer transient variable"}}
{"run":10,"commit":"929ade5","metric":4404814,"metrics":{"v2_v2_v2":187320,"v2_v2_v4":190354,"v2_v3_v3":149791,"v2_v4_v2":192302,"v2_v3_v4":177459,"v2_v4_v3":171316,"v2_v2_v3":166284,"v2_v3_v2":170753,"v3_v2_v3":149748,"v2_v4_v4":151875,"v3_v2_v4":172984,"v3_v2_v2":166168,"v3_v3_v3":146887,"v3_v3_v2":149737,"v3_v3_v4":164233,"v3_v4_v2":171206,"v3_v4_v4":141234,"v4_v2_v3":171543,"v3_v4_v3":162869,"v4_v2_v2":187963,"v4_v2_v4":171209,"v4_v3_v4":154297,"v4_v3_v3":162852,"v4_v3_v2":171470,"v4_v4_v3":161050,"v4_v4_v4":91538,"v4_v4_v2":150372,"bytecode_size":22051},"status":"keep","description":"Merge V2 forward_len conditionals — -51 gas","timestamp":1781047544601,"segment":0,"confidence":209.94827586206895,"asi":{"hypothesis":"Merge two 'if forward_len > 0' conditionals in _cmd_v2_swap_compact into one, moving the TSTORE into the forward_data conditional","result":"-51 gas from eliminating one conditional branch. V2 paths with swap_compact improved (V2V2V2: -17 gas). Bytecode -10 bytes. The savings come from Venom not needing to evaluate the condition twice"}}
{"run":11,"commit":"cfeaeb3","metric":4404568,"metrics":{"v2_v2_v2":187238,"v2_v2_v4":190354,"v2_v3_v3":149791,"v2_v4_v2":192220,"v2_v3_v4":177459,"v2_v4_v3":171316,"v2_v2_v3":166284,"v2_v3_v2":170671,"v3_v2_v3":149748,"v2_v4_v4":151875,"v3_v2_v4":172984,"v3_v2_v2":166168,"v3_v3_v3":146887,"v3_v3_v2":149737,"v3_v3_v4":164233,"v3_v4_v2":171206,"v3_v4_v4":141234,"v4_v2_v3":171543,"v3_v4_v3":162869,"v4_v2_v2":187963,"v4_v2_v4":171209,"v4_v3_v4":154297,"v4_v3_v3":162852,"v4_v3_v2":171470,"v4_v4_v3":161050,"v4_v4_v4":91538,"v4_v4_v2":150372,"bytecode_size":21882},"status":"keep","description":"Remove V2 fee assertion — -246 gas, -169 bytes","timestamp":1781047689426,"segment":0,"confidence":44.44722719141324,"asi":{"hypothesis":"Remove assert fee>0 and fee<10000 in _cmd_v2_swap_compact — invalid fees cause V2 K-invariant failure anyway","result":"-246 gas and -169 bytes bytecode. The assertion string alone cost ~160 bytes of bytecode (revert string). V2 paths improved by ~82 gas each (3 V2 swap_compact paths use this). The assertion was just an early revert with a clear message; invalid fees still fail at the V2 pair's K-invariant check"}}
{"run":12,"commit":"b7188f6","metric":4404568,"metrics":{"v2_v2_v2":187238,"v2_v2_v4":190354,"v2_v3_v3":149791,"v2_v4_v2":192220,"v2_v3_v4":177459,"v2_v4_v3":171316,"v2_v2_v3":166284,"v2_v3_v2":170671,"v3_v2_v3":149748,"v2_v4_v4":151875,"v3_v2_v4":172984,"v3_v2_v2":166168,"v3_v3_v3":146887,"v3_v3_v2":149737,"v3_v3_v4":164233,"v3_v4_v2":171206,"v3_v4_v4":141234,"v4_v2_v3":171543,"v3_v4_v3":162869,"v4_v2_v2":187963,"v4_v2_v4":171209,"v4_v3_v4":154297,"v4_v3_v3":162852,"v4_v3_v2":171470,"v4_v4_v3":161050,"v4_v4_v4":91538,"v4_v4_v2":150372,"bytecode_size":21734},"status":"keep","description":"Remove V2_CALC fee assertion — bytecode -148","timestamp":1781047808081,"segment":0,"confidence":24.79640718562874,"asi":{"hypothesis":"Remove V2_SWAP_CALC fee assertion (same as V2_SWAP_COMPACT removal)","result":"Same total_gas (V2_SWAP_CALC not used in 27 perms) but bytecode -148 bytes. Good for headroom under 24KB limit"}}
{"run":13,"commit":"aba2535","metric":4404568,"metrics":{"v2_v2_v2":187238,"v2_v2_v4":190354,"v2_v3_v3":149791,"v2_v4_v2":192220,"v2_v3_v4":177459,"v2_v4_v3":171316,"v2_v2_v3":166284,"v2_v3_v2":170671,"v3_v2_v3":149748,"v2_v4_v4":151875,"v3_v2_v4":172984,"v3_v2_v2":166168,"v3_v3_v3":146887,"v3_v3_v2":149737,"v3_v3_v4":164233,"v3_v4_v2":171206,"v3_v4_v4":141234,"v4_v2_v3":171543,"v3_v4_v3":162869,"v4_v2_v2":187963,"v4_v2_v4":171209,"v4_v3_v4":154297,"v4_v3_v3":162852,"v4_v3_v2":171470,"v4_v4_v3":161050,"v4_v4_v4":91538,"v4_v4_v2":150372,"bytecode_size":21576},"status":"keep","description":"Remove V2 liquidity assertion — bytecode -158","timestamp":1781047941498,"segment":0,"confidence":24.970854271356785,"asi":{"hypothesis":"Remove amount_out < reserve_out assertion in _v2_get_amount_in","result":"Same total_gas (Venom already inlines @view, so assertion overhead is minimal). Bytecode -158 bytes. The assertion would revert on underflow anyway"}}
{"run":14,"commit":"aba2535","metric":4405393,"metrics":{"v2_v2_v2":187274,"v2_v2_v4":190354,"v2_v3_v3":149851,"v2_v4_v2":192256,"v2_v3_v4":177489,"v2_v4_v3":171346,"v2_v2_v3":166314,"v2_v3_v2":170737,"v3_v2_v3":149808,"v2_v4_v4":151875,"v3_v2_v4":173014,"v3_v2_v2":166198,"v3_v3_v3":146938,"v3_v3_v2":149797,"v3_v3_v4":164281,"v3_v4_v2":171236,"v3_v4_v4":141258,"v4_v2_v3":171573,"v3_v4_v3":162917,"v4_v2_v2":187963,"v4_v2_v4":171209,"v4_v3_v4":154321,"v4_v3_v3":162900,"v4_v3_v2":171500,"v4_v4_v3":161074,"v4_v4_v4":91538,"v4_v4_v2":150372,"bytecode_size":20926},"status":"discard","description":"Callback dedup — +825 gas regression","timestamp":1781048105319,"segment":0,"confidence":24.79640718562874,"asi":{"hypothesis":"Deduplicate V2/V3 callback handlers into shared _handle_v2_callback/_handle_v3_callback internal functions","next_action_hint":"Keep duplicated callback handler code. Function extraction only helps Venom memory liveness for _execute_command_at dispatch. Regular helper dedup adds call overhead","result":"+825 gas regression! invoke overhead per callback outweighed bytecode savings. Venom doesn't inline @internal functions with side effects"}}
{"run":15,"commit":"c53de25","metric":4404568,"metrics":{"v2_v2_v2":187238,"v2_v2_v4":190354,"v2_v3_v3":149791,"v2_v4_v2":192220,"v2_v3_v4":177459,"v2_v4_v3":171316,"v2_v2_v3":166284,"v2_v3_v2":170671,"v3_v2_v3":149748,"v2_v4_v4":151875,"v3_v2_v4":172984,"v3_v2_v2":166168,"v3_v3_v3":146887,"v3_v3_v2":149737,"v3_v3_v4":164233,"v3_v4_v2":171206,"v3_v4_v4":141234,"v4_v2_v3":171543,"v3_v4_v3":162869,"v4_v2_v2":187963,"v4_v2_v4":171209,"v4_v3_v4":154297,"v4_v3_v3":162852,"v4_v3_v2":171470,"v4_v4_v3":161050,"v4_v4_v4":91538,"v4_v4_v2":150372,"bytecode_size":20994},"status":"keep","description":"Remove non-hot-path assertions — bytecode -582","timestamp":1781048222989,"segment":0,"confidence":24.970854271356785,"asi":{"hypothesis":"Remove V4_BATCH/V3_SWAP_DELTA/V4_SWAP_DYNAMIC assertions (not used in 27 paths, saving bytecode)","result":"Same total_gas (4,404,568). Bytecode -582 bytes (21,576→20,994). These assertions had string data that inflated bytecode significantly. Now at 85.4% of 24KB limit"}}
{"run":16,"commit":"f68e6c1","metric":4404398,"metrics":{"v2_v2_v2":187223,"v2_v2_v4":190339,"v2_v3_v3":149782,"v2_v4_v2":192211,"v2_v3_v4":177450,"v2_v4_v3":171307,"v2_v2_v3":166269,"v2_v3_v2":170662,"v3_v2_v3":149742,"v2_v4_v4":151866,"v3_v2_v4":172978,"v3_v2_v2":166156,"v3_v3_v3":146887,"v3_v3_v2":149731,"v3_v3_v4":164233,"v3_v4_v2":171200,"v3_v4_v4":141234,"v4_v2_v3":171537,"v3_v4_v3":162869,"v4_v2_v2":187951,"v4_v2_v4":171204,"v4_v3_v4":154297,"v4_v3_v3":162852,"v4_v3_v2":171464,"v4_v4_v3":161050,"v4_v4_v4":91538,"v4_v4_v2":150366,"bytecode_size":20990},"status":"keep","description":"Inline pool_idx in V2_SWAP_DIRECT — -170 gas","timestamp":1781048354262,"segment":0,"confidence":25.491902834008098,"asi":{"hypothesis":"Remove pool_idx intermediate variable from _cmd_v2_swap_direct, inline t_addresses lookup directly","result":"-170 gas total. Saving one stack variable in a hot path (25 uses across 27 tests) helps Venom's register allocator. Many paths improved slightly (V2V4V2: -9, V2V2V2: -15, V2V4V4: -9, etc)"}}
{"run":17,"commit":"f68e6c1","metric":0,"metrics":{"v2_v2_v2":0,"v2_v2_v4":0,"v2_v3_v3":0,"v2_v4_v2":0,"v2_v3_v4":0,"v2_v4_v3":0,"v2_v2_v3":0,"v2_v3_v2":0,"v3_v2_v3":0,"v2_v4_v4":0,"v3_v2_v4":0,"v3_v2_v2":0,"v3_v3_v3":0,"v3_v3_v2":0,"v3_v3_v4":0,"v3_v4_v2":0,"v3_v4_v4":0,"v4_v2_v3":0,"v3_v4_v3":0,"v4_v2_v2":0,"v4_v2_v4":0,"v4_v3_v4":0,"v4_v3_v3":0,"v4_v3_v2":0,"v4_v4_v3":0,"v4_v4_v4":0,"v4_v4_v2":0,"bytecode_size":0},"status":"crash","description":"V4 swap compact inline — Venom crash","timestamp":1781048405231,"segment":0,"confidence":25.491902834008098,"asi":{"hypothesis":"Inline currency0/currency1/hooks_idx in _cmd_v4_swap_compact (same pattern as V2_SWAP_DIRECT)","next_action_hint":"Struct constructor inlining causes Venom crash. Only safe for simple t_addresses lookups, not struct fields. Try inlining idx vars for _cmd_v3_swap_compact and _cmd_erc20_transfer instead","result":"Venom INTERNALERROR crash! Inlining t_addresses lookups inside a PoolKey struct constructor breaks Venom's codegen. Revert to explicit variables","rollback_reason":"Venom crash on struct constructor with inlined index lookups"}}
{"run":18,"commit":"f68e6c1","metric":4404584,"metrics":{"v2_v2_v2":187238,"v2_v2_v4":190339,"v2_v3_v3":149797,"v2_v4_v2":192226,"v2_v3_v4":177450,"v2_v4_v3":171322,"v2_v2_v3":166284,"v2_v3_v2":170677,"v3_v2_v3":149757,"v2_v4_v4":151866,"v3_v2_v4":172978,"v3_v2_v2":166171,"v3_v3_v3":146887,"v3_v3_v2":149746,"v3_v3_v4":164233,"v3_v4_v2":171215,"v3_v4_v4":141234,"v4_v2_v3":171537,"v3_v4_v3":162881,"v4_v2_v2":187951,"v4_v2_v4":171204,"v4_v3_v4":154297,"v4_v3_v3":162864,"v4_v3_v2":171464,"v4_v4_v3":161062,"v4_v4_v4":91538,"v4_v4_v2":150366,"bytecode_size":20995},"status":"discard","description":"ERC20 transfer inline — +186 gas regression","timestamp":1781048532047,"segment":0,"confidence":31.132262051915944,"asi":{"hypothesis":"Inline token_idx/recipient_idx in _cmd_erc20_transfer (same as V2_SWAP_DIRECT)","next_action_hint":"Only inline index lookups where the variable is used ONCE. In erc20_transfer, the idx is used inside a nested extcall, causing double evaluation overhead. V2_SWAP_DIRECT works because pool is used once separately","result":"+186 gas regression! The inlined slice+convert inside IERC20() constructor and .transfer() argument caused Venom to evaluate twice, offsetting the stack variable savings"}}
{"run":19,"commit":"a052966","metric":4404398,"metrics":{"v2_v2_v2":187223,"v2_v2_v4":190339,"v2_v3_v3":149782,"v2_v4_v2":192211,"v2_v3_v4":177450,"v2_v4_v3":171307,"v2_v2_v3":166269,"v2_v3_v2":170662,"v3_v2_v3":149742,"v2_v4_v4":151866,"v3_v2_v4":172978,"v3_v2_v2":166156,"v3_v3_v3":146887,"v3_v3_v2":149731,"v3_v3_v4":164233,"v3_v4_v2":171200,"v3_v4_v4":141234,"v4_v2_v3":171537,"v3_v4_v3":162869,"v4_v2_v2":187951,"v4_v2_v4":171204,"v4_v3_v4":154297,"v4_v3_v3":162852,"v4_v3_v2":171464,"v4_v4_v3":161050,"v4_v4_v4":91538,"v4_v4_v2":150366,"bytecode_size":20824},"status":"keep","description":"Remove V4_TAKE_DELTA assertion — bytecode -170","timestamp":1781048676110,"segment":0,"confidence":26.96573875802998,"asi":{"hypothesis":"Remove V4_TAKE_DELTA delta>0 assertion (not used in 27 paths, saves bytecode)","result":"Same total_gas (4,404,398). Bytecode -170 bytes. Now at 84.7% of 24KB limit"}}
{"run":20,"commit":"8b0951f","metric":4404398,"metrics":{"v2_v2_v2":187223,"v2_v2_v4":190339,"v2_v3_v3":149782,"v2_v4_v2":192211,"v2_v3_v4":177450,"v2_v4_v3":171307,"v2_v2_v3":166269,"v2_v3_v2":170662,"v3_v2_v3":149742,"v2_v4_v4":151866,"v3_v2_v4":172978,"v3_v2_v2":166156,"v3_v3_v3":146887,"v3_v3_v2":149731,"v3_v3_v4":164233,"v3_v4_v2":171200,"v3_v4_v4":141234,"v4_v2_v3":171537,"v3_v4_v3":162869,"v4_v2_v2":187951,"v4_v2_v4":171204,"v4_v3_v4":154297,"v4_v3_v3":162852,"v4_v3_v2":171464,"v4_v4_v3":161050,"v4_v4_v4":91538,"v4_v4_v2":150366,"bytecode_size":20544},"status":"keep","description":"Remove V2_CALC assertions — bytecode -280","timestamp":1781048792489,"segment":0,"confidence":28.52321630804077,"asi":{"hypothesis":"Remove V2_SWAP_CALC balance/amount assertions (not used in 27 paths)","result":"Same total_gas (4,404,398). Bytecode -280 bytes. Now at 83.5% of 24KB limit (20,544 bytes)"}}
{"run":21,"commit":"4846570","metric":4404331,"metrics":{"bytecode_size":20543,"v2_v2_v2":187223,"v2_v2_v3":166269,"v2_v2_v4":190336,"v2_v3_v2":170662,"v2_v3_v3":149782,"v2_v3_v4":177444,"v2_v4_v2":192208,"v2_v4_v3":171304,"v2_v4_v4":151860,"v3_v2_v2":166156,"v3_v2_v3":149742,"v3_v2_v4":172972,"v3_v3_v2":149731,"v3_v3_v3":146887,"v3_v3_v4":164228,"v3_v4_v2":171197,"v3_v4_v3":162867,"v3_v4_v4":141229,"v4_v2_v2":187948,"v4_v2_v3":171534,"v4_v2_v4":171202,"v4_v3_v2":171461,"v4_v3_v3":162850,"v4_v3_v4":154292,"v4_v4_v2":150363,"v4_v4_v3":161048,"v4_v4_v4":91536},"status":"keep","description":"Inline V4_TAKE idx vars — -67 gas","timestamp":1781048976242,"segment":0,"confidence":30.432692307692307,"asi":{"hypothesis":"Inline currency_idx/recipient_idx in _cmd_v4_take (both used once in simple extcall, like V2_SWAP_DIRECT)","result":"-67 gas total. Inlining 2 stack variables in V4_TAKE saves gas. Both t_addresses lookups are used once each directly as extcall arguments, avoiding double evaluation. Minor savings across many V4-using paths."}}
