{"run":41,"commit":"12d1a49","metric":4381015,"metrics":{"bytecode_size":19524,"v2_v2_v2":186392,"v2_v2_v3":165615,"v2_v2_v4":189208,"v2_v3_v2":169970,"v2_v3_v3":149242,"v2_v3_v4":176323,"v2_v4_v2":191007,"v2_v4_v3":170255,"v2_v4_v4":150622,"v3_v2_v2":165527,"v3_v2_v3":149202,"v3_v2_v4":171920,"v3_v3_v2":149191,"v3_v3_v3":146610,"v3_v3_v4":163478,"v3_v4_v2":170173,"v3_v4_v3":162119,"v3_v4_v4":140330,"v4_v2_v2":186914,"v4_v2_v3":170589,"v4_v2_v4":170260,"v4_v3_v2":170541,"v4_v3_v3":162102,"v4_v3_v4":153356,"v4_v4_v2":149257,"v4_v4_v4":90644,"v4_v4_v3":160168},"status":"discard","description":"Conditional V3 TSTORE — +4,404 gas REGRESSION","timestamp":1781052558356,"segment":0,"confidence":41.33060388945752,"asi":{"hypothesis":"Conditional TSTORE for V3 callback registration: skip t_callback write if already registered","result":"+4,404 gas regression! The TLOAD check + conditional branch overhead makes this worse than an unconditional TSTORE. For V3 swaps, the pool is always unique per swap (no duplicate pool callbacks), so the conditional never saves a TSTORE. It only adds TLOAD + branch overhead.","next_action":"Don't conditionally guard TSTORE with TLOAD — the TLOAD + branch overhead costs more than the TSTORE it might save.","rollback_reason":"+4,404 gas regression — conditional TSTORE is counterproductive"}}
{"run":42,"commit":"a0cd289","metric":4376451,"metrics":{"bytecode_size":19448,"v2_v2_v2":186392,"v2_v2_v3":165436,"v2_v2_v4":189208,"v2_v3_v2":169791,"v2_v3_v3":148884,"v2_v3_v4":176144,"v2_v4_v2":191007,"v2_v4_v3":170076,"v2_v4_v4":150622,"v3_v2_v2":165348,"v3_v2_v3":148844,"v3_v2_v4":171741,"v3_v3_v2":148833,"v3_v3_v3":146180,"v3_v3_v4":163192,"v3_v4_v2":169994,"v3_v4_v3":161832,"v3_v4_v4":140187,"v4_v2_v2":186889,"v4_v2_v3":170385,"v4_v2_v4":170240,"v4_v3_v2":170337,"v4_v3_v3":161816,"v4_v3_v4":153192,"v4_v4_v2":149232,"v4_v4_v3":160005,"v4_v4_v4":90644},"status":"keep","description":"unsafe_sub for delta negation in settle_currency — -160 gas","timestamp":1781052686075,"segment":0,"confidence":38.72015281757402,"asi":{"hypothesis":"Replace convert(-delta, uint256) with convert(unsafe_sub(0, delta), uint256) in _v4_settle_currency to avoid negation overflow check","result":"-160 gas. The Vyper negation operator on int256 compiles to SUB(0, delta) + overflow check (JUMPI). Using unsafe_sub eliminates the JUMPI. Small saving because _v4_settle_currency is called once per settled currency. Bytecode -40 bytes (19,488 -> 19,448)."}}
{"run":43,"commit":"a0cd289","metric":0,"metrics":{"bytecode_size":0,"v2_v2_v2":0,"v2_v2_v3":0,"v2_v2_v4":0,"v2_v3_v2":0,"v2_v3_v3":0,"v2_v3_v4":0,"v2_v4_v2":0,"v2_v4_v3":0,"v2_v4_v4":0,"v3_v2_v2":0,"v3_v2_v3":0,"v3_v2_v4":0,"v3_v3_v2":0,"v3_v3_v3":0,"v3_v3_v4":0,"v3_v4_v2":0,"v3_v4_v3":0,"v3_v4_v4":0,"v4_v2_v2":0,"v4_v2_v3":0,"v4_v2_v4":0,"v4_v3_v2":0,"v4_v3_v3":0,"v4_v3_v4":0,"v4_v4_v2":0,"v4_v4_v3":0,"v4_v4_v4":0},"status":"crash","description":"Negation to unsafe_sub — 19 test FAILURES","timestamp":1781052776645,"segment":0,"confidence":38.72015281757402,"asi":{"hypothesis":"Replace negation patterns with unsafe_sub","next_action":"Only apply safe negation replacements: v4_swap_compact and settle_currency only","result":"19/27 failures. unsafe_sub(empty(int256), input_delta) broke batch function.","rollback_reason":"Test failures from incorrect int256 negation replacement"}}
{"run":44,"commit":"ec0c782","metric":4375846,"metrics":{"bytecode_size":19408,"v2_v2_v2":186392,"v2_v2_v3":165436,"v2_v2_v4":189183,"v2_v3_v2":169791,"v2_v3_v3":148884,"v2_v3_v4":176119,"v2_v4_v2":190982,"v2_v4_v3":170051,"v2_v4_v4":150572,"v3_v2_v2":165348,"v3_v2_v3":148844,"v3_v2_v4":171716,"v3_v3_v2":148833,"v3_v3_v3":146180,"v3_v3_v4":163172,"v3_v4_v2":169969,"v3_v4_v3":161812,"v3_v4_v4":140147,"v4_v2_v2":186864,"v4_v2_v3":170360,"v4_v2_v4":170200,"v4_v3_v2":170312,"v4_v3_v3":161796,"v4_v3_v4":153152,"v4_v4_v2":149182,"v4_v4_v3":159965,"v4_v4_v4":90584},"status":"keep","description":"unsafe negation in v4_swap_compact — -605 gas","timestamp":1781052947782,"segment":0,"confidence":36.83527305282006,"asi":{"hypothesis":"Replace -convert(x, int256) with unsafe_sub(empty(int256), convert(x, int256)) in _cmd_v4_swap_compact to avoid negation overflow check","result":"-605 gas! Using unsafe_sub(empty(int256), convert(x, int256)) correctly replaces -convert(x, int256) by: (1) converting uint128 to int256 first, (2) then subtracting from int256 zero without overflow check. Bytecode -40 bytes (19,448 -> 19,408)"}}
{"run":45,"commit":"3f33e36","metric":4375846,"metrics":{"bytecode_size":19287,"v2_v2_v2":186392,"v2_v2_v3":165436,"v2_v2_v4":189183,"v2_v3_v2":169791,"v2_v3_v3":148884,"v2_v3_v4":176119,"v2_v4_v2":190982,"v2_v4_v3":170051,"v2_v4_v4":150572,"v3_v2_v2":165348,"v3_v2_v3":148844,"v3_v2_v4":171716,"v3_v3_v2":148833,"v3_v3_v3":146180,"v3_v3_v4":163172,"v3_v4_v2":169969,"v3_v4_v3":161812,"v3_v4_v4":140147,"v4_v2_v2":186864,"v4_v2_v3":170360,"v4_v2_v4":170200,"v4_v3_v2":170312,"v4_v3_v3":161796,"v4_v3_v4":153152,"v4_v4_v2":149182,"v4_v4_v3":159965,"v4_v4_v4":90584},"status":"keep","description":"Expand unsafe negation to batch/dynamic — -121 bytes","timestamp":1781053058428,"segment":0,"confidence":36.83527305282006,"asi":{"hypothesis":"Apply unsafe_sub(empty(int256), ...) negation pattern to _cmd_v4_batch and _cmd_v4_swap_dynamic","result":"Same gas (4,375,846). Bytecode -121 bytes (19,408 -> 19,287). These functions are not in the 27 benchmark paths, so no gas impact. Each negation replacement removes a JUMPI overflow check."}}
{"run":46,"commit":"f75213b","metric":4375453,"metrics":{"bytecode_size":19250,"v2_v2_v2":186392,"v2_v2_v3":165420,"v2_v2_v4":189183,"v2_v3_v2":169775,"v2_v3_v3":148852,"v2_v3_v4":176103,"v2_v4_v2":190982,"v2_v4_v3":170035,"v2_v4_v4":150572,"v3_v2_v2":165332,"v3_v2_v3":148812,"v3_v2_v4":171700,"v3_v3_v2":148801,"v3_v3_v3":146142,"v3_v3_v4":163146,"v3_v4_v2":169953,"v3_v4_v3":161787,"v3_v4_v4":140134,"v4_v2_v2":186864,"v4_v2_v3":170344,"v4_v2_v4":170200,"v4_v3_v2":170296,"v4_v3_v3":161770,"v4_v3_v4":153140,"v4_v4_v2":149182,"v4_v4_v3":159952,"v4_v4_v4":90584},"status":"keep","description":"Direct slice→int256 conversion in V3 swap — -393 gas","timestamp":1781053194484,"segment":0,"confidence":37.18710832587287,"asi":{"hypothesis":"Replace convert(convert(slice, uint128), int256) with convert(slice, int256) directly in _cmd_v3_swap_compact. The intermediate uint128 conversion is unnecessary because Vyper's convert(Bytes[16], int256) reads 16 bytes and sign-extends, which gives the same result for positive uint128 values.","result":"-393 gas! Direct Bytes[16] to int256 conversion eliminates the intermediate uint128 bounds check. All paths with V3 swaps benefit (v3_* paths show -12 to -50 gas each). Bytecode -37 bytes (19,287 -> 19,250)."}}
{"run":47,"commit":"532f5fd","metric":4374918,"metrics":{"bytecode_size":19211,"v2_v2_v2":186392,"v2_v2_v3":165420,"v2_v2_v4":189161,"v2_v3_v2":169775,"v2_v3_v3":148852,"v2_v3_v4":176081,"v2_v4_v2":190960,"v2_v4_v3":170013,"v2_v4_v4":150528,"v3_v2_v2":165332,"v3_v2_v3":148812,"v3_v2_v4":171678,"v3_v3_v2":148801,"v3_v3_v3":146142,"v3_v3_v4":163128,"v3_v4_v2":169931,"v3_v4_v3":161769,"v3_v4_v4":140099,"v4_v2_v2":186842,"v4_v2_v3":170322,"v4_v2_v4":170164,"v4_v3_v2":170274,"v4_v3_v3":161752,"v4_v3_v4":153104,"v4_v4_v2":149138,"v4_v4_v3":159917,"v4_v4_v4":90531},"status":"keep","description":"Direct slice→uint256/int256 conversions — -535 gas","timestamp":1781053338592,"segment":0,"confidence":37.666069829901524,"asi":{"hypothesis":"Replace convert(convert(slice, uint128), uint256/int256) with convert(slice, uint256/int256) directly across all command handlers. Eliminates the intermediate uint128 bounds check.","result":"-535 gas! Direct Bytes[16] to uint256/int256 conversion eliminates the intermediate uint128 check. Vyper's convert(Bytes[N], T) reads N bytes and zero-extends (for uint) or sign-extends (for int), which gives the same result as the two-step conversion. Bytecode -39 bytes (19,250 -> 19,211)."}}
{"run":48,"commit":"c3e61f1","metric":4374918,"metrics":{"bytecode_size":19211,"v2_v2_v2":186392,"v2_v2_v3":165420,"v2_v2_v4":189161,"v2_v3_v2":169775,"v2_v3_v3":148852,"v2_v3_v4":176081,"v2_v4_v2":190960,"v2_v4_v3":170013,"v2_v4_v4":150528,"v3_v2_v2":165332,"v3_v2_v3":148812,"v3_v2_v4":171678,"v3_v3_v2":148801,"v3_v3_v3":146142,"v3_v3_v4":163128,"v3_v4_v2":169931,"v3_v4_v3":161769,"v3_v4_v4":140099,"v4_v2_v2":186842,"v4_v2_v3":170322,"v4_v2_v4":170164,"v4_v3_v2":170274,"v4_v3_v3":161752,"v4_v3_v4":153104,"v4_v4_v2":149138,"v4_v4_v3":159917,"v4_v4_v4":90531},"status":"keep","description":"Expand direct conversion to remaining handlers — no change","timestamp":1781053456647,"segment":0,"confidence":37.666069829901524,"asi":{"hypothesis":"Apply direct slice→uint256 conversion to remaining handlers (SEND_ETH, WETH_DEPOSIT/WITHDRAW, etc)","result":"Same gas (4,374,918). Same bytecode (19,211). Changes are in non-benchmark paths. The sed replacement correctly matched the offset+2 and offset+3 patterns."}}
{"run":49,"commit":"0634d29","metric":4373827,"metrics":{"bytecode_size":19191,"v2_v2_v2":186348,"v2_v2_v3":165376,"v2_v2_v4":189117,"v2_v3_v2":169731,"v2_v3_v3":148808,"v2_v3_v4":176037,"v2_v4_v2":190916,"v2_v4_v3":169969,"v2_v4_v4":150484,"v3_v2_v2":165288,"v3_v2_v3":148775,"v3_v2_v4":171634,"v3_v3_v2":148766,"v3_v3_v3":146107,"v3_v3_v4":163093,"v3_v4_v2":169887,"v3_v4_v3":161734,"v3_v4_v4":140064,"v4_v2_v2":186798,"v4_v2_v3":170278,"v4_v2_v4":170129,"v4_v3_v2":170230,"v4_v3_v3":161717,"v4_v3_v4":153069,"v4_v4_v2":149094,"v4_v4_v3":159882,"v4_v4_v4":90496},"status":"keep","description":"unsafe_add for balance sums in execute/withdraw — -1,091 gas","timestamp":1781053659329,"segment":0,"confidence":38.350955131052864,"asi":{"hypothesis":"Replace checked add in combined_before/combined_after (WETH.balanceOf(self) + self.balance) with unsafe_add. Also in withdraw() for eth_balance + weth_balance. Both are sum-of-balances which can't overflow uint256.","result":"-1,091 gas! The balance sum check runs twice per execute() call (before and after commands), so removing two overflow checks saves ~6 gas per check × 2 × 27 paths = ~324 gas on average. But the savings are higher because each overflow check involves multiple EVM instructions (ADD + JUMPI + revert path). Bytecode -20 bytes (19,211 -> 19,191)."}}
{"run":50,"commit":"ec03a4b","metric":4373732,"metrics":{"bytecode_size":19191,"v2_v2_v2":186348,"v2_v2_v3":165376,"v2_v2_v4":189117,"v2_v3_v2":169731,"v2_v3_v3":148808,"v2_v3_v4":176037,"v2_v4_v2":190916,"v2_v4_v3":169969,"v2_v4_v4":150484,"v3_v2_v2":165288,"v3_v2_v3":148775,"v3_v2_v4":171634,"v3_v3_v2":148766,"v3_v3_v3":146107,"v3_v3_v4":163093,"v3_v4_v2":169887,"v3_v4_v3":161734,"v3_v4_v4":140064,"v4_v2_v2":186781,"v4_v2_v3":170261,"v4_v2_v4":170129,"v4_v3_v2":170213,"v4_v3_v3":161717,"v4_v3_v4":153056,"v4_v4_v2":149077,"v4_v4_v3":159868,"v4_v4_v4":90496},"status":"keep","description":"Reorder settle_currency: WETH-first — -95 gas","timestamp":1781053966929,"segment":0,"confidence":38.14726631393298,"asi":{"hypothesis":"Reorder _v4_settle_currency branches: check WETH first, then NATIVE, then ERC20. WETH is the most commonly settled currency in V4 paths (most V4 swaps involve WETH as input/output).","result":"-95 gas. WETH-first ordering saves ~1 address comparison on the most common settle path. The V4-heavy paths show the savings (v4_v4_v2: -17, v4_v3_v2: -17, v4_v2_v2: -17). Native ETH paths are unaffected (still check 1 condition). Bytecode unchanged (19,191)."}}
{"type":"config","name":"Optimize command selection in 27 three-hop paths","metricName":"total_gas","metricUnit":"gas","bestDirection":"lower"}
{"run":51,"commit":"6e73de8","metric":4372343,"metrics":{"bytecode_size":19191,"v2_v2_v2":186348,"v2_v2_v3":165376,"v2_v2_v4":189102,"v2_v3_v2":169731,"v2_v3_v3":148808,"v2_v3_v4":175879,"v2_v4_v2":190919,"v2_v4_v3":169972,"v2_v4_v4":150344,"v3_v2_v2":165288,"v3_v2_v3":148775,"v3_v2_v4":171476,"v3_v3_v2":148766,"v3_v3_v3":146107,"v3_v3_v4":162952,"v3_v4_v2":169890,"v3_v4_v3":161722,"v3_v4_v4":139937,"v4_v2_v2":186766,"v4_v2_v3":170264,"v4_v2_v4":170020,"v4_v3_v2":170198,"v4_v3_v3":161688,"v4_v3_v4":152929,"v4_v4_v2":148922,"v4_v4_v3":159768,"v4_v4_v4":90396},"status":"keep","description":"V4_TAKE→V4_TAKE_COMPACT in all 27 paths — -1,389 gas","timestamp":1781055627990,"segment":1,"confidence":null,"asi":{"hypothesis":"Replace all 26 V4_TAKE calls with V4_TAKE_COMPACT in the 27 benchmark paths. V4_TAKE uses 35 bytes (uint256 amount), V4_TAKE_COMPACT uses 19 bytes (uint128 amount). All test amounts fit in uint128. Saves 16 bytes calldata per take = ~64 gas + handler savings (16-byte slice vs 32-byte). Also moved V4_TAKE_COMPACT to higher dispatch position (2nd).","result":"-1,389 gas! Calldata savings (16 bytes * 4 gas = 64 per take) plus handler savings (slice WIDTH_UINT128 vs WIDTH_UINT256). Paths with V4 takes show the biggest improvements (v4_v3_v3: -29, v4_v4_v2: -155, v4_v4_v4: -100).","v4_take_usage":"26 calls replaced, all amounts fit in uint128"}}
{"run":52,"commit":"6e73de8","metric":4374982,"metrics":{"bytecode_size":19191,"v2_v2_v2":186348,"v2_v2_v3":165376,"v2_v2_v4":189102,"v2_v3_v2":169731,"v2_v3_v3":148808,"v2_v3_v4":175879,"v2_v4_v2":190919,"v2_v4_v3":169972,"v2_v4_v4":150344,"v3_v2_v2":165288,"v3_v2_v3":148775,"v3_v2_v4":171476,"v3_v3_v2":148766,"v3_v3_v3":146107,"v3_v3_v4":162952,"v3_v4_v2":169890,"v3_v4_v3":161722,"v3_v4_v4":139937,"v4_v2_v2":186766,"v4_v2_v3":170264,"v4_v2_v4":170020,"v4_v3_v2":170198,"v4_v3_v3":161688,"v4_v3_v4":152929,"v4_v4_v2":148922,"v4_v4_v3":159768,"v4_v4_v4":93035},"status":"discard","description":"V4_BATCH for V4-V4-V4 — +2,639 gas regression","timestamp":1781055833013,"segment":1,"confidence":null,"asi":{"hypothesis":"Replace V4_V4_V4's 3 V4_SWAP_COMPACT + V4_TAKE_COMPACT with V4_BATCH(3 entries) which auto-settles all deltas","next_action":"V4_BATCH auto-settle is too expensive for the profit-only case. Revert. Look for other command substitution opportunities instead.","result":"+2,639 gas regression on v4_v4_v4. V4_BATCH auto-settles by iterating all t_addresses to check deltas for each currency. Manual V4_TAKE_COMPACT directly takes the known positive delta (1 TLOAD per currency). The auto-settle overhead (~6 TLOADs for checking each address) outweighs the dispatch savings.","rollback_reason":"+2,639 gas regression — V4_BATCH auto-settle overhead exceeds dispatch savings"}}
{"run":53,"commit":"6e73de8","metric":4372343,"metrics":{"bytecode_size":19191,"v2_v2_v2":186348,"v2_v2_v3":165376,"v2_v2_v4":189102,"v2_v3_v2":169731,"v2_v3_v3":148808,"v2_v3_v4":175879,"v2_v4_v2":190919,"v2_v4_v3":169972,"v2_v4_v4":150344,"v3_v2_v2":165288,"v3_v2_v3":148775,"v3_v2_v4":171476,"v3_v3_v2":148766,"v3_v3_v3":146107,"v3_v3_v4":162952,"v3_v4_v2":169890,"v3_v4_v3":161722,"v3_v4_v4":139937,"v4_v2_v2":186766,"v4_v2_v3":170264,"v4_v2_v4":170020,"v4_v3_v2":170198,"v4_v3_v3":161688,"v4_v3_v4":152929,"v4_v4_v2":148922,"v4_v4_v3":159768,"v4_v4_v4":90396},"status":"discard","description":"V2 fee-in-sentinel — no gas impact (auto-pay unused in benchmarks)","timestamp":1781056059205,"segment":1,"confidence":null,"asi":{"hypothesis":"Embed V2 fee in forward_data sentinel to avoid TLOAD in _v2_auto_pay callback","next_action":"The 27 benchmark paths never use V2 auto-pay callbacks (all V2 callbacks have command forward_data). The fee-in-sentinel saves TLOAD only in auto-pay callbacks. Look for other optimization angles: command consolidation, dispatch reordering for new command frequencies, or reducing command count.","result":"No gas change — V2 auto-pay is NOT used in any of the 27 benchmark paths. All V2 swap callbacks process command streams, not auto-pay. The fee-in-sentinel only saves gas in auto-pay callbacks which don't exist in the benchmark. Reverted.","rollback_reason":"No gas impact — V2 auto-pay not used in any benchmark path"}}
{"run":54,"commit":"6e73de8","metric":4372388,"metrics":{"bytecode_size":19191,"v2_v2_v2":186417,"v2_v2_v3":165399,"v2_v2_v4":189079,"v2_v3_v2":169754,"v2_v3_v3":148788,"v2_v3_v4":175833,"v2_v4_v2":190988,"v2_v4_v3":169995,"v2_v4_v4":150390,"v3_v2_v2":165311,"v3_v2_v3":148756,"v3_v2_v4":171476,"v3_v3_v2":148748,"v3_v3_v3":145996,"v3_v3_v4":162916,"v3_v4_v2":169913,"v3_v4_v3":161704,"v3_v4_v4":139937,"v4_v2_v2":186789,"v4_v2_v3":170241,"v4_v2_v4":170020,"v4_v3_v2":170175,"v4_v3_v3":161670,"v4_v3_v4":152911,"v4_v4_v2":148945,"v4_v4_v3":159805,"v4_v4_v4":90432},"status":"discard","description":"Dispatch reorder by freq — within noise","timestamp":1781056223772,"segment":1,"confidence":null,"asi":{"hypothesis":"Dispatch reorder by updated frequency","next_action":"Try compound commands to reduce dispatch count","result":"Within noise (+45 gas). Frequencies too similar for meaningful dispatch gains."}}
{"run":55,"commit":"6e73de8","metric":4372343,"metrics":{"bytecode_size":19191,"v2_v2_v2":186348,"v2_v2_v3":165376,"v2_v2_v4":189102,"v2_v3_v2":169731,"v2_v3_v3":148808,"v2_v3_v4":175879,"v2_v4_v2":190919,"v2_v4_v3":169972,"v2_v4_v4":150344,"v3_v2_v2":165288,"v3_v2_v3":148775,"v3_v2_v4":171476,"v3_v3_v2":148766,"v3_v3_v3":146107,"v3_v3_v4":162952,"v3_v4_v2":169890,"v3_v4_v3":161722,"v3_v4_v4":139937,"v4_v2_v2":186766,"v4_v2_v3":170264,"v4_v2_v4":170020,"v4_v3_v2":170198,"v4_v3_v3":161688,"v4_v3_v4":152929,"v4_v4_v2":148922,"v4_v4_v3":159768,"v4_v4_v4":90396},"status":"discard","description":"Skip TSTORE ZERO_ADDR — TSTORE cost is value-independent","timestamp":1781056516721,"segment":1,"confidence":null,"asi":{"hypothesis":"Skip TSTORE for ZERO_ADDRESS in preamble since transient storage is already 0","next_action":"TSTORE costs 100 gas regardless of value — writing 0 is NOT cheaper than writing non-zero. Cannot optimize TSTORE by value. Instead, try eliminating the entire SET_ADDRESS command for ZERO_ADDRESS by reserving index 0 for it. This would require: (1) Python AddressTable changes, (2) command encoding changes. The savings would be ~214 gas per path (TSTORE + calldata + processing). But the index remapping is invasive.","result":"FAILED: TSTORE costs the same regardless of value written. Writing address(0) to t_addresses[idx] costs 100 gas just like any other address. The EVM does NOT have a 'zero-write' optimization.","rollback_reason":"TSTORE cost is value-independent — no savings possible from writing 0 vs non-zero"}}
{"type":"config","name":"cmd_executor 27-perm gas reduction","metricName":"total_gas","metricUnit":"gas","bestDirection":"lower"}
{"run":56,"commit":"c80c801","metric":4358280,"metrics":{"v2_v2_v4":188265,"v2_v4_v2":190094,"v2_v2_v2":186348,"v2_v3_v3":148808,"v2_v3_v2":169731,"v2_v4_v3":169147,"v2_v3_v4":175182,"v2_v2_v3":165376,"v2_v4_v4":149460,"v3_v2_v2":165288,"v3_v2_v4":170779,"v3_v2_v3":148775,"v3_v3_v4":162395,"v3_v3_v2":148766,"v3_v3_v3":146107,"v3_v4_v2":169065,"v3_v4_v4":139230,"v4_v2_v2":185929,"v3_v4_v3":161062,"v4_v2_v4":169424,"v4_v2_v3":169427,"v4_v3_v3":161028,"v4_v3_v2":169361,"v4_v4_v3":159173,"v4_v3_v4":152222,"v4_v4_v2":148178,"v4_v4_v4":89660,"bytecode_size":19306},"status":"keep","description":"V4 no-hooks sentinel (0xFF) — -14,063 gas. Hooks_idx=0xFF skips TLOAD for address(0) lookup and eliminates SET_ADDRESS for ZERO_ADDRESS in command stream. Backward-compatible.","timestamp":1781057447586,"segment":2,"confidence":null,"asi":{"hypothesis":"Use 0xFF sentinel value in V4 hooks_idx field to mean 'no hooks', skipping TLOAD for address(0) and eliminating SET_ADDRESS ZERO_ADDRESS from command stream","result":"-14,063 gas total. V4-heavy paths see 500-900 gas savings each. No regression on non-V4 paths. Bytecode +115 bytes from sentinel checks in 3 V4 handler locations. Key insight: ZERO_ADDRESS was only used for V4 hooks, so a targeted sentinel avoids penalizing non-V4 paths (unlike the pre-population approach which would cost 300 gas per non-V4 path).","savings_breakdown":"per-V4-swap: skip 1 TLOAD (100 gas) + skip SET_ADDRESS ZERO (84 gas calldata + ~300 gas preprocessing) minus ~6 gas sentinel check = ~478 gas per V4 swap","backward_compatible":"old encodings with ZERO_ADDRESS in the address table still work — they just don't benefit from the optimization"}}
{"run":57,"commit":"c80c801","metric":4358280,"metrics":{"v2_v2_v4":188265,"v2_v4_v2":190094,"v2_v2_v2":186348,"v2_v3_v3":148808,"v2_v3_v2":169731,"v2_v4_v3":169147,"v2_v3_v4":175182,"v2_v2_v3":165376,"v2_v4_v4":149460,"v3_v2_v2":165288,"v3_v2_v4":170779,"v3_v2_v3":148775,"v3_v3_v4":162395,"v3_v3_v2":148766,"v3_v3_v3":146107,"v3_v4_v2":169065,"v3_v4_v4":139230,"v3_v4_v3":161062,"v4_v2_v2":185929,"v4_v3_v2":169361,"v4_v2_v4":169424,"v4_v2_v3":169427,"v4_v3_v3":161028,"v4_v4_v3":159173,"v4_v3_v4":152222,"v4_v4_v2":148178,"v4_v4_v4":89660,"bytecode_size":19306},"status":"discard","description":"Simplify double convert in V4 mint/burn — no gas change","timestamp":1781057687461,"segment":2,"confidence":null,"asi":{"hypothesis":"Replace convert(convert(currency, uint160), uint256) with convert(currency, uint256) in V4 mint/burn","next_action_hint":"Try another optimization - the double convert is already optimized by Venom","result":"no gas change, Venom already handles this"}}
