{"run":115,"commit":"d28dd52","metric":4241130,"metrics":{"v2_v2_v2":182901,"v2_v3_v3":145604,"v2_v2_v4":183498,"v2_v4_v2":185225,"v2_v3_v4":169708,"v2_v2_v3":161836,"v2_v4_v3":164184,"v3_v2_v2":161749,"v2_v3_v2":165822,"v2_v4_v4":144378,"v3_v2_v4":165447,"v3_v3_v2":145564,"v3_v3_v3":142761,"v3_v2_v3":145572,"v3_v3_v4":157756,"v3_v4_v2":164106,"v3_v4_v4":134794,"v3_v4_v3":156721,"v4_v2_v2":181233,"v4_v2_v3":164264,"v4_v2_v4":165419,"v4_v4_v2":143281,"v4_v3_v3":156390,"v4_v3_v4":147629,"v4_v3_v2":164202,"v4_v4_v4":86274,"v4_v4_v3":154812,"bytecode_size":17877},"status":"keep","description":"Remove forward_data variables in V2/V3 swap compact — -1,895 gas, -74 bytes","timestamp":1781112929134,"segment":3,"confidence":48.001477104874446,"asi":{"hypothesis":"Remove forward_data intermediate variables in V2 and V3 swap compact — pass slice directly to extcall","result":"-1,895 gas, -74 bytes bytecode! Same pattern as _cmd_v4_unlock: eliminating intermediate Bytes[MAX_COMMANDS_LENGTH] variables that are only used once allows Venom to avoid memory allocation and pass the slice directly.","v2_saving":"V2 paths with swaps save ~100 gas per V2 swap","v3_saving":"V3 paths with swaps save ~100 gas per V3 swap","pattern":"Eliminating intermediate Bytes variables that are only used once is a consistent optimization technique for Venom codegen"}}
{"run":116,"commit":"d28dd52","metric":4241372,"metrics":{"v2_v4_v2":185235,"v2_v2_v4":183508,"v2_v3_v3":145604,"v2_v2_v2":182901,"v2_v4_v3":164194,"v2_v2_v3":161836,"v2_v3_v4":169718,"v2_v3_v2":165822,"v2_v4_v4":144398,"v3_v2_v4":165457,"v3_v2_v2":161749,"v3_v2_v3":145572,"v3_v3_v2":145564,"v3_v3_v3":142761,"v3_v3_v4":157764,"v3_v4_v3":156729,"v3_v4_v2":164116,"v3_v4_v4":134810,"v4_v2_v4":165435,"v4_v2_v3":164274,"v4_v2_v2":181243,"v4_v3_v2":164212,"v4_v3_v4":147645,"v4_v4_v3":154828,"v4_v4_v2":143301,"v4_v3_v3":156398,"v4_v4_v4":86298,"bytecode_size":17878},"status":"discard","description":"Inline _fee/_ts into PoolKey — +242 gas regression","timestamp":1781113097671,"segment":3,"confidence":48.001477104874446,"asi":{"hypothesis":"Inline _fee and _ts into PoolKey constructor in _cmd_v4_swap_compact","next_action_hint":"Named intermediate variables HELP Venom optimize. Don't inline them into struct constructors. The prior result (experiment #81) also showed +242 gas regression.","result":"+242 gas regression. Inlining named variables into struct constructor is consistently worse for Venom. Named variables help Venom's liveness analysis.","rollback_reason":"Named intermediate variables improve Venom liveness optimization"}}
{"run":117,"commit":"d28dd52","metric":4241335,"metrics":{"v2_v3_v3":145604,"v2_v2_v4":183507,"v2_v2_v2":182901,"v2_v4_v2":185234,"v2_v3_v4":169726,"v2_v4_v3":164193,"v2_v3_v2":165822,"v2_v4_v4":144396,"v2_v2_v3":161836,"v3_v2_v4":165465,"v3_v2_v2":161749,"v3_v3_v2":145564,"v3_v3_v4":157771,"v3_v2_v3":145572,"v3_v3_v3":142761,"v3_v4_v3":156728,"v3_v4_v2":164115,"v4_v2_v2":181242,"v3_v4_v4":134808,"v4_v3_v2":164211,"v4_v2_v3":164273,"v4_v2_v4":165426,"v4_v3_v4":147644,"v4_v3_v3":156397,"v4_v4_v3":154819,"v4_v4_v2":143290,"v4_v4_v4":86281,"bytecode_size":17880},"status":"discard","description":"Inline amount variable in V4_TAKE_COMPACT — +205 gas regression","timestamp":1781113259103,"segment":3,"confidence":48.001477104874446,"asi":{"hypothesis":"Inline amount uint256 variable in _cmd_v4_take_compact","next_action_hint":"The elimination pattern only works for Bytes variables, not uint256/numeric ones. The save comes from avoiding Bytes memory allocation, not from removing the variable itself. Try other Bytes eliminations or completely different approach.","result":"+205 gas regression. Inlining uint256 variables does NOT help — only Bytes variable elimination works. The gas saving is from avoiding Bytes memory allocation, not from removing named variables.","rollback_reason":"Inline uint256 variable doesn't save gas — only Bytes variables matter"}}
{"run":118,"commit":"d28dd52","metric":0,"metrics":{"v2_v4_v2":0,"v2_v2_v4":0,"v2_v3_v3":0,"v2_v2_v2":0,"v2_v4_v3":0,"v2_v2_v3":0,"v2_v3_v4":0,"v2_v3_v2":0,"v2_v4_v4":0,"v3_v2_v4":0,"v3_v2_v2":0,"v3_v2_v3":0,"v3_v3_v2":0,"v3_v3_v3":0,"v3_v3_v4":0,"v3_v4_v3":0,"v3_v4_v2":0,"v3_v4_v4":0,"v4_v2_v4":0,"v4_v2_v3":0,"v4_v2_v2":0,"v4_v3_v2":0,"v4_v3_v4":0,"v4_v4_v3":0,"v4_v4_v2":0,"v4_v3_v3":0,"v4_v4_v4":0,"bytecode_size":0},"status":"crash","description":"Unconditional WETH deposit in _v4_settle_currency — test failures","timestamp":1781113344276,"segment":3,"confidence":48.001477104874446,"asi":{"hypothesis":"Always deposit full owed WETH in _v4_settle_currency to skip balanceOf staticcall","next_action_hint":"Dead end — unconditional deposit wraps excess ETH, breaking profit check. The balanceOf + conditional deposit is necessary.","result":"Tests fail — 6 V4 paths. Always depositing full owed amount wraps excess ETH, breaking profit check.","rollback_reason":"Excess ETH wrapping breaks profit check"}}
{"run":119,"commit":"b45d112","metric":4241130,"metrics":{"v2_v2_v2":182901,"v2_v3_v3":145604,"v2_v2_v4":183498,"v2_v4_v2":185225,"v2_v2_v3":161836,"v2_v3_v2":165822,"v2_v3_v4":169708,"v2_v4_v3":164184,"v2_v4_v4":144378,"v3_v2_v3":145572,"v3_v2_v2":161749,"v3_v2_v4":165447,"v3_v3_v4":157756,"v3_v3_v2":145564,"v3_v3_v3":142761,"v4_v2_v2":181233,"v3_v4_v2":164106,"v3_v4_v3":156721,"v3_v4_v4":134794,"v4_v2_v4":165419,"v4_v2_v3":164264,"v4_v3_v2":164202,"v4_v3_v3":156390,"v4_v3_v4":147629,"v4_v4_v2":143281,"v4_v4_v4":86274,"v4_v4_v3":154812,"bytecode_size":17877},"status":"keep","description":"Simplify convert(address, bytes32) — no gas change, cleaner code","timestamp":1781113537434,"segment":3,"confidence":42.23131903833658,"asi":{"hypothesis":"Replace convert(convert(address, uint160), bytes32) with direct convert(address, bytes32)","result":"No gas change. Venom/Vyper already optimizes both forms to identical bytecode. Cleanliness improvement: simpler code.","simplification":"3 sites simplified"}}
{"run":120,"commit":"2fe05de","metric":4241034,"metrics":{"v2_v3_v3":145604,"v2_v2_v4":183498,"v2_v2_v2":182869,"v2_v4_v2":185193,"v2_v3_v4":169708,"v2_v4_v3":164184,"v2_v3_v2":165790,"v2_v2_v3":161836,"v2_v4_v4":144378,"v3_v2_v4":165447,"v3_v2_v3":145572,"v3_v2_v2":161749,"v3_v3_v2":145564,"v3_v3_v3":142761,"v3_v4_v2":164106,"v3_v4_v3":156721,"v3_v3_v4":157756,"v3_v4_v4":134794,"v4_v2_v4":165419,"v4_v2_v2":181233,"v4_v2_v3":164264,"v4_v3_v4":147629,"v4_v3_v2":164202,"v4_v3_v3":156390,"v4_v4_v2":143281,"v4_v4_v4":86274,"v4_v4_v3":154812,"bytecode_size":17863},"status":"keep","description":"Remove forward_len>0 guard in V2 swap compact — -96 gas, -14 bytes","timestamp":1781113832963,"segment":3,"confidence":25.663779527559054,"asi":{"hypothesis":"Remove forward_len > 0 guard in V2 swap compact — always register callback","result":"-96 gas, -14 bytes bytecode. V2-containing paths save ~32 gas each. The conditional branch was always taken in benchmarks, so removing it saves the comparison + conditional jump.","savings_per_v2_swap":"~32 gas per V2 swap path with callback"}}
{"run":121,"commit":"2fe05de","metric":4241034,"metrics":{"v2_v4_v2":185193,"v2_v2_v4":183498,"v2_v3_v3":145604,"v2_v2_v2":182869,"v2_v4_v3":164184,"v2_v2_v3":161836,"v2_v3_v4":169708,"v2_v3_v2":165790,"v2_v4_v4":144378,"v3_v2_v4":165447,"v3_v2_v2":161749,"v3_v2_v3":145572,"v3_v3_v2":145564,"v3_v3_v3":142761,"v3_v3_v4":157756,"v3_v4_v3":156721,"v3_v4_v2":164106,"v3_v4_v4":134794,"v4_v2_v4":165419,"v4_v2_v3":164264,"v4_v2_v2":181233,"v4_v3_v4":147629,"v4_v3_v2":164202,"v4_v3_v3":156390,"v4_v4_v2":143281,"v4_v4_v4":86274,"v4_v4_v3":154812,"bytecode_size":17863},"status":"crash","description":"Unconditional WETH deposit in _v4_settle_currency (take 2) — test failures","timestamp":1781114250284,"segment":3,"confidence":22.872280701754384,"asi":{"hypothesis":"Unconditional WETH deposit in _v4_settle_currency — replace balanceOf with always-deposit","next_action_hint":"Unconditional deposit is a confirmed dead end. The balanceOf check is necessary for correctness. Try tracking WETH from V4_TAKE in transient variable instead, or explore a completely different optimization.","result":"Tests fail — wraps excess ETH, breaking subsequent ops. Same issue as before.","rollback_reason":"Unconditional WETH deposit breaks ETH balance invariant"}}
{"run":122,"commit":"2fe05de","metric":4241148,"metrics":{"v2_v4_v2":185231,"v2_v2_v4":183498,"v2_v3_v3":145604,"v2_v2_v2":182907,"v2_v4_v3":164184,"v2_v2_v3":161836,"v2_v3_v4":169708,"v2_v3_v2":165828,"v2_v4_v4":144378,"v3_v2_v4":165447,"v3_v2_v2":161749,"v3_v2_v3":145572,"v3_v3_v2":145564,"v3_v3_v3":142761,"v3_v3_v4":157756,"v3_v4_v2":164106,"v3_v4_v3":156721,"v3_v4_v4":134794,"v4_v2_v4":165419,"v4_v2_v2":181233,"v4_v2_v3":164264,"v4_v3_v2":164202,"v4_v3_v3":156390,"v4_v3_v4":147629,"v4_v4_v2":143281,"v4_v4_v4":86274,"v4_v4_v3":154812,"bytecode_size":17848},"status":"discard","description":"Multiplication pattern for V2 swap amounts — +114 gas regression","timestamp":1781114431812,"segment":3,"confidence":20.628481012658227,"asi":{"hypothesis":"Replace ternary with multiplication pattern for V2 swap amounts","next_action_hint":"Multiplication is more expensive than ternary for this pattern. Try other approaches.","result":"+114 gas regression. convert(bool, uint256) + multiplication + unsafe_sub costs more than two ternary expressions.","rollback_reason":"Multiplication pattern more expensive than ternary"}}
{"run":123,"commit":"2fe05de","metric":4241057,"metrics":{"v2_v2_v4":183498,"v2_v3_v3":145604,"v2_v2_v2":182872,"v2_v4_v2":185196,"v2_v3_v2":165793,"v2_v3_v4":169708,"v2_v2_v3":161836,"v2_v4_v4":144378,"v2_v4_v3":164184,"v3_v2_v2":161749,"v3_v2_v4":165447,"v3_v3_v2":145564,"v3_v2_v3":145572,"v3_v3_v3":142775,"v3_v4_v3":156721,"v3_v4_v2":164106,"v3_v4_v4":134794,"v3_v3_v4":157756,"v4_v2_v2":181233,"v4_v2_v3":164264,"v4_v2_v4":165419,"v4_v3_v2":164202,"v4_v3_v3":156390,"v4_v3_v4":147629,"v4_v4_v3":154812,"v4_v4_v4":86274,"v4_v4_v2":143281,"bytecode_size":17863},"status":"discard","description":"Reorder V3/V2 auto-pay if/elif — amount1 first (+23 gas)","timestamp":1781114823807,"segment":3,"confidence":19.74136886735312,"asi":{"hypothesis":"Reorder V3/V2 auto-pay if/elif to check amount1 > 0 first (WETH typically token1)","result":"+23 gas regression. The benchmark test pools don't follow the WETH-is-token1 pattern, so the reorder just swaps which branch falls through. Only saves gas for specific pool configurations.","rollback_reason":"No improvement for benchmark paths; reorder is chain-specific"}}
{"run":124,"commit":"2fe05de","metric":4254790,"metrics":{"v2_v2_v4":183498,"v2_v2_v2":182869,"v2_v3_v3":146556,"v2_v4_v2":185193,"v2_v3_v2":166385,"v2_v4_v3":164779,"v2_v2_v3":162431,"v2_v3_v4":170303,"v2_v4_v4":144378,"v3_v2_v2":162355,"v3_v2_v4":166053,"v3_v3_v2":146524,"v3_v2_v3":146533,"v3_v3_v3":143945,"v3_v3_v4":158717,"v3_v4_v3":157682,"v3_v4_v2":164712,"v3_v4_v4":135279,"v4_v2_v2":181233,"v4_v2_v4":165419,"v4_v2_v3":164859,"v4_v3_v2":164797,"v4_v3_v4":148105,"v4_v3_v3":157342,"v4_v4_v2":143281,"v4_v4_v3":155288,"v4_v4_v4":86274,"bytecode_size":17947},"status":"discard","description":"V3 pre-read token for auto-pay — +13,756 gas regression","timestamp":1781115095313,"segment":3,"confidence":18.927409988385598,"asi":{"hypothesis":"Pre-read V3 token addresses before swap and TSTORE for auto-pay callback","next_action_hint":"V3 token pre-read is much worse. The TSTORE (100) + conditional staticcall + convert(address,uint256) in the command handler costs more than a single staticcall in the callback. The callback only runs once, so the overhead per V3 swap is net negative. Try different optimization.","result":"+13,756 gas regression. Adding TSTORE + staticcall to command handler is much more expensive than lazy-read in callback.","rollback_reason":"V3 token pre-read adds more cost than it saves"}}
{"run":125,"commit":"2fe05de","metric":4241034,"metrics":{"bytecode_size":17866,"v2_v2_v2":182869,"v2_v2_v4":183498,"v2_v3_v3":145604,"v2_v4_v2":185193,"v2_v3_v2":165790,"v2_v2_v3":161836,"v2_v3_v4":169708,"v2_v4_v3":164184,"v2_v4_v4":144378,"v3_v2_v2":161749,"v3_v2_v3":145572,"v3_v3_v2":145564,"v3_v2_v4":165447,"v3_v3_v3":142761,"v3_v3_v4":157756,"v3_v4_v4":134794,"v3_v4_v2":164106,"v3_v4_v3":156721,"v4_v2_v2":181233,"v4_v2_v4":165419,"v4_v2_v3":164264,"v4_v3_v2":164202,"v4_v3_v3":156390,"v4_v4_v2":143281,"v4_v4_v3":154812,"v4_v3_v4":147629,"v4_v4_v4":86274},"status":"discard","description":"Tuple variable for getReserves — no gas change, +3 bytes","timestamp":1781115226705,"segment":3,"confidence":13.155600403632695,"asi":{"hypothesis":"Replace getReserves destructuring with tuple variable + index access in _cmd_v2_swap_calc","next_action_hint":"Tuple variable indexing adds bytecode (no savings). Vyper destructuring compiles to sequential MSTOREs which Venom optimizes well. Try other approaches.","result":"No gas change, +3 bytes bytecode. Tuple variable with indexing is slightly larger.","rollback_reason":"No gas savings, minor bytecode regression"}}
{"run":126,"commit":"22d0655","metric":4240911,"metrics":{"bytecode_size":17908,"v2_v2_v2":182869,"v2_v2_v4":183527,"v2_v3_v3":145604,"v2_v4_v2":185193,"v2_v2_v3":161836,"v2_v4_v3":164184,"v2_v3_v2":165790,"v2_v3_v4":169708,"v2_v4_v4":144378,"v3_v2_v3":145572,"v3_v2_v4":165447,"v3_v3_v2":145564,"v3_v2_v2":161749,"v3_v4_v2":164106,"v3_v4_v3":156721,"v3_v3_v4":157756,"v3_v3_v3":142761,"v4_v2_v4":165424,"v3_v4_v4":134794,"v4_v2_v3":164236,"v4_v2_v2":181205,"v4_v3_v4":147607,"v4_v3_v2":164174,"v4_v3_v3":156390,"v4_v4_v3":154789,"v4_v4_v2":143253,"v4_v4_v4":86274},"status":"keep","description":"Reorder _v4_settle_currency: check delta < 0 first — -123 gas","timestamp":1781115485105,"segment":3,"confidence":10.465770953294946,"asi":{"hypothesis":"Reorder delta comparison in _v4_settle_currency: check delta < 0 first (settle before take)","result":"-123 gas improvement. The settle path (delta < 0) is more common in benchmarks (V4_SETTLE_DELTA always has negative delta). Checking it first avoids one JUMPI on the common path.","bytecode_change":"+45 bytes (longer settle code now first in bytecode layout)"}}
{"run":127,"commit":"22d0655","metric":4240911,"metrics":{"bytecode_size":17908,"v2_v2_v2":182869,"v2_v2_v4":183527,"v2_v3_v3":145604,"v2_v4_v2":185193,"v2_v2_v3":161836,"v2_v4_v3":164184,"v2_v3_v2":165790,"v2_v3_v4":169708,"v2_v4_v4":144378,"v3_v2_v3":145572,"v3_v2_v4":165447,"v3_v3_v2":145564,"v3_v2_v2":161749,"v3_v4_v2":164106,"v3_v4_v3":156721,"v3_v3_v4":157756,"v3_v3_v3":142761,"v4_v2_v4":165424,"v3_v4_v4":134794,"v4_v2_v3":164236,"v4_v2_v2":181205,"v4_v3_v4":147607,"v4_v3_v2":164174,"v4_v3_v3":156390,"v4_v4_v3":154789,"v4_v4_v2":143253,"v4_v4_v4":86274},"status":"discard","description":"Replace convert(bool) with != 0 — no gas change","timestamp":1781115651337,"segment":3,"confidence":10.40419780569248,"asi":{"hypothesis":"Replace convert(uint256, bool) with != 0 for zero_for_one across all swap handlers","next_action_hint":"Venom already optimizes convert(uint256, bool) to ISZERO. No savings. Try different optimization.","result":"No gas change. Venom internally compiles both patterns to the same ISZERO opcode.","rollback_reason":"No gas savings from replace convert(bool) with != 0"}}
{"run":128,"commit":"22d0655","metric":4241103,"metrics":{"bytecode_size":17874,"v2_v2_v2":182933,"v2_v2_v4":183527,"v2_v3_v3":145604,"v2_v4_v2":185257,"v2_v2_v3":161836,"v2_v4_v3":164184,"v2_v3_v2":165854,"v2_v3_v4":169708,"v2_v4_v4":144378,"v3_v2_v2":161749,"v3_v2_v3":145572,"v3_v2_v4":165447,"v3_v3_v2":145564,"v3_v3_v3":142761,"v3_v3_v4":157756,"v3_v4_v2":164106,"v3_v4_v3":156721,"v3_v4_v4":134794,"v4_v2_v2":181205,"v4_v2_v3":164236,"v4_v3_v3":156390,"v4_v3_v4":147607,"v4_v2_v4":165424,"v4_v3_v2":164174,"v4_v4_v2":143253,"v4_v4_v3":154789,"v4_v4_v4":86274},"status":"discard","description":"Convert bytes1→uint256 comparison in V2 callback — +192 gas","timestamp":1781115819128,"segment":3,"confidence":10.343344925703446,"asi":{"hypothesis":"Convert bytes1 comparison to uint256 in _v2_callback_handler auto-pay check","next_action_hint":"bytes1 comparison is already optimal. Convert to uint256 adds overhead. Try different approach.","result":"+192 gas regression. Converting bytes1 to uint256 for the comparison is more expensive.","rollback_reason":"convert(bytes1, uint256) + comparison is more expensive than bytes1 comparison"}}
{"run":129,"commit":"22d0655","metric":4240911,"metrics":{"bytecode_size":17908,"v2_v2_v2":182869,"v2_v2_v4":183527,"v2_v3_v3":145604,"v2_v4_v2":185193,"v2_v2_v3":161836,"v2_v4_v3":164184,"v2_v3_v2":165790,"v2_v3_v4":169708,"v2_v4_v4":144378,"v3_v2_v2":161749,"v3_v2_v3":145572,"v3_v2_v4":165447,"v3_v3_v2":145564,"v3_v3_v3":142761,"v3_v3_v4":157756,"v3_v4_v2":164106,"v3_v4_v3":156721,"v3_v4_v4":134794,"v4_v2_v2":181205,"v4_v2_v4":165424,"v4_v2_v3":164236,"v4_v3_v2":164174,"v4_v3_v3":156390,"v4_v3_v4":147607,"v4_v4_v3":154789,"v4_v4_v2":143253,"v4_v4_v4":86274},"status":"discard","description":"Inline _cmd_v4_sync in dispatch — no gas change","timestamp":1781115964038,"segment":3,"confidence":10.046368800859819,"asi":{"hypothesis":"Inline _cmd_v4_sync directly in dispatch to save function call overhead","next_action_hint":"Inlining V4_SYNC doesn't help. Venom already optimizes function calls. Function extraction benefits Venom liveness analysis. Don't inline small handlers.","result":"No gas change. The function call overhead is already optimized by Venom. Inlining increases _execute_command_at's memory footprint without savings.","rollback_reason":"No gas savings from inlining V4_SYNC"}}
{"run":130,"commit":"c12fc78","metric":4240665,"metrics":{"bytecode_size":18009,"v2_v2_v2":182869,"v2_v2_v4":183497,"v2_v3_v3":145604,"v2_v4_v2":185193,"v2_v2_v3":161836,"v2_v4_v3":164184,"v2_v3_v2":165790,"v2_v3_v4":169708,"v2_v4_v4":144378,"v3_v2_v2":161749,"v3_v2_v3":145572,"v3_v2_v4":165447,"v3_v3_v2":145564,"v3_v3_v3":142761,"v3_v3_v4":157756,"v3_v4_v2":164106,"v3_v4_v3":156721,"v3_v4_v4":134794,"v4_v2_v2":181175,"v4_v2_v4":165376,"v4_v2_v3":164206,"v4_v3_v2":164144,"v4_v3_v3":156390,"v4_v3_v4":147583,"v4_v4_v2":143223,"v4_v4_v3":154765,"v4_v4_v4":86274},"status":"keep","description":"Sentinel-aware V4_SETTLE_DELTA — -246 gas","timestamp":1781116327288,"segment":3,"confidence":9.839402985074626,"asi":{"bytecode_change":"+101 bytes (+0.6%)","hypothesis":"Sentinel-aware V4_SETTLE_DELTA: check currency_idx sentinels before _lookup_address to skip redundant comparisons","result":"-246 gas improvement. For WETH/NATIVE sentinels, we directly call _read_pm_delta with the known address, avoiding _lookup_address overhead."}}
{"run":131,"commit":"c12fc78","metric":4240665,"metrics":{"bytecode_size":18009,"v2_v2_v2":182869,"v2_v2_v4":183497,"v2_v3_v3":145604,"v2_v4_v2":185193,"v2_v2_v3":161836,"v2_v4_v3":164184,"v2_v3_v2":165790,"v2_v3_v4":169708,"v2_v4_v4":144378,"v3_v2_v2":161749,"v3_v2_v3":145572,"v3_v2_v4":165447,"v3_v3_v2":145564,"v3_v3_v3":142761,"v3_v3_v4":157756,"v3_v4_v2":164106,"v3_v4_v3":156721,"v3_v4_v4":134794,"v4_v2_v2":181175,"v4_v2_v4":165376,"v4_v2_v3":164206,"v4_v3_v2":164144,"v4_v3_v3":156390,"v4_v3_v4":147583,"v4_v4_v2":143223,"v4_v4_v3":154765,"v4_v4_v4":86274},"status":"discard","description":"Inline _cmd_v4_settle in dispatch — no gas change","timestamp":1781116526855,"segment":3,"confidence":9.813039595117594,"asi":{"hypothesis":"Inline _cmd_v4_settle (PM.settle()) in dispatch to save function call overhead","next_action_hint":"Venom already optimizes small function calls. Inlining into dispatch doesn't save gas but increases _execute_command_at memory footprint. Don't inline simple handlers.","result":"No gas change. Same as V4_SYNC inline — Venom handles function call optimization.","rollback_reason":"No gas savings from inlining V4_SETTLE"}}
{"run":132,"commit":"01c90c6","metric":4238811,"metrics":{"bytecode_size":18009,"v2_v2_v2":182771,"v2_v2_v4":183422,"v2_v3_v3":145526,"v2_v4_v2":185118,"v2_v2_v3":161738,"v2_v4_v3":164109,"v2_v3_v2":165692,"v2_v3_v4":169633,"v2_v4_v4":144326,"v3_v2_v2":161651,"v3_v2_v3":145494,"v3_v2_v4":165372,"v3_v3_v2":145485,"v3_v3_v3":142683,"v3_v3_v4":157696,"v3_v4_v2":164031,"v3_v4_v3":156661,"v3_v4_v4":134752,"v4_v2_v2":181100,"v4_v2_v4":165334,"v4_v2_v3":164131,"v4_v3_v2":164069,"v4_v3_v3":156330,"v4_v3_v4":147541,"v4_v4_v2":143171,"v4_v4_v3":154724,"v4_v4_v4":86251},"status":"keep","description":"Reorder _preprocess: SET_ADDRESS before BEGIN_EXECUTION — -1,854 gas","timestamp":1781116672726,"segment":3,"confidence":10.33729216152019,"asi":{"hypothesis":"Reorder _preprocess if/elif to check SET_ADDRESS (0x00) before BEGIN_EXECUTION (0xFF), since SET_ADDRESS is more common in the preprocessing loop","result":"-1,854 gas improvement. SET_ADDRESS is called multiple times per preprocessing pass (one per address in table), while BEGIN_EXECUTION is checked only once. Putting SET_ADDRESS first saves 1 comparison (JUMPI, ~6 gas) per SET_ADDRESS × many paths = significant total savings.","bytecode_change":"0 bytes (unchanged)"}}
