{"run":97,"commit":"07a64e9","metric":0,"metrics":{"v2_v4_v2":0,"v2_v2_v4":0,"v2_v3_v3":0,"v2_v2_v2":0,"v2_v4_v3":0,"v2_v2_v3":0,"v2_v3_v4":0,"v2_v3_v2":0,"v2_v4_v4":0,"v3_v2_v4":0,"v3_v2_v2":0,"v3_v2_v3":0,"v3_v3_v2":0,"v3_v3_v3":0,"v3_v3_v4":0,"v3_v4_v3":0,"v3_v4_v2":0,"v3_v4_v4":0,"v4_v2_v4":0,"v4_v2_v3":0,"v4_v2_v2":0,"v4_v3_v2":0,"v4_v3_v4":0,"v4_v4_v3":0,"v4_v4_v2":0,"v4_v3_v3":0,"v4_v4_v4":0,"bytecode_size":0},"status":"crash","description":"10-byte merge in V4_SWAP_COMPACT — CRASH","timestamp":1781108728062,"segment":3,"confidence":null,"asi":{"hypothesis":"Merge c_indices (2B) + fthz (8B) into 10-byte single read in V4_SWAP_COMPACT","next_action_hint":"Stick to 2/3/5/8 byte merges which are proven. Try completely different optimization approach.","result":"CRASH - V4 transactions revert. convert(Bytes[10], uint256) doesn't work correctly in Vyper 0.5.0a2","rollback_reason":"10-byte slice→uint256 conversion produces wrong values"}}
{"run":98,"commit":"07a64e9","metric":4276207,"metrics":{"v2_v2_v4":184755,"v2_v4_v2":186411,"v2_v3_v3":146976,"v2_v2_v2":184274,"v2_v4_v3":165519,"v2_v3_v2":167388,"v2_v2_v3":163357,"v2_v3_v4":171180,"v2_v4_v4":145523,"v3_v2_v2":163266,"v3_v2_v3":146942,"v3_v2_v4":166916,"v3_v3_v3":144332,"v3_v3_v2":146933,"v3_v4_v2":165434,"v3_v3_v4":159089,"v3_v4_v3":157942,"v3_v4_v4":135863,"v4_v2_v2":182504,"v4_v2_v3":165733,"v4_v2_v4":166332,"v4_v3_v4":148700,"v4_v3_v3":157718,"v4_v4_v2":144419,"v4_v3_v2":165667,"v4_v4_v4":87193,"v4_v4_v3":155841,"bytecode_size":18202},"status":"discard","description":"Replace DynArray with HashMap for address table — +2,580 gas regression","timestamp":1781109223450,"segment":3,"confidence":null,"asi":{"hypothesis":"Replace transient(DynArray) with transient(HashMap) for address table","next_action_hint":"HashMap keccak256 overhead is too expensive. Try different approach","result":"+2,580 gas REGRESSION. keccak256 slot computation overhead is more expensive than DynArray bounds-check TLOAD","rollback_reason":"HashMap is more expensive than DynArray"}}
{"run":99,"commit":"7bc5f2b","metric":4248641,"metrics":{"v2_v2_v4":183614,"v2_v3_v3":145962,"v2_v4_v2":185414,"v2_v2_v2":183003,"v2_v3_v2":166121,"v2_v3_v4":170042,"v2_v4_v3":164521,"v2_v4_v4":144515,"v2_v2_v3":162086,"v3_v2_v2":161999,"v3_v2_v3":145930,"v3_v3_v2":145921,"v3_v2_v4":165781,"v3_v3_v3":143267,"v3_v3_v4":158184,"v3_v4_v3":157148,"v3_v4_v2":164440,"v3_v4_v4":135061,"v4_v2_v2":181367,"v4_v2_v4":165528,"v4_v3_v2":164533,"v4_v3_v3":156812,"v4_v3_v4":147899,"v4_v2_v3":164598,"v4_v4_v4":86384,"v4_v4_v3":155096,"v4_v4_v2":143415,"bytecode_size":18302},"status":"keep","description":"Conditional balance reads — skip when skip_profit_check + no bribe — -24,986 gas","timestamp":1781109417817,"segment":3,"confidence":9.684496124031007,"asi":{"hypothesis":"Skip WETH balanceOf staticcalls when skip_profit_check=True and bribe_bips=0","result":"-24,986 gas saved! Each balanceOf(WETH) staticcall costs ~200 gas. With skip_profit_check=True (used by all benchmarks), the two before/after balance reads are unnecessary. Added 'need_balance' boolean to gate the expensive staticcalls. Also eliminated the complex return paths for skip_profit_check.","savings_breakdown":"~412 gas per path (2 staticcalls + 2 self.balance reads) × 27 paths = ~11,124 gas from balance reads. Additional savings from simplified return logic."}}
{"run":100,"commit":"7442b0a","metric":4248202,"metrics":{"v2_v3_v3":145948,"v2_v4_v2":185396,"v2_v2_v2":182985,"v2_v2_v4":183614,"v2_v3_v4":170024,"v2_v2_v3":162068,"v2_v4_v3":164503,"v2_v3_v2":166103,"v2_v4_v4":144497,"v3_v2_v3":145916,"v3_v2_v2":161981,"v3_v2_v4":165763,"v3_v3_v4":158169,"v3_v3_v3":143252,"v3_v3_v2":145907,"v3_v4_v2":164422,"v3_v4_v4":135047,"v4_v2_v3":164580,"v3_v4_v3":157134,"v4_v2_v2":181349,"v4_v3_v4":147884,"v4_v3_v2":164515,"v4_v2_v4":165514,"v4_v3_v3":156798,"v4_v4_v3":155067,"v4_v4_v2":143397,"v4_v4_v4":86369,"bytecode_size":18302},"status":"keep","description":"Reorder _lookup_address sentinels: SELF before NATIVE — -439 gas","timestamp":1781109574482,"segment":3,"confidence":2,"asi":{"hypothesis":"Reorder _lookup_address sentinel checks: SELF before NATIVE (SELF is more common as recipient)","result":"-439 gas saved. Moving SELF check before NATIVE saves one EQ+JUMPI (~6 gas) per SELF sentinel lookup. SELF (0xFD) is used for recipient in V4_TAKE_COMPACT, while NATIVE (0xFF) is used less frequently.","savings_breakdown":"~22 SELF lookups × ~6 gas per saved comparison = ~132 gas. Minus ~7 NATIVE lookups × 6 gas extra = ~42 gas. Net ~90 gas estimated, actual ~439 gas — Venom may further optimize the branch ordering."}}
{"run":101,"commit":"3d8df2f","metric":4245175,"metrics":{"v2_v3_v3":145743,"v2_v2_v2":182975,"v2_v4_v2":185386,"v2_v2_v4":183614,"v2_v3_v4":169896,"v2_v2_v3":161940,"v2_v4_v3":164375,"v2_v3_v2":165965,"v3_v2_v2":161853,"v3_v2_v3":145711,"v2_v4_v4":144497,"v3_v3_v4":157964,"v3_v2_v4":165635,"v3_v3_v3":142945,"v3_v3_v2":145702,"v3_v4_v4":134944,"v3_v4_v3":156929,"v4_v2_v2":181349,"v3_v4_v2":164294,"v4_v2_v3":164452,"v4_v3_v4":147782,"v4_v3_v3":156593,"v4_v3_v2":164387,"v4_v2_v4":165514,"v4_v4_v4":86369,"v4_v4_v3":154964,"v4_v4_v2":143397,"bytecode_size":18212},"status":"keep","description":"Replace t_callback HashMap with single-variable — -3,027 gas","timestamp":1781109992604,"segment":3,"confidence":8.208886324293132,"asi":{"hypothesis":"Replace t_callback HashMap with single-variable t_expected_callback + t_callback_fee","result":"-3,027 gas saved! HashMap access requires keccak256 + TLOAD (~142 gas), while single transient variable only needs TLOAD (~100 gas). The save is ~42 gas per TSTORE write + ~42 gas per TLOAD read. V2 auto-pay fee is read immediately in callback before nesting can overwrite it, so single-var is safe.","savings_breakdown":"~6 callback registrations × ~42 gas + ~6 callback verifications × ~42 gas = ~504 gas from TSTORE/TLOAD savings. The bulk of savings likely from Venom optimizing single-variable access more efficiently than HashMap access."}}
{"run":102,"commit":"3d8df2f","metric":4245175,"metrics":{"v2_v2_v2":182975,"v2_v3_v3":145743,"v2_v2_v4":183614,"v2_v4_v2":185386,"v2_v2_v3":161940,"v2_v3_v4":169896,"v2_v4_v3":164375,"v2_v3_v2":165965,"v2_v4_v4":144497,"v3_v3_v2":145702,"v3_v2_v2":161853,"v3_v2_v4":165635,"v3_v2_v3":145711,"v3_v4_v3":156929,"v3_v3_v4":157964,"v3_v3_v3":142945,"v3_v4_v2":164294,"v3_v4_v4":134944,"v4_v2_v2":181349,"v4_v2_v3":164452,"v4_v2_v4":165514,"v4_v3_v4":147782,"v4_v3_v2":164387,"v4_v4_v2":143397,"v4_v3_v3":156593,"v4_v4_v4":86369,"v4_v4_v3":154964,"bytecode_size":18365},"status":"discard","description":"Inline exttload in _auto_settle_touched — no gas change, +153 bytes","timestamp":1781110125523,"segment":3,"confidence":8.763899584167564,"asi":{"hypothesis":"Inline exttload for WETH/NATIVE in _auto_settle_touched to avoid _read_pm_delta function call + conditional branches","next_action_hint":"Venom inlines small functions already. Look for other optimization vectors — conditional branches, redundant operations, etc.","result":"No gas change, +153 bytes bytecode regression. Venom already inlines _read_pm_delta when called with known arguments. The extra bytecode comes from duplicated staticcall code.","rollback_reason":"No gas savings, bytecode regression"}}
{"run":103,"commit":"3d8df2f","metric":4246327,"metrics":{"v2_v4_v2":185437,"v2_v2_v2":183009,"v2_v2_v4":183648,"v2_v3_v3":145784,"v2_v2_v3":161974,"v2_v4_v3":164426,"v2_v3_v4":169947,"v2_v3_v2":166016,"v3_v2_v2":161887,"v3_v2_v4":165686,"v2_v4_v4":144531,"v3_v2_v3":145752,"v3_v3_v2":145743,"v3_v3_v3":142986,"v3_v3_v4":158019,"v3_v4_v2":164345,"v3_v4_v4":134985,"v4_v2_v2":181383,"v3_v4_v3":156984,"v4_v2_v3":164503,"v4_v3_v3":156648,"v4_v3_v2":164438,"v4_v3_v4":147823,"v4_v2_v4":165541,"v4_v4_v2":143431,"v4_v4_v3":155005,"v4_v4_v4":86396,"bytecode_size":18218},"status":"discard","description":"Cache len(data) in _process_commands — +1,152 gas regression","timestamp":1781110237476,"segment":3,"confidence":9.399405351833499,"asi":{"hypothesis":"Cache len(data) in _process_commands to avoid repeated memory reads","next_action_hint":"len(data) is already cheap (MLOAD from memory). The extra variable allocation costs more than the repeated MLOADs. Try different approach.","result":"+1,152 gas REGRESSION. Extra memory slot for data_len variable costs more than saved MLOADs.","rollback_reason":"Regression from extra memory slot"}}
{"run":104,"commit":"84c45e8","metric":4245283,"metrics":{"v2_v3_v3":145743,"v2_v2_v4":183614,"v2_v2_v2":183011,"v2_v4_v2":185422,"v2_v3_v4":169896,"v2_v3_v2":166001,"v2_v2_v3":161940,"v2_v4_v4":144497,"v2_v4_v3":164375,"v3_v2_v2":161853,"v3_v2_v3":145711,"v3_v3_v2":145702,"v3_v2_v4":165635,"v3_v3_v4":157964,"v3_v3_v3":142945,"v3_v4_v2":164294,"v4_v2_v2":181349,"v3_v4_v3":156929,"v3_v4_v4":134944,"v4_v2_v3":164452,"v4_v2_v4":165514,"v4_v3_v2":164387,"v4_v3_v4":147782,"v4_v3_v3":156593,"v4_v4_v3":154964,"v4_v4_v2":143397,"v4_v4_v4":86369,"bytecode_size":18023},"status":"keep","description":"Extract V2 callback handler — -108 gas, -189 bytes","timestamp":1781110388937,"segment":3,"confidence":13.977892409727339,"asi":{"hypothesis":"Extract shared V2 callback logic into _v2_callback_handler internal function to reduce bytecode","result":"-108 gas saved, -189 bytes bytecode. Deduplication of V2 callback logic reduces bytecode size. Minor gas savings possibly from Venom optimizing the shared function more efficiently (liveness analysis on smaller functions).","bytecode_savings":"-189 bytes (from 18,212 to 18,023)"}}
{"run":105,"commit":"84c45e8","metric":4246037,"metrics":{"v2_v2_v4":183614,"v2_v4_v2":185422,"v2_v3_v3":145796,"v2_v2_v2":183011,"v2_v3_v2":166034,"v2_v4_v3":164408,"v2_v2_v3":161973,"v2_v3_v4":169929,"v2_v4_v4":144497,"v3_v2_v4":165668,"v3_v2_v2":161886,"v3_v2_v3":145764,"v3_v3_v4":158017,"v3_v3_v3":143004,"v3_v4_v2":164327,"v3_v3_v2":145755,"v3_v4_v3":156982,"v4_v2_v2":181349,"v3_v4_v4":134971,"v4_v3_v4":147808,"v4_v2_v3":164485,"v4_v3_v2":164420,"v4_v2_v4":165514,"v4_v4_v3":154991,"v4_v4_v2":143397,"v4_v3_v3":156646,"v4_v4_v4":86369,"bytecode_size":18001},"status":"discard","description":"Extract V3 callback handler — +754 gas regression","timestamp":1781110537345,"segment":3,"confidence":24.697916666666668,"asi":{"hypothesis":"Extract V3 callback logic into _v3_callback_handler to reduce bytecode","next_action_hint":"V3 callback extraction doesn't help. Try different optimization.","result":"+754 gas REGRESSION. Function call overhead outweighs bytecode savings.","rollback_reason":"Regression from function call overhead"}}
{"run":106,"commit":"84c45e8","metric":4245283,"metrics":{"v2_v2_v2":183011,"v2_v2_v4":183614,"v2_v3_v3":145743,"v2_v4_v2":185422,"v2_v2_v3":161940,"v2_v3_v4":169896,"v2_v4_v3":164375,"v2_v3_v2":166001,"v3_v2_v3":145711,"v2_v4_v4":144497,"v3_v2_v4":165635,"v3_v2_v2":161853,"v3_v3_v3":142945,"v3_v3_v4":157964,"v3_v4_v2":164294,"v3_v3_v2":145702,"v4_v2_v2":181349,"v3_v4_v3":156929,"v3_v4_v4":134944,"v4_v2_v3":164452,"v4_v2_v4":165514,"v4_v3_v2":164387,"v4_v3_v4":147782,"v4_v4_v3":154964,"v4_v4_v4":86369,"v4_v3_v3":156593,"v4_v4_v2":143397,"bytecode_size":18630},"status":"discard","description":"Specialize V4 settle functions for WETH/NATIVE — no gas change, +628 bytes","timestamp":1781110726571,"segment":3,"confidence":28.254220456802383,"asi":{"hypothesis":"Specialize _v4_settle_currency into _v4_settle_weth and _v4_settle_native to skip currency comparisons","next_action_hint":"Venom already optimizes when called with constant arguments. Code dedup doesn't help. Focus on reducing total number of operations or finding truly new optimization angles.","result":"No gas change, +628 bytes bytecode. Venom already eliminates the currency comparisons when arguments are known constants. The specialized functions just bloat bytecode.","rollback_reason":"No gas savings, significant bytecode increase"}}
{"run":107,"commit":"3fec6da","metric":4245283,"metrics":{"v2_v2_v2":183011,"v2_v4_v2":185422,"v2_v3_v3":145743,"v2_v2_v3":161940,"v2_v2_v4":183614,"v2_v4_v3":164375,"v2_v3_v4":169896,"v2_v4_v4":144497,"v3_v2_v2":161853,"v3_v2_v3":145711,"v2_v3_v2":166001,"v3_v2_v4":165635,"v3_v3_v4":157964,"v3_v3_v2":145702,"v3_v4_v2":164294,"v3_v4_v4":134944,"v3_v3_v3":142945,"v4_v2_v2":181349,"v4_v2_v3":164452,"v4_v2_v4":165514,"v3_v4_v3":156929,"v4_v3_v2":164387,"v4_v4_v2":143397,"v4_v3_v4":147782,"v4_v3_v3":156593,"v4_v4_v3":154964,"v4_v4_v4":86369,"bytecode_size":18023},"status":"keep","description":"Replace % 256 with & 255 in V4 handlers — no gas change","timestamp":1781110853135,"segment":3,"confidence":33.00696055684455,"asi":{"hypothesis":"Replace % 256 with & 255 in V4 swap handler hooks_idx extraction","result":"No gas change. Venom already optimizes modulo by power-of-2 to bitwise AND. Consistency fix only.","next_action_hint":"Try completely different optimization angle. The low-hanging fruit is mostly exhausted."}}
{"run":108,"commit":"9f410a2","metric":4244498,"metrics":{"v2_v3_v3":145717,"v2_v2_v4":183582,"v2_v2_v2":182979,"v2_v4_v2":185390,"v2_v3_v2":165969,"v2_v3_v4":169864,"v2_v2_v3":161908,"v2_v4_v3":164343,"v2_v4_v4":144465,"v3_v2_v2":161821,"v3_v2_v3":145685,"v3_v2_v4":165603,"v3_v3_v3":142920,"v3_v3_v4":157939,"v3_v3_v2":145676,"v3_v4_v2":164262,"v4_v2_v2":181317,"v3_v4_v4":134919,"v3_v4_v3":156904,"v4_v2_v3":164420,"v4_v2_v4":165488,"v4_v3_v2":164355,"v4_v3_v3":156568,"v4_v3_v4":147756,"v4_v4_v4":86344,"v4_v4_v2":143365,"v4_v4_v3":154939,"bytecode_size":18009},"status":"keep","description":"Remove len(commands)>0 guard in execute() — -785 gas","timestamp":1781111020211,"segment":3,"confidence":50.57118055555556,"asi":{"hypothesis":"Remove len(commands) > 0 guard in execute() preprocessing check","result":"-785 gas saved! The len(commands) > 0 short-circuit guard costs ~29 gas per execute() call (MLOAD + ISZERO + AND + JUMPI). The slice() call on empty bytes would OOB, but commands is always non-empty in production (contract ABI encoding ensures valid data). The guard was overly defensive.","savings_breakdown":"~29 gas per execute() call × 27 paths = ~783 gas. Matches precisely."}}
{"run":109,"commit":"7c2b476","metric":4244498,"metrics":{"v2_v4_v2":185390,"v2_v2_v2":182979,"v2_v2_v4":183582,"v2_v4_v3":164343,"v2_v3_v3":145717,"v2_v3_v2":165969,"v2_v2_v3":161908,"v2_v4_v4":144465,"v3_v2_v3":145685,"v2_v3_v4":169864,"v3_v2_v4":165603,"v3_v2_v2":161821,"v3_v3_v3":142920,"v3_v3_v2":145676,"v3_v4_v2":164262,"v3_v3_v4":157939,"v3_v4_v3":156904,"v3_v4_v4":134919,"v4_v2_v2":181317,"v4_v2_v4":165488,"v4_v2_v3":164420,"v4_v3_v2":164355,"v4_v3_v4":147756,"v4_v3_v3":156568,"v4_v4_v2":143365,"v4_v4_v3":154939,"v4_v4_v4":86344,"bytecode_size":18002},"status":"keep","description":"Use unsafe_sub in withdraw() — no gas change, -7 bytes","timestamp":1781111199169,"segment":3,"confidence":37.10700636942675,"asi":{"hypothesis":"Use unsafe_sub in withdraw() instead of checked subtraction","result":"No gas change, -7 bytes bytecode. The withdraw function is not in the benchmark path, so no runtime savings. Bytecode saved from removing the overflow check.","bytecode_savings":"-7 bytes"}}
{"run":110,"commit":"3530c8a","metric":4244498,"metrics":{"v2_v4_v2":185390,"v2_v2_v2":182979,"v2_v2_v4":183582,"v2_v3_v3":145717,"v2_v4_v3":164343,"v2_v2_v3":161908,"v2_v3_v4":169864,"v2_v3_v2":165969,"v3_v2_v2":161821,"v2_v4_v4":144465,"v3_v2_v4":165603,"v3_v2_v3":145685,"v3_v3_v4":157939,"v3_v3_v2":145676,"v3_v3_v3":142920,"v3_v4_v2":164262,"v3_v4_v4":134919,"v3_v4_v3":156904,"v4_v2_v2":181317,"v4_v2_v3":164420,"v4_v3_v2":164355,"v4_v3_v3":156568,"v4_v2_v4":165488,"v4_v3_v4":147756,"v4_v4_v2":143365,"v4_v4_v4":86344,"v4_v4_v3":154939,"bytecode_size":18001},"status":"keep","description":"Use unsafe_sub in tstore continuation read — no gas change, -1 byte","timestamp":1781111350448,"segment":3,"confidence":37.10700636942675,"asi":{"hypothesis":"Use unsafe_sub in tstore continuation read for cmd_size - first_part_len","result":"No gas change, -1 byte bytecode. The tstore continuation read path is not in benchmark paths, so no runtime savings.","bytecode_savings":"-1 byte"}}
{"run":111,"commit":"d906768","metric":4244498,"metrics":{"v2_v2_v4":183582,"v2_v3_v3":145717,"v2_v2_v2":182979,"v2_v4_v2":185390,"v2_v3_v4":169864,"v2_v3_v2":165969,"v2_v4_v3":164343,"v2_v2_v3":161908,"v3_v2_v4":165603,"v3_v2_v2":161821,"v3_v2_v3":145685,"v2_v4_v4":144465,"v3_v3_v4":157939,"v3_v4_v2":164262,"v3_v3_v3":142920,"v3_v3_v2":145676,"v3_v4_v3":156904,"v4_v2_v2":181317,"v4_v2_v3":164420,"v4_v2_v4":165488,"v3_v4_v4":134919,"v4_v3_v2":164355,"v4_v3_v3":156568,"v4_v3_v4":147756,"v4_v4_v2":143365,"v4_v4_v4":86344,"v4_v4_v3":154939,"bytecode_size":18001},"status":"keep","description":"Change @view to @pure on pure functions — no gas change","timestamp":1781111580637,"segment":3,"confidence":37.10700636942675,"asi":{"hypothesis":"Change @view to @pure on pure functions (_v2_get_amount_out, _v2_get_amount_in, _command_size)","result":"No gas change. Venom treats @view and @pure identically for internal functions. Consistency improvement — these functions don't read storage."}}
{"run":112,"commit":"d906768","metric":4244767,"metrics":{"v2_v2_v4":183593,"v2_v3_v3":145726,"v2_v4_v2":185401,"v2_v2_v2":182990,"v2_v3_v4":169875,"v2_v3_v2":165980,"v2_v4_v3":164354,"v2_v4_v4":144476,"v2_v2_v3":161919,"v3_v2_v2":161832,"v3_v2_v3":145694,"v3_v3_v3":142928,"v3_v2_v4":165614,"v3_v3_v2":145685,"v3_v3_v4":157948,"v3_v4_v2":164273,"v4_v2_v2":181328,"v3_v4_v3":156912,"v4_v2_v3":164431,"v3_v4_v4":134928,"v4_v2_v4":165497,"v4_v3_v4":147765,"v4_v3_v3":156576,"v4_v3_v2":164366,"v4_v4_v4":86352,"v4_v4_v2":143376,"v4_v4_v3":154948,"bytecode_size":17999},"status":"discard","description":"Inline need_balance condition — +269 gas regression","timestamp":1781111704510,"segment":3,"confidence":37.10700636942675,"asi":{"hypothesis":"Replace need_balance variable with inline condition in execute()","next_action_hint":"The variable is needed — duplicating the condition evaluates it twice. Stick with the variable. Try different approaches.","result":"+269 gas regression — the compound condition (not skip_profit_check) or (bribe_bips > 0) is evaluated twice instead of once when using inline. The variable caches the result.","rollback_reason":"Inline condition evaluated twice, costs more than cached variable"}}
{"run":113,"commit":"d906768","metric":4244747,"metrics":{"v2_v2_v4":183582,"v2_v2_v2":182891,"v2_v4_v2":185302,"v2_v3_v3":145752,"v2_v3_v4":169886,"v2_v4_v3":164365,"v2_v2_v3":161930,"v2_v3_v2":165903,"v3_v2_v4":165625,"v3_v2_v3":145720,"v2_v4_v4":144465,"v3_v2_v2":161843,"v3_v3_v2":145712,"v3_v3_v4":157974,"v3_v4_v2":164284,"v3_v3_v3":142972,"v3_v4_v3":156939,"v4_v2_v3":164442,"v4_v2_v2":181317,"v3_v4_v4":134936,"v4_v2_v4":165488,"v4_v3_v3":156603,"v4_v3_v4":147774,"v4_v3_v2":164377,"v4_v4_v2":143365,"v4_v4_v4":86344,"v4_v4_v3":154956,"bytecode_size":18152},"status":"discard","description":"Pack t_expected_callback + t_callback_fee into single transient — +249 gas regression","timestamp":1781112593258,"segment":3,"confidence":37.10700636942675,"asi":{"hypothesis":"Pack t_expected_callback + t_callback_fee into single uint256 transient to save TSTORE/TLOAD","next_action_hint":"Pack transient approach is a dead end for this contract. The address extraction overhead (AND + convert for V2, direct convert for V3) negates the TSTORE/TLOAD savings. Try a completely different optimization vector.","result":"Packed transient variable approach gave -124 gas (best run) but the overhead of address extraction from packed uint256 (AND + convert for V2 callbacks, convert for V3 callbacks) nearly negated the TSTORE/TLOAD savings. V3 write sites also became more expensive (double-convert vs direct address TSTORE). Net saving was only -124 gas with +136 bytes bytecode.","rollback_reason":"Packed transient is overall a net negative — extraction overhead exceeds TSTORE savings"}}
{"run":114,"commit":"6bf3656","metric":4243025,"metrics":{"v2_v2_v4":183498,"v2_v2_v2":182979,"v2_v3_v3":145717,"v2_v4_v2":185306,"v2_v2_v3":161908,"v2_v3_v2":165969,"v2_v4_v3":164259,"v2_v3_v4":169780,"v3_v2_v2":161821,"v2_v4_v4":144378,"v3_v2_v3":145685,"v3_v2_v4":165519,"v3_v3_v3":142920,"v3_v3_v2":145676,"v3_v4_v2":164181,"v3_v3_v4":157872,"v3_v4_v3":156839,"v3_v4_v4":134852,"v4_v2_v3":164336,"v4_v2_v2":181233,"v4_v3_v2":164271,"v4_v2_v4":165419,"v4_v3_v4":147687,"v4_v4_v2":143281,"v4_v3_v3":156498,"v4_v4_v4":86274,"v4_v4_v3":154867,"bytecode_size":17951},"status":"keep","description":"Remove forward_data variable in _cmd_v4_unlock — -1,473 gas, -50 bytes","timestamp":1781112784339,"segment":3,"confidence":41.86320109439124,"asi":{"hypothesis":"Remove forward_data intermediate variable in _cmd_v4_unlock — pass slice directly to extcall","result":"-1,473 gas, -50 bytes bytecode! Eliminating the intermediate Bytes variable allows Venom to avoid a memory allocation and pass the slice directly to the ABI encoder. Major win from a simple change.","bytecode_change":"-50 bytes","gas_saving":"-1,473"}}
