{"run":153,"commit":"a0a6d4a","metric":4356230,"metrics":{"v2_v2_v4":189806,"v2_v3_v3":145148,"v2_v2_v2":182268,"v2_v4_v2":191040,"v2_v3_v4":177442,"v2_v3_v2":165210,"v2_v2_v3":161244,"v2_v4_v3":170040,"v2_v4_v4":153616,"v3_v2_v2":161151,"v3_v2_v4":172335,"v3_v2_v3":145111,"v3_v3_v3":142354,"v3_v3_v2":145102,"v3_v4_v3":161418,"v3_v4_v2":169956,"v3_v3_v4":163284,"v3_v4_v4":142196,"v4_v2_v4":170841,"v4_v2_v2":186354,"v4_v2_v3":169406,"v4_v3_v3":160980,"v4_v3_v2":169344,"v4_v3_v4":156333,"v4_v4_v2":150767,"v4_v4_v4":92696,"v4_v4_v3":160788,"bytecode_size":18927},"status":"checks_failed","description":"Merge 2+16→18 byte in V2_SWAP_COMPACT — -279 gas (checks race)","timestamp":1781135260647,"segment":4,"confidence":2.226531240381656,"asi":{"bytecode_change":"-27 bytes","checks":"6 failed + 72 errors in parallel (-j4) but 275 passed sequentially. Likely xdist race condition on shared test fixtures, not a real code bug","hypothesis":"Merge 2+16→18 byte read in V2_SWAP_COMPACT","next_action_hint":"Re-run to confirm checks pass. If they fail consistently, debug the specific test errors."}}
{"run":154,"commit":"1fa0639","metric":4356230,"metrics":{"v2_v2_v4":189806,"v2_v3_v3":145148,"v2_v2_v2":182268,"v2_v4_v2":191040,"v2_v3_v4":177442,"v2_v3_v2":165210,"v2_v2_v3":161244,"v2_v4_v3":170040,"v2_v4_v4":153616,"v3_v2_v3":145111,"v3_v2_v2":161151,"v3_v2_v4":172335,"v3_v3_v2":145102,"v3_v3_v4":163284,"v3_v3_v3":142354,"v3_v4_v2":169956,"v3_v4_v3":161418,"v3_v4_v4":142196,"v4_v2_v3":169406,"v4_v2_v2":186354,"v4_v3_v4":156333,"v4_v2_v4":170841,"v4_v3_v3":160980,"v4_v3_v2":169344,"v4_v4_v3":160788,"v4_v4_v4":92696,"v4_v4_v2":150767,"bytecode_size":18927},"status":"keep","description":"Merge 2+16→18 byte read in V2_SWAP_COMPACT — -279 gas","timestamp":1781135457536,"segment":4,"confidence":2.312403816558941,"asi":{"bytecode_change":"-27 bytes (18954 → 18927)","checks_retry_note":"Previous xdist race condition; all 274 tests pass sequentially","hypothesis":"Merge 2+16→18 byte read in V2_SWAP_COMPACT to save 1 bounds check","paths_improved":"v2_v2_v2(-93), v2_v3_v2(-93), v2_v4_v2(-93)"}}
{"run":155,"commit":"7d50050","metric":4353290,"metrics":{"v2_v2_v4":189677,"v2_v3_v3":145148,"v2_v2_v2":182268,"v2_v4_v2":190911,"v2_v3_v2":165210,"v2_v3_v4":177184,"v2_v4_v3":169911,"v2_v2_v3":161244,"v2_v4_v4":153358,"v3_v2_v2":161151,"v3_v2_v4":172077,"v3_v2_v3":145111,"v3_v3_v3":142354,"v3_v3_v2":145102,"v3_v3_v4":163077,"v3_v4_v3":161315,"v3_v4_v4":141990,"v3_v4_v2":169827,"v4_v2_v2":186225,"v4_v2_v4":170738,"v4_v3_v2":169215,"v4_v2_v3":169277,"v4_v3_v4":156127,"v4_v4_v2":150638,"v4_v3_v3":160877,"v4_v4_v3":160685,"v4_v4_v4":92593,"bytecode_size":18883},"status":"keep","description":"Merge 2+16→18 byte read in V4_TAKE_COMPACT — -2,940 gas","timestamp":1781135596975,"segment":4,"confidence":3.2172976300400125,"asi":{"bytecode_change":"-44 bytes (18927 → 18883)","hypothesis":"Merge 2+16→18 byte read in V4_TAKE_COMPACT to save 1 bounds check per call","paths_improved":"All paths with V4_TAKE_COMPACT: v2_v4_v4(-258), v2_v4_v2(-129), v2_v4_v3(-129), v3_v4_v4(-278), v3_v4_v2(-129), v3_v4_v3(-103), v4_v4_v2(-129), v4_v4_v3(-103), v4_v3_v4(-206), v4_v3_v2(-129), v4_v3_v3(-103), v4_v2_v4(-103), v4_v2_v3(-129), v4_v2_v2(-129), v2_v2_v4(-129), v2_v3_v4(-258), v3_v3_v4(-207)"}}
{"run":156,"commit":"0d7f4b4","metric":4350533,"metrics":{"v2_v2_v4":189563,"v2_v4_v2":190797,"v2_v2_v2":182268,"v2_v3_v3":145148,"v2_v3_v2":165210,"v2_v4_v3":169797,"v2_v2_v3":161244,"v2_v3_v4":177070,"v2_v4_v4":153130,"v3_v2_v2":161151,"v3_v2_v4":171963,"v3_v3_v2":145102,"v3_v2_v3":145111,"v3_v3_v3":142354,"v3_v4_v2":169713,"v3_v4_v3":161224,"v3_v3_v4":162986,"v3_v4_v4":141808,"v4_v2_v3":169163,"v4_v2_v2":186111,"v4_v2_v4":170556,"v4_v3_v2":169101,"v4_v3_v4":155944,"v4_v4_v2":150410,"v4_v3_v3":160786,"v4_v4_v3":160503,"v4_v4_v4":92320,"bytecode_size":18850},"status":"keep","description":"Merge 10+16→26 byte mega-read in V4_SWAP_COMPACT — -2,757 gas","timestamp":1781135731418,"segment":4,"confidence":3.685825892857143,"asi":{"bytecode_change":"-33 bytes (18883 → 18850)","hypothesis":"Merge 10+16 byte reads into single 26-byte read in V4_SWAP_COMPACT (3 slice reads → 1)","paths_improved":"All V4-containing paths: v4_v4_v4(-273), v4_v4_v3(-182), v4_v4_v2(-228), v4_v3_v4(-183), v4_v3_v3(-91), v4_v3_v2(-114), v4_v2_v4(-182), v4_v2_v3(-114), v4_v2_v2(-114), vs all mixed paths"}}
{"run":157,"commit":"0d7f4b4","metric":4350533,"metrics":{"v2_v2_v2":182268,"v2_v2_v4":189563,"v2_v3_v3":145148,"v2_v4_v2":190797,"v2_v2_v3":161244,"v2_v3_v2":165210,"v2_v3_v4":177070,"v2_v4_v3":169797,"v2_v4_v4":153130,"v3_v2_v3":145111,"v3_v2_v2":161151,"v3_v2_v4":171963,"v3_v3_v2":145102,"v3_v4_v2":169713,"v3_v3_v3":142354,"v3_v3_v4":162986,"v3_v4_v3":161224,"v4_v2_v3":169163,"v4_v2_v2":186111,"v3_v4_v4":141808,"v4_v2_v4":170556,"v4_v3_v2":169101,"v4_v4_v2":150410,"v4_v3_v3":160786,"v4_v3_v4":155944,"v4_v4_v4":92320,"v4_v4_v3":160503,"bytecode_size":18829},"status":"discard","description":"Merge 1+16→17 byte in SEND_ETH — no gas change, -21 bytes","timestamp":1781135917867,"segment":4,"confidence":2.761864938323228,"asi":{"bytecode_change":"-21 bytes (18850 -> 18829)","hypothesis":"Merge 1+16 into 17-byte read in SEND_ETH","result":"No gas change — SEND_ETH is not used in any of the 27 benchmark paths"}}
{"run":158,"commit":"0d7f4b4","metric":4350533,"metrics":{"v2_v3_v3":145148,"v2_v4_v2":190797,"v2_v2_v4":189563,"v2_v2_v2":182268,"v2_v3_v4":177070,"v2_v3_v2":165210,"v2_v4_v3":169797,"v2_v2_v3":161244,"v2_v4_v4":153130,"v3_v2_v2":161151,"v3_v2_v3":145111,"v3_v2_v4":171963,"v3_v3_v2":145102,"v3_v3_v4":162986,"v3_v3_v3":142354,"v3_v4_v3":161224,"v3_v4_v2":169713,"v3_v4_v4":141808,"v4_v2_v4":170556,"v4_v3_v2":169101,"v4_v2_v3":169163,"v4_v2_v2":186111,"v4_v3_v4":155944,"v4_v3_v3":160786,"v4_v4_v3":160503,"v4_v4_v4":92320,"v4_v4_v2":150410,"bytecode_size":19046},"status":"discard","description":"Inline NATIVE settle in _cmd_v4_settle_delta — no gas change, +196 bytes","timestamp":1781136080343,"segment":4,"confidence":2.6137712702809655,"asi":{"bytecode_change":"+196 bytes (18850 → 19046)","hypothesis":"Inline _v4_settle_currency for NATIVE sentinel in _cmd_v4_settle_delta","result":"No gas change. Venom already optimizes the function call with constant propagation for NATIVE_ADDRESS. The inlined version is identical in execution cost.","rollback_reason":"No gas savings, bytecode bloat (+196 bytes)"}}
{"run":159,"commit":"0d7f4b4","metric":4350533,"metrics":{"v2_v2_v4":189563,"v2_v3_v3":145148,"v2_v2_v2":182268,"v2_v3_v2":165210,"v2_v4_v2":190797,"v2_v2_v3":161244,"v2_v4_v4":153130,"v2_v3_v4":177070,"v2_v4_v3":169797,"v3_v2_v3":145111,"v3_v2_v4":171963,"v3_v2_v2":161151,"v3_v3_v2":145102,"v3_v3_v4":162986,"v3_v3_v3":142354,"v3_v4_v3":161224,"v3_v4_v2":169713,"v3_v4_v4":141808,"v4_v2_v3":169163,"v4_v2_v2":186111,"v4_v2_v4":170556,"v4_v3_v2":169101,"v4_v3_v4":155944,"v4_v3_v3":160786,"v4_v4_v2":150410,"v4_v4_v3":160503,"v4_v4_v4":92320,"bytecode_size":18728},"status":"checks_failed","description":"V4_BATCH 26-byte merge — test failures (hooks bit position bug)","timestamp":1781136315774,"segment":4,"confidence":2.210508701472557,"asi":{"bug":"hooks_idx extraction was (all >> 8) instead of (all >> 136) — wrong bit position for 26-byte merged value","hypothesis":"Merge V4_BATCH entry reads into 26-byte single slice","result":"5 test failures — hooks_idx at wrong bit position caused incorrect pool key construction","rollback_reason":"Bug in bit extraction for 26-byte merged read"}}
{"run":160,"commit":"0d7f4b4","metric":4350533,"metrics":{"v2_v3_v3":145148,"v2_v4_v2":190797,"v2_v2_v4":189563,"v2_v2_v2":182268,"v2_v3_v4":177070,"v2_v3_v2":165210,"v2_v4_v3":169797,"v2_v4_v4":153130,"v2_v2_v3":161244,"v3_v2_v3":145111,"v3_v2_v2":161151,"v3_v3_v2":145102,"v3_v2_v4":171963,"v3_v3_v3":142354,"v3_v4_v2":169713,"v3_v3_v4":162986,"v3_v4_v3":161224,"v3_v4_v4":141808,"v4_v2_v2":186111,"v4_v2_v4":170556,"v4_v2_v3":169163,"v4_v4_v2":150410,"v4_v3_v2":169101,"v4_v3_v4":155944,"v4_v3_v3":160786,"v4_v4_v3":160503,"v4_v4_v4":92320,"bytecode_size":18728},"status":"discard","description":"V4_BATCH 26-byte merge — no benchmark gas change, -122 bytes","timestamp":1781136440607,"segment":4,"confidence":2.2633427567891715,"asi":{"bytecode_change":"-122 bytes (18850 → 18728)","hypothesis":"Merge 2+8+16 → 26-byte in V4_BATCH with correct bit positions","result":"No gas change — V4_BATCH only affects v4_v4_v4 path; loop body restructuring doesn't change Venom's internal optimization"}}
{"run":161,"commit":"f735b7f","metric":4350533,"metrics":{"v2_v2_v4":189563,"v2_v3_v3":145148,"v2_v2_v2":182268,"v2_v4_v2":190797,"v2_v2_v3":161244,"v2_v3_v2":165210,"v2_v3_v4":177070,"v2_v4_v3":169797,"v3_v2_v2":161151,"v3_v2_v3":145111,"v2_v4_v4":153130,"v3_v2_v4":171963,"v3_v3_v4":162986,"v3_v4_v2":169713,"v3_v4_v3":161224,"v3_v3_v3":142354,"v3_v3_v2":145102,"v4_v2_v3":169163,"v4_v2_v4":170556,"v3_v4_v4":141808,"v4_v2_v2":186111,"v4_v3_v4":155944,"v4_v3_v3":160786,"v4_v3_v2":169101,"v4_v4_v2":150410,"v4_v4_v3":160503,"v4_v4_v4":92320,"bytecode_size":18808},"status":"keep","description":"10-byte merge in V4_SWAP_DYNAMIC — no gas change, -42 bytes","timestamp":1781136581427,"segment":4,"confidence":2.318764261892224,"asi":{"bytecode_change":"-42 bytes (18850 → 18808)","hypothesis":"Apply 10-byte merge to V4_SWAP_DYNAMIC for code consistency","result":"No gas change — V4_SWAP_DYNAMIC is not used in benchmark paths. Bytecode reduced by 42 bytes."}}
{"run":162,"commit":"f735b7f","metric":4350533,"metrics":{"v2_v3_v3":145148,"v2_v4_v2":190797,"v2_v2_v4":189563,"v2_v2_v2":182268,"v2_v3_v4":177070,"v2_v4_v3":169797,"v2_v4_v4":153130,"v2_v3_v2":165210,"v2_v2_v3":161244,"v3_v3_v2":145102,"v3_v2_v2":161151,"v3_v2_v4":171963,"v3_v3_v4":162986,"v3_v2_v3":145111,"v3_v3_v3":142354,"v3_v4_v3":161224,"v3_v4_v4":141808,"v3_v4_v2":169713,"v4_v2_v2":186111,"v4_v2_v3":169163,"v4_v2_v4":170556,"v4_v3_v2":169101,"v4_v3_v3":160786,"v4_v3_v4":155944,"v4_v4_v3":160503,"v4_v4_v2":150410,"v4_v4_v4":92320,"bytecode_size":18775},"status":"checks_failed","description":"V2_SWAP_CALC 5-byte merge — test failures (bit position bug)","timestamp":1781136745300,"segment":4,"confidence":2.318764261892224,"asi":{"bug":"recipient_idx extraction was (pzrf >> 8) instead of (pzrf >> 16) — wrong bit position for 5-byte merged value","hypothesis":"Merge 2+3 → 5-byte in V2_SWAP_CALC","result":"32 test failures — recipient_idx at wrong bit position caused incorrect recipient for V2 swaps"}}
{"run":163,"commit":"3983f8c","metric":4347903,"metrics":{"v2_v2_v4":189563,"v2_v3_v3":144970,"v2_v4_v2":190797,"v2_v2_v2":182268,"v2_v3_v2":165099,"v2_v4_v3":169686,"v2_v2_v3":161133,"v2_v3_v4":176953,"v2_v4_v4":153130,"v3_v2_v3":144933,"v3_v2_v4":171852,"v3_v2_v2":161040,"v3_v3_v4":162804,"v3_v3_v2":144924,"v3_v4_v2":169596,"v3_v3_v3":142088,"v4_v2_v2":186111,"v3_v4_v3":161041,"v3_v4_v4":141714,"v4_v2_v3":169052,"v4_v2_v4":170556,"v4_v3_v4":155851,"v4_v3_v3":160608,"v4_v3_v2":168990,"v4_v4_v2":150410,"v4_v4_v4":92320,"v4_v4_v3":160414,"bytecode_size":18766},"status":"keep","description":"Merge 18+3→21 byte in V3_SWAP_COMPACT — -2,630 gas","timestamp":1781136991963,"segment":4,"confidence":2.7804107424960507,"asi":{"bytecode_change":"-42 bytes (18808 → 18766)","gas_saving":"1 bounds check eliminated per V3 swap compact call × ~30 calls","hypothesis":"Merge 18+3 byte reads into 21-byte in V3_SWAP_COMPACT","layout":"[pool_idx:1][zfo:1][amount:16][recipient_idx:1][forward_len:2] as single 21-byte slice"}}
{"run":164,"commit":"762c23e","metric":4345258,"metrics":{"v2_v4_v2":190683,"v2_v2_v4":189335,"v2_v3_v3":144879,"v2_v2_v2":182040,"v2_v4_v3":169572,"v2_v3_v2":164985,"v2_v3_v4":176839,"v2_v2_v3":160905,"v2_v4_v4":153016,"v3_v2_v2":160812,"v3_v2_v3":144842,"v3_v2_v4":171738,"v3_v3_v2":144833,"v3_v4_v2":169482,"v3_v3_v3":142088,"v3_v3_v4":162804,"v3_v4_v3":161041,"v3_v4_v4":141714,"v4_v2_v3":168938,"v4_v2_v4":170464,"v4_v2_v2":185883,"v4_v3_v2":168876,"v4_v3_v4":155851,"v4_v4_v2":150296,"v4_v3_v3":160608,"v4_v4_v4":92320,"v4_v4_v3":160414,"bytecode_size":18708},"status":"keep","description":"Merge 18+1→19 byte in V2_SWAP_DIRECT — -2,645 gas","timestamp":1781137119026,"segment":4,"confidence":4.373077832978471,"asi":{"bytecode_change":"-58 bytes (18766 → 18708)","gas_saving":"1 bounds check eliminated per V2_SWAP_DIRECT call × 25 calls","hypothesis":"Merge 18+1 -> 19-byte in V2_SWAP_DIRECT","layout":"[pool_idx:1][zfo:1][amount_out:16][recipient_idx:1] as single 19-byte slice"}}
{"run":165,"commit":"fbe3afa","metric":4344934,"metrics":{"v2_v4_v2":190575,"v2_v2_v4":189335,"v2_v2_v2":181932,"v2_v3_v3":144879,"v2_v4_v3":169572,"v2_v2_v3":160905,"v2_v3_v2":164877,"v2_v3_v4":176839,"v2_v4_v4":153016,"v3_v2_v4":171738,"v3_v2_v2":160812,"v3_v2_v3":144842,"v3_v3_v2":144833,"v3_v4_v2":169482,"v3_v3_v4":162804,"v3_v3_v3":142088,"v3_v4_v3":161041,"v3_v4_v4":141714,"v4_v2_v2":185883,"v4_v2_v3":168938,"v4_v3_v2":168876,"v4_v2_v4":170464,"v4_v3_v3":160608,"v4_v4_v4":92320,"v4_v4_v3":160414,"v4_v3_v4":155851,"v4_v4_v2":150296,"bytecode_size":18676},"status":"keep","description":"Merge 18+5→23 byte in V2_SWAP_COMPACT — -324 gas","timestamp":1781137444143,"segment":4,"confidence":3.532206572769953,"asi":{"bytecode_change":"-32 bytes (18708 → 18676)","gas_saving":"1 bounds check × 3 V2_SWAP_COMPACT calls + bytecode reduction","hypothesis":"Merge 18+5 → 23-byte in V2_SWAP_COMPACT","note":"Fixed bit positions: pool_idx>>176, zfo>>168, amount>>40%2^128, r_idx>>32, fee>>16, fwd_len&65535"}}
{"run":166,"commit":"fbe3afa","metric":4344934,"metrics":{"v2_v2_v4":189335,"v2_v4_v2":190575,"v2_v2_v2":181932,"v2_v3_v3":144879,"v2_v4_v3":169572,"v2_v3_v2":164877,"v2_v2_v3":160905,"v2_v3_v4":176839,"v3_v2_v2":160812,"v2_v4_v4":153016,"v3_v2_v3":144842,"v3_v2_v4":171738,"v3_v3_v2":144833,"v3_v3_v4":162804,"v3_v3_v3":142088,"v3_v4_v2":169482,"v3_v4_v4":141714,"v3_v4_v3":161041,"v4_v2_v3":168938,"v4_v2_v2":185883,"v4_v3_v3":160608,"v4_v2_v4":170464,"v4_v4_v2":150296,"v4_v3_v4":155851,"v4_v3_v2":168876,"v4_v4_v3":160414,"v4_v4_v4":92320,"bytecode_size":18830},"status":"discard","description":"Inline _lookup_address in V4_TAKE_DELTA — no gas change, +154 bytes","timestamp":1781137576818,"segment":4,"confidence":3.3435250199982223,"asi":{"bytecode_change":"+154 bytes (18676 → 18830)","gas_change":"0","hypothesis":"Inline _lookup_address in V4_TAKE_DELTA (10 calls × 2 lookups)","result":"No gas savings, bytecode regression from duplicating sentinel resolution code. Venom already optimizes the function call for this handler — likely because V4_TAKE_DELTA's _lookup_address calls don't benefit from constant propagation like V4_SWAP_COMPACT's do."}}
{"run":167,"commit":"fbe3afa","metric":4344934,"metrics":{"bytecode_size":18686,"v2_v2_v2":181932,"v2_v2_v3":160905,"v2_v2_v4":189335,"v2_v3_v2":164877,"v2_v3_v3":144879,"v2_v3_v4":176839,"v2_v4_v2":190575,"v2_v4_v3":169572,"v2_v4_v4":153016,"v3_v2_v2":160812,"v3_v2_v3":144842,"v3_v2_v4":171738,"v3_v3_v2":144833,"v3_v3_v3":142088,"v3_v3_v4":162804,"v3_v4_v2":169482,"v3_v4_v3":161041,"v3_v4_v4":141714,"v4_v2_v2":185883,"v4_v2_v3":168938,"v4_v2_v4":170464,"v4_v3_v2":168876,"v4_v3_v3":160608,"v4_v3_v4":155851,"v4_v4_v2":150296,"v4_v4_v3":160414,"v4_v4_v4":92320},"status":"discard","description":"Delta != 0 check in _auto_settle_touched — no gas change","timestamp":1781137759172,"segment":4,"confidence":3.3593498839078406,"asi":{"bytecode_change":"+10 bytes","gas_change":"0","hypothesis":"Add delta != 0 check before _v4_settle_currency in _auto_settle_touched","result":"No gas savings — benchmark paths have nonzero deltas for all table entries"}}
{"run":168,"commit":"3a8c978","metric":4344325,"metrics":{"bytecode_size":19320,"v2_v2_v2":181932,"v2_v2_v3":160905,"v2_v2_v4":189286,"v2_v3_v2":164877,"v2_v3_v3":144879,"v2_v3_v4":176839,"v2_v4_v2":190575,"v2_v4_v3":169572,"v2_v4_v4":153016,"v3_v2_v2":160812,"v3_v2_v3":144842,"v3_v2_v4":171738,"v3_v3_v2":144833,"v3_v3_v3":142088,"v3_v3_v4":162804,"v3_v4_v2":169482,"v3_v4_v3":161041,"v3_v4_v4":141714,"v4_v2_v2":185790,"v4_v2_v3":168845,"v4_v2_v4":170425,"v4_v3_v2":168783,"v4_v3_v3":160608,"v4_v3_v4":155776,"v4_v4_v2":150203,"v4_v4_v3":160340,"v4_v4_v4":92320},"status":"keep","description":"Inline WETH/NATIVE settle in V4_SETTLE_DELTA — -609 gas","timestamp":1781138051629,"segment":4,"confidence":3.438031161473088,"asi":{"bytecode_change":"+644 bytes (18676 → 19320)","gas_saving":"Skips currency comparison in _v4_settle_currency for WETH/NATIVE sentinels. ~6 gas per comparison × 10 V4_SETTLE_DELTA calls + avoids function call overhead for inlined paths","hypothesis":"Inline WETH/NATIVE settlement directly in _cmd_v4_settle_delta, bypassing _v4_settle_currency's redundant address comparisons"}}
{"run":169,"commit":"3a8c978","metric":4344325,"metrics":{"bytecode_size":19969,"v2_v2_v2":181932,"v2_v2_v3":160905,"v2_v2_v4":189286,"v2_v3_v2":164877,"v2_v3_v3":144879,"v2_v3_v4":176839,"v2_v4_v2":190575,"v2_v4_v3":169572,"v2_v4_v4":153016,"v3_v2_v2":160812,"v3_v2_v3":144842,"v3_v2_v4":171738,"v3_v3_v2":144833,"v3_v3_v3":142088,"v3_v3_v4":162804,"v3_v4_v2":169482,"v3_v4_v3":161041,"v3_v4_v4":141714,"v4_v2_v2":185790,"v4_v2_v3":168845,"v4_v2_v4":170425,"v4_v3_v2":168783,"v4_v3_v3":160608,"v4_v3_v4":155776,"v4_v4_v2":150203,"v4_v4_v3":160340,"v4_v4_v4":92320},"status":"discard","description":"Inline WETH/NATIVE settle in _auto_settle_touched — no gas, +649 bytes","timestamp":1781138169254,"segment":4,"confidence":3.4084605932947167,"asi":{"bytecode_change":"+649 bytes (19320 → 19969)","gas_change":"0 — _auto_settle_touched only runs once per path, and Venom already propagates WETH/NATIVE constants through _v4_settle_currency","hypothesis":"Inline WETH/NATIVE settlement in _auto_settle_touched, same pattern as V4_SETTLE_DELTA","rollback_reason":"No gas savings, bytecode regression"}}
{"run":170,"commit":"9372098","metric":4344325,"metrics":{"bytecode_size":19264,"v2_v2_v2":181932,"v2_v2_v3":160905,"v2_v2_v4":189286,"v2_v3_v2":164877,"v2_v3_v3":144879,"v2_v3_v4":176839,"v2_v4_v2":190575,"v2_v4_v3":169572,"v2_v4_v4":153016,"v3_v2_v2":160812,"v3_v2_v3":144842,"v3_v2_v4":171738,"v3_v3_v2":144833,"v3_v3_v3":142088,"v3_v3_v4":162804,"v3_v4_v2":169482,"v3_v4_v3":161041,"v3_v4_v4":141714,"v4_v2_v2":185790,"v4_v2_v3":168845,"v4_v2_v4":170425,"v4_v3_v2":168783,"v4_v3_v3":160608,"v4_v3_v4":155776,"v4_v4_v2":150203,"v4_v4_v3":160340,"v4_v4_v4":92320},"status":"keep","description":"Merge V4_MINT/BURN_COMPACT slice reads — no gas, -56 bytes bytecode","timestamp":1781138383654,"segment":4,"confidence":3.4084605932947167,"asi":{"bytecode_change":"-56 bytes (19320 → 19264)","gas_change":"0","hypothesis":"Merge slice reads in V4_MINT_COMPACT (2+16->18) and V4_BURN_COMPACT (1+16->17)"}}
{"run":171,"commit":"6a86004","metric":4344325,"metrics":{"bytecode_size":19227,"v2_v2_v2":181932,"v2_v2_v3":160905,"v2_v2_v4":189286,"v2_v3_v2":164877,"v2_v3_v3":144879,"v2_v3_v4":176839,"v2_v4_v2":190575,"v2_v4_v3":169572,"v2_v4_v4":153016,"v3_v2_v2":160812,"v3_v2_v3":144842,"v3_v2_v4":171738,"v3_v3_v2":144833,"v3_v3_v3":142088,"v3_v3_v4":162804,"v3_v4_v2":169482,"v3_v4_v3":161041,"v3_v4_v4":141714,"v4_v2_v2":185790,"v4_v2_v3":168845,"v4_v2_v4":170425,"v4_v3_v2":168783,"v4_v3_v3":160608,"v4_v3_v4":155776,"v4_v4_v2":150203,"v4_v4_v3":160340,"v4_v4_v4":92320},"status":"keep","description":"Merge BRIBE_ADDRESS reads — no gas, -37 bytes bytecode","timestamp":1781138508179,"segment":4,"confidence":3.4084605932947167,"asi":{"bytecode_change":"-37 bytes (19264 → 19227)","gas_change":"0 — BRIBE_ADDRESS not in benchmarks","hypothesis":"Merge 1+2 -> 3-byte read in BRIBE_ADDRESS preprocessing handler"}}
{"run":172,"commit":"855f15a","metric":4344325,"metrics":{"bytecode_size":19191,"v2_v2_v2":181932,"v2_v2_v3":160905,"v2_v2_v4":189286,"v2_v3_v2":164877,"v2_v3_v3":144879,"v2_v3_v4":176839,"v2_v4_v2":190575,"v2_v4_v3":169572,"v2_v4_v4":153016,"v3_v2_v2":160812,"v3_v2_v3":144842,"v3_v2_v4":171738,"v3_v3_v2":144833,"v3_v3_v3":142088,"v3_v3_v4":162804,"v3_v4_v2":169482,"v3_v4_v3":161041,"v3_v4_v4":141714,"v4_v2_v2":185790,"v4_v2_v3":168845,"v4_v2_v4":170425,"v4_v3_v2":168783,"v4_v3_v3":160608,"v4_v3_v4":155776,"v4_v4_v2":150203,"v4_v4_v3":160340,"v4_v4_v4":92320},"status":"keep","description":"Merge V3_SWAP_DELTA reads — no gas, -36 bytes bytecode","timestamp":1781138629745,"segment":4,"confidence":3.326993917587595,"asi":{"bytecode_change":"-36 bytes (19227 → 19191)","gas_change":"0 — V3_SWAP_DELTA not in benchmarks","hypothesis":"Merge 2+1 -> 3-byte read in V3_SWAP_DELTA"}}
{"run":173,"commit":"ca85754","metric":4344325,"metrics":{"bytecode_size":19158,"v2_v2_v2":181932,"v2_v2_v3":160905,"v2_v2_v4":189286,"v2_v3_v2":164877,"v2_v3_v3":144879,"v2_v3_v4":176839,"v2_v4_v2":190575,"v2_v4_v3":169572,"v2_v4_v4":153016,"v3_v2_v2":160812,"v3_v2_v3":144842,"v3_v2_v4":171738,"v3_v3_v2":144833,"v3_v3_v3":142088,"v3_v3_v4":162804,"v3_v4_v2":169482,"v3_v4_v3":161041,"v3_v4_v4":141714,"v4_v2_v2":185790,"v4_v2_v3":168845,"v4_v2_v4":170425,"v4_v3_v2":168783,"v4_v3_v3":160608,"v4_v3_v4":155776,"v4_v4_v2":150203,"v4_v4_v3":160340,"v4_v4_v4":92320},"status":"keep","description":"Merge V2_SWAP_CALC reads — no gas, -33 bytes bytecode","timestamp":1781138758581,"segment":4,"confidence":3.249330655957162,"asi":{"bytecode_change":"-33 bytes (19191 → 19158)","gas_change":"0 — V2_SWAP_CALC not in benchmarks","hypothesis":"Merge 2+3 -> 5-byte read in V2_SWAP_CALC"}}
