{"run":326,"commit":"2d1ea51","metric":4947168,"metrics":{"bytecode_size":15375,"v2_v2_v2":197114,"v2_v2_v3":196467,"v2_v2_v4":209448,"v2_v3_v2":180687,"v2_v3_v3":197140,"v2_v3_v4":209704,"v2_v4_v2":188231,"v2_v4_v3":204600,"v2_v4_v4":173308,"v3_v2_v2":177088,"v3_v2_v3":197081,"v3_v2_v4":209683,"v3_v3_v2":194717,"v3_v3_v3":197180,"v3_v3_v4":210261,"v3_v4_v2":185210,"v3_v4_v3":205206,"v3_v4_v4":173929,"v4_v2_v2":167258,"v4_v2_v3":187251,"v4_v2_v4":182619,"v4_v3_v2":167847,"v4_v3_v3":187837,"v4_v3_v4":178163,"v4_v4_v2":131691,"v4_v4_v3":151672,"v4_v4_v4":85776},"status":"discard","description":"CSE hoist of forward_len into named local in V2/V3_SWAP_COMPACT. REGRESSED +90 gas (per-path +3..+9) + 16 bytes — mstore/mload overhead exceeds saved AND. Confirms caching-cheap-values dead end extends to pure-AND extracts.","timestamp":1781983904122,"segment":13,"confidence":0.3184828416616496,"asi":{"finding":"REGRESSION (misread arithmetic: 4,947,168 > 4,947,078 = +90). Per-path nearly all +3..+9 gas. Named-local mstore/mload overhead exceeded saved AND.","hypothesis":"CSE hoist of duplicated all & 255 into named local in V2/V3_SWAP_COMPACT.","next_action_hint":"Stop CSE-hoisting sub-5-gas bitwise extracts. Only >~10-gas expressions (keccak/exttload) worth hoisting, already inlined.","reinforces_dead_end":"Confirms caching-cheap-values dead end extends to pure-AND extracts: named local for sub-3-gas op costs more (mstore+2xmload ~9 gas) than recomputing (2x AND ~6 gas).","rollback_reason":"+90 gas regression, +16 bytes bytecode"}}
{"run":327,"commit":"2d1ea51","metric":4947054,"metrics":{"bytecode_size":15506,"v2_v2_v2":197111,"v2_v2_v3":196464,"v2_v2_v4":209448,"v2_v3_v2":180681,"v2_v3_v3":197134,"v2_v3_v4":209701,"v2_v4_v2":188228,"v2_v4_v3":204597,"v2_v4_v4":173308,"v3_v2_v2":177085,"v3_v2_v3":197075,"v3_v2_v4":209680,"v3_v3_v2":194711,"v3_v3_v3":197171,"v3_v3_v4":210255,"v3_v4_v2":185207,"v3_v4_v3":205200,"v3_v4_v4":173926,"v4_v2_v2":167258,"v4_v2_v3":187248,"v4_v2_v4":182619,"v4_v3_v2":167844,"v4_v3_v3":187831,"v4_v3_v4":178136,"v4_v4_v2":131691,"v4_v4_v3":151669,"v4_v4_v4":85776},"status":"discard","description":"Inline _read_pm_delta slot+raw intermediates via return-per-branch (3× exttload). −24 gas (within noise; settle_delta WETH paths −3..−27) but +147 bytes bytecode from 3× duplicated extcall. Not a defensible trade — discarded.","timestamp":1781984421918,"segment":13,"confidence":0.026744862104704364,"asi":{"finding":"−24 gas (within noise, ~-1/path; settle_delta WETH paths v4_v3_v4 -27, v2_v3_v4 -3, v3_v3_v4 -6, rest ±3). Bytecode +147 bytes (15,359->15,506) from 3x duplicated exttload extcall.","hypothesis":"Inline slot+raw intermediates in _read_pm_delta via return-per-branch (3x exttload, no slot/raw alloca) — Venom may drop 2 allocas for the WETH fast-path used by settle_delta paths.","reinforces_dead_end":"Extends _read_pm_delta/V4_SETTLE_DELTA fragility: changes here yield sub-noise gas deltas but real bytecode cost. The prior precomputed-slot + single-extcall form is at a local optimum; Venom already eliminates the slot/raw intermediates effectively.","next_action_hint":"DO NOT restructure _read_pm_delta further — single-extcall + precomputed-slot form is optimal. Confirms _read_pm_delta is in the same fragile family as _cmd_v4_take_delta (any growth = bytecode bloat, sub-noise gas). Remaining avenues: none safe — R9 PM-as-bank proven structurally impossible for pure-V2 (borrows initial WETH, repays only smaller profit, no V4 swap to net-wash delta -> CurrencyNotSettled).","rollback_reason":"−24 gas is within noise (confidence <1.0x, ~-1 gas/path vs ±3/path variance); +147 bytes bytecode + 3x duplicated extcall not a defensible trade."}}
{"run":328,"commit":"2d1ea51","metric":4947078,"metrics":{"bytecode_size":15359,"v2_v2_v2":197111,"v2_v2_v3":196464,"v2_v2_v4":209448,"v2_v3_v2":180681,"v2_v3_v3":197134,"v2_v3_v4":209701,"v2_v4_v2":188228,"v2_v4_v3":204597,"v2_v4_v4":173308,"v3_v2_v2":177085,"v3_v2_v3":197075,"v3_v2_v4":209680,"v3_v3_v2":194711,"v3_v3_v3":197171,"v3_v3_v4":210255,"v3_v4_v2":185207,"v3_v4_v3":205200,"v3_v4_v4":173926,"v4_v2_v2":167258,"v4_v2_v3":187248,"v4_v2_v4":182619,"v4_v3_v2":167844,"v4_v3_v3":187831,"v4_v3_v4":178160,"v4_v4_v2":131691,"v4_v4_v3":151669,"v4_v4_v4":85776},"status":"keep","description":"Stability confirmation: baseline 4,947,078 reproducible after #326 (CSE-hoist dead end) and #327 (_read_pm_delta restructure dead end) both reverted. Exhaustive verification complete — all remaining +/- are comments or dead _v2_get_amount_out code, all redundant masks removed, R9 PM-as-bank proven structurally impossible for pure-V2.","timestamp":1781984606271,"segment":13,"confidence":4.640350877192983,"asi":{"finding":"Baseline 4,947,078 reproducible (exact match to #325; bytecode 15,359). No noise drift. Per-path v3_v4_v4=178,160 (was 178,163, +-3 noise).","hypothesis":"Stability confirmation that the post-user-sentinel-removal ceiling (4,947,078) is reproducible, after runs #326 (CSE-hoist dead end) and #327 (_read_pm_delta restructure dead end) both reverted.","reconfirms_ceiling":"Genuine ceiling at 4,947,078/15,359. All avenues exhausted: (a) zero remaining checked arithmetic on hot paths (grep confirms all +/- are comments or dead _v2_get_amount_out), (b) Idea #1 redundant masks = 0 remain, (c) 2-way ternaries fully applied (remaining empty(T) are 5-way sentinel chains = dead end, or dead-code bribe), (d) _read_pm_delta fragile (#327), (e) R9 PM-as-bank pure-V2 proven STRUCTURALLY IMPOSSIBLE (borrows initial WETH, only repays smaller profit, no V4 swap to net-wash delta -> CurrencyNotSettled), (f) MAX_COMMANDS_LENGTH=288 minimum, (g) dispatch at local optimum. Remaining gas ~80% irreducible protocol extcalls + off-limits V3 fake-pool math."}}
{"run":329,"commit":"1c1aa4d","metric":4940839,"metrics":{"bytecode_size":15359,"v2_v2_v2":197111,"v2_v2_v3":196464,"v2_v2_v4":209448,"v2_v3_v2":180681,"v2_v3_v3":197134,"v2_v3_v4":209701,"v2_v4_v2":188228,"v2_v4_v3":204597,"v2_v4_v4":173308,"v3_v2_v2":177085,"v3_v2_v3":197075,"v3_v2_v4":209680,"v3_v3_v2":194711,"v3_v3_v3":197171,"v3_v3_v4":210255,"v3_v4_v2":185207,"v3_v4_v3":205200,"v3_v4_v4":173926,"v4_v2_v2":167258,"v4_v2_v3":187248,"v4_v2_v4":176380,"v4_v3_v2":167844,"v4_v3_v3":187831,"v4_v3_v4":178160,"v4_v4_v2":131691,"v4_v4_v3":151669,"v4_v4_v4":85776},"status":"keep","description":"V4V2V4: send V2b WBTC output directly to PM via sync+V2b_direct(→PM)+settle, eliminating executor WBTC custody + settle_delta exttload + executor→PM transfer (4→3 transfers). −6,239 gas on v4_v2_v4 (182,619→176,380). Settle-side analog of V4V4V3 take-to-pool win.","timestamp":1781985144536,"segment":13,"confidence":0.16653549504171258,"asi":{"finding":"−6,239 gas on v4_v2_v4 (182,619→176,380), single path. Checks pass (276 tests). Bytecode unchanged (test-only). Transfer count 4→3. Executor never held WBTC; conservation passes.","generalizable":"YES — settle-side direct-to-PM pattern. Any V4-X-V4 path where intermediate hop X produces the input for the second V4 swap can send output directly to PM (via sync+settle) instead of executor custody + settle_delta (exttload+sync+transfer+settle). Mirrors V2V4V2 and V4V4V3 (take-to-pool −20K). Not address-specific tuning.","hypothesis":"V4V2V4 sends V2b WBTC output to executor then settle_delta(executor→PM transfer). Instead: sync(WBTC)+V2b_direct(→PM)+plain settle, crediting WBTC delta via the V2b deposit. Eliminates exttload + executor→PM ERC20 transfer.","next_action_hint":"Audit other V4-X-V4 paths where intermediate hop produces settle currency via executor custody + settle_delta: V4V3V4 (V3b WBTC→PM?), V4V3V2, V4V3V3, V4V4V2/V4V4V3 (V4 swap output→PM?). Check each delta flow before editing."}}
{"run":330,"commit":"1c1aa4d","metric":4961121,"metrics":{"bytecode_size":15359,"v2_v2_v2":197111,"v2_v2_v3":196464,"v2_v2_v4":209448,"v2_v3_v2":180681,"v2_v3_v3":197134,"v2_v3_v4":209701,"v2_v4_v2":188228,"v2_v4_v3":204597,"v2_v4_v4":173308,"v3_v2_v2":177085,"v3_v2_v3":197075,"v3_v2_v4":209680,"v3_v3_v2":194711,"v3_v3_v3":197171,"v3_v3_v4":210255,"v3_v4_v2":185207,"v3_v4_v3":205200,"v3_v4_v4":173926,"v4_v2_v2":167258,"v4_v2_v3":187248,"v4_v2_v4":176380,"v4_v3_v2":167844,"v4_v3_v3":187831,"v4_v3_v4":178160,"v4_v4_v2":151973,"v4_v4_v3":151669,"v4_v4_v4":85776},"status":"discard","description":"V4V4V2 direct-to-PM (V2c WETH→PM + sync+settle + take). REGRESSED +20,282 gas (131,691→151,973). Direct-to-PM hurts for the PROFIT currency (WETH) — take-back from PM is cold/expensive vs keeping warm at executor. Only intermediate currencies qualify. Discarded; V4V2V4 win stands.","timestamp":1781985442131,"segment":13,"confidence":0.08511665325824617,"asi":{"finding":"REGRESSION +20,282 gas on v4_v4_v2 (131,691→151,973). Checks passed (deltas reconcile), but direct-to-PM is much more expensive here.","hypothesis":"V4V4V2 direct-to-PM: route V2c WETH output to PM (sync+settle) instead of executor custody, making WETH settle_delta a take (delta>0). Expected ~2-4K savings like V4V2V4.","key_learning":"Direct-to-PM helps for INTERMEDIATE currencies destined for PM anyway (V4V2V4 WBTC: -6,239) but HURTS for the PROFIT currency the executor must keep. Sending profit WETH to PM then taking it back forces a cold PM.take (WETH transfer PM→executor, cold executor balance slot write) — far worse than keeping WETH at executor (warm from V2c→executor transfer). V4V4V2's old path: V2c→executor warms WETH slot, settle_delta transfers only the DEBT (1 WETH) executor→PM, profit stays warm. The take-back round-trip dominates.","rule":"Settle-side direct-to-PM applies ONLY to intermediate currencies ( WBTC/USDC that PM needs for the next swap). NEVER send the profit currency (WETH) to PM if it must return to executor — the take-back is a cold transfer.","rollback_reason":"+20,282 gas regression. Take-back of profit WETH from PM is cold/expensive.","next_action_hint":"Closed: direct-to-PM only for intermediate currencies. V4V2V4 win stands. Other V4-X-V4 paths settle WETH (profit) via executor custody — not applicable. V4V3V4 already direct-to-PM. Settle-side direct-to-PM avenue EXHAUSTED."}}
{"run":331,"commit":"1c1aa4d","metric":4940839,"metrics":{"bytecode_size":15359,"v2_v2_v2":197111,"v2_v2_v3":196464,"v2_v2_v4":209448,"v2_v3_v2":180681,"v2_v3_v3":197134,"v2_v3_v4":209701,"v2_v4_v2":188228,"v2_v4_v3":204597,"v2_v4_v4":173308,"v3_v2_v2":177085,"v3_v2_v3":197075,"v3_v2_v4":209680,"v3_v3_v2":194711,"v3_v3_v3":197171,"v3_v3_v4":210255,"v3_v4_v2":185207,"v3_v4_v3":205200,"v3_v4_v4":173926,"v4_v2_v2":167258,"v4_v2_v3":187248,"v4_v2_v4":176380,"v4_v3_v2":167844,"v4_v3_v3":187831,"v4_v3_v4":178160,"v4_v4_v2":131691,"v4_v4_v3":151669,"v4_v4_v4":85776},"status":"keep","description":"Stability confirmation: 4,940,839 reproducible after #330 (V4V4V2 regression) discarded. V4V2V4 win (−6,239) stable, V4V4V2 reverted cleanly. Full 27-path audit complete — settle-side direct-to-PM avenue exhausted (only V4V2V4 qualified).","timestamp":1781985611032,"segment":13,"confidence":0.16653549504171258,"asi":{"finding":"4,940,839 reproducible (exact match to #329). v4_v2_v4=176,380 (V4V2V4 win stable), v4_v4_v2=131,691 (V4V4V2 reverted cleanly to cheap). No noise drift.","hypothesis":"Stability confirmation after #330 (V4V4V2 direct-to-PM regression) was discarded, verifying the V4V2V4 win (commit 1c1aa4d) is locked in and the V4V4V2 revert restored that path.","avenue_status":"Settle-side direct-to-PM EXHAUSTED after full 27-path audit. V4V2V4 (WBTC intermediate custody) was the only applicable path — now fixed (-6,239). V4V3V4/V2V4V2/V2V4V4/V3V4V4 already direct-to-PM. V4V3V2/V4V3V3/V4V4V2/V4V4V3/V4V2V2/V4V2V3 settle WETH (profit currency) — direct-to-PM regresses (cold take-back, proven +20K on V4V4V2). No remaining intermediate-currency custody to eliminate."}}
{"run":332,"commit":"1c1aa4d","metric":4940839,"metrics":{"bytecode_size":15359,"v2_v2_v2":197111,"v2_v2_v3":196464,"v2_v2_v4":209448,"v2_v3_v2":180681,"v2_v3_v3":197134,"v2_v3_v4":209701,"v2_v4_v2":188228,"v2_v4_v3":204597,"v2_v4_v4":173308,"v3_v2_v2":177085,"v3_v2_v3":197075,"v3_v2_v4":209680,"v3_v3_v2":194711,"v3_v3_v3":197171,"v3_v3_v4":210255,"v3_v4_v2":185207,"v3_v4_v3":205200,"v3_v4_v4":173926,"v4_v2_v2":167258,"v4_v2_v3":187248,"v4_v2_v4":176380,"v4_v3_v2":167844,"v4_v3_v3":187831,"v4_v3_v4":178160,"v4_v4_v2":131691,"v4_v4_v3":151669,"v4_v4_v4":85776},"status":"discard","description":"Single convert(WETH_ADDR,uint256) in ERC6909 balanceOf (mode 2). Zero gas/bytecode change — Venom folds the double-convert identically (confirms run #280 extends to profit-check site). Cosmetic only.","timestamp":1781985807268,"segment":13,"confidence":0.08478922904311588,"asi":{"finding":"Zero gas change (4,940,839; v4_v4_v4=85,776 identical), zero bytecode change (15,359). Venom folds convert(convert(WETH_ADDR,uint160),uint256) identically to convert(WETH_ADDR,uint256) in the ERC6909 balanceOf staticcall arg, same as run #280 found for V4_MINT/BURN.","hypothesis":"Replace double-convert convert(convert(WETH_ADDR,uint160),uint256) with single convert(WETH_ADDR,uint256) for the ERC6909 balanceOf weth_id arg in mode 2 profit check (V4V4V4 hot path). Might save a convert op.","reinforces_dead_end":"Confirms run #280's finding extends to the profit-check mode-2 site: Venom always folds address->uint256 double-converts. No remaining double-converts to clean up provide gas savings (pure cosmetics).","rollback_reason":"Zero gas + zero bytecode change. Cosmetic only."}}
{"run":333,"commit":"1c1aa4d","metric":4940839,"metrics":{"bytecode_size":15359,"v2_v2_v2":197111,"v2_v2_v3":196464,"v2_v2_v4":209448,"v2_v3_v2":180681,"v2_v3_v3":197134,"v2_v3_v4":209701,"v2_v4_v2":188228,"v2_v4_v3":204597,"v2_v4_v4":173308,"v3_v2_v2":177085,"v3_v2_v3":197075,"v3_v2_v4":209680,"v3_v3_v2":194711,"v3_v3_v3":197171,"v3_v3_v4":210255,"v3_v4_v2":185207,"v3_v4_v3":205200,"v3_v4_v4":173926,"v4_v2_v2":167258,"v4_v2_v3":187248,"v4_v2_v4":176380,"v4_v3_v2":167844,"v4_v3_v3":187831,"v4_v3_v4":178160,"v4_v4_v2":131691,"v4_v4_v3":151669,"v4_v4_v4":85776},"status":"keep","description":"Stability confirmation: 4,940,839 reproducible (3rd exact match) after #332 cosmetic discard reverted. V4V2V4 win stable (176,380), V4V4V2 cleanly reverted (131,691). All safe hypotheses exhausted this resume — contract at verified ceiling. Remaining gas is irreducible protocol extcalls + off-limits V3 math.","timestamp":1781986006298,"segment":13,"confidence":0.08478922904311588,"asi":{"avenue_status":"ALL safe hypotheses exhausted this resume. Dead-end classes (proven this session + prior): (1) direct-to-PM for WETH-profit currency (cold take-back dominates, #330 +20,282); (2) callback loop reorder before invoke (#298 +7,976, destroys function-extraction boundary); (3) CSE hoist of cheap bitwise (#326 +90); (4) _read_pm_delta restructure (#327 +147 bytes sub-noise); (5) profit-check mode 3 WETH-only (#317 +544, self.balance is warm); (6) dispatch elif reorder (#318 +474); (7) double-convert folding (cosmetic, #332). Intermediate-currency direct-to-PM EXHAUSTED via full 27-path audit (only V4V2V4 qualified, fixed at 1c1aa4d).","finding":"4,940,839 reproducible (3rd exact match: #329, #331, this run). Bytecode 15,359. v4_v2_v4=176,380 (V4V2V4 win stable across 3 runs), v4_v4_v2=131,691 (returned to cheap path after #330 revert). No drift. Tree clean at 1c1aa4d.","hypothesis":"Stability confirmation after #332 (cosmetic double-convert discard) to verify the committed V4V2V4 win (1c1aa4d, 4,940,839) is reproducible and stable. No new code change this iteration — all remaining hypotheses are proven dead.","local_optimum_confirmed":"Contract at verified ceiling 4,940,839/15,359 (commit 1c1aa4d). Remaining ~80% of gas is irreducible protocol extcalls (V2/V3 swap, getReserves, token0/token1) + off-limits V3 fake-pool math. Further reduction requires Vyper/Venom compiler improvement or protocol-level change (off-limits by project rules)."}}
{"run":334,"commit":"aa03c3b","metric":4940430,"metrics":{"bytecode_size":15359,"v2_v2_v2":197111,"v2_v2_v3":196464,"v2_v2_v4":209039,"v2_v3_v2":180681,"v2_v3_v3":197134,"v2_v3_v4":209701,"v2_v4_v2":188228,"v2_v4_v3":204597,"v2_v4_v4":173308,"v3_v2_v2":177085,"v3_v2_v3":197075,"v3_v2_v4":209680,"v3_v3_v2":194711,"v3_v3_v3":197171,"v3_v3_v4":210255,"v3_v4_v2":185207,"v3_v4_v3":205200,"v3_v4_v4":173926,"v4_v2_v2":167258,"v4_v2_v3":187248,"v4_v2_v4":176380,"v4_v3_v2":167844,"v4_v3_v3":187831,"v4_v3_v4":178160,"v4_v4_v2":131691,"v4_v4_v3":151669,"v4_v4_v4":85776},"status":"keep","description":"V2V2V4: replace V4_SETTLE_DELTA(WETH) (exttload + take-branch) with V4_TAKE_COMPACT(WETH, executor, AMOUNT_WETH_PROFIT - AMOUNT_WETH) — net WETH delta is a known positive constant (pure profit, no V4a WETH debt in this path). −409 gas (v2_v2_v4: 209,448→209,039). Skips the exttload read; amount = V4c output − prior IIA take, computable off-chain.","timestamp":1781986280224,"segment":13,"confidence":0.08478922904311588,"asi":{"caveat":"Net WETH delta must be POSITIVE and equal to the known profit for this to work. First attempt used AMOUNT_WETH_PROFIT (2 WETH) — over-take reverted CurrencyNotSettled (V4c produces +2 but prior V4_TAKE to V2a already withdrew 1). Correct amount = AMOUNT_WETH_PROFIT - AMOUNT_WETH = net profit (1 WETH). Operator computes amount = (V4c WETH output) - (prior WETH take) off-chain.","finding":"−409 gas total (v2_v2_v4: 209,448→209,039). Checks pass (276 tests). Bytecode unchanged (test-only). Net WETH delta = +AMOUNT_WETH_PROFIT (V4c output) - AMOUNT_WETH (V2a IIA take) = profit (1 WETH); TAKE_COMPACT(1) extracts exactly that, PM.unlock() sees delta=0. Savings = 1 exttload (the settle_delta read).","generalizable":"CONDITIONALLY — only when WETH delta is a KNOWN positive constant (pure profit, no V4a WETH-input debt). V2V2V4 qualifies: V4a is WBTC→WETH (executor owes only WBTC deposit, which V2b→PM handles). Applies to paths where the ONLY V4 swap involving WETH produces profit (WBTC→WETH output swap) and any prior V4_TAKE(WETH) for IIA is a known constant. Contrast: paths with V4a WETH→X input debt (V4V2V2, V4V4V2, V4V3V2, V4V3V3, V4V4V3) need settle_delta(delta<0 sync+transfer+settle) — settle_delta reading the actual delta is required, TAKE_COMPACT can't represent debt. This is the inverse of the documented V4_TAKE_DELTA→TAKE_COMPACT dead-end: that replaced a calldata-amount take with a delta-reading take (regressed); here I replace a delta-reading settle with a calldata-amount take (saves exttload).","hypothesis":"Replace V4_SETTLE_DELTA(WETH) (which does exttload + take-branch when delta>0) with V4_TAKE_COMPACT(WETH, executor, known-profit) when the WETH delta is a known positive constant (profit). Saves the exttload read. V2V2V4: V4c WBTC→WETH produces +2 WETH delta, minus the AMOUNT_WETH IIA take to V2a = +1 WETH profit take. No V4a WETH-input debt in this path.","next_action_hint":"Audit other V2/V3-X-V4 paths where the V4 swap is WBTC→WETH (profit producer, no executor WETH debt): check V2V3V4, V3V2V4, V3V3V4 settle_delta(weth). V3V3V4 already uses V4_TAKE_COMPACT for profit (not settle_delta). Check V2V3V4/V3V2V4 — if their settle_delta(weth) is delta>0 profit (not debt), apply same replacement. Also V4V2V4 (my prior win) uses settle_delta(weth) for net profit after the direct-to-PM WBTC — CHECK if that's replaceable too."}}
{"run":335,"commit":"438ca2a","metric":4939893,"metrics":{"bytecode_size":15359,"v2_v2_v2":197111,"v2_v2_v3":196464,"v2_v2_v4":209039,"v2_v3_v2":180681,"v2_v3_v3":197134,"v2_v3_v4":209701,"v2_v4_v2":188228,"v2_v4_v3":204597,"v2_v4_v4":173308,"v3_v2_v2":177085,"v3_v2_v3":197075,"v3_v2_v4":209680,"v3_v3_v2":194711,"v3_v3_v3":197171,"v3_v3_v4":210255,"v3_v4_v2":185207,"v3_v4_v3":205200,"v3_v4_v4":173926,"v4_v2_v2":167258,"v4_v2_v3":187248,"v4_v2_v4":175843,"v4_v3_v2":167844,"v4_v3_v3":187831,"v4_v3_v4":178160,"v4_v4_v2":131691,"v4_v4_v3":151669,"v4_v4_v4":85776},"status":"keep","description":"V4V2V4: replace V4_SETTLE_DELTA(WETH) with V4_TAKE_COMPACT(WETH, executor, AMOUNT_WETH_PROFIT - AMOUNT_WETH). Same as #334 — V4c (WBTC→WETH) +2 minus V4a (WETH→USDC) -1 debt = +1 net profit take. −537 gas (v4_v2_v4: 176,380→175,843). Skips settle_delta exttload.","timestamp":1781986435290,"segment":13,"confidence":0.08495262566243778,"asi":{"finding":"−537 gas (v4_v2_v4: 176,380→175,843). Checks pass (276 tests). Same replacement as #334. Net WETH delta = +AMOUNT_WETH_PROFIT (V4c WBTC→WETH output) - AMOUNT_WETH (V4a WETH→USDC debt) = +1 profit; TAKE_COMPACT(executor, AMOUNT_WETH_PROFIT - AMOUNT_WETH) extracts it. Skips settle_delta exttload. PM.unlock() sees all deltas zero.","hypothesis":"Apply the #334 V2V2V4 settle_delta→take_compact replacement to V4V2V4 (same shape: V4a WETH→USDC debt + V4c WBTC→WETH profit, net WETH delta = +profit).","next_action_hint":"Remaining settle_delta(weth) paths (V4V2V2, V4V2V3, V4V3V2, V4V3V3, V4V4V2, V4V4V3) all have V4a WETH→X debt with NO compensating V4c WETH production (profit comes via V2c/V3c→executor, not PM delta) → net WETH delta is NEGATIVE (debt), settle_delta is required. EXHAUSTED. Also check V2V3V4/V3V2V4/V3V3V4 (V3-outer paths ending in V4) — V3V3V4 already uses TAKE_COMPACT for profit; check V2V3V4/V3V2V4 settle_delta(weth) if they have it (V3V2V4/V2V3V4 settle delta<0 debt)."}}
